# start 2026-08-23T10:29:04-04:00 uptime 9.13
ffff8ba94077d140 16833439 S Co:1:003:0 s 01 0b 0000 0000 0000 0
ffff8ba94077d140 16835830 C Co:1:003:0 0 0
ffff8ba94077d140 16843314 S Bi:1:003:1 -115 512 <
ffff8ba94077d140 16848645 C Bi:1:003:1 -2 0
ffff8ba94077d140 16848719 S Bo:1:003:1 -115 512 = e8078b91 4407f9c6 f6ee92ef ac54b7e6 431f56e2 88243cf6 f4801afb 3f6baf3d
ffff8ba94077d140 16848758 C Bo:1:003:1 0 512 >
ffff8ba94077d140 16848768 S Bi:1:003:1 -115 512 <
ffff8ba94077d140 18849154 C Bi:1:003:1 -2 0
ffff8ba94077d140 18857196 S Bi:1:003:1 -115 512 <
ffff8ba94077d140 18862549 C Bi:1:003:1 -2 0
ffff8ba94077d140 18862609 S Bo:1:003:1 -115 512 = 67038988 0792e922 fec029c4 1710d333 a12d975a 2554cf71 4502852f d5568496
ffff8ba94077d140 18862660 C Bo:1:003:1 0 512 >
ffff8ba94077d140 18862670 S Bi:1:003:1 -115 512 <
ffff8ba94077d140 18862901 C Bi:1:003:1 0 512 = 0fc8e307 00000000 00000000 00000000 00000000 00000000 00000000 00000000
ffff8ba94077d140 18862919 S Bi:1:003:1 -115 512 <
ffff8ba94077d140 18862931 C Bi:1:003:1 0 0
ffff8ba94077d140 18862984 S Bo:1:003:1 -115 512 = 73931c2c 5b516431 e95246ba 92cc4937 d8458196 ee7e1b9c 8d03495f db48aa30
ffff8ba94077d140 18863019 C Bo:1:003:1 0 512 >
ffff8ba94077d140 18863025 S Bi:1:003:1 -115 512 <
ffff8ba94077d140 18863180 C Bi:1:003:1 0 512 = 33c8e407 00000000 00000000 00000000 00000000 00000000 00000000 00000000
ffff8ba94077d140 18863186 S Bi:1:003:1 -115 512 <
ffff8ba94077d140 18863219 C Bi:1:003:1 0 0
ffff8ba94077d140 18863245 S Bo:1:003:1 -115 512 = e7b504f7 80af5e2c 44777144 cfb970c4 96e26ac9 2d2020e5 3b530213 24476894
ffff8ba94077d140 18863280 C Bo:1:003:1 0 512 >
ffff8ba94077d140 18863286 S Bi:1:003:1 -115 512 <
ffff8ba94077d140 18863415 C Bi:1:003:1 0 512 = 34c8e507 00000000 00000000 00000000 00000000 00000000 00000000 00000000
ffff8ba94077d140 18863421 S Bi:1:003:1 -115 512 <
ffff8ba94077d140 18863455 C Bi:1:003:1 0 0
ffff8ba94077d140 18863521 S Bo:1:003:1 -115 512 = ee2a2154 63dea32f c6b09779 cd163122 40461f37 fab1d1c6 7faca986 26fd2c2d
ffff8ba94077d140 18863552 C Bo:1:003:1 0 512 >
ffff8ba94077d140 18863556 S Bi:1:003:1 -115 512 <
ffff8ba94077d140 18863684 C Bi:1:003:1 0 512 = 7bc80100 00000000 00000000 00000000 00000000 00000000 00000000 00000000
ffff8ba94077d140 19013782 S Bo:1:003:1 -115 512 = 09b87017 1e8084a1 eb7dcd4d 2de935e6 f29c5eec 79ef411a 3b984684 a59b7df8
ffff8ba94077d140 19013843 C Bo:1:003:1 0 512 >
ffff8ba94077d140 19013863 S Bi:1:003:1 -115 512 <
ffff8ba94077d140 19013894 C Bi:1:003:1 0 0
ffff8ba94077d140 19164281 S Bo:1:003:1 -115 512 = ece8a47b be070e38 bcfd859d fc8f8c61 f3965b71 d4219658 83234282 c6a2e35b
ffff8ba94077d140 19164342 C Bo:1:003:1 0 512 >
ffff8ba94077d140 19164361 S Bi:1:003:1 -115 512 <
ffff8ba94077d140 19164398 C Bi:1:003:1 0 512 = 34c80200 00000000 00000000 00000000 00000000 00000000 00000000 00000000
ffff8ba95498f080 19768067 S Bo:1:003:1 -115 512 = dc3bd92d fcc93c21 4a5bc493 33a99d72 d6b1e6f9 932e2fec 56d0c48a 640a52d1
ffff8ba95498f080 19768138 C Bo:1:003:1 0 512 >
ffff8ba95498f080 19768151 S Bi:1:003:1 -115 512 <
ffff8ba95498f080 19768166 C Bi:1:003:1 0 0
ffff8ba95498f080 19768194 S Bo:1:003:1 -115 512 = 21401afd 589b60be dce408b5 57de0b2c b45b934d b4dff56b d95bb490 22866fa4
ffff8ba95498f080 19768370 C Bo:1:003:1 0 512 >
ffff8ba95498f080 19768375 S Bi:1:003:1 -115 512 <
ffff8ba95498f080 19768597 C Bi:1:003:1 0 512 = 0ac80300 00000000 6c69616e 6c696832 735f3030 30315f30 30323700 00000000
ffff8ba95498f200 20759872 S Bo:1:003:1 -115 512 = f448eccb ac49f5ab 9707f9cf 4c68ea54 fd5ecf95 fb7a8e35 39d33ae1 5eb8b98e
ffff8ba95498f200 20759911 C Bo:1:003:1 0 512 >
ffff8ba95498f200 20759919 S Bi:1:003:1 -115 512 <
ffff8ba95498f200 20759953 C Bi:1:003:1 0 0
ffff8ba95498f200 20759974 S Bo:1:003:1 -115 512 = f8e67d0a 7d4baac8 3f3070a0 46220c37 7ecdd3ab 146491df 452733f0 c7ac0c46
ffff8ba95498f200 20760002 C Bo:1:003:1 0 512 >
ffff8ba95498f200 20760006 S Bi:1:003:1 -115 512 <
ffff8ba95498f200 20760042 C Bi:1:003:1 0 512 = fac88803 00000000 0b000000 00170000 00000000 06a6f70b d7e566e1 03000116
ffff8ba90290cfc0 24897535 S Ii:1:002:1 -115:1 64 <
ffff8ba988001d40 24948006 S Ci:1:002:0 s a1 01 0352 0000 00c8 200 <
ffff8ba988001d40 24949572 C Ci:1:002:0 0 200 = 50010000 00000000 00000000 00000314 1e010000 00000000 00000000 00000314
ffff8ba988001d40 24949601 S Ci:1:002:0 s a1 01 0350 0000 0122 290 <
ffff8ba988001d40 24951986 C Ci:1:002:0 0 290 = 50010000 00000000 00000000 00000314 1e010000 00000000 00000000 00000314
ffff8ba988001d40 24951995 S Co:1:002:0 s 21 09 0351 0000 02f9 761 = 51000000 00000000 00000000 00000000 00000000 00000000 00000000 00000000
ffff8ba988001d40 24957748 C Co:1:002:0 0 761 >
ffff8ba988001d40 24958020 S Ci:1:002:0 s a1 01 0351 0000 01f4 500 <
ffff8ba988001d40 24960342 C Ci:1:002:0 0 290 = 50010000 00000000 00000000 00000314 1e010000 00000000 00000000 00000314
ffff8ba988001d40 24960349 S Co:1:002:0 s 21 09 0350 0000 0122 290 = 5009ff00 0000ff00 0000ffff ffff0315 7809ff00 0000ff00 0000ffff ffff0315
ffff8ba988001d40 24962629 C Co:1:002:0 0 290 >
ffff8ba988001d40 24975850 S Ci:1:002:0 s 80 06 0300 0000 0040 64 <
ffff8ba988001d40 24976045 C Ci:1:002:0 0 4 = 04030904
ffff8ba988001d40 24976053 S Ci:1:002:0 s 80 06 0303 0409 0200 512 <
ffff8ba988001d40 24976401 C Ci:1:002:0 0 26 = 1a033700 45003700 30003200 35003000 31003000 39003000 3100
ffff8ba98420d980 24976909 S Ci:1:002:0 s 80 06 0300 0000 0040 64 <
ffff8ba98420d980 24977103 C Ci:1:002:0 0 4 = 04030904
ffff8ba98420d980 24977111 S Ci:1:002:0 s 80 06 0301 0409 0200 512 <
ffff8ba98420d980 24977341 C Ci:1:002:0 0 8 = 08034d00 53004900
ffff8ba98420d980 24977349 S Ci:1:002:0 s 80 06 0300 0000 0040 64 <
ffff8ba98420d980 24977510 C Ci:1:002:0 0 4 = 04030904
ffff8ba98420d980 24977515 S Ci:1:002:0 s 80 06 0302 0409 0200 512 <
ffff8ba98420d980 24977867 C Ci:1:002:0 0 26 = 1a034d00 59005300 54004900 43002000 4c004900 47004800 5400
ffff8ba98421d740 25205535 S Co:1:002:0 s 21 09 0351 0000 02d7 727 = 51090800 0000f000 00000000 00000000 00000000 00000000 00000000 00000000
ffff8ba98421d740 25211046 C Co:1:002:0 0 727 >
ffff8ba98421d740 25211055 S Co:1:002:0 s 21 09 0351 0000 02d7 727 = 51090400 0000f000 00000000 00000000 00000000 00000000 00000000 00000000
ffff8ba98421d740 25216689 C Co:1:002:0 0 727 >
ffff8ba98421d740 25216696 S Co:1:002:0 s 21 09 0351 0000 02d7 727 = 51090401 0000f000 00000000 00000000 00000000 00000000 00000000 00000000
ffff8ba98421d740 25222342 C Co:1:002:0 0 727 >
ffff8ba98421d740 25222347 S Co:1:002:0 s 21 09 0351 0000 02d7 727 = 51090402 0000f000 00000000 00000000 00000000 00000000 00000000 00000000
ffff8ba98421d740 25227986 C Co:1:002:0 0 727 >
ffff8ba98420c240 43970043 S Co:1:003:0 s 01 0b 0000 0000 0000 0
ffff8ba98420c240 43972254 C Co:1:003:0 0 0
ffff8ba98420c240 43979685 S Bi:1:003:1 -115 512 <
ffff8ba98420c240 43985006 C Bi:1:003:1 -2 0
ffff8ba98420c240 43985035 S Bo:1:003:1 -115 512 = e8078b91 4407f9c6 f6ee92ef ac54b7e6 431f56e2 88243cf6 f4801afb 3f6baf3d
ffff8ba98420c240 43985069 C Bo:1:003:1 0 512 >
ffff8ba98420c240 43985074 S Bi:1:003:1 -115 512 <
ffff8ba98420c240 45985410 C Bi:1:003:1 -2 0
ffff8ba98420c240 45985450 S Bi:1:003:1 -115 512 <
ffff8ba98420c240 45990779 C Bi:1:003:1 -2 0
ffff8ba98420c240 45990809 S Bo:1:003:1 -115 512 = e88ba592 03f091d2 09aacf8f 9a725cd2 765857de 09350ca2 62c9e9c3 e350b3ca
ffff8ba98420c240 45990843 C Bo:1:003:1 0 512 >
ffff8ba98420c240 45990849 S Bi:1:003:1 -115 512 <
ffff8ba98420c240 45991078 C Bi:1:003:1 0 512 = 0fc8db07 00000000 00000000 00000000 00000000 00000000 00000000 00000000
ffff8ba98420c240 45991090 S Bi:1:003:1 -115 512 <
ffff8ba98420c240 45991117 C Bi:1:003:1 0 0
ffff8ba98420c240 45991166 S Bo:1:003:1 -115 512 = ea7c9f84 1c73b576 01d7ee02 11f2c997 973af4ff 0771868b 19566d99 5ce5cbd9
ffff8ba98420c240 45991200 C Bo:1:003:1 0 512 >
ffff8ba98420c240 45991205 S Bi:1:003:1 -115 512 <
ffff8ba98420c240 45991348 C Bi:1:003:1 0 512 = 33c8dc07 00000000 00000000 00000000 00000000 00000000 00000000 00000000
ffff8ba98420c240 45991357 S Bi:1:003:1 -115 512 <
ffff8ba98420c240 45991388 C Bi:1:003:1 0 0
ffff8ba98420c240 45991413 S Bo:1:003:1 -115 512 = bd075dd4 9d90c4d5 66300c0c 7916d83c 31f44d26 cc420cb2 5e8bd73d aafb1eab
ffff8ba98420c240 45991448 C Bo:1:003:1 0 512 >
ffff8ba98420c240 45991454 S Bi:1:003:1 -115 512 <
ffff8ba98420c240 45991596 C Bi:1:003:1 0 512 = 34c8dd07 00000000 00000000 00000000 00000000 00000000 00000000 00000000
ffff8ba98420c240 45991604 S Bi:1:003:1 -115 512 <
ffff8ba98420c240 45991635 C Bi:1:003:1 0 0
ffff8ba98420c240 45991705 S Bo:1:003:1 -115 512 = ee2a2154 63dea32f c6b09779 cd163122 40461f37 fab1d1c6 7faca986 26fd2c2d
ffff8ba98420c240 45991739 C Bo:1:003:1 0 512 >
ffff8ba98420c240 45991744 S Bi:1:003:1 -115 512 <
ffff8ba98420c240 45991887 C Bi:1:003:1 0 512 = 7bc80100 00000000 00000000 00000000 00000000 00000000 00000000 00000000
ffff8ba94077c9c0 46141960 S Bo:1:003:1 -115 512 = 09b87017 1e8084a1 eb7dcd4d 2de935e6 f29c5eec 79ef411a 3b984684 a59b7df8
ffff8ba94077c9c0 46142005 C Bo:1:003:1 0 512 >
ffff8ba94077c9c0 46142017 S Bi:1:003:1 -115 512 <
ffff8ba94077c9c0 46142046 C Bi:1:003:1 0 0
ffff8ba94077c9c0 46292110 S Bo:1:003:1 -115 512 = ece8a47b be070e38 bcfd859d fc8f8c61 f3965b71 d4219658 83234282 c6a2e35b
ffff8ba94077c9c0 46292148 C Bo:1:003:1 0 512 >
ffff8ba94077c9c0 46292162 S Bi:1:003:1 -115 512 <
ffff8ba94077c9c0 46292191 C Bi:1:003:1 0 512 = 34c80200 00000000 00000000 00000000 00000000 00000000 00000000 00000000
ffff8ba94077c9c0 47396221 S Bo:1:003:1 -115 512 = 80c1df4c d2e60aed a14aa5d1 c3096654 913ddaf6 7c03500f b69a9fbf 675fa04a
ffff8ba94077c9c0 47396273 C Bo:1:003:1 0 512 >
ffff8ba94077c9c0 47396283 S Bi:1:003:1 -115 512 <
ffff8ba94077c9c0 47396308 C Bi:1:003:1 0 0
ffff8ba902a43800 49098910 S Bi:1:003:1 -115 512 <
ffff8ba902a43800 49098946 C Bi:1:003:1 0 512 = 0ac80300 00000000 6c69616e 6c696832 735f3030 30315f30 30323700 00000000
ffff8ba902a43800 49098957 S Bi:1:003:1 -115 512 <
ffff8ba902a43800 49098975 C Bi:1:003:1 0 0
ffff8ba9250dde00 49099005 S Bo:1:003:1 -115 512 = e5b02ee4 91bea3bb df460c74 0c1f2d75 9b69e168 13b36752 22f56070 7db59746
ffff8ba9250dde00 49099041 C Bo:1:003:1 0 512 >
ffff8ba9250dde00 49099053 S Bi:1:003:1 -115 512 <
ffff8ba9250dde00 49099154 C Bi:1:003:1 0 512 = fbc87c05 00000000 00000000 00000000 00000000 00000000 00000000 00000000
ffff8ba941e70b40 49099167 S Bo:1:003:1 -115 512 = 1ac9fbd0 f720d251 a7df8d54 524b7de9 a6b1eb71 0dc6c9fd 5aa1d590 49d1e9e9
ffff8ba941e70b40 49099202 C Bo:1:003:1 0 512 >
ffff8ba941e70b40 49099211 S Bi:1:003:1 -115 512 <
ffff8ba941e70b40 49099246 C Bi:1:003:1 0 0
ffff8ba941e70b40 49099262 S Bi:1:003:1 -115 512 <
ffff8ba941e70b40 49099675 C Bi:1:003:1 0 512 = fac8230c 00000000 0b000000 00170000 00000000 09caf70b d7e566e1 03000116
ffff8ba941e70b40 49099686 S Bi:1:003:1 -115 512 <
ffff8ba941e70b40 49099709 C Bi:1:003:1 0 0
ffff8ba941e70b40 49099732 S Bo:1:003:1 -115 512 = f9025e39 8e4ab17a c1ad603c 2451898d 1d977809 e510c7d8 7a39ab06 566c9c19
ffff8ba941e70b40 49099760 C Bo:1:003:1 0 512 >
ffff8ba941e70b40 49099766 S Bi:1:003:1 -115 512 <
ffff8ba941e70b40 49099802 C Bi:1:003:1 0 512 = 0ac8a308 00000000 6c69616e 6c696832 735f3030 30315f30 30323700 00000000
ffff8ba941e70b40 49099816 S Bi:1:003:1 -115 512 <
ffff8ba941e70b40 49099841 C Bi:1:003:1 0 0
ffff8ba941e70b40 49099884 S Bo:1:003:1 -115 512 = 3ef41246 8ce2e2ef 3dcf44e6 39525d57 e16c3d56 5e02fa59 dc9ce1a9 cc70828c
ffff8ba941e70b40 49099912 C Bo:1:003:1 0 512 >
ffff8ba941e70b40 49099916 S Bi:1:003:1 -115 512 <
ffff8ba941e70b40 49099959 C Bi:1:003:1 0 512 = 0fc8a408 00000000 00000000 00000000 00000000 00000000 00000000 00000000
ffff8ba941e70b40 49099969 S Bi:1:003:1 -115 512 <
ffff8ba941e70b40 49099992 C Bi:1:003:1 0 0
ffff8ba941e70b40 49100015 S Bo:1:003:1 -115 512 = 91c222d8 12550c96 57012686 bb81413b 8becc907 4aa9423a 637d900d 730efb8a
ffff8ba941e70b40 49100041 C Bo:1:003:1 0 512 >
ffff8ba941e70b40 49100045 S Bi:1:003:1 -115 512 <
ffff8ba941e70b40 49100085 C Bi:1:003:1 0 512 = 33c8a508 00000000 00000000 00000000 00000000 00000000 00000000 00000000
ffff8ba941e70b40 49100094 S Bi:1:003:1 -115 512 <
ffff8ba941e70b40 49100120 C Bi:1:003:1 0 0
ffff8ba941e70b40 49100139 S Bo:1:003:1 -115 512 = a72ab1e7 a576dc7b 731255fb 6cf29376 b1f30599 61c7e21c 8f658f65 b61a3e63
ffff8ba941e70b40 49100163 C Bo:1:003:1 0 512 >
ffff8ba941e70b40 49100166 S Bi:1:003:1 -115 512 <
ffff8ba941e70b40 49100201 C Bi:1:003:1 0 512 = 34c8a608 00000000 00000000 00000000 00000000 00000000 00000000 00000000
ffff8ba941e70b40 49100207 S Bi:1:003:1 -115 512 <
ffff8ba941e70b40 49100241 C Bi:1:003:1 0 0
ffff8ba941e70b40 49100284 S Bo:1:003:1 -115 1849 = 95cbd70d 00eb5802 bc720059 c899393f d56498bb 500e1b1c ff93f72e b978a968
ffff8ba941e70b40 49100356 C Bo:1:003:1 0 1849 >
ffff8ba941e70b40 49100360 S Bi:1:003:1 -115 512 <
ffff8ba941e70b40 49100400 C Bi:1:003:1 0 512 = 0fc8a708 00000000 00000000 00000000 00000000 00000000 00000000 00000000
ffff8ba941e70b40 49100406 S Bi:1:003:1 -115 512 <
ffff8ba941e70b40 49100435 C Bi:1:003:1 0 0
ffff8ba902a423c0 49134436 S Bo:1:003:1 -115 17596 = eb5704eb 61e6df48 8049e562 04465a69 c778c2b5 70df1b94 dde71258 5c14f585
ffff8ba902a423c0 49134887 C Bo:1:003:1 0 17596 >
ffff8ba91fa63d40 49134900 S Bi:1:003:1 -115 512 <
ffff8ba91fa63d40 49134922 C Bi:1:003:1 0 512 = 79c8a808 00000000 04000000 00000000 00000000 00000000 00000000 00000000
ffff8ba98420c240 49134939 S Bi:1:003:1 -115 512 <
ffff8ba98420c240 49134961 C Bi:1:003:1 0 0
ffff8ba9246e6d80 49134988 S Bo:1:003:1 -115 512 = f3468c4d 357ebf95 43ea1854 557308d9 32b9c20c 633b3621 d76ffa57 2ddc9426
ffff8ba9246e6d80 49135012 C Bo:1:003:1 0 512 >
ffff8ba9246e4f00 49135021 S Bi:1:003:1 -115 512 <
ffff8ba9246e4f00 49135370 C Bi:1:003:1 0 512 = 79c8c608 00000000 05000000 00000000 00000000 00000000 00000000 00000000
ffff8ba9246e4f00 49135379 S Bi:1:003:1 -115 512 <
ffff8ba9246e4f00 49135398 C Bi:1:003:1 0 0
ffff8ba9246e52c0 49185477 S Bo:1:003:1 -115 512 = 2b3a425e 8c0fdecb 92255689 eef70bae 8eb9be04 651761b2 c8940414 ca219e46
ffff8ba9246e52c0 49185521 C Bo:1:003:1 0 512 >
ffff8ba9246e52c0 49185530 S Bi:1:003:1 -115 512 <
ffff8ba9246e52c0 49185558 C Bi:1:003:1 0 512 = 7ac8c708 00000000 05000000 00000000 00000000 00000000 00000000 00000000
ffff8ba9246e52c0 49185563 S Bi:1:003:1 -115 512 <
ffff8ba9246e52c0 49185598 C Bi:1:003:1 0 0
ffff8ba94987f080 49235675 S Bo:1:003:1 -115 512 = 3a276981 0f07509a 25ec6d04 b9245299 e821a2e5 0b033040 4f1c9ef1 9fb9ece4
ffff8ba94987f080 49235722 C Bo:1:003:1 0 512 >
ffff8ba94987f080 49235731 S Bi:1:003:1 -115 512 <
ffff8ba94987f080 49235759 C Bi:1:003:1 0 512 = 7ac8f908 00000000 05000000 00000000 00000000 00000000 00000000 00000000
ffff8ba94987f080 49235766 S Bi:1:003:1 -115 512 <
ffff8ba94987f080 49235800 C Bi:1:003:1 0 0
ffff8ba94987f080 49285874 S Bo:1:003:1 -115 512 = 4c1d2d8b 62fb885e ece168c7 eca9f574 701001a7 5fef682c b92db6ec 6f491407
ffff8ba94987f080 49285918 C Bo:1:003:1 0 512 >
ffff8ba94987f080 49285925 S Bi:1:003:1 -115 512 <
ffff8ba94987f080 49285962 C Bi:1:003:1 0 512 = 7ac82b09 00000000 05000000 00000000 00000000 00000000 00000000 00000000
ffff8ba94987f080 49285967 S Bi:1:003:1 -115 512 <
ffff8ba94987f080 49286002 C Bi:1:003:1 0 0
ffff8ba94987f080 49336081 S Bo:1:003:1 -115 512 = adbc371f 17ae6550 ed09cb66 b0c3fabb 4f6010da 5a9990a0 28c3704f e538c40b
ffff8ba94987f080 49336122 C Bo:1:003:1 0 512 >
ffff8ba94987f080 49336131 S Bi:1:003:1 -115 512 <
ffff8ba94987f080 49336153 C Bi:1:003:1 0 512 = 7ac85d09 00000000 05000000 00000000 00000000 00000000 00000000 00000000
ffff8ba94987f080 49336158 S Bi:1:003:1 -115 512 <
ffff8ba94987f080 49336197 C Bi:1:003:1 0 0
ffff8ba94987f080 49386275 S Bo:1:003:1 -115 512 = 7d60cba9 a4fa48bd 011263f7 bc2d2db8 f9b2b3cb 7467b96a a7a2c7ea 5f16d63f
ffff8ba94987f080 49386321 C Bo:1:003:1 0 512 >
ffff8ba94987f080 49386330 S Bi:1:003:1 -115 512 <
ffff8ba94987f080 49386355 C Bi:1:003:1 0 512 = 7ac89009 00000000 05000000 00000000 00000000 00000000 00000000 00000000
ffff8ba94987f080 49386361 S Bi:1:003:1 -115 512 <
ffff8ba94987f080 49386398 C Bi:1:003:1 0 0
ffff8ba9246e6b40 49401906 S Bo:1:003:1 -115 512 = c40c0b62 89d1739c 7e86977b 9648eef6 941aeb65 1e6fe7b3 7db4a016 c9d52f9b
ffff8ba9246e6b40 49401945 C Bo:1:003:1 0 512 >
ffff8ba9246e6b40 49401954 S Bi:1:003:1 -115 512 <
ffff8ba9246e6b40 49401978 C Bi:1:003:1 0 512 = 7ac8c209 00000000 05000000 00000000 00000000 00000000 00000000 00000000
ffff8ba94987f080 49436476 S Bo:1:003:1 -115 512 = 9180567f 4933c573 62531e17 8f0ef59b 83b89800 89807395 9fdbda9c 775e3cc9
ffff8ba94987f080 49436635 C Bo:1:003:1 0 512 >
ffff8ba94987f080 49436642 S Bi:1:003:1 -115 512 <
ffff8ba94987f080 49436870 C Bi:1:003:1 0 0
ffff8ba94987f080 49436874 S Bi:1:003:1 -115 512 <
ffff8ba94987f080 49437105 C Bi:1:003:1 0 512 = fac8520d 00000000 0b000000 00170000 00000000 09caf70b d7e566e1 03000116
ffff8ba94987f080 49437109 S Bi:1:003:1 -115 512 <
ffff8ba94987f080 49437120 C Bi:1:003:1 0 0
ffff8ba94987f080 49437171 S Bo:1:003:1 -115 55576 = 0966ef35 4ec64343 7a2fb64c 678fc535 e378a95c 013ab32d e569e867 559d6896
ffff8ba94987f080 49438743 C Bo:1:003:1 0 55576 >
ffff8ba94987f080 49438748 S Bi:1:003:1 -115 512 <
ffff8ba94987f080 49438972 C Bi:1:003:1 0 512 = 7ac8f409 00000000 05000000 00000000 00000000 00000000 00000000 00000000
ffff8ba94987f080 49438985 S Bi:1:003:1 -115 512 <
ffff8ba94987f080 49439208 C Bi:1:003:1 0 0
ffff8ba94987f080 49439228 S Bo:1:003:1 -115 512 = 34b4cc09 a189eb44 a7192a6f b4f51956 70fe5df9 a7d5741c cb9f9847 56be1959
ffff8ba94987f080 49439443 C Bo:1:003:1 0 512 >
ffff8ba94987f080 49439448 S Bi:1:003:1 -115 512 <
ffff8ba94987f080 49439466 C Bi:1:003:1 0 512 = 79c8f509 00000000 06000000 00000000 00000000 00000000 00000000 00000000
ffff8ba94987f080 49439471 S Bi:1:003:1 -115 512 <
ffff8ba94987f080 49439506 C Bi:1:003:1 0 0
ffff8ba94987f080 49489582 S Bo:1:003:1 -115 512 = c150d992 253970f6 225bd4c5 c4e6f7ef be2acf86 ccb12975 3f238eb2 b757c6c4
ffff8ba94987f080 49489754 C Bo:1:003:1 0 512 >
ffff8ba94987f080 49489761 S Bi:1:003:1 -115 512 <
ffff8ba94987f080 49489990 C Bi:1:003:1 0 512 = 7ac8f709 00000000 06000000 00000000 00000000 00000000 00000000 00000000
ffff8ba94987f080 49489995 S Bi:1:003:1 -115 512 <
ffff8ba94987f080 49490226 C Bi:1:003:1 0 0
ffff8ba941e73380 49540305 S Bo:1:003:1 -115 512 = c4235f2b 355d3dfa 4a50826b 319fcd6c 1eae3b1d 72e530fc 60047cdb c9c7dcaa
ffff8ba941e73380 49540340 C Bo:1:003:1 0 512 >
ffff8ba941e73380 49540347 S Bi:1:003:1 -115 512 <
ffff8ba941e73380 49540561 C Bi:1:003:1 0 512 = 7ac8290a 00000000 06000000 00000000 00000000 00000000 00000000 00000000
ffff8ba941e73380 49540566 S Bi:1:003:1 -115 512 <
ffff8ba941e73380 49540577 C Bi:1:003:1 0 0
ffff8ba941e73380 49590656 S Bo:1:003:1 -115 512 = a3ea77eb e5937b73 f521952e e1257778 7dc6d816 8f3635fb acf3a145 3b8ee291
ffff8ba941e73380 49590864 C Bo:1:003:1 0 512 >
ffff8ba941e73380 49590874 S Bi:1:003:1 -115 512 <
ffff8ba941e73380 49590896 C Bi:1:003:1 0 512 = 7ac85c0a 00000000 06000000 00000000 00000000 00000000 00000000 00000000
ffff8ba941e73380 49590902 S Bi:1:003:1 -115 512 <
ffff8ba941e73380 49590934 C Bi:1:003:1 0 0
ffff8ba941e73380 49641014 S Bo:1:003:1 -115 512 = a9426657 2fd1bffa 571c6579 fc08580f ba4b86b0 df38a3e8 50f27803 21a727dd
ffff8ba941e73380 49641045 C Bo:1:003:1 0 512 >
ffff8ba941e73380 49641051 S Bi:1:003:1 -115 512 <
ffff8ba941e73380 49641242 C Bi:1:003:1 0 512 = 7ac88e0a 00000000 05000000 00000000 00000000 00000000 00000000 00000000
ffff8ba941e73380 49641249 S Bi:1:003:1 -115 512 <
ffff8ba941e73380 49641259 C Bi:1:003:1 0 0
ffff8ba941e73380 49691335 S Bo:1:003:1 -115 512 = 95450370 6e9fef12 d610f914 359e3b92 f91b087d e26f2f8a 058ea2da 79b29daf
ffff8ba941e73380 49691534 C Bo:1:003:1 0 512 >
ffff8ba941e73380 49691542 S Bi:1:003:1 -115 512 <
ffff8ba941e73380 49691767 C Bi:1:003:1 0 512 = 7ac8c10a 00000000 05000000 00000000 00000000 00000000 00000000 00000000
ffff8ba941e73380 49691772 S Bi:1:003:1 -115 512 <
ffff8ba941e73380 49691782 C Bi:1:003:1 0 0
ffff8ba941e73380 49741857 S Bo:1:003:1 -115 512 = 178d3875 ef975090 fd778da2 7e0721d3 4ed90640 ffcb1f84 c2eedaf6 ffcf495b
ffff8ba941e73380 49741902 C Bo:1:003:1 0 512 >
ffff8ba941e73380 49741911 S Bi:1:003:1 -115 512 <
ffff8ba941e73380 49741936 C Bi:1:003:1 0 512 = 7ac8f30a 00000000 05000000 00000000 00000000 00000000 00000000 00000000
ffff8ba941e73380 49741941 S Bi:1:003:1 -115 512 <
ffff8ba941e73380 49741976 C Bi:1:003:1 0 0
ffff8ba941e73380 49792057 S Bo:1:003:1 -115 512 = 0881f38c c56eb930 97350f51 c1673fcc bb2538f0 7f2c10d8 67cfeba9 9ed37ceb
ffff8ba941e73380 49792219 C Bo:1:003:1 0 512 >
ffff8ba941e73380 49792226 S Bi:1:003:1 -115 512 <
ffff8ba941e73380 49792446 C Bi:1:003:1 0 512 = 7ac8250b 00000000 05000000 00000000 00000000 00000000 00000000 00000000
ffff8ba941e73380 49792452 S Bi:1:003:1 -115 512 <
ffff8ba941e73380 49792462 C Bi:1:003:1 0 0
ffff8ba941e73380 49842539 S Bo:1:003:1 -115 512 = 2ccd6b1f d40efd82 36e88be5 40e59946 a4c9c026 6f6ed6f4 9fecffd8 d586ad08
ffff8ba941e73380 49842790 C Bo:1:003:1 0 512 >
ffff8ba941e73380 49842796 S Bi:1:003:1 -115 512 <
ffff8ba941e73380 49843068 C Bi:1:003:1 0 512 = 7ac8580b 00000000 05000000 00000000 00000000 00000000 00000000 00000000
ffff8ba941e73380 49843073 S Bi:1:003:1 -115 512 <
ffff8ba941e73380 49843303 C Bi:1:003:1 0 0
ffff8ba9250dde00 49887082 S Bo:1:003:1 -115 512 = e024c483 bbf2f5f9 90783376 9ca38be1 6cd8c731 0d7ffee4 dda57917 f22c30fd
ffff8ba9250dde00 49887110 C Bo:1:003:1 0 512 >
ffff8ba9250dde00 49887116 S Bi:1:003:1 -115 512 <
ffff8ba9250dde00 49887150 C Bi:1:003:1 0 512 = 7ac88a0b 00000000 05000000 00000000 00000000 00000000 00000000 00000000
ffff8ba902a426c0 49893380 S Bo:1:003:1 -115 512 = e22c5d44 3e68e7e2 c667d077 5804f02b 1e5fd692 af5c990b eae1a9f8 10612a48
ffff8ba902a426c0 49893406 C Bo:1:003:1 0 512 >
ffff8ba902a426c0 49893411 S Bi:1:003:1 -115 512 <
ffff8ba902a426c0 49893450 C Bi:1:003:1 0 0
ffff8ba902a426c0 49893454 S Bi:1:003:1 -115 512 <
ffff8ba902a426c0 49893486 C Bi:1:003:1 0 512 = fac8370f 00000000 0b000000 00170000 00000000 09caf70b d7e566e1 03000116
ffff8ba902a426c0 49893490 S Bi:1:003:1 -115 512 <
ffff8ba902a426c0 49893527 C Bi:1:003:1 0 0
ffff8ba902a426c0 49893568 S Bo:1:003:1 -115 55714 = 5acc0b56 4aa17c82 5595a1a2 86027d3d ce632864 3d7d180b f5150423 b85ae000
ffff8ba902a426c0 49895168 C Bo:1:003:1 0 55714 >
ffff8ba902a426c0 49895173 S Bi:1:003:1 -115 512 <
ffff8ba902a426c0 49895211 C Bi:1:003:1 0 512 = 7ac8bd0b 00000000 05000000 00000000 00000000 00000000 00000000 00000000
ffff8ba902a426c0 49895219 S Bi:1:003:1 -115 512 <
ffff8ba902a426c0 49895247 C Bi:1:003:1 0 0
ffff8ba902a426c0 49895267 S Bo:1:003:1 -115 512 = 067b8c41 78fa7b03 5220d3be dbff0b6a 8495d8b2 1adaaec5 5c0b0652 d37062a2
ffff8ba902a426c0 49895294 C Bo:1:003:1 0 512 >
ffff8ba902a426c0 49895297 S Bi:1:003:1 -115 512 <
ffff8ba902a426c0 49895816 C Bi:1:003:1 0 512 = 79c8be0b 00000000 06000000 00000000 00000000 00000000 00000000 00000000
ffff8ba902a426c0 49895820 S Bi:1:003:1 -115 512 <
ffff8ba902a426c0 49895856 C Bi:1:003:1 0 0
ffff8ba941e71a40 49945904 S Bo:1:003:1 -115 512 = a0a0a75d 6d5d10ba ad694902 a7c51b63 e6008856 76499003 a4ef89e3 b66ee557
ffff8ba941e71a40 49945937 C Bo:1:003:1 0 512 >
ffff8ba941e71a40 49945947 S Bi:1:003:1 -115 512 <
ffff8ba941e71a40 49945968 C Bi:1:003:1 0 512 = 7ac8bf0b 00000000 06000000 00000000 00000000 00000000 00000000 00000000
ffff8ba941e71a40 49945972 S Bi:1:003:1 -115 512 <
ffff8ba941e71a40 49946009 C Bi:1:003:1 0 0
ffff8ba91fa63ec0 49996086 S Bo:1:003:1 -115 512 = 79c8eb6f 193d7b8a 913ee541 48bd8af5 23995fe7 116d903a ddb29fa2 33ba3bbd
ffff8ba91fa63ec0 49996126 C Bo:1:003:1 0 512 >
ffff8ba9a6103ec0 49996140 S Bi:1:003:1 -115 512 <
ffff8ba9a6103ec0 49996168 C Bi:1:003:1 0 512 = 7ac8f10b 00000000 06000000 00000000 00000000 00000000 00000000 00000000
ffff8ba91fa62540 49996179 S Bi:1:003:1 -115 512 <
ffff8ba91fa62540 49996203 C Bi:1:003:1 0 0
ffff8ba91fa63ec0 50046284 S Bo:1:003:1 -115 512 = e8d8c510 18e0385f 67951f58 084e7527 468110fc 92449bf7 9ee6a9f7 72b708f9
ffff8ba91fa63ec0 50046320 C Bo:1:003:1 0 512 >
ffff8ba91fa63ec0 50046327 S Bi:1:003:1 -115 512 <
ffff8ba91fa63ec0 50046362 C Bi:1:003:1 0 512 = 7ac8240c 00000000 06000000 00000000 00000000 00000000 00000000 00000000
ffff8ba91fa63ec0 50046367 S Bi:1:003:1 -115 512 <
ffff8ba91fa63ec0 50046400 C Bi:1:003:1 0 0
ffff8ba91fa63ec0 50096440 S Bo:1:003:1 -115 512 = a1719329 ffd1b4b4 18aa3b37 cf5f9593 15278bde cde2c640 dce56fc5 7fa6807e
ffff8ba91fa63ec0 50096479 C Bo:1:003:1 0 512 >
ffff8ba91fa63ec0 50096486 S Bi:1:003:1 -115 512 <
ffff8ba91fa63ec0 50096517 C Bi:1:003:1 0 512 = 7ac8560c 00000000 06000000 00000000 00000000 00000000 00000000 00000000
ffff8ba91fa63ec0 50096521 S Bi:1:003:1 -115 512 <
ffff8ba91fa63ec0 50096562 C Bi:1:003:1 0 0
ffff8ba90290c180 50146595 S Bo:1:003:1 -115 512 = 6bd4528e b419b56a a095d135 ac1e4fa4 23ba6302 c7d3839f 524f5158 aa3ded23
ffff8ba90290c180 50146622 C Bo:1:003:1 0 512 >
ffff8ba90290c180 50146629 S Bi:1:003:1 -115 512 <
ffff8ba90290c180 50146657 C Bi:1:003:1 0 512 = 7ac8880c 00000000 06000000 00000000 00000000 00000000 00000000 00000000
ffff8ba90290c180 50146662 S Bi:1:003:1 -115 512 <
ffff8ba90290c180 50146702 C Bi:1:003:1 0 0
ffff8ba90290c300 50196758 S Bo:1:003:1 -115 512 = 45cdf268 b7d2d77b 088ceccb 3efc1ace 23d78865 549e9f09 aa1713f2 42c4f7b5
ffff8ba90290c300 50196781 C Bo:1:003:1 0 512 >
ffff8ba90290c300 50196800 S Bi:1:003:1 -115 512 <
ffff8ba90290c300 50196829 C Bi:1:003:1 0 512 = 7ac8ba0c 00000000 06000000 00000000 00000000 00000000 00000000 00000000
ffff8ba90290c300 50196838 S Bi:1:003:1 -115 512 <
ffff8ba90290c300 50196863 C Bi:1:003:1 0 0
ffff8ba90290c300 50246946 S Bo:1:003:1 -115 512 = 2634de93 5a257ffb e4e3b59c e004fca8 d91c053a 87eb0c41 2c6989f8 7eae7cf2
ffff8ba90290c300 50246973 C Bo:1:003:1 0 512 >
ffff8ba90290c300 50246980 S Bi:1:003:1 -115 512 <
ffff8ba90290c300 50247021 C Bi:1:003:1 0 512 = 7ac8ec0c 00000000 06000000 00000000 00000000 00000000 00000000 00000000
ffff8ba90290c300 50247026 S Bi:1:003:1 -115 512 <
ffff8ba90290c300 50247059 C Bi:1:003:1 0 0
ffff8ba941e71a40 50297135 S Bo:1:003:1 -115 512 = bdbd6d7e b5ac9c97 b9519b9e 8676ee20 873750b5 d3e433e8 de7be815 e07d72c6
ffff8ba941e71a40 50297163 C Bo:1:003:1 0 512 >
ffff8ba941e71a40 50297170 S Bi:1:003:1 -115 512 <
ffff8ba941e71a40 50297204 C Bi:1:003:1 0 512 = 7ac81e0d 00000000 06000000 00000000 00000000 00000000 00000000 00000000
ffff8ba941e71a40 50297208 S Bi:1:003:1 -115 512 <
ffff8ba941e71a40 50297242 C Bi:1:003:1 0 0
ffff8ba941e71a40 50347315 S Bo:1:003:1 -115 512 = 7be3af50 91948785 cef07f48 5e7f70d2 43ff765c 063853e6 191ed710 56d7a32b
ffff8ba941e71a40 50347358 C Bo:1:003:1 0 512 >
ffff8ba941e71a40 50347364 S Bi:1:003:1 -115 512 <
ffff8ba941e71a40 50347392 C Bi:1:003:1 0 512 = 7ac8510d 00000000 06000000 00000000 00000000 00000000 00000000 00000000
ffff8ba941e71a40 50347397 S Bi:1:003:1 -115 512 <
ffff8ba941e71a40 50347440 C Bi:1:003:1 0 0
ffff8ba941e71a40 50397513 S Bo:1:003:1 -115 512 = 833c0ecb 0253fa53 89aa90ae fdd9e300 1cc66cb9 3411f253 a833b667 7e9c1b32
ffff8ba941e71a40 50397544 C Bo:1:003:1 0 512 >
ffff8ba941e71a40 50397549 S Bi:1:003:1 -115 512 <
ffff8ba941e71a40 50397587 C Bi:1:003:1 0 512 = 7ac8830d 00000000 06000000 00000000 00000000 00000000 00000000 00000000
ffff8ba941e71a40 50397591 S Bi:1:003:1 -115 512 <
ffff8ba941e71a40 50397623 C Bi:1:003:1 0 0
ffff8ba94077c300 50447699 S Bo:1:003:1 -115 512 = c0fba689 e2b7db2c c3a11a1c ab257418 6612bf37 16d66c45 e0e202d4 945cee4e
ffff8ba94077c300 50447735 C Bo:1:003:1 0 512 >
ffff8ba94077c300 50447742 S Bi:1:003:1 -115 512 <
ffff8ba94077c300 50447777 C Bi:1:003:1 0 512 = 7ac8b50d 00000000 06000000 00000000 00000000 00000000 00000000 00000000
ffff8ba94077c300 50447782 S Bi:1:003:1 -115 512 <
ffff8ba94077c300 50447815 C Bi:1:003:1 0 0
ffff8ba9544d6180 50497880 S Bo:1:003:1 -115 512 = 6a51efb2 a34ac1ec 9a73d5c3 9c99880b 1cdaf66e 3cb7159c 50fa2b98 47cfb1c0
ffff8ba9544d6180 50497916 C Bo:1:003:1 0 512 >
ffff8ba9544d6180 50497925 S Bi:1:003:1 -115 512 <
ffff8ba9544d6180 50497952 C Bi:1:003:1 0 512 = 7ac8e70d 00000000 06000000 00000000 00000000 00000000 00000000 00000000
ffff8ba9544d6180 50497956 S Bi:1:003:1 -115 512 <
ffff8ba9544d6180 50497990 C Bi:1:003:1 0 0
ffff8ba94077d380 50548024 S Bo:1:003:1 -115 512 = df31d46b 9cff022e a3a44f77 172c7dc8 c3bec574 008b2b44 b794f647 234240f3
ffff8ba94077d380 50548060 C Bo:1:003:1 0 512 >
ffff8ba94077d380 50548067 S Bi:1:003:1 -115 512 <
ffff8ba94077d380 50548105 C Bi:1:003:1 0 512 = 7ac8190e 00000000 06000000 00000000 00000000 00000000 00000000 00000000
ffff8ba94077d380 50548110 S Bi:1:003:1 -115 512 <
ffff8ba94077d380 50548140 C Bi:1:003:1 0 0
ffff8ba94077d380 50598233 S Bo:1:003:1 -115 512 = f9e14d8b 4c094a5b edd87e9f 747fa817 71d12388 3fb32b45 778468e1 83b8ef07
ffff8ba94077d380 50598268 C Bo:1:003:1 0 512 >
ffff8ba94077d380 50598276 S Bi:1:003:1 -115 512 <
ffff8ba94077d380 50598304 C Bi:1:003:1 0 512 = 7ac84c0e 00000000 06000000 00000000 00000000 00000000 00000000 00000000
ffff8ba94077d380 50598311 S Bi:1:003:1 -115 512 <
ffff8ba94077d380 50598348 C Bi:1:003:1 0 0
ffff8ba94077d380 50648444 S Bo:1:003:1 -115 512 = 98499c01 30aa7695 ab8c2e2e 5de66089 828b4da0 c70650c8 6020ee8d 9a5ab2f2
ffff8ba94077d380 50648491 C Bo:1:003:1 0 512 >
ffff8ba94077d380 50648498 S Bi:1:003:1 -115 512 <
ffff8ba94077d380 50648526 C Bi:1:003:1 0 512 = 7ac87e0e 00000000 06000000 00000000 00000000 00000000 00000000 00000000
ffff8ba94077d380 50648533 S Bi:1:003:1 -115 512 <
ffff8ba94077d380 50648571 C Bi:1:003:1 0 0
ffff8ba94077d380 50698668 S Bo:1:003:1 -115 512 = f60a9aad 2cc85ca0 c7ab8004 d402bcbb cc1fc99f 5c05b86e 4ffc18ee e9e3a5e2
ffff8ba94077d380 50698699 C Bo:1:003:1 0 512 >
ffff8ba9544dd440 50698710 S Bi:1:003:1 -115 512 <
ffff8ba9544dd440 50698734 C Bi:1:003:1 0 512 = 7ac8b00e 00000000 06000000 00000000 00000000 00000000 00000000 00000000
ffff8ba902a42fc0 50698743 S Bi:1:003:1 -115 512 <
ffff8ba902a42fc0 50698779 C Bi:1:003:1 0 0
ffff8ba941e73440 50748858 S Bo:1:003:1 -115 512 = 3f236630 a7f8f5e5 0ef77e90 82ee3981 825d69ab 83c6f632 eb97de7a 5d12632c
ffff8ba941e73440 50748892 C Bo:1:003:1 0 512 >
ffff8ba941e73440 50748897 S Bi:1:003:1 -115 512 <
ffff8ba941e73440 50748936 C Bi:1:003:1 0 512 = 7ac8e20e 00000000 06000000 00000000 00000000 00000000 00000000 00000000
ffff8ba941e73440 50748941 S Bi:1:003:1 -115 512 <
ffff8ba941e73440 50748970 C Bi:1:003:1 0 0
ffff8ba914b9a300 50799044 S Bo:1:003:1 -115 512 = cb4b8400 fe09d444 b48643ea cd269f80 29ffda1f 725faf60 7c91101b 1c17fd33
ffff8ba914b9a300 50799080 C Bo:1:003:1 0 512 >
ffff8ba914b9a300 50799087 S Bi:1:003:1 -115 512 <
ffff8ba914b9a300 50799115 C Bi:1:003:1 0 512 = 7ac8140f 00000000 06000000 00000000 00000000 00000000 00000000 00000000
ffff8ba914b9a300 50799121 S Bi:1:003:1 -115 512 <
ffff8ba914b9a300 50799162 C Bi:1:003:1 0 0
ffff8ba914b9a300 50849239 S Bo:1:003:1 -115 512 = 4686191a b841db97 a5b1fb82 72b47b97 0b5727c1 e3f255ab f29df1a6 13a531f0
ffff8ba914b9a300 50849274 C Bo:1:003:1 0 512 >
ffff8ba914b9a300 50849279 S Bi:1:003:1 -115 512 <
ffff8ba914b9a300 50849309 C Bi:1:003:1 0 512 = 7ac8470f 00000000 06000000 00000000 00000000 00000000 00000000 00000000
ffff8ba914b9a300 50849315 S Bi:1:003:1 -115 512 <
ffff8ba914b9a300 50849354 C Bi:1:003:1 0 0
ffff8ba9566a7980 50887273 S Bo:1:003:1 -115 512 = 5065c41c 0068cad2 57eb8ab6 38b389cf 8f352008 ed85d5c4 424615c6 55c6b624
ffff8ba9566a7980 50887308 C Bo:1:003:1 0 512 >
ffff8ba9566a7980 50887316 S Bi:1:003:1 -115 512 <
ffff8ba9566a7980 50887344 C Bi:1:003:1 0 512 = 7ac8790f 00000000 06000000 00000000 00000000 00000000 00000000 00000000
ffff8ba914b9a300 50899432 S Bo:1:003:1 -115 512 = 63e25cf1 92d39b5b a8c19a87 f3b04d02 e3298795 e516f4b9 61d5c55f bdc33b9e
ffff8ba914b9a300 50899467 C Bo:1:003:1 0 512 >
ffff8ba914b9a300 50899479 S Bi:1:003:1 -115 512 <
ffff8ba914b9a300 50899503 C Bi:1:003:1 0 0
ffff8ba914b9a300 50899509 S Bi:1:003:1 -115 512 <
ffff8ba914b9a300 50899543 C Bi:1:003:1 0 512 = fac81f13 00000000 0b000000 00170000 00000000 09cbf70b d7e566e1 03000116
ffff8ba914b9a300 50899548 S Bi:1:003:1 -115 512 <
ffff8ba914b9a300 50899583 C Bi:1:003:1 0 0
ffff8ba914b9a300 50899637 S Bo:1:003:1 -115 58443 = e86abb4e d647aef5 d40edefa 9e763cbd 06fcc901 52d718c6 fb6790a5 6d701cd1
ffff8ba914b9a300 50901526 C Bo:1:003:1 0 58443 >
ffff8ba914b9a300 50901535 S Bi:1:003:1 -115 512 <
ffff8ba914b9a300 50901562 C Bi:1:003:1 0 512 = 7ac8ab0f 00000000 06000000 00000000 00000000 00000000 00000000 00000000
ffff8ba914b9a300 50901574 S Bi:1:003:1 -115 512 <
ffff8ba914b9a300 50901609 C Bi:1:003:1 0 0
ffff8ba914b9a300 50901635 S Bo:1:003:1 -115 512 = f6b1d2d7 926408ac 6e6e1998 0d961d36 1983fe6c 7c740f83 d427775c abacbe55
ffff8ba914b9a300 50901673 C Bo:1:003:1 0 512 >
ffff8ba914b9a300 50901679 S Bi:1:003:1 -115 512 <
ffff8ba914b9a300 50901989 C Bi:1:003:1 0 512 = 79c8ac0f 00000000 07000000 00000000 00000000 00000000 00000000 00000000
ffff8ba914b9a300 50901995 S Bi:1:003:1 -115 512 <
ffff8ba914b9a300 50902024 C Bi:1:003:1 0 0
ffff8ba914b9a300 50952143 S Bo:1:003:1 -115 512 = 44d47e3f 1dbc5936 61d32663 b89a734b 0fe42b58 444f0887 c105a24f 3ccd1af7
ffff8ba914b9a300 50952173 C Bo:1:003:1 0 512 >
ffff8ba914b9a300 50952185 S Bi:1:003:1 -115 512 <
ffff8ba914b9a300 50952213 C Bi:1:003:1 0 512 = 7ac8ad0f 00000000 07000000 00000000 00000000 00000000 00000000 00000000
ffff8ba914b9a300 50952222 S Bi:1:003:1 -115 512 <
ffff8ba914b9a300 50952253 C Bi:1:003:1 0 0
ffff8ba914b9a300 51002337 S Bo:1:003:1 -115 512 = d87d3fe0 9647e7e7 8b2d218f aadd48a3 96fb8949 4f63d654 6d6382c1 8fb0bef0
ffff8ba914b9a300 51002375 C Bo:1:003:1 0 512 >
ffff8ba914b9a300 51002385 S Bi:1:003:1 -115 512 <
ffff8ba914b9a300 51002413 C Bi:1:003:1 0 512 = 7ac8e00f 00000000 07000000 00000000 00000000 00000000 00000000 00000000
ffff8ba914b9a300 51002419 S Bi:1:003:1 -115 512 <
ffff8ba914b9a300 51002453 C Bi:1:003:1 0 0
ffff8ba9566a6a80 51052494 S Bo:1:003:1 -115 512 = 2195534a fca503a8 b51358a2 5c7abe6d 90124616 9f56f555 4ff09fba ac403bbb
ffff8ba9566a6a80 51052529 C Bo:1:003:1 0 512 >
ffff8ba9566a6a80 51052536 S Bi:1:003:1 -115 512 <
ffff8ba9566a6a80 51052564 C Bi:1:003:1 0 512 = 7ac81210 00000000 07000000 00000000 00000000 00000000 00000000 00000000
ffff8ba9566a6a80 51052569 S Bi:1:003:1 -115 512 <
ffff8ba9566a6a80 51052609 C Bi:1:003:1 0 0
ffff8ba9566a6a80 51102687 S Bo:1:003:1 -115 512 = 74ff95db a233e17b 1ef493ff 057c936a 0a2d168a 4e36f019 721bd698 43b02b7f
ffff8ba9566a6a80 51102721 C Bo:1:003:1 0 512 >
ffff8ba9566a6a80 51102726 S Bi:1:003:1 -115 512 <
ffff8ba9566a6a80 51102756 C Bi:1:003:1 0 512 = 7ac84410 00000000 07000000 00000000 00000000 00000000 00000000 00000000
ffff8ba9566a6a80 51102762 S Bi:1:003:1 -115 512 <
ffff8ba9566a6a80 51102805 C Bi:1:003:1 0 0
ffff8ba9566a6a80 51152882 S Bo:1:003:1 -115 512 = 5813359a 0e5b62ed 95e9297a 52557ef1 ac64ed1f 6bbfaaa8 99be1826 391c73ce
ffff8ba9566a6a80 51152916 C Bo:1:003:1 0 512 >
ffff8ba9566a6a80 51152921 S Bi:1:003:1 -115 512 <
ffff8ba9566a6a80 51152960 C Bi:1:003:1 0 512 = 7ac87610 00000000 07000000 00000000 00000000 00000000 00000000 00000000
ffff8ba9566a6a80 51152965 S Bi:1:003:1 -115 512 <
ffff8ba9566a6a80 51152996 C Bi:1:003:1 0 0
ffff8ba9566a6a80 51203095 S Bo:1:003:1 -115 512 = 05ee8b00 6bda0c29 05caf6f9 e248f680 a149d2d6 797cc9c0 9ef0d8f7 707f0aec
ffff8ba9566a6a80 51203130 C Bo:1:003:1 0 512 >
ffff8ba9566a6a80 51203138 S Bi:1:003:1 -115 512 <
ffff8ba9566a6a80 51203166 C Bi:1:003:1 0 512 = 7ac8a810 00000000 07000000 00000000 00000000 00000000 00000000 00000000
ffff8ba9566a6a80 51203174 S Bi:1:003:1 -115 512 <
ffff8ba9566a6a80 51203210 C Bi:1:003:1 0 0
ffff8ba9566a6a80 51253291 S Bo:1:003:1 -115 512 = 3efdfd63 3fd129de aaf5d167 d8cdb5a2 8c550379 8655f3a8 fcbc3272 a3b4e26c
ffff8ba9566a6a80 51253325 C Bo:1:003:1 0 512 >
ffff8ba9566a6a80 51253331 S Bi:1:003:1 -115 512 <
ffff8ba9566a6a80 51253371 C Bi:1:003:1 0 512 = 7ac8db10 00000000 07000000 00000000 00000000 00000000 00000000 00000000
ffff8ba9566a6a80 51253376 S Bi:1:003:1 -115 512 <
ffff8ba9566a6a80 51253411 C Bi:1:003:1 0 0
ffff8ba9566a6a80 51303488 S Bo:1:003:1 -115 512 = 5c6cdd55 8c5bbc52 341ab6bc 2296d5c7 18e3c567 9803bb8b 8bc9f2d9 f85a24da
ffff8ba9566a6a80 51303523 C Bo:1:003:1 0 512 >
ffff8ba9566a6a80 51303528 S Bi:1:003:1 -115 512 <
ffff8ba9566a6a80 51303558 C Bi:1:003:1 0 512 = 7ac80d11 00000000 07000000 00000000 00000000 00000000 00000000 00000000
ffff8ba9566a6a80 51303563 S Bi:1:003:1 -115 512 <
ffff8ba9566a6a80 51303602 C Bi:1:003:1 0 0
ffff8ba9566a6a80 51353683 S Bo:1:003:1 -115 512 = 2f879f35 b18974a5 c47ea250 56e8b98a 602798de abcd6db4 c72908fe 0d595a30
ffff8ba9566a6a80 51353718 C Bo:1:003:1 0 512 >
ffff8ba9566a6a80 51353724 S Bi:1:003:1 -115 512 <
ffff8ba9566a6a80 51353753 C Bi:1:003:1 0 512 = 7ac83f11 00000000 07000000 00000000 00000000 00000000 00000000 00000000
ffff8ba9566a6a80 51353758 S Bi:1:003:1 -115 512 <
ffff8ba9566a6a80 51353798 C Bi:1:003:1 0 0
ffff8ba9566a6a80 51403875 S Bo:1:003:1 -115 512 = 1b801472 72108f91 9db90cd3 8377e78d 6987a2cf 0b7f2c66 603a767d 7471908d
ffff8ba9566a6a80 51403911 C Bo:1:003:1 0 512 >
ffff8ba9566a6a80 51403916 S Bi:1:003:1 -115 512 <
ffff8ba9566a6a80 51403946 C Bi:1:003:1 0 512 = 7ac87111 00000000 07000000 00000000 00000000 00000000 00000000 00000000
ffff8ba9566a6a80 51403952 S Bi:1:003:1 -115 512 <
ffff8ba9566a6a80 51403993 C Bi:1:003:1 0 0
ffff8ba9566a6a80 51454022 S Bo:1:003:1 -115 512 = 8cd6a0d2 3c346c86 0b6bd2a8 b1b91634 77d6f8f8 471e3ddc 33401182 e92ced8e
ffff8ba9566a6a80 51454070 C Bo:1:003:1 0 512 >
ffff8ba9566a6a80 51454078 S Bi:1:003:1 -115 512 <
ffff8ba9566a6a80 51454119 C Bi:1:003:1 0 512 = 7ac8a311 00000000 07000000 00000000 00000000 00000000 00000000 00000000
ffff8ba9566a6a80 51454126 S Bi:1:003:1 -115 512 <
ffff8ba9566a6a80 51454159 C Bi:1:003:1 0 0
ffff8ba98420ea80 51504249 S Bo:1:003:1 -115 512 = f1ba037c 13ac3d64 d7718e0d b7c29a3b ad4631f4 68abd372 edecb096 069bd749
ffff8ba98420ea80 51504286 C Bo:1:003:1 0 512 >
ffff8ba98420ea80 51504291 S Bi:1:003:1 -115 512 <
ffff8ba98420ea80 51504321 C Bi:1:003:1 0 512 = 7ac8d611 00000000 07000000 00000000 00000000 00000000 00000000 00000000
ffff8ba98420ea80 51504325 S Bi:1:003:1 -115 512 <
ffff8ba98420ea80 51504368 C Bi:1:003:1 0 0
ffff8ba98420ea80 51554444 S Bo:1:003:1 -115 512 = b673bf91 8321a5d3 bec59b17 271fbe2d 78a58377 345e89f8 6b3fd8e9 5e9fd5db
ffff8ba98420ea80 51554478 C Bo:1:003:1 0 512 >
ffff8ba98420ea80 51554482 S Bi:1:003:1 -115 512 <
ffff8ba98420ea80 51554522 C Bi:1:003:1 0 512 = 7ac80812 00000000 07000000 00000000 00000000 00000000 00000000 00000000
ffff8ba98420ea80 51554525 S Bi:1:003:1 -115 512 <
ffff8ba98420ea80 51554558 C Bi:1:003:1 0 0
ffff8ba98420ea80 51604625 S Bo:1:003:1 -115 512 = 37859989 9f491bae b23a1c14 cc15a068 18379131 c7553df3 67e1d9fd 65ce9a18
ffff8ba98420ea80 51604659 C Bo:1:003:1 0 512 >
ffff8ba98420ea80 51604662 S Bi:1:003:1 -115 512 <
ffff8ba98420ea80 51604702 C Bi:1:003:1 0 512 = 7ac83a12 00000000 07000000 00000000 00000000 00000000 00000000 00000000
ffff8ba98420ea80 51604706 S Bi:1:003:1 -115 512 <
ffff8ba98420ea80 51604739 C Bi:1:003:1 0 0
ffff8ba98420ea80 51654799 S Bo:1:003:1 -115 512 = bf41e415 015fa46b e7cd6abf d216462b 6180e4a2 d9ff5866 38814ecd ef1f59b5
ffff8ba98420ea80 51654832 C Bo:1:003:1 0 512 >
ffff8ba98420ea80 51654836 S Bi:1:003:1 -115 512 <
ffff8ba98420ea80 51654872 C Bi:1:003:1 0 512 = 7ac86c12 00000000 07000000 00000000 00000000 00000000 00000000 00000000
ffff8ba98420ea80 51654876 S Bi:1:003:1 -115 512 <
ffff8ba98420ea80 51654913 C Bi:1:003:1 0 0
ffff8ba98420ea80 51704973 S Bo:1:003:1 -115 512 = 3b692f96 bacebb2a 074f5ce4 845d0882 1657b8c9 c2f71bd0 71f22e8f 603dd948
ffff8ba98420ea80 51705004 C Bo:1:003:1 0 512 >
ffff8ba98420ea80 51705008 S Bi:1:003:1 -115 512 <
ffff8ba98420ea80 51705048 C Bi:1:003:1 0 512 = 7ac89e12 00000000 07000000 00000000 00000000 00000000 00000000 00000000
ffff8ba98420ea80 51705052 S Bi:1:003:1 -115 512 <
ffff8ba98420ea80 51705084 C Bi:1:003:1 0 0
ffff8ba9566a6a80 51755160 S Bo:1:003:1 -115 512 = bf8f6eae d3883ec4 1a782836 486b4dc6 abb9e5d6 76a8cf33 00700c4c 4b2ab037
ffff8ba9566a6a80 51755194 C Bo:1:003:1 0 512 >
ffff8ba9566a6a80 51755198 S Bi:1:003:1 -115 512 <
ffff8ba9566a6a80 51755237 C Bi:1:003:1 0 512 = 7ac8d012 00000000 07000000 00000000 00000000 00000000 00000000 00000000
ffff8ba9566a6a80 51755241 S Bi:1:003:1 -115 512 <
ffff8ba9566a6a80 51755274 C Bi:1:003:1 0 0
ffff8ba9566a6a80 51805335 S Bo:1:003:1 -115 512 = 2710d0a1 6b404f92 a1051c7c 3a01a45e fba44700 ad89ee47 1cfc7d8f 7a2bc812
ffff8ba9566a6a80 51805380 C Bo:1:003:1 0 512 >
ffff8ba9566a6a80 51805384 S Bi:1:003:1 -115 512 <
ffff8ba9566a6a80 51805424 C Bi:1:003:1 0 512 = 7ac80313 00000000 07000000 00000000 00000000 00000000 00000000 00000000
ffff8ba9566a6a80 51805427 S Bi:1:003:1 -115 512 <
ffff8ba9566a6a80 51805460 C Bi:1:003:1 0 0
ffff8ba9566a6a80 51855538 S Bo:1:003:1 -115 512 = beb68423 6ab54057 7063167d a7004265 818828ec bc6fbea9 dacc76c2 23229e42
ffff8ba9566a6a80 51855572 C Bo:1:003:1 0 512 >
ffff8ba9566a6a80 51855577 S Bi:1:003:1 -115 512 <
ffff8ba9566a6a80 51855615 C Bi:1:003:1 0 512 = 7ac83513 00000000 07000000 00000000 00000000 00000000 00000000 00000000
ffff8ba9566a6a80 51855619 S Bi:1:003:1 -115 512 <
ffff8ba9566a6a80 51855652 C Bi:1:003:1 0 0
ffff8ba902a426c0 51887273 S Bo:1:003:1 -115 512 = 87199e6e e8ef28aa 3d3c3345 eb81e528 0daf34f8 b79a1ac2 bfeb04bd 1dec0f6d
ffff8ba902a426c0 51887309 C Bo:1:003:1 0 512 >
ffff8ba902a426c0 51887316 S Bi:1:003:1 -115 512 <
ffff8ba902a426c0 51887344 C Bi:1:003:1 0 512 = 7ac86713 00000000 07000000 00000000 00000000 00000000 00000000 00000000
ffff8ba9566a6a80 51905718 S Bo:1:003:1 -115 512 = 644054fb 3739f5f2 463657e4 d7b0b2dc 619fd57c 0fbe1b00 f808e26b ff8471da
ffff8ba9566a6a80 51905753 C Bo:1:003:1 0 512 >
ffff8ba9566a6a80 51905757 S Bi:1:003:1 -115 512 <
ffff8ba9566a6a80 51905793 C Bi:1:003:1 0 0
ffff8ba9566a6a80 51905796 S Bi:1:003:1 -115 512 <
ffff8ba9566a6a80 51905833 C Bi:1:003:1 0 512 = fac80717 00000000 0b000000 00170000 00000000 09cbf70b d7e566e1 03000116
ffff8ba9566a6a80 51905838 S Bi:1:003:1 -115 512 <
ffff8ba9566a6a80 51905874 C Bi:1:003:1 0 0
ffff8ba9566a6a80 51905920 S Bo:1:003:1 -115 53931 = 595ec367 e1f47e70 704f4a86 f493d33c 9f73e7bc fae9a8d9 d00eded6 bb853caa
ffff8ba9566a6a80 51907398 C Bo:1:003:1 0 53931 >
ffff8ba9566a6a80 51907403 S Bi:1:003:1 -115 512 <
ffff8ba9566a6a80 51907442 C Bi:1:003:1 0 512 = 7ac89913 00000000 07000000 00000000 00000000 00000000 00000000 00000000
ffff8ba9566a6a80 51907450 S Bi:1:003:1 -115 512 <
ffff8ba9566a6a80 51907478 C Bi:1:003:1 0 0
ffff8ba9566a6a80 51907501 S Bo:1:003:1 -115 512 = 44b9944a 27a95c00 9644a3be 69c56cda 8f2b5161 2b61e5a3 f87a92b9 6fbbc8e9
ffff8ba9566a6a80 51907538 C Bo:1:003:1 0 512 >
ffff8ba9566a6a80 51907541 S Bi:1:003:1 -115 512 <
ffff8ba9566a6a80 51908074 C Bi:1:003:1 0 512 = 79c89a13 00000000 08000000 00000000 00000000 00000000 00000000 00000000
ffff8ba9566a6a80 51908078 S Bi:1:003:1 -115 512 <
ffff8ba9566a6a80 51908111 C Bi:1:003:1 0 0
ffff8ba941e71a40 51915005 S Bo:1:003:1 -115 512 = 345a8807 8767e735 5f187e91 1ef8e27c 5cbb7f5f fbffe2c1 bcfefa80 c1da265a
ffff8ba941e71a40 51915038 C Bo:1:003:1 0 512 >
ffff8ba941e71a40 51915044 S Bi:1:003:1 -115 512 <
ffff8ba941e71a40 51915073 C Bi:1:003:1 0 512 = 7ac89b13 00000000 08000000 00000000 00000000 00000000 00000000 00000000
ffff8ba9566a6a80 51958183 S Bo:1:003:1 -115 512 = 3c932168 9c785687 2faf6cde 6a32847f cbac9b76 bff58f12 eb78dbc6 6c53dff0
ffff8ba9566a6a80 51958212 C Bo:1:003:1 0 512 >
ffff8ba9566a6a80 51958216 S Bi:1:003:1 -115 512 <
ffff8ba9566a6a80 51958252 C Bi:1:003:1 0 0
ffff8ba9566a6a80 51958256 S Bi:1:003:1 -115 512 <
ffff8ba9566a6a80 51958376 C Bi:1:003:1 0 512 = 7ac8ce13 00000000 08000000 00000000 00000000 00000000 00000000 00000000
ffff8ba9566a6a80 51958380 S Bi:1:003:1 -115 512 <
ffff8ba9566a6a80 51958416 C Bi:1:003:1 0 0
ffff8ba9566a6a80 51958448 S Bo:1:003:1 -115 58414 = c37d609f d0dea25b 878744c6 a1e62b71 d6e1d817 338c416e 6b5efe42 f570b6ac
ffff8ba9566a6a80 51960213 C Bo:1:003:1 0 58414 >
ffff8ba9566a6a80 51960217 S Bi:1:003:1 -115 512 <
ffff8ba9566a6a80 51960663 C Bi:1:003:1 0 512 = 79c8cf13 00000000 09000000 00000000 00000000 00000000 00000000 00000000
ffff8ba9566a6a80 51960670 S Bi:1:003:1 -115 512 <
ffff8ba9566a6a80 51960700 C Bi:1:003:1 0 0
ffff8ba9566a6a80 51960722 S Bo:1:003:1 -115 512 = 619c94ca ec971c62 90102d1d 27e21850 9a1a8150 fed83373 6f9059c5 80ea8a8c
ffff8ba9566a6a80 51960760 C Bo:1:003:1 0 512 >
ffff8ba9566a6a80 51960764 S Bi:1:003:1 -115 512 <
ffff8ba9566a6a80 51960907 C Bi:1:003:1 0 512 = 7ac8d013 00000000 09000000 00000000 00000000 00000000 00000000 00000000
ffff8ba9566a6a80 51960910 S Bi:1:003:1 -115 512 <
ffff8ba9566a6a80 51960947 C Bi:1:003:1 0 0
ffff8ba98420ea80 52011025 S Bo:1:003:1 -115 512 = 2a17715a d78d1709 393e4bde e6cd0ab6 6b35f7b1 02361faa 08d042bc efc11e86
ffff8ba98420ea80 52011053 C Bo:1:003:1 0 512 >
ffff8ba98420ea80 52011058 S Bi:1:003:1 -115 512 <
ffff8ba98420ea80 52011210 C Bi:1:003:1 0 512 = 7ac80314 00000000 09000000 00000000 00000000 00000000 00000000 00000000
ffff8ba98420ea80 52011213 S Bi:1:003:1 -115 512 <
ffff8ba98420ea80 52011256 C Bi:1:003:1 0 0
ffff8ba98420ea80 52061321 S Bo:1:003:1 -115 512 = a640df42 11a60f56 5f599f51 dd873537 1c71021a 74cfeb0d 0f04bd97 a408d4a8
ffff8ba98420ea80 52061355 C Bo:1:003:1 0 512 >
ffff8ba98420ea80 52061360 S Bi:1:003:1 -115 512 <
ffff8ba98420ea80 52061505 C Bi:1:003:1 0 512 = 7ac83514 00000000 09000000 00000000 00000000 00000000 00000000 00000000
ffff8ba98420ea80 52061509 S Bi:1:003:1 -115 512 <
ffff8ba98420ea80 52061545 C Bi:1:003:1 0 0
ffff8ba98420ea80 52111621 S Bo:1:003:1 -115 512 = 80acea95 27dd9959 b16d543e e2a0b9ea 9f15c69a a18bfbd7 9e8fbe7d a4ef8fe9
ffff8ba98420ea80 52111655 C Bo:1:003:1 0 512 >
ffff8ba98420ea80 52111658 S Bi:1:003:1 -115 512 <
ffff8ba98420ea80 52111858 C Bi:1:003:1 0 512 = 7ac86714 00000000 09000000 00000000 00000000 00000000 00000000 00000000
ffff8ba98420ea80 52111861 S Bi:1:003:1 -115 512 <
ffff8ba98420ea80 52111895 C Bi:1:003:1 0 0
ffff8ba941e71a40 52161981 S Bo:1:003:1 -115 512 = 9019c9fb eb379eff e1b9fa82 987374e3 7ada0b83 ba131baf 89daaa69 1a851790
ffff8ba941e71a40 52162013 C Bo:1:003:1 0 512 >
ffff8ba941e71a40 52162021 S Bi:1:003:1 -115 512 <
ffff8ba941e71a40 52162178 C Bi:1:003:1 0 512 = 7ac89914 00000000 09000000 00000000 00000000 00000000 00000000 00000000
ffff8ba941e71a40 52162187 S Bi:1:003:1 -115 512 <
ffff8ba941e71a40 52162210 C Bi:1:003:1 0 0
ffff8ba941e71a40 52212288 S Bo:1:003:1 -115 512 = a30b9bef 65a4fd90 d0f842ea fbe81c87 7b0399b4 fa905125 ba1f6488 e7a82577
ffff8ba941e71a40 52212330 C Bo:1:003:1 0 512 >
ffff8ba941e71a40 52212338 S Bi:1:003:1 -115 512 <
ffff8ba941e71a40 52212491 C Bi:1:003:1 0 512 = 7ac8cc14 00000000 09000000 00000000 00000000 00000000 00000000 00000000
ffff8ba941e71a40 52212500 S Bi:1:003:1 -115 512 <
ffff8ba941e71a40 52212513 C Bi:1:003:1 0 0
ffff8ba91ded0000 52262549 S Bo:1:003:1 -115 512 = aab33b6b b6f4564f d8910e24 7d6b3c72 1e4e4342 9e576ec2 99009483 72527736
ffff8ba91ded0000 52262590 C Bo:1:003:1 0 512 >
ffff8ba91ded1140 52262623 S Bi:1:003:1 -115 512 <
ffff8ba91ded1140 52262731 C Bi:1:003:1 0 512 = 7ac8fe14 00000000 09000000 00000000 00000000 00000000 00000000 00000000
ffff8ba91ded0840 52262761 S Bi:1:003:1 -115 512 <
ffff8ba91ded0840 52262772 C Bi:1:003:1 0 0
ffff8ba902af8540 52312858 S Bo:1:003:1 -115 512 = d3c1236d 8ad47608 559cd4d3 2c735e09 5e9d6be8 a4695ef5 db8c5716 82de572b
ffff8ba902af8540 52312902 C Bo:1:003:1 0 512 >
ffff8ba902af8540 52312913 S Bi:1:003:1 -115 512 <
ffff8ba902af8540 52313044 C Bi:1:003:1 0 512 = 7ac83015 00000000 09000000 00000000 00000000 00000000 00000000 00000000
ffff8ba902af8540 52313054 S Bi:1:003:1 -115 512 <
ffff8ba902af8540 52313066 C Bi:1:003:1 0 0
ffff8ba902af8540 52363140 S Bo:1:003:1 -115 512 = 2a0778a0 9ca511d2 18b7c62c aecc012a 119b8d94 229c68da 0fa509f4 79977bb2
ffff8ba902af8540 52363184 C Bo:1:003:1 0 512 >
ffff8ba902af8540 52363193 S Bi:1:003:1 -115 512 <
ffff8ba902af8540 52363330 C Bi:1:003:1 0 512 = 7ac86315 00000000 09000000 00000000 00000000 00000000 00000000 00000000
ffff8ba902af8540 52363339 S Bi:1:003:1 -115 512 <
ffff8ba902af8540 52363354 C Bi:1:003:1 0 0
ffff8ba902af8540 52413433 S Bo:1:003:1 -115 512 = 9f2e1eae 1660d973 54a024de 1b2a39aa a29543e1 bd65fe85 977b649e a8bfa7f0
ffff8ba902af8540 52413479 C Bo:1:003:1 0 512 >
ffff8ba902af8540 52413487 S Bi:1:003:1 -115 512 <
ffff8ba902af8540 52413612 C Bi:1:003:1 0 512 = 7ac89515 00000000 09000000 00000000 00000000 00000000 00000000 00000000
ffff8ba902af8540 52413620 S Bi:1:003:1 -115 512 <
ffff8ba902af8540 52413643 C Bi:1:003:1 0 0
ffff8ba902af8540 52463720 S Bo:1:003:1 -115 512 = ef543583 38a41dac 5032071f 43f9feb3 4619a786 9fbb958d c8c9653a 01437079
ffff8ba902af8540 52463768 C Bo:1:003:1 0 512 >
ffff8ba902af8540 52463773 S Bi:1:003:1 -115 512 <
ffff8ba902af8540 52463923 C Bi:1:003:1 0 512 = 7ac8c715 00000000 09000000 00000000 00000000 00000000 00000000 00000000
ffff8ba902af8540 52463929 S Bi:1:003:1 -115 512 <
ffff8ba902af8540 52463963 C Bi:1:003:1 0 0
ffff8ba902af8540 52514023 S Bo:1:003:1 -115 512 = 744c85c4 e61a15b8 8c05cca8 0f7af5ca a8b3470b c21ea842 cdb42a7d b40125d2
ffff8ba902af8540 52514052 C Bo:1:003:1 0 512 >
ffff8ba902af8540 52514058 S Bi:1:003:1 -115 512 <
ffff8ba902af8540 52514211 C Bi:1:003:1 0 512 = 7ac8fa15 00000000 09000000 00000000 00000000 00000000 00000000 00000000
ffff8ba902af8540 52514216 S Bi:1:003:1 -115 512 <
ffff8ba902af8540 52514251 C Bi:1:003:1 0 0
ffff8ba902af8180 52564339 S Bo:1:003:1 -115 512 = 14aa6732 cba8b33c 949ece3c 90b57a7c 520b3209 4af5121f 39951a8b a17e0db1
ffff8ba902af8180 52564385 C Bo:1:003:1 0 512 >
ffff8ba902af8180 52564393 S Bi:1:003:1 -115 512 <
ffff8ba902af8180 52564530 C Bi:1:003:1 0 512 = 7ac82c16 00000000 09000000 00000000 00000000 00000000 00000000 00000000
ffff8ba902af8180 52564536 S Bi:1:003:1 -115 512 <
ffff8ba902af8180 52564570 C Bi:1:003:1 0 0
ffff8ba902af8180 52614648 S Bo:1:003:1 -115 512 = 0652c479 050409a8 e003a0a1 b01d3580 93781386 767ae218 1a73d2c4 c36b7f66
ffff8ba902af8180 52614682 C Bo:1:003:1 0 512 >
ffff8ba902af8180 52614687 S Bi:1:003:1 -115 512 <
ffff8ba902af8180 52614832 C Bi:1:003:1 0 512 = 7ac85e16 00000000 09000000 00000000 00000000 00000000 00000000 00000000
ffff8ba902af8180 52614838 S Bi:1:003:1 -115 512 <
ffff8ba902af8180 52614865 C Bi:1:003:1 0 0
ffff8ba9566a6a80 52664913 S Bo:1:003:1 -115 512 = 045d3291 cfdb326e a59e0640 daba2c70 fbd2e021 04f02bc7 9cd20364 72b2609f
ffff8ba9566a6a80 52664950 C Bo:1:003:1 0 512 >
ffff8ba9566a6a80 52664958 S Bi:1:003:1 -115 512 <
ffff8ba9566a6a80 52665089 C Bi:1:003:1 0 512 = 7ac89016 00000000 09000000 00000000 00000000 00000000 00000000 00000000
ffff8ba9566a6a80 52665095 S Bi:1:003:1 -115 512 <
ffff8ba9566a6a80 52665128 C Bi:1:003:1 0 0
ffff8ba9566a6a80 52715206 S Bo:1:003:1 -115 512 = 54680985 3029d661 d16f1cae e4756bdb 38308296 99dad4a5 6a59a9ca e70120de
ffff8ba9566a6a80 52715240 C Bo:1:003:1 0 512 >
ffff8ba9566a6a80 52715245 S Bi:1:003:1 -115 512 <
ffff8ba9566a6a80 52717484 C Bi:1:003:1 0 512 = 7ac8c316 00000000 09000000 00000000 00000000 00000000 00000000 00000000
ffff8ba9566a6a80 52717490 S Bi:1:003:1 -115 512 <
ffff8ba9566a6a80 52717524 C Bi:1:003:1 0 0
ffff8ba9566a6a80 52767639 S Bo:1:003:1 -115 512 = af2aa7aa 00ce98e4 b2e9ed99 1221cc6c a2cf10ce a58621fc f9ef8636 bc247e9c
ffff8ba9566a6a80 52767675 C Bo:1:003:1 0 512 >
ffff8ba9566a6a80 52767685 S Bi:1:003:1 -115 512 <
ffff8ba9566a6a80 52767888 C Bi:1:003:1 0 512 = 7ac8f716 00000000 09000000 00000000 00000000 00000000 00000000 00000000
ffff8ba9566a6a80 52767911 S Bi:1:003:1 -115 512 <
ffff8ba9566a6a80 52767942 C Bi:1:003:1 0 0
ffff8ba9566a6a80 52818024 S Bo:1:003:1 -115 512 = 9dcf67c2 67ced80d e967ce13 816c12a9 03d8d4dd e96b89bd 90bcf6c3 6a2c9748
ffff8ba9566a6a80 52818054 C Bo:1:003:1 0 512 >
ffff8ba9566a6a80 52818060 S Bi:1:003:1 -115 512 <
ffff8ba9566a6a80 52818284 C Bi:1:003:1 0 512 = 7ac82a17 00000000 09000000 00000000 00000000 00000000 00000000 00000000
ffff8ba9566a6a80 52818289 S Bi:1:003:1 -115 512 <
ffff8ba9566a6a80 52818324 C Bi:1:003:1 0 0
ffff8ba902af8180 52868415 S Bo:1:003:1 -115 512 = 853662df df4b47cd bfa4ba68 a7c3438b b3951c80 d95eeed7 35a0df17 e6f68502
ffff8ba902af8180 52868449 C Bo:1:003:1 0 512 >
ffff8ba902af8180 52868454 S Bi:1:003:1 -115 512 <
ffff8ba902af8180 52868655 C Bi:1:003:1 0 512 = 7ac85c17 00000000 09000000 00000000 00000000 00000000 00000000 00000000
ffff8ba902af8180 52868668 S Bi:1:003:1 -115 512 <
ffff8ba902af8180 52868700 C Bi:1:003:1 0 0
ffff8ba902a426c0 52887331 S Bo:1:003:1 -115 512 = 2565bea9 bf1aa299 659f57b2 002344c5 504f2d4f 37a8ef34 7295b57b 43936ff7
ffff8ba902a426c0 52887370 C Bo:1:003:1 0 512 >
ffff8ba902a426c0 52887379 S Bi:1:003:1 -115 512 <
ffff8ba902a426c0 52887578 C Bi:1:003:1 0 512 = fac8ef1a 00000000 0b000000 00170000 00000000 0698f70b d7e566e1 03000116
ffff8ba902af8180 52918777 S Bo:1:003:1 -115 512 = 4bff60d6 fba1f1b3 b1f31811 9f3f1e9e 01eaf5c5 1425bfc8 9b40bfe8 d06e8545
ffff8ba902af8180 52918813 C Bo:1:003:1 0 512 >
ffff8ba902af8180 52918820 S Bi:1:003:1 -115 512 <
ffff8ba902af8180 52918853 C Bi:1:003:1 0 0
ffff8ba902af8180 52918859 S Bi:1:003:1 -115 512 <
ffff8ba902af8180 52919030 C Bi:1:003:1 0 512 = 7ac88e17 00000000 08000000 00000000 00000000 00000000 00000000 00000000
ffff8ba902af8180 52919039 S Bi:1:003:1 -115 512 <
ffff8ba902af8180 52919061 C Bi:1:003:1 0 0
ffff8ba902af8180 52919106 S Bo:1:003:1 -115 57730 = 7ec32063 c75672d3 c3bf612d bfa3d383 9a35bb98 3c193b5d 8310b47f 94a8bde1
ffff8ba902af8180 52920553 C Bo:1:003:1 0 57730 >
ffff8ba902af8180 52920564 S Bi:1:003:1 -115 512 <
ffff8ba902af8180 52921352 C Bi:1:003:1 0 512 = 79c88f17 00000000 09000000 00000000 00000000 00000000 00000000 00000000
ffff8ba902af8180 52921368 S Bi:1:003:1 -115 512 <
ffff8ba902af8180 52921391 C Bi:1:003:1 0 0
ffff8ba902af8180 52921417 S Bo:1:003:1 -115 512 = c81b6a04 bf34ef70 383f5fcd 665b2a06 76401f2c 4c823f7f a7349fc5 11b5390a
ffff8ba902af8180 52921452 C Bo:1:003:1 0 512 >
ffff8ba902af8180 52921458 S Bi:1:003:1 -115 512 <
ffff8ba902af8180 52921612 C Bi:1:003:1 0 512 = 7ac89117 00000000 09000000 00000000 00000000 00000000 00000000 00000000
ffff8ba902af8180 52921618 S Bi:1:003:1 -115 512 <
ffff8ba902af8180 52921652 C Bi:1:003:1 0 0
ffff8ba902af8180 52971730 S Bo:1:003:1 -115 512 = 26171c76 79dbbf01 b935a49f 282c6b04 c7ba0dd8 f144d0b9 b6ed6fbf ef40414e
ffff8ba902af8180 52971775 C Bo:1:003:1 0 512 >
ffff8ba902af8180 52971780 S Bi:1:003:1 -115 512 <
ffff8ba902af8180 52971977 C Bi:1:003:1 0 512 = 7ac8c317 00000000 09000000 00000000 00000000 00000000 00000000 00000000
ffff8ba902af8180 52971983 S Bi:1:003:1 -115 512 <
ffff8ba902af8180 52972017 C Bi:1:003:1 0 0
ffff8ba902af8180 53022096 S Bo:1:003:1 -115 512 = 98aa1778 71a1caad 00a551bc 72bb5f5b 8fc27de3 e358f2f7 90988822 9e068d5d
ffff8ba902af8180 53022159 C Bo:1:003:1 0 512 >
ffff8ba902af8180 53022168 S Bi:1:003:1 -115 512 <
ffff8ba902af8180 53022350 C Bi:1:003:1 0 512 = 7ac8f617 00000000 09000000 00000000 00000000 00000000 00000000 00000000
ffff8ba902af8180 53022359 S Bi:1:003:1 -115 512 <
ffff8ba902af8180 53022383 C Bi:1:003:1 0 0
ffff8ba941e71a40 53072480 S Bo:1:003:1 -115 512 = c91bf19a b1fbd246 87ac1be2 a1516781 0748758d 9d023113 b2359623 cbaab6fe
ffff8ba941e71a40 53072540 C Bo:1:003:1 0 512 >
ffff8ba941e71a40 53072560 S Bi:1:003:1 -115 512 <
ffff8ba941e71a40 53072742 C Bi:1:003:1 0 512 = 7ac82818 00000000 09000000 00000000 00000000 00000000 00000000 00000000
ffff8ba941e71a40 53072769 S Bi:1:003:1 -115 512 <
ffff8ba941e71a40 53072800 C Bi:1:003:1 0 0
ffff8ba941e71a40 53122885 S Bo:1:003:1 -115 512 = 656dc07e bbe5ffd0 532f1390 3936ee58 23d42fcb 6d048249 f6358e0d 21c6e355
ffff8ba941e71a40 53122927 C Bo:1:003:1 0 512 >
ffff8ba941e71a40 53122937 S Bi:1:003:1 -115 512 <
ffff8ba941e71a40 53123134 C Bi:1:003:1 0 512 = 7ac85a18 00000000 09000000 00000000 00000000 00000000 00000000 00000000
ffff8ba941e71a40 53123143 S Bi:1:003:1 -115 512 <
ffff8ba941e71a40 53123163 C Bi:1:003:1 0 0
ffff8ba941e71a40 53173243 S Bo:1:003:1 -115 512 = 9116ee90 ee0a6b78 8fc451ba 1270067d db8ae2fe 3fd5cade 682248a5 1a6a1f98
ffff8ba941e71a40 53173289 C Bo:1:003:1 0 512 >
ffff8ba941e71a40 53173298 S Bi:1:003:1 -115 512 <
ffff8ba941e71a40 53173483 C Bi:1:003:1 0 512 = 7ac88d18 00000000 09000000 00000000 00000000 00000000 00000000 00000000
ffff8ba941e71a40 53173491 S Bi:1:003:1 -115 512 <
ffff8ba941e71a40 53173514 C Bi:1:003:1 0 0
ffff8ba941e71a40 53223592 S Bo:1:003:1 -115 512 = 1786a93c c0e14e7b b00fd1bc 965a82e2 03151937 0cf34f2d 0e152287 6eeca48e
ffff8ba941e71a40 53223637 C Bo:1:003:1 0 512 >
ffff8ba941e71a40 53223646 S Bi:1:003:1 -115 512 <
ffff8ba941e71a40 53223847 C Bi:1:003:1 0 512 = 7ac8bf18 00000000 08000000 00000000 00000000 00000000 00000000 00000000
ffff8ba941e71a40 53223855 S Bi:1:003:1 -115 512 <
ffff8ba941e71a40 53223878 C Bi:1:003:1 0 0
ffff8ba902a42900 53273964 S Bo:1:003:1 -115 512 = 7f5ad7da 034ae29a df8be1ad c82db600 519e5d35 55b7be8c c1fbeb67 b6d1056b
ffff8ba902a42900 53274011 C Bo:1:003:1 0 512 >
ffff8ba902a42900 53274020 S Bi:1:003:1 -115 512 <
ffff8ba902a42900 53274221 C Bi:1:003:1 0 512 = 7ac8f118 00000000 08000000 00000000 00000000 00000000 00000000 00000000
ffff8ba902a42900 53274229 S Bi:1:003:1 -115 512 <
ffff8ba902a42900 53274242 C Bi:1:003:1 0 0
ffff8ba902a42540 53324323 S Bo:1:003:1 -115 512 = 19c325e7 a958e993 f39d1477 13029696 46002f18 7c44fbc5 3c781991 a77ce1ed
ffff8ba902a42540 53324369 C Bo:1:003:1 0 512 >
ffff8ba902a42540 53324380 S Bi:1:003:1 -115 512 <
ffff8ba902a42540 53324573 C Bi:1:003:1 0 512 = 7ac82419 00000000 08000000 00000000 00000000 00000000 00000000 00000000
ffff8ba902a42540 53324582 S Bi:1:003:1 -115 512 <
ffff8ba902a42540 53324605 C Bi:1:003:1 0 0
ffff8ba902a42540 53374685 S Bo:1:003:1 -115 512 = 48e926e9 5cbb7631 30892129 934bf63d 5fcd2a00 dcd6da9b ce20d214 1e8cdf58
ffff8ba902a42540 53374731 C Bo:1:003:1 0 512 >
ffff8ba902a42540 53374741 S Bi:1:003:1 -115 512 <
ffff8ba902a42540 53374936 C Bi:1:003:1 0 512 = 7ac85619 00000000 08000000 00000000 00000000 00000000 00000000 00000000
ffff8ba902a42540 53374945 S Bi:1:003:1 -115 512 <
ffff8ba902a42540 53374968 C Bi:1:003:1 0 0
ffff8ba902a42540 53425023 S Bo:1:003:1 -115 512 = 6852a68b 6e670c85 4d106639 ca187d96 d6a1397e d170b05e c4e30354 a1339f93
ffff8ba902a42540 53425062 C Bo:1:003:1 0 512 >
ffff8ba902a42540 53425071 S Bi:1:003:1 -115 512 <
ffff8ba902a42540 53425268 C Bi:1:003:1 0 512 = 7ac88919 00000000 08000000 00000000 00000000 00000000 00000000 00000000
ffff8ba902a42540 53425277 S Bi:1:003:1 -115 512 <
ffff8ba902a42540 53425300 C Bi:1:003:1 0 0
ffff8ba902a42540 53475378 S Bo:1:003:1 -115 512 = 221e16d6 d9f2868d 66f5dfba 770ad5fa 6f9be039 d0bce26b 681739f2 2da48cc6
ffff8ba902a42540 53475423 C Bo:1:003:1 0 512 >
ffff8ba902a42540 53475431 S Bi:1:003:1 -115 512 <
ffff8ba902a42540 53475643 C Bi:1:003:1 0 512 = 7ac8bb19 00000000 08000000 00000000 00000000 00000000 00000000 00000000
ffff8ba902a42540 53475652 S Bi:1:003:1 -115 512 <
ffff8ba902a42540 53475675 C Bi:1:003:1 0 0
ffff8ba902a42540 53525753 S Bo:1:003:1 -115 512 = 01fce09b bd500e4b afd75296 436a2e4a e2d88fab 6e862b85 0289e909 b1068891
ffff8ba902a42540 53525798 C Bo:1:003:1 0 512 >
ffff8ba902a42540 53525806 S Bi:1:003:1 -115 512 <
ffff8ba902a42540 53525997 C Bi:1:003:1 0 512 = 7ac8ed19 00000000 07000000 00000000 00000000 00000000 00000000 00000000
ffff8ba902a42540 53526012 S Bi:1:003:1 -115 512 <
ffff8ba902a42540 53526025 C Bi:1:003:1 0 0
ffff8ba902a42540 53576103 S Bo:1:003:1 -115 512 = ec5a1515 4e551950 a563cfcf 62294d3c 5adbd00d fe2c2518 bc8e6456 274b302f
ffff8ba902a42540 53576149 C Bo:1:003:1 0 512 >
ffff8ba902a42540 53576157 S Bi:1:003:1 -115 512 <
ffff8ba902a42540 53576375 C Bi:1:003:1 0 512 = 7ac8201a 00000000 07000000 00000000 00000000 00000000 00000000 00000000
ffff8ba902a42540 53576384 S Bi:1:003:1 -115 512 <
ffff8ba902a42540 53576406 C Bi:1:003:1 0 0
ffff8ba902a42540 53626484 S Bo:1:003:1 -115 512 = a94b69ed c76a3513 25bf899c 9983df70 385f4dcb 4ee6d8cf 6c14f848 e249d70a
ffff8ba902a42540 53626545 C Bo:1:003:1 0 512 >
ffff8ba902a42540 53626554 S Bi:1:003:1 -115 512 <
ffff8ba902a42540 53627759 C Bi:1:003:1 0 512 = 7ac8521a 00000000 07000000 00000000 00000000 00000000 00000000 00000000
ffff8ba902a42540 53627769 S Bi:1:003:1 -115 512 <
ffff8ba902a42540 53627791 C Bi:1:003:1 0 0
ffff8ba902a42540 53677870 S Bo:1:003:1 -115 512 = 9cb685e2 da01c57d 1f9ef134 efc511ac 0d2be0b4 b36c5011 2142b05e 47be5cdc
ffff8ba902a42540 53677925 C Bo:1:003:1 0 512 >
ffff8ba902a42540 53677934 S Bi:1:003:1 -115 512 <
ffff8ba902a42540 53678165 C Bi:1:003:1 0 512 = 7ac8851a 00000000 07000000 00000000 00000000 00000000 00000000 00000000
ffff8ba902a42540 53678173 S Bi:1:003:1 -115 512 <
ffff8ba902a42540 53678189 C Bi:1:003:1 0 0
ffff8ba902a42540 53728270 S Bo:1:003:1 -115 512 = 7eeb849d b4b391ba 6029763e c67852c7 39e8ef8d 394fc716 814cb369 a53e41f4
ffff8ba902a42540 53728317 C Bo:1:003:1 0 512 >
ffff8ba902a42540 53728327 S Bi:1:003:1 -115 512 <
ffff8ba902a42540 53728541 C Bi:1:003:1 0 512 = 7ac8b81a 00000000 07000000 00000000 00000000 00000000 00000000 00000000
ffff8ba902a42540 53728550 S Bi:1:003:1 -115 512 <
ffff8ba902a42540 53728573 C Bi:1:003:1 0 0
ffff8ba902a42540 53778651 S Bo:1:003:1 -115 512 = cf484860 5c661288 cc0d1a12 f30a4100 bea444fa 4ab6bd12 c3c26a49 ba0db1d0
ffff8ba902a42540 53778686 C Bo:1:003:1 0 512 >
ffff8ba902a42540 53778692 S Bi:1:003:1 -115 512 <
ffff8ba902a42540 53778919 C Bi:1:003:1 0 512 = 7ac8ea1a 00000000 07000000 00000000 00000000 00000000 00000000 00000000
ffff8ba902a42540 53778924 S Bi:1:003:1 -115 512 <
ffff8ba902a42540 53778958 C Bi:1:003:1 0 0
ffff8ba902a42540 53829023 S Bo:1:003:1 -115 512 = 70d96d27 0250ab5c 7634fff5 34a363b1 4b92aecc 649c5bd8 b23cfaed 0887ad81
ffff8ba902a42540 53829052 C Bo:1:003:1 0 512 >
ffff8ba9250dce40 53829064 S Bi:1:003:1 -115 512 <
ffff8ba9250dce40 53829251 C Bi:1:003:1 0 512 = 7ac81d1b 00000000 06000000 00000000 00000000 00000000 00000000 00000000
ffff8ba902a42540 53829262 S Bi:1:003:1 -115 512 <
ffff8ba902a42540 53829295 C Bi:1:003:1 0 0
ffff8ba9250dce40 53879379 S Bo:1:003:1 -115 512 = 1b5bba53 d910a43c 05ae1e5d 1126d4a7 499f9f67 4b6d4d9d e994bf14 2ba55f63
ffff8ba9250dce40 53879414 C Bo:1:003:1 0 512 >
ffff8ba9250dce40 53879420 S Bi:1:003:1 -115 512 <
ffff8ba9250dce40 53879613 C Bi:1:003:1 0 512 = 7ac84f1b 00000000 06000000 00000000 00000000 00000000 00000000 00000000
ffff8ba9250dce40 53879619 S Bi:1:003:1 -115 512 <
ffff8ba9250dce40 53879648 C Bi:1:003:1 0 0
ffff8ba914b9a300 53929730 S Bo:1:003:1 -115 512 = 85e7df1c c4c8f784 c480533b 0e26671d 10277544 80175531 c354dd9e a29c305f
ffff8ba914b9a300 53929777 C Bo:1:003:1 0 512 >
ffff8ba914b9a300 53929793 S Bi:1:003:1 -115 512 <
ffff8ba914b9a300 53929967 C Bi:1:003:1 0 512 = 7ac8811b 00000000 06000000 00000000 00000000 00000000 00000000 00000000
ffff8ba914b9a300 53929976 S Bi:1:003:1 -115 512 <
ffff8ba914b9a300 53929999 C Bi:1:003:1 0 0
ffff8ba914b9a300 53980078 S Bo:1:003:1 -115 512 = 1f28cedb 3ccde2f4 942e4cbe d566c7db 2b90338b b46e7fcb d3deff51 72977002
ffff8ba914b9a300 53980124 C Bo:1:003:1 0 512 >
ffff8ba914b9a300 53980133 S Bi:1:003:1 -115 512 <
ffff8ba914b9a300 53980331 C Bi:1:003:1 0 512 = 7ac8b41b 00000000 06000000 00000000 00000000 00000000 00000000 00000000
ffff8ba914b9a300 53980340 S Bi:1:003:1 -115 512 <
ffff8ba914b9a300 53980353 C Bi:1:003:1 0 0
ffff8ba914b9a300 54030432 S Bo:1:003:1 -115 512 = d757e172 32d0ed21 49a5a2c8 512459a5 21a04cb7 13d057b8 6b5e3f4f c9e84bbd
ffff8ba914b9a300 54030478 C Bo:1:003:1 0 512 >
ffff8ba914b9a300 54030487 S Bi:1:003:1 -115 512 <
ffff8ba914b9a300 54030679 C Bi:1:003:1 0 512 = 7ac8e61b 00000000 06000000 00000000 00000000 00000000 00000000 00000000
ffff8ba914b9a300 54030687 S Bi:1:003:1 -115 512 <
ffff8ba914b9a300 54030710 C Bi:1:003:1 0 0
ffff8ba914b9a300 54080789 S Bo:1:003:1 -115 512 = 67a9802b 4bb0fac4 4716a8bc e8266404 f8608010 b576535b a3d92988 80fd5bef
ffff8ba914b9a300 54080835 C Bo:1:003:1 0 512 >
ffff8ba914b9a300 54080843 S Bi:1:003:1 -115 512 <
ffff8ba914b9a300 54081046 C Bi:1:003:1 0 512 = 7ac8181c 00000000 06000000 00000000 00000000 00000000 00000000 00000000
ffff8ba914b9a300 54081055 S Bi:1:003:1 -115 512 <
ffff8ba914b9a300 54081078 C Bi:1:003:1 0 0
ffff8ba914b9a300 54131156 S Bo:1:003:1 -115 512 = 6589f320 4234baa2 303fe430 100c08b9 c54a48d5 8b964182 0c03ada1 d3c5026f
ffff8ba914b9a300 54131202 C Bo:1:003:1 0 512 >
ffff8ba914b9a300 54131210 S Bi:1:003:1 -115 512 <
ffff8ba914b9a300 54131401 C Bi:1:003:1 0 512 = 7ac84b1c 00000000 05000000 00000000 00000000 00000000 00000000 00000000
ffff8ba914b9a300 54131410 S Bi:1:003:1 -115 512 <
ffff8ba914b9a300 54131433 C Bi:1:003:1 0 0
ffff8ba914b9a300 54181512 S Bo:1:003:1 -115 512 = 9b9027da 26922d8e 1aa4a7ef 42ac1508 5d1e0138 c8beb994 ff4d247d 78822819
ffff8ba914b9a300 54181558 C Bo:1:003:1 0 512 >
ffff8ba914b9a300 54181566 S Bi:1:003:1 -115 512 <
ffff8ba914b9a300 54181755 C Bi:1:003:1 0 512 = 7ac87d1c 00000000 05000000 00000000 00000000 00000000 00000000 00000000
ffff8ba914b9a300 54181763 S Bi:1:003:1 -115 512 <
ffff8ba914b9a300 54181786 C Bi:1:003:1 0 0
ffff8ba914b9a300 54231864 S Bo:1:003:1 -115 512 = c1fe6224 6faae047 c28c2d42 164ef8af f1b58c65 400b9086 2600375c 9ce94f67
ffff8ba914b9a300 54231904 C Bo:1:003:1 0 512 >
ffff8ba914b9a300 54231913 S Bi:1:003:1 -115 512 <
ffff8ba914b9a300 54232120 C Bi:1:003:1 0 512 = 7ac8af1c 00000000 05000000 00000000 00000000 00000000 00000000 00000000
ffff8ba914b9a300 54232129 S Bi:1:003:1 -115 512 <
ffff8ba914b9a300 54232151 C Bi:1:003:1 0 0
ffff8ba914b9a300 54282259 S Bo:1:003:1 -115 512 = bebe3a83 ee07d461 08f55540 0b684055 1d3c0b64 cee1c9dd 1facc49e 39dedf26
ffff8ba914b9a300 54282307 C Bo:1:003:1 0 512 >
ffff8ba914b9a300 54282319 S Bi:1:003:1 -115 512 <
ffff8ba914b9a300 54282509 C Bi:1:003:1 0 512 = 7ac8e21c 00000000 05000000 00000000 00000000 00000000 00000000 00000000
ffff8ba914b9a300 54282536 S Bi:1:003:1 -115 512 <
ffff8ba914b9a300 54282567 C Bi:1:003:1 0 0
ffff8ba914b9a300 54332652 S Bo:1:003:1 -115 512 = f6952273 7fd24fbe 641f33d6 05269f2c c6d66d2c 4252a02a 383d1775 568f2adc
ffff8ba914b9a300 54332681 C Bo:1:003:1 0 512 >
ffff8ba902a42900 54332694 S Bi:1:003:1 -115 512 <
ffff8ba902a42900 54332891 C Bi:1:003:1 0 512 = 7ac8141d 00000000 05000000 00000000 00000000 00000000 00000000 00000000
ffff8ba902a426c0 54332899 S Bi:1:003:1 -115 512 <
ffff8ba902a426c0 54332931 C Bi:1:003:1 0 0
ffff8ba9566a7980 54383014 S Bo:1:003:1 -115 512 = b710aa05 6dfd6027 35401730 8adfba47 1c8cacd4 eb17173c 2f6adbd4 4ac86f29
ffff8ba9566a7980 54383043 C Bo:1:003:1 0 512 >
ffff8ba9566a7980 54383050 S Bi:1:003:1 -115 512 <
ffff8ba9566a7980 54383236 C Bi:1:003:1 0 512 = 7ac8471d 00000000 05000000 00000000 00000000 00000000 00000000 00000000
ffff8ba9566a7980 54383241 S Bi:1:003:1 -115 512 <
ffff8ba9566a7980 54383275 C Bi:1:003:1 0 0
ffff8ba9566a7980 54433352 S Bo:1:003:1 -115 512 = 75e3929d 25edf814 d06fe22a ef48ce41 b85c39c8 41eefc55 9e21d287 9080ab0a
ffff8ba9566a7980 54433386 C Bo:1:003:1 0 512 >
ffff8ba9566a7980 54433391 S Bi:1:003:1 -115 512 <
ffff8ba9566a7980 54433591 C Bi:1:003:1 0 512 = 7ac8791d 00000000 04000000 00000000 00000000 00000000 00000000 00000000
ffff8ba9566a7980 54433596 S Bi:1:003:1 -115 512 <
ffff8ba9566a7980 54433632 C Bi:1:003:1 0 0
ffff8ba9566a7980 54483709 S Bo:1:003:1 -115 512 = 965e3aa0 ab468155 168cd76c f5c1f7d1 9f6bcb6e a89ae7fc f4d6148b f5873947
ffff8ba9566a7980 54483743 C Bo:1:003:1 0 512 >
ffff8ba9566a7980 54483748 S Bi:1:003:1 -115 512 <
ffff8ba9566a7980 54483952 C Bi:1:003:1 0 512 = 7ac8ab1d 00000000 04000000 00000000 00000000 00000000 00000000 00000000
ffff8ba9566a7980 54483957 S Bi:1:003:1 -115 512 <
ffff8ba9566a7980 54483992 C Bi:1:003:1 0 0
ffff8ba9566a7980 54534023 S Bo:1:003:1 -115 512 = 40064b66 9329d1d5 ae1b5422 e785e1a1 09863722 1048f035 7a15ea3a f6738e23
ffff8ba9566a7980 54534055 C Bo:1:003:1 0 512 >
ffff8ba9566a7980 54534060 S Bi:1:003:1 -115 512 <
ffff8ba9566a7980 54534265 C Bi:1:003:1 0 512 = 7ac8de1d 00000000 04000000 00000000 00000000 00000000 00000000 00000000
ffff8ba9566a7980 54534271 S Bi:1:003:1 -115 512 <
ffff8ba9566a7980 54534305 C Bi:1:003:1 0 0
ffff8ba9566a7980 54584383 S Bo:1:003:1 -115 512 = a8e7a1cb 64448386 c13f7e7b f4708f65 1da59105 ee3aab8a 9274887b 008fae02
ffff8ba9566a7980 54584428 C Bo:1:003:1 0 512 >
ffff8ba9566a7980 54584433 S Bi:1:003:1 -115 512 <
ffff8ba9566a7980 54584646 C Bi:1:003:1 0 512 = 7ac8101e 00000000 04000000 00000000 00000000 00000000 00000000 00000000
ffff8ba9566a7980 54584651 S Bi:1:003:1 -115 512 <
ffff8ba9566a7980 54584686 C Bi:1:003:1 0 0
ffff8ba9566a7980 54634763 S Bo:1:003:1 -115 512 = 36a47003 9811d7ac ba641128 4aa21bf0 3ffd5cdf 7ae8523b bf9996f3 66556bb5
ffff8ba9566a7980 54634797 C Bo:1:003:1 0 512 >
ffff8ba9566a7980 54634802 S Bi:1:003:1 -115 512 <
ffff8ba9566a7980 54635006 C Bi:1:003:1 0 512 = 7ac8421e 00000000 04000000 00000000 00000000 00000000 00000000 00000000
ffff8ba9566a7980 54635012 S Bi:1:003:1 -115 512 <
ffff8ba9566a7980 54635045 C Bi:1:003:1 0 0
ffff8ba9566a7980 54685123 S Bo:1:003:1 -115 512 = ea0317e0 2a506608 7e85a2ba 107c1d48 07121cc5 aacbd0aa 221541fb f98fc21e
ffff8ba9566a7980 54685169 C Bo:1:003:1 0 512 >
ffff8ba9566a7980 54685174 S Bi:1:003:1 -115 512 <
ffff8ba9566a7980 54685389 C Bi:1:003:1 0 512 = 7ac8751e 00000000 04000000 00000000 00000000 00000000 00000000 00000000
ffff8ba9566a7980 54685394 S Bi:1:003:1 -115 512 <
ffff8ba9566a7980 54685429 C Bi:1:003:1 0 0
ffff8ba9566a7980 54735507 S Bo:1:003:1 -115 512 = 4b6d72c8 89c43ff6 685c666b 3d3c8f27 ac138f4e 313a233a f4cb696b bf1b423f
ffff8ba9566a7980 54735552 C Bo:1:003:1 0 512 >
ffff8ba9566a7980 54735557 S Bi:1:003:1 -115 512 <
ffff8ba9566a7980 54735761 C Bi:1:003:1 0 512 = 7ac8a71e 00000000 03000000 00000000 00000000 00000000 00000000 00000000
ffff8ba9566a7980 54735767 S Bi:1:003:1 -115 512 <
ffff8ba9566a7980 54735801 C Bi:1:003:1 0 0
ffff8ba9566a7980 54785867 S Bo:1:003:1 -115 512 = 4b815b6b ef397993 459e9270 4b76566d 01615f27 7edbc36e 15fd4341 7b5f00f3
ffff8ba9566a7980 54785899 C Bo:1:003:1 0 512 >
ffff8ba9566a7980 54785904 S Bi:1:003:1 -115 512 <
ffff8ba9566a7980 54786120 C Bi:1:003:1 0 512 = 7ac8d91e 00000000 03000000 00000000 00000000 00000000 00000000 00000000
ffff8ba9566a7980 54786125 S Bi:1:003:1 -115 512 <
ffff8ba9566a7980 54786160 C Bi:1:003:1 0 0
ffff8ba9566a7980 54836237 S Bo:1:003:1 -115 512 = 580214a3 8284dfc5 0738747b 785362cf cba08b2e 921b4ddd e07fe404 c0ebc429
ffff8ba9566a7980 54836282 C Bo:1:003:1 0 512 >
ffff8ba9566a7980 54836291 S Bi:1:003:1 -115 512 <
ffff8ba9566a7980 54836492 C Bi:1:003:1 0 512 = 7ac80c1f 00000000 03000000 00000000 00000000 00000000 00000000 00000000
ffff8ba9566a7980 54836501 S Bi:1:003:1 -115 512 <
ffff8ba9566a7980 54836524 C Bi:1:003:1 0 0
ffff8ba9544d75c0 54886599 S Bo:1:003:1 -115 512 = 11f279f7 e0b31780 c4c13273 a78040f3 e9929e97 35a5d522 b058d0b8 266dc67e
ffff8ba9544d75c0 54886636 C Bo:1:003:1 0 512 >
ffff8ba9544d75c0 54886646 S Bi:1:003:1 -115 512 <
ffff8ba9544d75c0 54886846 C Bi:1:003:1 0 512 = 7ac83e1f 00000000 03000000 00000000 00000000 00000000 00000000 00000000
ffff8ba9544d75c0 54886852 S Bi:1:003:1 -115 512 <
ffff8ba9544d75c0 54886882 C Bi:1:003:1 0 0
ffff8ba9544d75c0 54936961 S Bo:1:003:1 -115 512 = d32c4d74 1c2643e6 17adaaa5 adf279ba 611b71df d70fc100 57a0cdf7 573c2c13
ffff8ba9544d75c0 54936996 C Bo:1:003:1 0 512 >
ffff8ba9544d75c0 54937004 S Bi:1:003:1 -115 512 <
ffff8ba9544d75c0 54937190 C Bi:1:003:1 0 512 = 7ac8701f 00000000 03000000 00000000 00000000 00000000 00000000 00000000
ffff8ba9544d75c0 54937195 S Bi:1:003:1 -115 512 <
ffff8ba9544d75c0 54937230 C Bi:1:003:1 0 0
ffff8ba9544d75c0 54987308 S Bo:1:003:1 -115 512 = c905a949 4eaa1426 73df04be 0fd40c22 fbbbfd8a 374c34a5 635ec8a3 5b8b7d45
ffff8ba9544d75c0 54987342 C Bo:1:003:1 0 512 >
ffff8ba9544d75c0 54987346 S Bi:1:003:1 -115 512 <
ffff8ba9544d75c0 54987548 C Bi:1:003:1 0 512 = 7ac8a31f 00000000 03000000 00000000 00000000 00000000 00000000 00000000
ffff8ba9544d75c0 54987554 S Bi:1:003:1 -115 512 <
ffff8ba9544d75c0 54987588 C Bi:1:003:1 0 0
ffff8ba9544d75c0 55037700 S Bo:1:003:1 -115 512 = 52eebeea 6dcf7701 501e5d38 9b95ef1e 2badf12d 7380ecab 04869d3e 17076d5c
ffff8ba9544d75c0 55037738 C Bo:1:003:1 0 512 >
ffff8ba9544d75c0 55037751 S Bi:1:003:1 -115 512 <
ffff8ba9544d75c0 55037944 C Bi:1:003:1 0 512 = 7ac8d51f 00000000 02000000 00000000 00000000 00000000 00000000 00000000
ffff8ba9544d75c0 55037950 S Bi:1:003:1 -115 512 <
ffff8ba9544d75c0 55037984 C Bi:1:003:1 0 0
ffff8ba9544d75c0 55038027 S Bo:1:003:1 -115 58343 = e57021d8 e8161d31 3731fef6 c266b550 136ee6f2 e3fe1298 ee6d9de9 e17343da
ffff8ba9544d75c0 55039894 C Bo:1:003:1 0 58343 >
ffff8ba9544d75c0 55039902 S Bi:1:003:1 -115 512 <
ffff8ba9544d75c0 55040315 C Bi:1:003:1 0 512 = 79c8d61f 00000000 03000000 00000000 00000000 00000000 00000000 00000000
ffff8ba9544d75c0 55040332 S Bi:1:003:1 -115 512 <
ffff8ba9544d75c0 55040354 C Bi:1:003:1 0 0
ffff8ba9544d75c0 55040390 S Bo:1:003:1 -115 60514 = 545df50a dfbb907a cdbd8646 3d93c7da dfc01c4e 554642f9 0fe22680 e442399e
ffff8ba9544d75c0 55042051 C Bo:1:003:1 0 60514 >
ffff8ba9544d75c0 55042066 S Bi:1:003:1 -115 512 <
ffff8ba9544d75c0 55042737 C Bi:1:003:1 0 512 = 79c8d81f 00000000 04000000 00000000 00000000 00000000 00000000 00000000
ffff8ba9544d75c0 55042754 S Bi:1:003:1 -115 512 <
ffff8ba9544d75c0 55042776 C Bi:1:003:1 0 0
ffff8ba9544d75c0 55042802 S Bo:1:003:1 -115 512 = 0b99527b 6d76f659 fce86f57 c7fdba74 47f11727 3a3b0ebb c5aed563 89d4d727
ffff8ba9544d75c0 55042837 C Bo:1:003:1 0 512 >
ffff8ba9544d75c0 55042843 S Bi:1:003:1 -115 512 <
ffff8ba9544d75c0 55042996 C Bi:1:003:1 0 512 = 7ac8da1f 00000000 04000000 00000000 00000000 00000000 00000000 00000000
ffff8ba9544d75c0 55043003 S Bi:1:003:1 -115 512 <
ffff8ba9544d75c0 55043030 C Bi:1:003:1 0 0
ffff8ba9544d75c0 55093108 S Bo:1:003:1 -115 512 = 1ee48da7 064281ef dc02d2cd 0a4fcd2c 7c696596 8e63b53f b1c50b26 cfc2c24e
ffff8ba9544d75c0 55093143 C Bo:1:003:1 0 512 >
ffff8ba9544d75c0 55093149 S Bi:1:003:1 -115 512 <
ffff8ba9544d75c0 55093337 C Bi:1:003:1 0 512 = 7ac80d20 00000000 04000000 00000000 00000000 00000000 00000000 00000000
ffff8ba9544d75c0 55093342 S Bi:1:003:1 -115 512 <
ffff8ba9544d75c0 55093374 C Bi:1:003:1 0 0
ffff8ba902a42540 55143453 S Bo:1:003:1 -115 512 = 75474fe8 adb30af0 cb82189e 44fac197 1d097532 cbade94c 9671aa6b 8dbcb189
ffff8ba902a42540 55143488 C Bo:1:003:1 0 512 >
ffff8ba902a42540 55143495 S Bi:1:003:1 -115 512 <
ffff8ba902a42540 55143695 C Bi:1:003:1 0 512 = 7ac83f20 00000000 04000000 00000000 00000000 00000000 00000000 00000000
ffff8ba902a42540 55143701 S Bi:1:003:1 -115 512 <
ffff8ba902a42540 55143735 C Bi:1:003:1 0 0
ffff8ba902a42540 55193814 S Bo:1:003:1 -115 512 = e659ee4f 42cdfa39 8e6be33f 90d61339 5414026c 74873752 87c9da7f cb606204
ffff8ba902a42540 55193849 C Bo:1:003:1 0 512 >
ffff8ba902a42540 55193855 S Bi:1:003:1 -115 512 <
ffff8ba902a42540 55194052 C Bi:1:003:1 0 512 = 7ac87120 00000000 04000000 00000000 00000000 00000000 00000000 00000000
ffff8ba902a42540 55194064 S Bi:1:003:1 -115 512 <
ffff8ba902a42540 55194092 C Bi:1:003:1 0 0
ffff8ba902a42540 55244170 S Bo:1:003:1 -115 512 = 83fb3699 f877db3a 1d64bf7c ee9ae0b3 56ec5742 a74c0b84 5544a42e 960d529e
ffff8ba902a42540 55244205 C Bo:1:003:1 0 512 >
ffff8ba902a42540 55244212 S Bi:1:003:1 -115 512 <
ffff8ba902a42540 55244428 C Bi:1:003:1 0 512 = 7ac8a420 00000000 04000000 00000000 00000000 00000000 00000000 00000000
ffff8ba902a42540 55244435 S Bi:1:003:1 -115 512 <
ffff8ba902a42540 55244468 C Bi:1:003:1 0 0
ffff8ba9544d75c0 55294538 S Bo:1:003:1 -115 512 = 7ed840ca 0ee4b482 0428d5a3 27d962b7 d7e8e181 47820a65 a6c3db79 112ffecd
ffff8ba9544d75c0 55294584 C Bo:1:003:1 0 512 >
ffff8ba9544d75c0 55294593 S Bi:1:003:1 -115 512 <
ffff8ba9544d75c0 55294788 C Bi:1:003:1 0 512 = 7ac8d620 00000000 04000000 00000000 00000000 00000000 00000000 00000000
ffff8ba9544d75c0 55294797 S Bi:1:003:1 -115 512 <
ffff8ba9544d75c0 55294820 C Bi:1:003:1 0 0
ffff8ba9544d75c0 55344899 S Bo:1:003:1 -115 512 = fd64a03a 9ebea8e8 fc131678 93724a7e 7e332112 ff6b1a98 22bc0e50 16cd5f95
ffff8ba9544d75c0 55344950 C Bo:1:003:1 0 512 >
ffff8ba9544d75c0 55344958 S Bi:1:003:1 -115 512 <
ffff8ba9544d75c0 55345159 C Bi:1:003:1 0 512 = 7ac80821 00000000 03000000 00000000 00000000 00000000 00000000 00000000
ffff8ba9544d75c0 55345169 S Bi:1:003:1 -115 512 <
ffff8ba9544d75c0 55345191 C Bi:1:003:1 0 0
ffff8ba9544d75c0 55395271 S Bo:1:003:1 -115 512 = cdfcba96 7dd18fb3 d71c4993 e5f8eddf c2c54ed6 b3b4681c 47f5e437 8b65fccc
ffff8ba9544d75c0 55395328 C Bo:1:003:1 0 512 >
ffff8ba9544d75c0 55395336 S Bi:1:003:1 -115 512 <
ffff8ba9544d75c0 55395529 C Bi:1:003:1 0 512 = 7ac83b21 00000000 03000000 00000000 00000000 00000000 00000000 00000000
ffff8ba9544d75c0 55395545 S Bi:1:003:1 -115 512 <
ffff8ba9544d75c0 55395556 C Bi:1:003:1 0 0
ffff8ba9544d75c0 55445634 S Bo:1:003:1 -115 512 = d039c3e9 22df7f93 ccbe256e 542100d3 661021d6 0a703b6a 1ce1955c a0f75586
ffff8ba9544d75c0 55445692 C Bo:1:003:1 0 512 >
ffff8ba9544d75c0 55445701 S Bi:1:003:1 -115 512 <
ffff8ba9544d75c0 55445900 C Bi:1:003:1 0 512 = 7ac86d21 00000000 03000000 00000000 00000000 00000000 00000000 00000000
ffff8ba9544d75c0 55445909 S Bi:1:003:1 -115 512 <
ffff8ba9544d75c0 55445921 C Bi:1:003:1 0 0
ffff8ba9544d75c0 55496000 S Bo:1:003:1 -115 512 = 5b1cf028 6da1b6bb 2c784919 5f61dcf1 a6ea5861 4b150515 cbbf4c1b 66715279
ffff8ba9544d75c0 55496046 C Bo:1:003:1 0 512 >
ffff8ba9544d75c0 55496055 S Bi:1:003:1 -115 512 <
ffff8ba9544d75c0 55496277 C Bi:1:003:1 0 512 = 7ac8a021 00000000 03000000 00000000 00000000 00000000 00000000 00000000
ffff8ba9544d75c0 55496285 S Bi:1:003:1 -115 512 <
ffff8ba9544d75c0 55496298 C Bi:1:003:1 0 0
ffff8ba9544d75c0 55546380 S Bo:1:003:1 -115 512 = dd170f3a 560ecaab 1364019b c3d569e6 886f1098 0cca6ded e6be130c c7da3542
ffff8ba9544d75c0 55546427 C Bo:1:003:1 0 512 >
ffff8ba9544d75c0 55546438 S Bi:1:003:1 -115 512 <
ffff8ba9544d75c0 55546634 C Bi:1:003:1 0 512 = 7ac8d221 00000000 03000000 00000000 00000000 00000000 00000000 00000000
ffff8ba9544d75c0 55546643 S Bi:1:003:1 -115 512 <
ffff8ba9544d75c0 55546656 C Bi:1:003:1 0 0
ffff8ba9544d75c0 55596782 S Bo:1:003:1 -115 512 = 169e6e36 981ea2f8 83367a27 48b4f0b0 86b6316e b15e779f 2a95255b 6e22c5ab
ffff8ba9544d75c0 55596831 C Bo:1:003:1 0 512 >
ffff8ba9544d75c0 55596846 S Bi:1:003:1 -115 512 <
ffff8ba9544d75c0 55597159 C Bi:1:003:1 0 512 = 7ac80422 00000000 03000000 00000000 00000000 00000000 00000000 00000000
ffff8ba9544d75c0 55597175 S Bi:1:003:1 -115 512 <
ffff8ba9544d75c0 55597189 C Bi:1:003:1 0 0
ffff8ba9544d75c0 55647269 S Bo:1:003:1 -115 512 = 0228e5fc 4daf3c42 897ce152 9cc0ca90 c4562229 2d8b2a3b 812122be 492f172c
ffff8ba9544d75c0 55647327 C Bo:1:003:1 0 512 >
ffff8ba9544d75c0 55647336 S Bi:1:003:1 -115 512 <
ffff8ba9544d75c0 55647538 C Bi:1:003:1 0 512 = 7ac83722 00000000 02000000 00000000 00000000 00000000 00000000 00000000
ffff8ba9544d75c0 55647546 S Bi:1:003:1 -115 512 <
ffff8ba9544d75c0 55647559 C Bi:1:003:1 0 0
ffff8ba9544d75c0 55647600 S Bo:1:003:1 -115 61967 = 14efb0ce 9e1f4c5e 220863e3 005b5bf4 8fe6b4b0 eb12585a b92453a6 379cfefa
ffff8ba9544d75c0 55649627 C Bo:1:003:1 0 61967 >
ffff8ba9544d75c0 55649639 S Bi:1:003:1 -115 512 <
ffff8ba9544d75c0 55650099 C Bi:1:003:1 0 512 = 79c83822 00000000 03000000 00000000 00000000 00000000 00000000 00000000
ffff8ba9544d75c0 55650117 S Bi:1:003:1 -115 512 <
ffff8ba9544d75c0 55650129 C Bi:1:003:1 0 0
ffff8ba9544d75c0 55650163 S Bo:1:003:1 -115 59533 = 8d41bbd2 6423e9ac 5ba00fe2 aa9b04fe bae64f9f 89ed7ad3 8e152340 4465126f
ffff8ba9544d75c0 55651639 C Bo:1:003:1 0 59533 >
ffff8ba9544d75c0 55651648 S Bi:1:003:1 -115 512 <
ffff8ba9544d75c0 55652593 C Bi:1:003:1 0 512 = 79c83a22 00000000 04000000 00000000 00000000 00000000 00000000 00000000
ffff8ba9544d75c0 55652604 S Bi:1:003:1 -115 512 <
ffff8ba9544d75c0 55652626 C Bi:1:003:1 0 0
ffff8ba9544d75c0 55652650 S Bo:1:003:1 -115 512 = c6ab704d 1b8f380a b888ca8e e8817609 e16def6d a876af97 9c9f58c0 f8ffcf60
ffff8ba9544d75c0 55652688 C Bo:1:003:1 0 512 >
ffff8ba9544d75c0 55652693 S Bi:1:003:1 -115 512 <
ffff8ba9544d75c0 55652851 C Bi:1:003:1 0 512 = 7ac83c22 00000000 04000000 00000000 00000000 00000000 00000000 00000000
ffff8ba9544d75c0 55652856 S Bi:1:003:1 -115 512 <
ffff8ba9544d75c0 55652891 C Bi:1:003:1 0 0
ffff8ba949880c00 55702981 S Bo:1:003:1 -115 512 = 17ffa59d 017c027f f0e9ec6f 94a9bdd9 bd7a6d50 d0a5baba 00927d27 b7815857
ffff8ba949880c00 55703028 C Bo:1:003:1 0 512 >
ffff8ba949880c00 55703039 S Bi:1:003:1 -115 512 <
ffff8ba949880c00 55703234 C Bi:1:003:1 0 512 = 7ac86e22 00000000 04000000 00000000 00000000 00000000 00000000 00000000
ffff8ba949880c00 55703243 S Bi:1:003:1 -115 512 <
ffff8ba949880c00 55703267 C Bi:1:003:1 0 0
ffff8ba949880c00 55753348 S Bo:1:003:1 -115 512 = 6f7f86f8 575b68a7 08319ae7 2fbf17f0 1380cdc1 1d88917a 678ead77 4a437d16
ffff8ba949880c00 55753394 C Bo:1:003:1 0 512 >
ffff8ba949880c00 55753404 S Bi:1:003:1 -115 512 <
ffff8ba949880c00 55753626 C Bi:1:003:1 0 512 = 7ac8a122 00000000 04000000 00000000 00000000 00000000 00000000 00000000
ffff8ba949880c00 55753634 S Bi:1:003:1 -115 512 <
ffff8ba949880c00 55753657 C Bi:1:003:1 0 0
ffff8ba949880c00 55803735 S Bo:1:003:1 -115 512 = 5615542a 9c7359c2 1748e751 f0a4e130 5a8bc072 d7440fd9 3f79de5e 0bd4eb41
ffff8ba949880c00 55803781 C Bo:1:003:1 0 512 >
ffff8ba949880c00 55803790 S Bi:1:003:1 -115 512 <
ffff8ba949880c00 55803987 C Bi:1:003:1 0 512 = 7ac8d322 00000000 04000000 00000000 00000000 00000000 00000000 00000000
ffff8ba949880c00 55803995 S Bi:1:003:1 -115 512 <
ffff8ba949880c00 55804018 C Bi:1:003:1 0 0
ffff8ba954973ec0 55854102 S Bo:1:003:1 -115 512 = e144e6db db730cc3 1040e832 2246ef7d 0288bc7d c08f971a 6c292f5d f03bab44
ffff8ba954973ec0 55854149 C Bo:1:003:1 0 512 >
ffff8ba954973ec0 55854160 S Bi:1:003:1 -115 512 <
ffff8ba954973ec0 55854383 C Bi:1:003:1 0 512 = 7ac80623 00000000 04000000 00000000 00000000 00000000 00000000 00000000
ffff8ba954973ec0 55854393 S Bi:1:003:1 -115 512 <
ffff8ba954973ec0 55854415 C Bi:1:003:1 0 0
ffff8ba954973ec0 55904494 S Bo:1:003:1 -115 512 = e6c88d27 fd11af9f b23b33d8 b8da0b4c 2d21d6f0 097cee89 7e43169d 57ce88d2
ffff8ba954973ec0 55904523 C Bo:1:003:1 0 512 >
ffff8ba9544ff740 55904534 S Bi:1:003:1 -115 512 <
ffff8ba9544ff740 55904728 C Bi:1:003:1 0 512 = 7ac83823 00000000 03000000 00000000 00000000 00000000 00000000 00000000
ffff8ba9544e29c0 55904738 S Bi:1:003:1 -115 512 <
ffff8ba9544e29c0 55904771 C Bi:1:003:1 0 0
ffff8ba902af8180 55954858 S Bo:1:003:1 -115 512 = 21b8c3e5 fcb8d465 0c0db6eb 6ace07fc c7951c76 2ed8c55c 2a65eef5 7abca974
ffff8ba902af8180 55954894 C Bo:1:003:1 0 512 >
ffff8ba902af8180 55954901 S Bi:1:003:1 -115 512 <
ffff8ba902af8180 55955095 C Bi:1:003:1 0 512 = 7ac86a23 00000000 03000000 00000000 00000000 00000000 00000000 00000000
ffff8ba902af8180 55955100 S Bi:1:003:1 -115 512 <
ffff8ba902af8180 55955134 C Bi:1:003:1 0 0
ffff8ba902af8180 56005212 S Bo:1:003:1 -115 512 = 172d3ea2 5c7f77cb d8c561cd f43b76d3 c53b1fab f29b4a07 972d1f4a c734acb5
ffff8ba902af8180 56005243 C Bo:1:003:1 0 512 >
ffff8ba902af8180 56005248 S Bi:1:003:1 -115 512 <
ffff8ba902af8180 56005445 C Bi:1:003:1 0 512 = 7ac89d23 00000000 03000000 00000000 00000000 00000000 00000000 00000000
ffff8ba902af8180 56005450 S Bi:1:003:1 -115 512 <
ffff8ba902af8180 56005485 C Bi:1:003:1 0 0
ffff8ba902af8180 56055564 S Bo:1:003:1 -115 512 = 84aa184b b1c54161 37e33ac8 269d7b6c f5467b21 ee042a2e 2d29ac61 5aee9dd7
ffff8ba902af8180 56055600 C Bo:1:003:1 0 512 >
ffff8ba902af8180 56055607 S Bi:1:003:1 -115 512 <
ffff8ba902af8180 56055783 C Bi:1:003:1 0 512 = 7ac8cf23 00000000 03000000 00000000 00000000 00000000 00000000 00000000
ffff8ba902af8180 56055789 S Bi:1:003:1 -115 512 <
ffff8ba902af8180 56055822 C Bi:1:003:1 0 0
ffff8ba902af8180 56105899 S Bo:1:003:1 -115 512 = 4dbda051 6e168ad8 bdea3476 cc263677 9cb9153a 473e6fc5 982d84e2 29f0f7b9
ffff8ba902af8180 56105947 C Bo:1:003:1 0 512 >
ffff8ba902af8180 56105953 S Bi:1:003:1 -115 512 <
ffff8ba902af8180 56106151 C Bi:1:003:1 0 512 = 7ac80124 00000000 03000000 00000000 00000000 00000000 00000000 00000000
ffff8ba902af8180 56106158 S Bi:1:003:1 -115 512 <
ffff8ba902af8180 56106191 C Bi:1:003:1 0 0
ffff8ba949880c00 56156269 S Bo:1:003:1 -115 512 = 3f19f56b 3eac2f9a 766db720 e2066949 d37cf3b0 f1e8f4bc 154eaf4f a71c5446
ffff8ba949880c00 56156330 C Bo:1:003:1 0 512 >
ffff8ba949880c00 56156340 S Bi:1:003:1 -115 512 <
ffff8ba949880c00 56156525 C Bi:1:003:1 0 512 = 7ac83424 00000000 03000000 00000000 00000000 00000000 00000000 00000000
ffff8ba949880c00 56156533 S Bi:1:003:1 -115 512 <
ffff8ba949880c00 56156557 C Bi:1:003:1 0 0
ffff8ba949880c00 56206636 S Bo:1:003:1 -115 512 = 43929bd5 3a2fcc0f d8eb6d97 a319ea8d 642c5250 01b0d72b 347c495d b8268e75
ffff8ba949880c00 56206683 C Bo:1:003:1 0 512 >
ffff8ba949880c00 56206691 S Bi:1:003:1 -115 512 <
ffff8ba949880c00 56206882 C Bi:1:003:1 0 512 = 7ac86624 00000000 02000000 00000000 00000000 00000000 00000000 00000000
ffff8ba949880c00 56206896 S Bi:1:003:1 -115 512 <
ffff8ba949880c00 56206911 C Bi:1:003:1 0 0
ffff8ba949880c00 56206952 S Bo:1:003:1 -115 59436 = 0e257cfe ba2bae7c d953586e da0b322d f960239e 06ac95c3 ad3e02a7 5a47b327
ffff8ba949880c00 56208547 C Bo:1:003:1 0 59436 >
ffff8ba949880c00 56208556 S Bi:1:003:1 -115 512 <
ffff8ba949880c00 56209280 C Bi:1:003:1 0 512 = 79c86724 00000000 03000000 00000000 00000000 00000000 00000000 00000000
ffff8ba949880c00 56209299 S Bi:1:003:1 -115 512 <
ffff8ba949880c00 56209311 C Bi:1:003:1 0 0
ffff8ba949880c00 56209346 S Bo:1:003:1 -115 62443 = c26349cd 66df9f51 92df2b69 21941553 8614343f 0cb51d38 4b0d86e8 cf924dc1
ffff8ba949880c00 56211312 C Bo:1:003:1 0 62443 >
ffff8ba949880c00 56211321 S Bi:1:003:1 -115 512 <
ffff8ba949880c00 56211721 C Bi:1:003:1 0 512 = 79c86924 00000000 04000000 00000000 00000000 00000000 00000000 00000000
ffff8ba949880c00 56211734 S Bi:1:003:1 -115 512 <
ffff8ba949880c00 56211746 C Bi:1:003:1 0 0
ffff8ba949880c00 56211771 S Bo:1:003:1 -115 512 = f934ff4d a037e4a3 9e445164 7546b4af 2e53f071 742dc27c 35fb7dea 5b95d458
ffff8ba949880c00 56211829 C Bo:1:003:1 0 512 >
ffff8ba949880c00 56211837 S Bi:1:003:1 -115 512 <
ffff8ba949880c00 56211972 C Bi:1:003:1 0 512 = 7ac86b24 00000000 04000000 00000000 00000000 00000000 00000000 00000000
ffff8ba949880c00 56211978 S Bi:1:003:1 -115 512 <
ffff8ba949880c00 56212011 C Bi:1:003:1 0 0
ffff8ba949880c00 56262089 S Bo:1:003:1 -115 512 = 513e17b7 b689c85e ed78686a 31bf41e3 06d025e4 90fe6b3d 36aa342a 5e9c87ad
ffff8ba949880c00 56262137 C Bo:1:003:1 0 512 >
ffff8ba949880c00 56262145 S Bi:1:003:1 -115 512 <
ffff8ba949880c00 56262338 C Bi:1:003:1 0 512 = 7ac89e24 00000000 04000000 00000000 00000000 00000000 00000000 00000000
ffff8ba949880c00 56262347 S Bi:1:003:1 -115 512 <
ffff8ba949880c00 56262370 C Bi:1:003:1 0 0
ffff8ba9544d75c0 56312483 S Bo:1:003:1 -115 512 = 7ccdf2d6 f7bc2dbc 831a1c10 bfe65d73 7e0522de ae797e80 872a3ea9 0377785c
ffff8ba9544d75c0 56312533 C Bo:1:003:1 0 512 >
ffff8ba9544d75c0 56312549 S Bi:1:003:1 -115 512 <
ffff8ba9544d75c0 56312743 C Bi:1:003:1 0 512 = 7ac8d024 00000000 04000000 00000000 00000000 00000000 00000000 00000000
ffff8ba9544d75c0 56312755 S Bi:1:003:1 -115 512 <
ffff8ba9544d75c0 56312768 C Bi:1:003:1 0 0
ffff8ba9544d75c0 56362850 S Bo:1:003:1 -115 512 = eee22188 19ddd1f7 b38403cd 8f9ab35d fc5bbd6f 281cc2f7 1d3a3709 b9b515b4
ffff8ba9544d75c0 56362896 C Bo:1:003:1 0 512 >
ffff8ba9544d75c0 56362905 S Bi:1:003:1 -115 512 <
ffff8ba9544d75c0 56363097 C Bi:1:003:1 0 512 = 7ac80225 00000000 04000000 00000000 00000000 00000000 00000000 00000000
ffff8ba9544d75c0 56363105 S Bi:1:003:1 -115 512 <
ffff8ba9544d75c0 56363128 C Bi:1:003:1 0 0
ffff8ba9544d75c0 56413207 S Bo:1:003:1 -115 512 = 2aa49a4c 5efa2efb 18e68af7 13c51304 ddf3317f 0b3e680f 5340abd8 5309bac8
ffff8ba9544d75c0 56413245 C Bo:1:003:1 0 512 >
ffff8ba9544d75c0 56413254 S Bi:1:003:1 -115 512 <
ffff8ba9544d75c0 56413463 C Bi:1:003:1 0 512 = 7ac83525 00000000 04000000 00000000 00000000 00000000 00000000 00000000
ffff8ba9544d75c0 56413472 S Bi:1:003:1 -115 512 <
ffff8ba9544d75c0 56413492 C Bi:1:003:1 0 0
ffff8ba9544d75c0 56463570 S Bo:1:003:1 -115 512 = f322e8ac ef47d817 bc5d8cf3 04a9b4ac 0e59c946 af41bfcf 993409f9 6cc3e20f
ffff8ba9544d75c0 56463615 C Bo:1:003:1 0 512 >
ffff8ba9544d75c0 56463624 S Bi:1:003:1 -115 512 <
ffff8ba9544d75c0 56463807 C Bi:1:003:1 0 512 = 7ac86725 00000000 04000000 00000000 00000000 00000000 00000000 00000000
ffff8ba9544d75c0 56463816 S Bi:1:003:1 -115 512 <
ffff8ba9544d75c0 56463838 C Bi:1:003:1 0 0
ffff8ba9544d75c0 56513918 S Bo:1:003:1 -115 512 = e5a6ff4f 1c38dac4 89e37bbf 716ccebb b54aecb9 69274809 608595fc bf4b101a
ffff8ba9544d75c0 56513968 C Bo:1:003:1 0 512 >
ffff8ba9544d75c0 56513978 S Bi:1:003:1 -115 512 <
ffff8ba9544d75c0 56514175 C Bi:1:003:1 0 512 = 7ac89925 00000000 03000000 00000000 00000000 00000000 00000000 00000000
ffff8ba9544d75c0 56514184 S Bi:1:003:1 -115 512 <
ffff8ba9544d75c0 56514206 C Bi:1:003:1 0 0
ffff8ba9544e29c0 56564298 S Bo:1:003:1 -115 512 = 14910030 1a48f6a6 e377e07f 87f054cf edcd3441 b0b33e77 93b01717 23f3db1e
ffff8ba9544e29c0 56564342 C Bo:1:003:1 0 512 >
ffff8ba9544e29c0 56564352 S Bi:1:003:1 -115 512 <
ffff8ba9544e29c0 56564564 C Bi:1:003:1 0 512 = 7ac8cc25 00000000 03000000 00000000 00000000 00000000 00000000 00000000
ffff8ba9544e29c0 56564573 S Bi:1:003:1 -115 512 <
ffff8ba9544e29c0 56564586 C Bi:1:003:1 0 0
ffff8ba9544e29c0 56614664 S Bo:1:003:1 -115 512 = 253c9461 fb5773b9 6814adb6 6f7fab8d f80f06f6 6f8920e1 1d817772 576af64a
ffff8ba9544e29c0 56614721 C Bo:1:003:1 0 512 >
ffff8ba9544e29c0 56614729 S Bi:1:003:1 -115 512 <
ffff8ba9544e29c0 56614934 C Bi:1:003:1 0 512 = 7ac8fe25 00000000 03000000 00000000 00000000 00000000 00000000 00000000
ffff8ba9544e29c0 56614950 S Bi:1:003:1 -115 512 <
ffff8ba9544e29c0 56614963 C Bi:1:003:1 0 0
ffff8ba9544e29c0 56665027 S Bo:1:003:1 -115 512 = fb3c0643 76e7cdac 224bbcd3 8cb8e2dd 6450d713 888e0e0f d6332054 d99b7a23
ffff8ba9544e29c0 56665086 C Bo:1:003:1 0 512 >
ffff8ba9544e29c0 56665097 S Bi:1:003:1 -115 512 <
ffff8ba9544e29c0 56665287 C Bi:1:003:1 0 512 = 7ac83126 00000000 03000000 00000000 00000000 00000000 00000000 00000000
ffff8ba9544e29c0 56665297 S Bi:1:003:1 -115 512 <
ffff8ba9544e29c0 56665313 C Bi:1:003:1 0 0
ffff8ba9544e29c0 56715399 S Bo:1:003:1 -115 512 = 035e25ed ea7a3e86 452a8e33 fc5ecd7e ea06b18e 9e4e5652 950a4e05 31418ba9
ffff8ba9544e29c0 56715445 C Bo:1:003:1 0 512 >
ffff8ba9544e29c0 56715454 S Bi:1:003:1 -115 512 <
ffff8ba9544e29c0 56715653 C Bi:1:003:1 0 512 = 7ac86326 00000000 03000000 00000000 00000000 00000000 00000000 00000000
ffff8ba9544e29c0 56715662 S Bi:1:003:1 -115 512 <
ffff8ba9544e29c0 56715692 C Bi:1:003:1 0 0
ffff8ba9544e29c0 56765770 S Bo:1:003:1 -115 512 = 738d114a 68a8ed20 e5bb46cc ad4100f8 3e069622 5c6b60a2 079cf612 047fe9d3
ffff8ba9544e29c0 56765816 C Bo:1:003:1 0 512 >
ffff8ba9544e29c0 56765824 S Bi:1:003:1 -115 512 <
ffff8ba9544e29c0 56766047 C Bi:1:003:1 0 512 = 7ac89526 00000000 03000000 00000000 00000000 00000000 00000000 00000000
ffff8ba9544e29c0 56766056 S Bi:1:003:1 -115 512 <
ffff8ba9544e29c0 56766080 C Bi:1:003:1 0 0
ffff8ba9544e29c0 56816158 S Bo:1:003:1 -115 512 = 6105f384 3f5e8462 60cd9178 c876735c 076d13d1 2f58e9ae b33f6d34 0a8be9ea
ffff8ba9544e29c0 56816220 C Bo:1:003:1 0 512 >
ffff8ba9544e29c0 56816228 S Bi:1:003:1 -115 512 <
ffff8ba9544e29c0 56816433 C Bi:1:003:1 0 512 = 7ac8c826 00000000 02000000 00000000 00000000 00000000 00000000 00000000
ffff8ba9544e29c0 56816442 S Bi:1:003:1 -115 512 <
ffff8ba9544e29c0 56816454 C Bi:1:003:1 0 0
ffff8ba9544e29c0 56816495 S Bo:1:003:1 -115 58341 = 9f10b6f7 dc0b0dbb 719e5f58 c5c29f32 c2773986 2cc27ea2 cc0f19aa 4d64385e
ffff8ba9544e29c0 56818019 C Bo:1:003:1 0 58341 >
ffff8ba9544e29c0 56818029 S Bi:1:003:1 -115 512 <
ffff8ba9544e29c0 56818900 C Bi:1:003:1 0 512 = 79c8c926 00000000 03000000 00000000 00000000 00000000 00000000 00000000
ffff8ba9544e29c0 56818919 S Bi:1:003:1 -115 512 <
ffff8ba9544e29c0 56818942 C Bi:1:003:1 0 0
ffff8ba9544e29c0 56818975 S Bo:1:003:1 -115 60256 = 6d719b1a 41eb8fec 88e08b28 a87289ab 98ca3cb3 e6795e2c 5f3aaf79 967c8a19
ffff8ba9544e29c0 56820490 C Bo:1:003:1 0 60256 >
ffff8ba9544e29c0 56820499 S Bi:1:003:1 -115 512 <
ffff8ba9544e29c0 56821339 C Bi:1:003:1 0 512 = 79c8ca26 00000000 04000000 00000000 00000000 00000000 00000000 00000000
ffff8ba9544e29c0 56821352 S Bi:1:003:1 -115 512 <
ffff8ba9544e29c0 56821364 C Bi:1:003:1 0 0
ffff8ba9544e29c0 56821390 S Bo:1:003:1 -115 512 = 97b7dbe2 c61cd325 6b91e280 aaa407ea 9954d5fe 896bd21a 11c7bed9 d8b61f5a
ffff8ba9544e29c0 56821426 C Bo:1:003:1 0 512 >
ffff8ba9544e29c0 56821433 S Bi:1:003:1 -115 512 <
ffff8ba9544e29c0 56821578 C Bi:1:003:1 0 512 = 7ac8cd26 00000000 04000000 00000000 00000000 00000000 00000000 00000000
ffff8ba9544e29c0 56821584 S Bi:1:003:1 -115 512 <
ffff8ba9544e29c0 56821618 C Bi:1:003:1 0 0
ffff8ba9544e29c0 56871697 S Bo:1:003:1 -115 512 = e9f85bcb 52714f68 e77413d5 50f07eeb 434b732d a80fe4ec f2ca3329 460e089f
ffff8ba9544e29c0 56871733 C Bo:1:003:1 0 512 >
ffff8ba9544e29c0 56871740 S Bi:1:003:1 -115 512 <
ffff8ba9544e29c0 56871953 C Bi:1:003:1 0 512 = 7ac8ff26 00000000 04000000 00000000 00000000 00000000 00000000 00000000
ffff8ba9544e29c0 56871959 S Bi:1:003:1 -115 512 <
ffff8ba9544e29c0 56871993 C Bi:1:003:1 0 0
ffff8ba9544e29c0 56922024 S Bo:1:003:1 -115 512 = 41b18c62 44877702 0452c8fe 66582e5a 7b26cc2b 8b0704ba 33eb1f8b ba44bd50
ffff8ba9544e29c0 56922068 C Bo:1:003:1 0 512 >
ffff8ba9544e29c0 56922078 S Bi:1:003:1 -115 512 <
ffff8ba9544e29c0 56922272 C Bi:1:003:1 0 512 = 7ac83227 00000000 04000000 00000000 00000000 00000000 00000000 00000000
ffff8ba9544e29c0 56922281 S Bi:1:003:1 -115 512 <
ffff8ba9544e29c0 56922304 C Bi:1:003:1 0 0
ffff8ba9544e29c0 56972382 S Bo:1:003:1 -115 512 = 9a8c413b 9f3fae91 5919ffd3 296e2c67 d87fbcbb eff19a0e 2f60b4e8 9a6f29fc
ffff8ba9544e29c0 56972428 C Bo:1:003:1 0 512 >
ffff8ba9544e29c0 56972436 S Bi:1:003:1 -115 512 <
ffff8ba9544e29c0 56972623 C Bi:1:003:1 0 512 = 7ac86427 00000000 04000000 00000000 00000000 00000000 00000000 00000000
ffff8ba9544e29c0 56972632 S Bi:1:003:1 -115 512 <
ffff8ba9544e29c0 56972656 C Bi:1:003:1 0 0
ffff8ba9544e29c0 57022734 S Bo:1:003:1 -115 512 = 0f5a32af b5bfdac2 159f215f 5f4ace16 c6088abe 4f2f32f4 4c24ad85 49c67003
ffff8ba9544e29c0 57022779 C Bo:1:003:1 0 512 >
ffff8ba9544e29c0 57022788 S Bi:1:003:1 -115 512 <
ffff8ba9544e29c0 57022981 C Bi:1:003:1 0 512 = 7ac89627 00000000 04000000 00000000 00000000 00000000 00000000 00000000
ffff8ba9544e29c0 57022990 S Bi:1:003:1 -115 512 <
ffff8ba9544e29c0 57023003 C Bi:1:003:1 0 0
ffff8ba9544ff740 57073085 S Bo:1:003:1 -115 512 = dbe4b296 2973636f a140b0a1 2492d834 e07d14e5 809ec41b 844446bd f29e82e5
ffff8ba9544ff740 57073127 C Bo:1:003:1 0 512 >
ffff8ba9544ff740 57073138 S Bi:1:003:1 -115 512 <
ffff8ba9544ff740 57073343 C Bi:1:003:1 0 512 = 7ac8c927 00000000 04000000 00000000 00000000 00000000 00000000 00000000
ffff8ba9544ff740 57073352 S Bi:1:003:1 -115 512 <
ffff8ba9544ff740 57073374 C Bi:1:003:1 0 0
ffff8ba9544ff740 57123453 S Bo:1:003:1 -115 512 = 05219adb ef9df890 53f93c8f da6b3c76 ed75c9e5 6e53a881 fe47e3d6 bccfa3ad
ffff8ba9544ff740 57123499 C Bo:1:003:1 0 512 >
ffff8ba9544ff740 57123507 S Bi:1:003:1 -115 512 <
ffff8ba9544ff740 57123701 C Bi:1:003:1 0 512 = 7ac8fb27 00000000 03000000 00000000 00000000 00000000 00000000 00000000
ffff8ba9544ff740 57123710 S Bi:1:003:1 -115 512 <
ffff8ba9544ff740 57123732 C Bi:1:003:1 0 0
ffff8ba9544ff740 57173810 S Bo:1:003:1 -115 512 = ac9acaab 6925f438 548c9da9 6eaac866 b373260d 71384bc5 cf89d15f 2ea75efb
ffff8ba9544ff740 57173856 C Bo:1:003:1 0 512 >
ffff8ba9544ff740 57173865 S Bi:1:003:1 -115 512 <
ffff8ba9544ff740 57174061 C Bi:1:003:1 0 512 = 7ac82d28 00000000 03000000 00000000 00000000 00000000 00000000 00000000
ffff8ba9544ff740 57174076 S Bi:1:003:1 -115 512 <
ffff8ba9544ff740 57174093 C Bi:1:003:1 0 0
ffff8ba9544ff740 57224174 S Bo:1:003:1 -115 512 = fb73a27e 8319d0bd 0a24d56f bc68e4f6 79ea55c4 a604224f 8268baf7 634a4714
ffff8ba9544ff740 57224230 C Bo:1:003:1 0 512 >
ffff8ba9544ff740 57224239 S Bi:1:003:1 -115 512 <
ffff8ba9544ff740 57224427 C Bi:1:003:1 0 512 = 7ac86028 00000000 03000000 00000000 00000000 00000000 00000000 00000000
ffff8ba9544ff740 57224436 S Bi:1:003:1 -115 512 <
ffff8ba9544ff740 57224458 C Bi:1:003:1 0 0
ffff8ba9544ff740 57274536 S Bo:1:003:1 -115 512 = 5ef696aa 23ec3ed5 dcce369f 322d2dc4 af087221 c6519c7c 5c472d34 8607cae6
ffff8ba9544ff740 57274581 C Bo:1:003:1 0 512 >
ffff8ba9544ff740 57274590 S Bi:1:003:1 -115 512 <
ffff8ba9544ff740 57274791 C Bi:1:003:1 0 512 = 7ac89228 00000000 03000000 00000000 00000000 00000000 00000000 00000000
ffff8ba9544ff740 57274800 S Bi:1:003:1 -115 512 <
ffff8ba9544ff740 57274824 C Bi:1:003:1 0 0
ffff8ba9544ff740 57324902 S Bo:1:003:1 -115 512 = 6c202c9e 7f9227c7 fd8a83b7 bb0b4445 c1c3a10b e50cf088 5d595beb c0cb56bd
ffff8ba9544ff740 57324948 C Bo:1:003:1 0 512 >
ffff8ba9544ff740 57324956 S Bi:1:003:1 -115 512 <
ffff8ba9544ff740 57325141 C Bi:1:003:1 0 512 = 7ac8c428 00000000 03000000 00000000 00000000 00000000 00000000 00000000
ffff8ba9544ff740 57325151 S Bi:1:003:1 -115 512 <
ffff8ba9544ff740 57325173 C Bi:1:003:1 0 0
ffff8ba9544ff740 57375251 S Bo:1:003:1 -115 512 = f9c522df 82e3607a f18998c9 597a1a7c 3143b7cc 73ddeb7c 1330d155 08d8a0be
ffff8ba9544ff740 57375292 C Bo:1:003:1 0 512 >
ffff8ba9544ff740 57375300 S Bi:1:003:1 -115 512 <
ffff8ba9544ff740 57375492 C Bi:1:003:1 0 512 = 7ac8f728 00000000 03000000 00000000 00000000 00000000 00000000 00000000
ffff8ba9544ff740 57375500 S Bi:1:003:1 -115 512 <
ffff8ba9544ff740 57375525 C Bi:1:003:1 0 0
ffff8ba9544ff740 57425603 S Bo:1:003:1 -115 512 = ffeadbf7 c9fe5057 33daa01c 314d52b5 6c2864fd f09e2696 380f9a55 ca90609c
ffff8ba9544ff740 57425649 C Bo:1:003:1 0 512 >
ffff8ba9544ff740 57425657 S Bi:1:003:1 -115 512 <
ffff8ba9544ff740 57425848 C Bi:1:003:1 0 512 = 7ac82929 00000000 02000000 00000000 00000000 00000000 00000000 00000000
ffff8ba9544ff740 57425857 S Bi:1:003:1 -115 512 <
ffff8ba9544ff740 57425879 C Bi:1:003:1 0 0
ffff8ba9544ff740 57425921 S Bo:1:003:1 -115 57701 = 1ecb994f a3f95659 42da3651 14da6b19 fa60983d 68505c6d 9183fd1f 648f5218
ffff8ba9544ff740 57427374 C Bo:1:003:1 0 57701 >
ffff8ba9544ff740 57427384 S Bi:1:003:1 -115 512 <
ffff8ba9544ff740 57428223 C Bi:1:003:1 0 512 = 79c82a29 00000000 03000000 00000000 00000000 00000000 00000000 00000000
ffff8ba9544ff740 57428242 S Bi:1:003:1 -115 512 <
ffff8ba9544ff740 57428255 C Bi:1:003:1 0 0
ffff8ba9544ff740 57428289 S Bo:1:003:1 -115 59017 = 83aaeb2c 7d946af0 75729b6e 778c9bf7 1ae07c9b 4e25ac60 026fad96 ff9be396
ffff8ba9544ff740 57429798 C Bo:1:003:1 0 59017 >
ffff8ba9544ff740 57429807 S Bi:1:003:1 -115 512 <
ffff8ba9544ff740 57430647 C Bi:1:003:1 0 512 = 79c82c29 00000000 04000000 00000000 00000000 00000000 00000000 00000000
ffff8ba9544ff740 57430660 S Bi:1:003:1 -115 512 <
ffff8ba9544ff740 57430672 C Bi:1:003:1 0 0
ffff8ba9544ff740 57430698 S Bo:1:003:1 -115 512 = 4893dd39 c0243f43 816a6060 e5430533 6915290f c045619f 9959c97b 31a8243e
ffff8ba9544ff740 57430730 C Bo:1:003:1 0 512 >
ffff8ba9544ff740 57430736 S Bi:1:003:1 -115 512 <
ffff8ba9544ff740 57430889 C Bi:1:003:1 0 512 = 7ac82e29 00000000 04000000 00000000 00000000 00000000 00000000 00000000
ffff8ba9544ff740 57430895 S Bi:1:003:1 -115 512 <
ffff8ba9544ff740 57430929 C Bi:1:003:1 0 0
ffff8ba9544ff740 57481005 S Bo:1:003:1 -115 512 = 0a611959 e300282c d35bb556 051a7e98 a9eeb4ae 45041507 90dfeddc 04c34862
ffff8ba9544ff740 57481050 C Bo:1:003:1 0 512 >
ffff8ba9544ff740 57481059 S Bi:1:003:1 -115 512 <
ffff8ba9544ff740 57481242 C Bi:1:003:1 0 512 = 7ac86129 00000000 04000000 00000000 00000000 00000000 00000000 00000000
ffff8ba9544ff740 57481258 S Bi:1:003:1 -115 512 <
ffff8ba9544ff740 57481271 C Bi:1:003:1 0 0
ffff8ba9544ff740 57531355 S Bo:1:003:1 -115 512 = 31c3b466 80fe4777 fc01bd06 c38f4089 ff77b64b 17dbe6e9 d76c5c85 502c3327
ffff8ba9544ff740 57531402 C Bo:1:003:1 0 512 >
ffff8ba9544ff740 57531413 S Bi:1:003:1 -115 512 <
ffff8ba9544ff740 57531648 C Bi:1:003:1 0 512 = 7ac89329 00000000 04000000 00000000 00000000 00000000 00000000 00000000
ffff8ba9544ff740 57531657 S Bi:1:003:1 -115 512 <
ffff8ba9544ff740 57531669 C Bi:1:003:1 0 0
ffff8ba9544d75c0 57581763 S Bo:1:003:1 -115 512 = 236442e4 0e535ae7 a4729f4a a8a01787 afec0afc b02d27b4 adce2bc5 7e6cb4bf
ffff8ba9544d75c0 57581811 C Bo:1:003:1 0 512 >
ffff8ba9544d75c0 57581822 S Bi:1:003:1 -115 512 <
ffff8ba9544d75c0 57582024 C Bi:1:003:1 0 512 = 7ac8c529 00000000 04000000 00000000 00000000 00000000 00000000 00000000
ffff8ba9544d75c0 57582033 S Bi:1:003:1 -115 512 <
ffff8ba9544d75c0 57582057 C Bi:1:003:1 0 0
ffff8ba9544d75c0 57632140 S Bo:1:003:1 -115 512 = 5c444d80 bdef44cc c0cf57ab d5f3160f 408e92d2 44adf981 d1a4640e 45a09d51
ffff8ba9544d75c0 57632186 C Bo:1:003:1 0 512 >
ffff8ba9544d75c0 57632197 S Bi:1:003:1 -115 512 <
ffff8ba9544d75c0 57632414 C Bi:1:003:1 0 512 = 7ac8f829 00000000 04000000 00000000 00000000 00000000 00000000 00000000
ffff8ba9544d75c0 57632424 S Bi:1:003:1 -115 512 <
ffff8ba9544d75c0 57632446 C Bi:1:003:1 0 0
ffff8ba9544d75c0 57682552 S Bo:1:003:1 -115 512 = 6462970c 0d44d417 063ae27f ea47adcc 0d5c5ff7 115f1305 9ffac0a3 c292d1f2
ffff8ba9544d75c0 57682611 C Bo:1:003:1 0 512 >
ffff8ba9544d75c0 57682628 S Bi:1:003:1 -115 512 <
ffff8ba9544d75c0 57682824 C Bi:1:003:1 0 512 = 7ac82a2a 00000000 04000000 00000000 00000000 00000000 00000000 00000000
ffff8ba9544d75c0 57682849 S Bi:1:003:1 -115 512 <
ffff8ba9544d75c0 57682880 C Bi:1:003:1 0 0
ffff8ba9544d75c0 57732963 S Bo:1:003:1 -115 512 = 2b3d772b dc77ce52 29d25b9b eb42997b 54716cf9 21c87305 aa92a98e 81a212ef
ffff8ba9544d75c0 57733013 C Bo:1:003:1 0 512 >
ffff8ba9544d75c0 57733022 S Bi:1:003:1 -115 512 <
ffff8ba9544d75c0 57733254 C Bi:1:003:1 0 512 = 7ac85c2a 00000000 04000000 00000000 00000000 00000000 00000000 00000000
ffff8ba9544d75c0 57733263 S Bi:1:003:1 -115 512 <
ffff8ba9544d75c0 57733275 C Bi:1:003:1 0 0
ffff8ba9544d75c0 57783360 S Bo:1:003:1 -115 512 = 4ac86ea6 ac081415 82d8996e cb23230d 52a9641c 7ca837e3 392578ba fd81a62d
ffff8ba9544d75c0 57783406 C Bo:1:003:1 0 512 >
ffff8ba9544d75c0 57783418 S Bi:1:003:1 -115 512 <
ffff8ba9544d75c0 57783618 C Bi:1:003:1 0 512 = 7ac88f2a 00000000 03000000 00000000 00000000 00000000 00000000 00000000
ffff8ba9544d75c0 57783628 S Bi:1:003:1 -115 512 <
ffff8ba9544d75c0 57783640 C Bi:1:003:1 0 0
ffff8ba9544d75c0 57833721 S Bo:1:003:1 -115 512 = 46600cc4 d4ea73c4 e78716c8 21c79d27 55651152 508b9855 6b33a6e6 bb9eb6b2
ffff8ba9544d75c0 57833757 C Bo:1:003:1 0 512 >
ffff8ba9544d75c0 57833764 S Bi:1:003:1 -115 512 <
ffff8ba9544d75c0 57833994 C Bi:1:003:1 0 512 = 7ac8c12a 00000000 03000000 00000000 00000000 00000000 00000000 00000000
ffff8ba9544d75c0 57833999 S Bi:1:003:1 -115 512 <
ffff8ba9544d75c0 57834030 C Bi:1:003:1 0 0
ffff8ba920dae300 57884124 S Bo:1:003:1 -115 512 = 19d64f1f fa76c058 5e987c13 a534f9dc 96893dab d06947b8 00e72471 df656ae7
ffff8ba920dae300 57884171 C Bo:1:003:1 0 512 >
ffff8ba920dae300 57884182 S Bi:1:003:1 -115 512 <
ffff8ba920dae300 57884382 C Bi:1:003:1 0 512 = 7ac8f42a 00000000 03000000 00000000 00000000 00000000 00000000 00000000
ffff8ba920dae300 57884391 S Bi:1:003:1 -115 512 <
ffff8ba920dae300 57884404 C Bi:1:003:1 0 0
ffff8ba920dae300 57934483 S Bo:1:003:1 -115 512 = e62913f4 f5a32641 893770e5 5d8e0634 c862a6bc 953f1ef3 6e6412f1 136857fc
ffff8ba920dae300 57934529 C Bo:1:003:1 0 512 >
ffff8ba920dae300 57934538 S Bi:1:003:1 -115 512 <
ffff8ba920dae300 57934770 C Bi:1:003:1 0 512 = 7ac8262b 00000000 03000000 00000000 00000000 00000000 00000000 00000000
ffff8ba920dae300 57934780 S Bi:1:003:1 -115 512 <
ffff8ba920dae300 57934803 C Bi:1:003:1 0 0
ffff8ba94077c3c0 57984864 S Bo:1:003:1 -115 512 = 2492a820 c251d092 47191c1e 6b6db186 e5827824 54230ad0 4e14db86 235b2051
ffff8ba94077c3c0 57984907 C Bo:1:003:1 0 512 >
ffff8ba94077c6c0 57984921 S Bi:1:003:1 -115 512 <
ffff8ba94077c6c0 57985107 C Bi:1:003:1 0 512 = 7ac8582b 00000000 03000000 00000000 00000000 00000000 00000000 00000000
ffff8ba94077cf00 57985120 S Bi:1:003:1 -115 512 <
ffff8ba94077cf00 57985132 C Bi:1:003:1 0 0
ffff8ba94077dec0 58035213 S Bo:1:003:1 -115 512 = 4087e1e6 eaacc099 bee4c456 2693db16 32b5c75b 130d545e fb987ff1 1d99b51c
ffff8ba94077dec0 58035259 C Bo:1:003:1 0 512 >
ffff8ba94077dec0 58035268 S Bi:1:003:1 -115 512 <
ffff8ba94077dec0 58035462 C Bi:1:003:1 0 512 = 7ac88b2b 00000000 02000000 00000000 00000000 00000000 00000000 00000000
ffff8ba94077dec0 58035472 S Bi:1:003:1 -115 512 <
ffff8ba94077dec0 58035494 C Bi:1:003:1 0 0
ffff8ba94077dec0 58035536 S Bo:1:003:1 -115 56233 = 2325e068 ac0e3018 45ab44bb ba89156e 97e00599 cf9bda22 7a08a167 c3059816
ffff8ba94077dec0 58038040 C Bo:1:003:1 0 56233 >
ffff8ba94077dec0 58038049 S Bi:1:003:1 -115 512 <
ffff8ba94077dec0 58039509 C Bi:1:003:1 0 512 = 79c88c2b 00000000 03000000 00000000 00000000 00000000 00000000 00000000
ffff8ba94077dec0 58039535 S Bi:1:003:1 -115 512 <
ffff8ba94077dec0 58039565 C Bi:1:003:1 0 0
ffff8ba94077dec0 58039607 S Bo:1:003:1 -115 57868 = 4e689fd0 46833e77 87ffc610 a5f15c9e 680f865b d842d3b7 031df5db 548019d2
ffff8ba94077dec0 58041467 C Bo:1:003:1 0 57868 >
ffff8ba94077dec0 58041477 S Bi:1:003:1 -115 512 <
ffff8ba94077dec0 58041872 C Bi:1:003:1 0 512 = 79c88f2b 00000000 04000000 00000000 00000000 00000000 00000000 00000000
ffff8ba94077dec0 58041886 S Bi:1:003:1 -115 512 <
ffff8ba94077dec0 58041898 C Bi:1:003:1 0 0
ffff8ba94077dec0 58041923 S Bo:1:003:1 -115 512 = aea7df7e 6328e47d c7a1008b 07221c91 437d70b9 2323a17f fa8ba279 455d8771
ffff8ba94077dec0 58041983 C Bo:1:003:1 0 512 >
ffff8ba94077dec0 58041991 S Bi:1:003:1 -115 512 <
ffff8ba94077dec0 58042137 C Bi:1:003:1 0 512 = 7ac8912b 00000000 04000000 00000000 00000000 00000000 00000000 00000000
ffff8ba94077dec0 58042145 S Bi:1:003:1 -115 512 <
ffff8ba94077dec0 58042158 C Bi:1:003:1 0 0
ffff8ba94077dec0 58092241 S Bo:1:003:1 -115 512 = 7d9f70a1 0faffc9c 1a190c01 7fbc0463 af5a5658 3958720a 0ee01f56 cc89e63d
ffff8ba94077dec0 58092283 C Bo:1:003:1 0 512 >
ffff8ba94077dec0 58092293 S Bi:1:003:1 -115 512 <
ffff8ba94077dec0 58092488 C Bi:1:003:1 0 512 = 7ac8c42b 00000000 04000000 00000000 00000000 00000000 00000000 00000000
ffff8ba94077dec0 58092497 S Bi:1:003:1 -115 512 <
ffff8ba94077dec0 58092508 C Bi:1:003:1 0 0
ffff8ba94077dec0 58142587 S Bo:1:003:1 -115 512 = 8405a8d2 974b2851 e2540cd5 423d3188 73aef925 1597aadf f6231ca8 6208dc72
ffff8ba94077dec0 58142633 C Bo:1:003:1 0 512 >
ffff8ba94077dec0 58142642 S Bi:1:003:1 -115 512 <
ffff8ba94077dec0 58142840 C Bi:1:003:1 0 512 = 7ac8f62b 00000000 04000000 00000000 00000000 00000000 00000000 00000000
ffff8ba94077dec0 58142848 S Bi:1:003:1 -115 512 <
ffff8ba94077dec0 58142871 C Bi:1:003:1 0 0
ffff8ba94077dec0 58192949 S Bo:1:003:1 -115 512 = 13c831ae 58a34185 f4c38620 13dc31f7 3f85c3c3 6b8d7dfe f3a3e9bb f4fa2c78
ffff8ba94077dec0 58192993 C Bo:1:003:1 0 512 >
ffff8ba94077dec0 58193003 S Bi:1:003:1 -115 512 <
ffff8ba94077dec0 58193184 C Bi:1:003:1 0 512 = 7ac8282c 00000000 04000000 00000000 00000000 00000000 00000000 00000000
ffff8ba94077dec0 58193192 S Bi:1:003:1 -115 512 <
ffff8ba94077dec0 58193215 C Bi:1:003:1 0 0
ffff8ba94077dec0 58243293 S Bo:1:003:1 -115 512 = b4d721dd f4b63da8 b968fcd3 21caebd2 25968991 8ef3d7b7 7709e572 d2ec3bc6
ffff8ba94077dec0 58243339 C Bo:1:003:1 0 512 >
ffff8ba94077dec0 58243347 S Bi:1:003:1 -115 512 <
ffff8ba94077dec0 58243548 C Bi:1:003:1 0 512 = 7ac85b2c 00000000 04000000 00000000 00000000 00000000 00000000 00000000
ffff8ba94077dec0 58243557 S Bi:1:003:1 -115 512 <
ffff8ba94077dec0 58243580 C Bi:1:003:1 0 0
ffff8ba94077dec0 58293661 S Bo:1:003:1 -115 512 = fa47344a b0ca0c74 1ee76314 288dd7d0 b7d25873 724e5247 1d3bb934 a146dcca
ffff8ba94077dec0 58293708 C Bo:1:003:1 0 512 >
ffff8ba94077dec0 58293718 S Bi:1:003:1 -115 512 <
ffff8ba94077dec0 58293912 C Bi:1:003:1 0 512 = 7ac88d2c 00000000 04000000 00000000 00000000 00000000 00000000 00000000
ffff8ba94077dec0 58293921 S Bi:1:003:1 -115 512 <
ffff8ba94077dec0 58293944 C Bi:1:003:1 0 0
ffff8ba94077dec0 58344027 S Bo:1:003:1 -115 512 = 518fe41e c59f21c3 339889f7 882340e1 298c9ebe da32e9b7 66939cbc 7e62d305
ffff8ba94077dec0 58344073 C Bo:1:003:1 0 512 >
ffff8ba94077dec0 58344084 S Bi:1:003:1 -115 512 <
ffff8ba94077dec0 58344289 C Bi:1:003:1 0 512 = 7ac8c02c 00000000 03000000 00000000 00000000 00000000 00000000 00000000
ffff8ba94077dec0 58344298 S Bi:1:003:1 -115 512 <
ffff8ba94077dec0 58344310 C Bi:1:003:1 0 0
ffff8ba94077dec0 58394393 S Bo:1:003:1 -115 512 = 70387ec1 a4c5ffe7 7fd51fa3 e05137c9 6e65f33d 1ade3d93 d0a006e2 c17963c3
ffff8ba94077dec0 58394439 C Bo:1:003:1 0 512 >
ffff8ba94077dec0 58394450 S Bi:1:003:1 -115 512 <
ffff8ba94077dec0 58394662 C Bi:1:003:1 0 512 = 7ac8f22c 00000000 03000000 00000000 00000000 00000000 00000000 00000000
ffff8ba94077dec0 58394670 S Bi:1:003:1 -115 512 <
ffff8ba94077dec0 58394693 C Bi:1:003:1 0 0
ffff8ba94077dec0 58444813 S Bo:1:003:1 -115 512 = 5a2e50b4 cf4c4fe8 cfd6d163 37c44ae5 73881143 3d69928d 9d53ebe2 72539513
ffff8ba94077dec0 58444872 C Bo:1:003:1 0 512 >
ffff8ba94077dec0 58444890 S Bi:1:003:1 -115 512 <
ffff8ba94077dec0 58445076 C Bi:1:003:1 0 512 = 7ac8242d 00000000 03000000 00000000 00000000 00000000 00000000 00000000
ffff8ba94077dec0 58445086 S Bi:1:003:1 -115 512 <
ffff8ba94077dec0 58445109 C Bi:1:003:1 0 0
ffff8ba94077dec0 58495189 S Bo:1:003:1 -115 512 = 95014326 c762f87f 9eee3dc5 f78bb2c4 e108209e 63071f2e d19f7f17 4e0d363d
ffff8ba94077dec0 58495246 C Bo:1:003:1 0 512 >
ffff8ba94077dec0 58495255 S Bi:1:003:1 -115 512 <
ffff8ba94077dec0 58495467 C Bi:1:003:1 0 512 = 7ac8572d 00000000 03000000 00000000 00000000 00000000 00000000 00000000
ffff8ba94077dec0 58495476 S Bi:1:003:1 -115 512 <
ffff8ba94077dec0 58495499 C Bi:1:003:1 0 0
ffff8ba94077dec0 58545578 S Bo:1:003:1 -115 512 = b6140862 2feb8ec0 6632b5b1 e3f75846 b5ee6d15 5d52a8fa 00b7111e f3d8ab54
ffff8ba94077dec0 58545624 C Bo:1:003:1 0 512 >
ffff8ba94077dec0 58545632 S Bi:1:003:1 -115 512 <
ffff8ba94077dec0 58545828 C Bi:1:003:1 0 512 = 7ac8892d 00000000 03000000 00000000 00000000 00000000 00000000 00000000
ffff8ba94077dec0 58545836 S Bi:1:003:1 -115 512 <
ffff8ba94077dec0 58545859 C Bi:1:003:1 0 0
ffff8ba94077dec0 58595937 S Bo:1:003:1 -115 512 = eaba852a 0f8b78ac bfa9df18 fb572093 ff059244 7146019b 94016c33 d934dac0
ffff8ba94077dec0 58595998 C Bo:1:003:1 0 512 >
ffff8ba94077dec0 58596006 S Bi:1:003:1 -115 512 <
ffff8ba94077dec0 58596224 C Bi:1:003:1 0 512 = 7ac8bb2d 00000000 03000000 00000000 00000000 00000000 00000000 00000000
ffff8ba94077dec0 58596233 S Bi:1:003:1 -115 512 <
ffff8ba94077dec0 58596256 C Bi:1:003:1 0 0
ffff8ba94077dec0 58646337 S Bo:1:003:1 -115 512 = ef530f89 a74cc477 9af493f2 783b9d7b d01b6e57 5ec7f9ad 030b8013 14176086
ffff8ba94077dec0 58646384 C Bo:1:003:1 0 512 >
ffff8ba94077dec0 58646394 S Bi:1:003:1 -115 512 <
ffff8ba94077dec0 58646592 C Bi:1:003:1 0 512 = 7ac8ee2d 00000000 02000000 00000000 00000000 00000000 00000000 00000000
ffff8ba94077dec0 58646601 S Bi:1:003:1 -115 512 <
ffff8ba94077dec0 58646624 C Bi:1:003:1 0 0
ffff8ba94077dec0 58646666 S Bo:1:003:1 -115 53589 = 3a9457d5 86265c86 85765b5c fc0e6d29 d2aa6ffb 27570865 557586b8 562f6273
ffff8ba94077dec0 58648431 C Bo:1:003:1 0 53589 >
ffff8ba94077dec0 58648442 S Bi:1:003:1 -115 512 <
ffff8ba94077dec0 58648845 C Bi:1:003:1 0 512 = 79c8ef2d 00000000 03000000 00000000 00000000 00000000 00000000 00000000
ffff8ba94077dec0 58648867 S Bi:1:003:1 -115 512 <
ffff8ba94077dec0 58648900 C Bi:1:003:1 0 0
ffff8ba94077dec0 58648932 S Bo:1:003:1 -115 58262 = 33808011 33015aec 5a4b1b38 97ae0595 a79aa48c a2e4328b bd5106db cd990fcc
ffff8ba94077dec0 58650573 C Bo:1:003:1 0 58262 >
ffff8ba94077dec0 58650581 S Bi:1:003:1 -115 512 <
ffff8ba94077dec0 58651262 C Bi:1:003:1 0 512 = 79c8f02d 00000000 04000000 00000000 00000000 00000000 00000000 00000000
ffff8ba94077dec0 58651275 S Bi:1:003:1 -115 512 <
ffff8ba94077dec0 58651287 C Bi:1:003:1 0 0
ffff8ba94077dec0 58651312 S Bo:1:003:1 -115 512 = 006be190 ab1e51f1 3f001d47 b9af5dd6 ef7092ce 2c298310 6d97727b c3041d24
ffff8ba94077dec0 58651374 C Bo:1:003:1 0 512 >
ffff8ba94077dec0 58651382 S Bi:1:003:1 -115 512 <
ffff8ba94077dec0 58651521 C Bi:1:003:1 0 512 = 7ac8f32d 00000000 04000000 00000000 00000000 00000000 00000000 00000000
ffff8ba94077dec0 58651527 S Bi:1:003:1 -115 512 <
ffff8ba94077dec0 58651561 C Bi:1:003:1 0 0
ffff8ba94077dec0 58701638 S Bo:1:003:1 -115 512 = dbd8a2cb 0a7701f8 40c5ba2c 0ab19176 60487a16 f37d720a 6f5b27c8 1d789b1b
ffff8ba94077dec0 58701684 C Bo:1:003:1 0 512 >
ffff8ba94077dec0 58701700 S Bi:1:003:1 -115 512 <
ffff8ba94077dec0 58701922 C Bi:1:003:1 0 512 = 7ac8252e 00000000 04000000 00000000 00000000 00000000 00000000 00000000
ffff8ba94077dec0 58701932 S Bi:1:003:1 -115 512 <
ffff8ba94077dec0 58701954 C Bi:1:003:1 0 0
ffff8ba94077dec0 58752025 S Bo:1:003:1 -115 512 = 6b7a8f37 6d6a9847 f32b1b09 294b13bb d7fc56fd f8c6f736 48e8454d bb77aa9f
ffff8ba94077dec0 58752072 C Bo:1:003:1 0 512 >
ffff8ba94077dec0 58752081 S Bi:1:003:1 -115 512 <
ffff8ba94077dec0 58752283 C Bi:1:003:1 0 512 = 7ac8582e 00000000 04000000 00000000 00000000 00000000 00000000 00000000
ffff8ba94077dec0 58752292 S Bi:1:003:1 -115 512 <
ffff8ba94077dec0 58752306 C Bi:1:003:1 0 0
ffff8ba94077dec0 58802385 S Bo:1:003:1 -115 512 = ca54d58b 53459450 44658710 035e2c4d 3d5ca4d3 9523d2ca e60c3613 fb068317
ffff8ba94077dec0 58802431 C Bo:1:003:1 0 512 >
ffff8ba94077dec0 58802440 S Bi:1:003:1 -115 512 <
ffff8ba94077dec0 58802662 C Bi:1:003:1 0 512 = 7ac88a2e 00000000 04000000 00000000 00000000 00000000 00000000 00000000
ffff8ba94077dec0 58802671 S Bi:1:003:1 -115 512 <
ffff8ba94077dec0 58802693 C Bi:1:003:1 0 0
ffff8ba94077dec0 58852771 S Bo:1:003:1 -115 512 = af3dde81 940d14ba dbc0461d ea64885f dbbb88c3 97b3d314 c751e3ac ac9cf806
ffff8ba94077dec0 58852816 C Bo:1:003:1 0 512 >
ffff8ba94077dec0 58852824 S Bi:1:003:1 -115 512 <
ffff8ba94077dec0 58853033 C Bi:1:003:1 0 512 = 7ac8bc2e 00000000 04000000 00000000 00000000 00000000 00000000 00000000
ffff8ba94077dec0 58853041 S Bi:1:003:1 -115 512 <
ffff8ba94077dec0 58853054 C Bi:1:003:1 0 0
ffff8ba94077dec0 58903134 S Bo:1:003:1 -115 512 = f36669c9 6fefafe4 f5e6c98f 4230be79 d97649c2 14f418eb fd80a989 67bb6469
ffff8ba94077dec0 58903181 C Bo:1:003:1 0 512 >
ffff8ba94077dec0 58903191 S Bi:1:003:1 -115 512 <
ffff8ba94077dec0 58903409 C Bi:1:003:1 0 512 = 7ac8ef2e 00000000 04000000 00000000 00000000 00000000 00000000 00000000
ffff8ba94077dec0 58903415 S Bi:1:003:1 -115 512 <
ffff8ba94077dec0 58903446 C Bi:1:003:1 0 0
ffff8ba94077dec0 58953524 S Bo:1:003:1 -115 512 = e41978a9 034d04c5 86daf3d6 d80e8ea1 598f12c0 e3005bf4 60ea7d6f fcfc42b4
ffff8ba94077dec0 58953570 C Bo:1:003:1 0 512 >
ffff8ba94077dec0 58953579 S Bi:1:003:1 -115 512 <
ffff8ba94077dec0 58953795 C Bi:1:003:1 0 512 = 7ac8212f 00000000 03000000 00000000 00000000 00000000 00000000 00000000
ffff8ba94077dec0 58953804 S Bi:1:003:1 -115 512 <
ffff8ba94077dec0 58953817 C Bi:1:003:1 0 0
ffff8ba9538a29c0 59003909 S Bo:1:003:1 -115 512 = 5cd34ac4 80bb538c 5ea2f01c f51dd6a7 c00c6556 8867453d d2b0b9e2 b8963638
ffff8ba9538a29c0 59003956 C Bo:1:003:1 0 512 >
ffff8ba9538a29c0 59003966 S Bi:1:003:1 -115 512 <
ffff8ba9538a29c0 59004151 C Bi:1:003:1 0 512 = 7ac8532f 00000000 03000000 00000000 00000000 00000000 00000000 00000000
ffff8ba9538a29c0 59004162 S Bi:1:003:1 -115 512 <
ffff8ba9538a29c0 59004176 C Bi:1:003:1 0 0
ffff8ba9538a29c0 59054254 S Bo:1:003:1 -115 512 = 0aa5cbb1 94cc3097 3cb1a027 5bda345b 5f9efdf0 db69b487 ec261cb3 a84fc831
ffff8ba9538a29c0 59054296 C Bo:1:003:1 0 512 >
ffff8ba9538a29c0 59054305 S Bi:1:003:1 -115 512 <
ffff8ba9538a29c0 59054503 C Bi:1:003:1 0 512 = 7ac8862f 00000000 03000000 00000000 00000000 00000000 00000000 00000000
ffff8ba9538a29c0 59054511 S Bi:1:003:1 -115 512 <
ffff8ba9538a29c0 59054536 C Bi:1:003:1 0 0
ffff8ba94987f140 59104646 S Bo:1:003:1 -115 512 = 4cb34110 0c2094a1 b0d13fa5 80178d0c 1fbeea49 3339de58 39fe796e 73b2fa22
ffff8ba94987f140 59104695 C Bo:1:003:1 0 512 >
ffff8ba94987f140 59104710 S Bi:1:003:1 -115 512 <
ffff8ba94987f140 59104956 C Bi:1:003:1 0 512 = 7ac8b82f 00000000 03000000 00000000 00000000 00000000 00000000 00000000
ffff8ba94987f140 59104968 S Bi:1:003:1 -115 512 <
ffff8ba94987f140 59104980 C Bi:1:003:1 0 0
ffff8ba94987f140 59155023 S Bo:1:003:1 -115 512 = f17e5965 f667a450 f152a276 d5522765 f2beddc8 8fbf5b76 bcc596e2 2d49e67f
ffff8ba94987f140 59155069 C Bo:1:003:1 0 512 >
ffff8ba94987f140 59155077 S Bi:1:003:1 -115 512 <
ffff8ba94987f140 59155277 C Bi:1:003:1 0 512 = 7ac8eb2f 00000000 03000000 00000000 00000000 00000000 00000000 00000000
ffff8ba94987f140 59155286 S Bi:1:003:1 -115 512 <
ffff8ba94987f140 59155298 C Bi:1:003:1 0 0
ffff8ba954973ec0 59205338 S Bo:1:003:1 -115 512 = 59ccca51 3df8a1ea b7d3cdc4 82de55d9 bdb09e0f e4ad627b 0a7b7351 1f4effb7
ffff8ba954973ec0 59205385 C Bo:1:003:1 0 512 >
ffff8ba954973ec0 59205395 S Bi:1:003:1 -115 512 <
ffff8ba954973ec0 59206231 C Bi:1:003:1 0 512 = 7ac81d30 00000000 02000000 00000000 00000000 00000000 00000000 00000000
ffff8ba954973ec0 59206240 S Bi:1:003:1 -115 512 <
ffff8ba954973ec0 59206252 C Bi:1:003:1 0 0
ffff8ba954973ec0 59206290 S Bo:1:003:1 -115 57205 = 9e3550de fbc41f79 e857b4dd 67e6b5b6 a951ab84 914aa9b3 2d7bbcfc 8378aae5
ffff8ba954973ec0 59208642 C Bo:1:003:1 0 57205 >
ffff8ba954973ec0 59208652 S Bi:1:003:1 -115 512 <
ffff8ba954973ec0 59209359 C Bi:1:003:1 0 512 = 79c81e30 00000000 03000000 00000000 00000000 00000000 00000000 00000000
ffff8ba954973ec0 59209378 S Bi:1:003:1 -115 512 <
ffff8ba954973ec0 59209391 C Bi:1:003:1 0 0
ffff8ba954973ec0 59209424 S Bo:1:003:1 -115 58240 = 61204c2f 363cd623 7341738e c51fb09e 8bebfdc5 bc23fa41 e28629ef c36eb97c
ffff8ba954973ec0 59211336 C Bo:1:003:1 0 58240 >
ffff8ba954973ec0 59211345 S Bi:1:003:1 -115 512 <
ffff8ba954973ec0 59211757 C Bi:1:003:1 0 512 = 79c82130 00000000 04000000 00000000 00000000 00000000 00000000 00000000
ffff8ba954973ec0 59211769 S Bi:1:003:1 -115 512 <
ffff8ba954973ec0 59211782 C Bi:1:003:1 0 0
ffff8ba954973ec0 59211807 S Bo:1:003:1 -115 512 = 7569646b b5ae8cca 9395942b 0044b6ef 780a2b2b d2be3b98 96a9cd84 6a637b14
ffff8ba954973ec0 59211844 C Bo:1:003:1 0 512 >
ffff8ba954973ec0 59211849 S Bi:1:003:1 -115 512 <
ffff8ba954973ec0 59212002 C Bi:1:003:1 0 512 = 7ac82330 00000000 04000000 00000000 00000000 00000000 00000000 00000000
ffff8ba954973ec0 59212011 S Bi:1:003:1 -115 512 <
ffff8ba954973ec0 59212036 C Bi:1:003:1 0 0
ffff8ba954973ec0 59262114 S Bo:1:003:1 -115 512 = 69894024 f9ad8f28 1a28c504 a0f6cd4f e0b6d9a6 74dc0fac f1a673e4 59c0aad0
ffff8ba954973ec0 59262155 C Bo:1:003:1 0 512 >
ffff8ba954973ec0 59262165 S Bi:1:003:1 -115 512 <
ffff8ba954973ec0 59262360 C Bi:1:003:1 0 512 = 7ac85630 00000000 04000000 00000000 00000000 00000000 00000000 00000000
ffff8ba954973ec0 59262369 S Bi:1:003:1 -115 512 <
ffff8ba954973ec0 59262392 C Bi:1:003:1 0 0
ffff8ba9544ff740 59312486 S Bo:1:003:1 -115 512 = 34e861e7 64830d6e 7ea1565a 64ab3b25 f5150c10 71dcd3d5 fcce8940 3ac4c274
ffff8ba9544ff740 59312533 C Bo:1:003:1 0 512 >
ffff8ba9544ff740 59312543 S Bi:1:003:1 -115 512 <
ffff8ba9544ff740 59312753 C Bi:1:003:1 0 512 = 7ac88830 00000000 04000000 00000000 00000000 00000000 00000000 00000000
ffff8ba9544ff740 59312762 S Bi:1:003:1 -115 512 <
ffff8ba9544ff740 59312785 C Bi:1:003:1 0 0
ffff8ba9544ff740 59362861 S Bo:1:003:1 -115 512 = bedb30c9 b002f08f ed502992 77b772ea 2bb9d3bd 442bca2e 0413302e 52e66175
ffff8ba9544ff740 59362907 C Bo:1:003:1 0 512 >
ffff8ba9544ff740 59362916 S Bi:1:003:1 -115 512 <
ffff8ba9544ff740 59363111 C Bi:1:003:1 0 512 = 7ac8ba30 00000000 04000000 00000000 00000000 00000000 00000000 00000000
ffff8ba9544ff740 59363120 S Bi:1:003:1 -115 512 <
ffff8ba9544ff740 59363133 C Bi:1:003:1 0 0
ffff8ba9544ff740 59413211 S Bo:1:003:1 -115 512 = 8de9f77e d5bbecc1 f1924888 0e78fe15 17b547c3 d4cd17ab ef36adab 3df4d3f9
ffff8ba9544ff740 59413257 C Bo:1:003:1 0 512 >
ffff8ba9544ff740 59413274 S Bi:1:003:1 -115 512 <
ffff8ba9544ff740 59413466 C Bi:1:003:1 0 512 = 7ac8ed30 00000000 04000000 00000000 00000000 00000000 00000000 00000000
ffff8ba9544ff740 59413479 S Bi:1:003:1 -115 512 <
ffff8ba9544ff740 59413491 C Bi:1:003:1 0 0
ffff8ba9544ff740 59463574 S Bo:1:003:1 -115 512 = 218df4e9 ff0f9f86 daa46bf3 b8579f69 942467dc fb2a94fa 132b6069 780f90a8
ffff8ba9544ff740 59463630 C Bo:1:003:1 0 512 >
ffff8ba9544ff740 59463639 S Bi:1:003:1 -115 512 <
ffff8ba9544ff740 59463820 C Bi:1:003:1 0 512 = 7ac81f31 00000000 04000000 00000000 00000000 00000000 00000000 00000000
ffff8ba9544ff740 59463828 S Bi:1:003:1 -115 512 <
ffff8ba9544ff740 59463851 C Bi:1:003:1 0 0
ffff8ba9544ff740 59513966 S Bo:1:003:1 -115 512 = 6a4a6c86 67f5a031 ebbb95c9 34635f87 e3be5d66 a77b89ee aec98560 bd8ba08b
ffff8ba9544ff740 59514014 C Bo:1:003:1 0 512 >
ffff8ba9544ff740 59514031 S Bi:1:003:1 -115 512 <
ffff8ba9544ff740 59514218 C Bi:1:003:1 0 512 = 7ac85131 00000000 03000000 00000000 00000000 00000000 00000000 00000000
ffff8ba9544ff740 59514244 S Bi:1:003:1 -115 512 <
ffff8ba9544ff740 59514275 C Bi:1:003:1 0 0
ffff8ba9544ff740 59564357 S Bo:1:003:1 -115 512 = 9910bf46 6100c5b7 5be2073e 64d4e779 d5ca14e5 043722ca 06eee0b8 834f207f
ffff8ba9544ff740 59564404 C Bo:1:003:1 0 512 >
ffff8ba9544ff740 59564416 S Bi:1:003:1 -115 512 <
ffff8ba9544ff740 59564635 C Bi:1:003:1 0 512 = 7ac88431 00000000 03000000 00000000 00000000 00000000 00000000 00000000
ffff8ba9544ff740 59564644 S Bi:1:003:1 -115 512 <
ffff8ba9544ff740 59564667 C Bi:1:003:1 0 0
ffff8ba9544ff740 59614741 S Bo:1:003:1 -115 512 = 97319055 6eca81e0 fb822237 915abffa 99048fec 0a223301 eed98e2f e7151c1e
ffff8ba9544ff740 59614780 C Bo:1:003:1 0 512 >
ffff8ba9544ff740 59614789 S Bi:1:003:1 -115 512 <
ffff8ba9544ff740 59614995 C Bi:1:003:1 0 512 = 7ac8b631 00000000 03000000 00000000 00000000 00000000 00000000 00000000
ffff8ba9544ff740 59615004 S Bi:1:003:1 -115 512 <
ffff8ba9544ff740 59615017 C Bi:1:003:1 0 0
ffff8ba9544ff740 59665099 S Bo:1:003:1 -115 512 = 948a7429 11e65bf5 4648b0ef 4e34abe1 ab7cd721 3186c09b 04569fd2 bf5ca7ee
ffff8ba9544ff740 59665141 C Bo:1:003:1 0 512 >
ffff8ba9544ff740 59665151 S Bi:1:003:1 -115 512 <
ffff8ba9544ff740 59665337 C Bi:1:003:1 0 512 = 7ac8e931 00000000 03000000 00000000 00000000 00000000 00000000 00000000
ffff8ba9544ff740 59665345 S Bi:1:003:1 -115 512 <
ffff8ba9544ff740 59665368 C Bi:1:003:1 0 0
ffff8ba9538a29c0 59715450 S Bo:1:003:1 -115 512 = c46f694b 222d1a95 85fa16a7 f4f98846 846d3e43 05a57b36 2335fd17 d3662dcd
ffff8ba9538a29c0 59715509 C Bo:1:003:1 0 512 >
ffff8ba9538a29c0 59715520 S Bi:1:003:1 -115 512 <
ffff8ba9538a29c0 59715716 C Bi:1:003:1 0 512 = 7ac81b32 00000000 03000000 00000000 00000000 00000000 00000000 00000000
ffff8ba9538a29c0 59715725 S Bi:1:003:1 -115 512 <
ffff8ba9538a29c0 59715748 C Bi:1:003:1 0 0
ffff8ba9538a29c0 59765827 S Bo:1:003:1 -115 512 = c5af44e0 2ba37e18 56179ef5 19d6e32f 336c7c07 be947731 8ce60bae 78dc92a5
ffff8ba9538a29c0 59765885 C Bo:1:003:1 0 512 >
ffff8ba9538a29c0 59765893 S Bi:1:003:1 -115 512 <
ffff8ba9538a29c0 59766075 C Bi:1:003:1 0 512 = 7ac84d32 00000000 03000000 00000000 00000000 00000000 00000000 00000000
ffff8ba9538a29c0 59766083 S Bi:1:003:1 -115 512 <
ffff8ba9538a29c0 59766108 C Bi:1:003:1 0 0
ffff8ba9538a29c0 59816186 S Bo:1:003:1 -115 512 = 6e3d67bd 7f114855 e4d947d2 1db41af7 8bd47fb1 ada1fea1 4dd4dc6f 0b050403
ffff8ba9538a29c0 59816231 C Bo:1:003:1 0 512 >
ffff8ba9538a29c0 59816240 S Bi:1:003:1 -115 512 <
ffff8ba9538a29c0 59816436 C Bi:1:003:1 0 512 = 7ac88032 00000000 02000000 00000000 00000000 00000000 00000000 00000000
ffff8ba9538a29c0 59816445 S Bi:1:003:1 -115 512 <
ffff8ba9538a29c0 59816468 C Bi:1:003:1 0 0
ffff8ba9538a29c0 59816507 S Bo:1:003:1 -115 59475 = cd3d23d3 c3ca868a 628cf751 7b12bc9e ce243121 248895d2 be886aea a68a596d
ffff8ba9538a29c0 59818055 C Bo:1:003:1 0 59475 >
ffff8ba9538a29c0 59818066 S Bi:1:003:1 -115 512 <
ffff8ba9538a29c0 59818939 C Bi:1:003:1 0 512 = 79c88132 00000000 03000000 00000000 00000000 00000000 00000000 00000000
ffff8ba9538a29c0 59818959 S Bi:1:003:1 -115 512 <
ffff8ba9538a29c0 59818970 C Bi:1:003:1 0 0
ffff8ba9538a29c0 59819011 S Bo:1:003:1 -115 56327 = eaba6b2f cb6b88f1 605aa8f2 2229f5f1 9a9d3dd9 a3b74f6a b96a85af 83c61308
ffff8ba9538a29c0 59820469 C Bo:1:003:1 0 56327 >
ffff8ba9538a29c0 59820484 S Bi:1:003:1 -115 512 <
ffff8ba9538a29c0 59821286 C Bi:1:003:1 0 512 = 79c88332 00000000 04000000 00000000 00000000 00000000 00000000 00000000
ffff8ba9538a29c0 59821305 S Bi:1:003:1 -115 512 <
ffff8ba9538a29c0 59821317 C Bi:1:003:1 0 0
ffff8ba9538a29c0 59821344 S Bo:1:003:1 -115 512 = d9cf7f0e 88e25d5f 65b6dd15 3e7b14ca f740e8c4 acd18592 ad693e6c 2c797dc3
ffff8ba9538a29c0 59821382 C Bo:1:003:1 0 512 >
ffff8ba9538a29c0 59821388 S Bi:1:003:1 -115 512 <
ffff8ba9538a29c0 59821537 C Bi:1:003:1 0 512 = 7ac88532 00000000 04000000 00000000 00000000 00000000 00000000 00000000
ffff8ba9538a29c0 59821543 S Bi:1:003:1 -115 512 <
ffff8ba9538a29c0 59821574 C Bi:1:003:1 0 0
ffff8ba9544e29c0 59871607 S Bo:1:003:1 -115 512 = e33f07df e4d256c6 47faee68 42aeb742 c8731fa4 70a06e21 60e433ff 83148e35
ffff8ba9544e29c0 59871650 C Bo:1:003:1 0 512 >
ffff8ba9544e29c0 59871660 S Bi:1:003:1 -115 512 <
ffff8ba9544e29c0 59871856 C Bi:1:003:1 0 512 = 7ac8b732 00000000 04000000 00000000 00000000 00000000 00000000 00000000
ffff8ba9544e29c0 59871865 S Bi:1:003:1 -115 512 <
ffff8ba9544e29c0 59871885 C Bi:1:003:1 0 0
ffff8ba9544e29c0 59921967 S Bo:1:003:1 -115 512 = 2b1a3831 f6f49ad2 fb70b46b 40241dd3 2dd29796 3b472ea6 f76b4957 c19bff3f
ffff8ba9544e29c0 59922163 C Bo:1:003:1 0 512 >
ffff8ba9544e29c0 59922174 S Bi:1:003:1 -115 512 <
ffff8ba9544e29c0 59922389 C Bi:1:003:1 0 512 = 7ac8e932 00000000 04000000 00000000 00000000 00000000 00000000 00000000
ffff8ba9544e29c0 59922396 S Bi:1:003:1 -115 512 <
ffff8ba9544e29c0 59922622 C Bi:1:003:1 0 0
ffff8ba9544e29c0 59972702 S Bo:1:003:1 -115 512 = aa8628ae e50cdff9 cc1cb58c ab012f85 ff881fea c09a039d b33b8575 9adf8d6e
ffff8ba9544e29c0 59972884 C Bo:1:003:1 0 512 >
ffff8ba9544e29c0 59972891 S Bi:1:003:1 -115 512 <
ffff8ba9544e29c0 59973118 C Bi:1:003:1 0 512 = 7ac81c33 00000000 04000000 00000000 00000000 00000000 00000000 00000000
ffff8ba9544e29c0 59973124 S Bi:1:003:1 -115 512 <
ffff8ba9544e29c0 59973134 C Bi:1:003:1 0 0
ffff8ba9544e29c0 60023212 S Bo:1:003:1 -115 512 = 4bedc2ef 855442d1 dbabe9ff d6481282 4f581ef6 172db6a9 8179c057 d850e814
ffff8ba9544e29c0 60023270 C Bo:1:003:1 0 512 >
ffff8ba9544e29c0 60023280 S Bi:1:003:1 -115 512 <
ffff8ba9544e29c0 60023476 C Bi:1:003:1 0 512 = 7ac84f33 00000000 04000000 00000000 00000000 00000000 00000000 00000000
ffff8ba9544e29c0 60023485 S Bi:1:003:1 -115 512 <
ffff8ba9544e29c0 60023508 C Bi:1:003:1 0 0
ffff8ba9544e29c0 60073587 S Bo:1:003:1 -115 512 = 39d20d21 d201d279 cb756d4f ec7e81af 0ad6cdb3 eb0516b9 6d0f9932 508f20c9
ffff8ba9544e29c0 60073640 C Bo:1:003:1 0 512 >
ffff8ba9544e03c0 60073656 S Bi:1:003:1 -115 512 <
ffff8ba9544e03c0 60073975 C Bi:1:003:1 0 512 = 7ac88133 00000000 03000000 00000000 00000000 00000000 00000000 00000000
ffff8ba9544dd200 60073988 S Bi:1:003:1 -115 512 <
ffff8ba9544dd200 60074001 C Bi:1:003:1 0 0
ffff8ba9566a6e40 60124087 S Bo:1:003:1 -115 512 = 9156d2dc 3f866a0e b0cb6582 55da6908 ca851863 337e88fb 06f147f7 716971bb
ffff8ba9566a6e40 60124147 C Bo:1:003:1 0 512 >
ffff8ba9566a6e40 60124158 S Bi:1:003:1 -115 512 <
ffff8ba9566a6e40 60124362 C Bi:1:003:1 0 512 = 7ac8b433 00000000 03000000 00000000 00000000 00000000 00000000 00000000
ffff8ba9566a6e40 60124372 S Bi:1:003:1 -115 512 <
ffff8ba9566a6e40 60124383 C Bi:1:003:1 0 0
ffff8ba9566a6e40 60174461 S Bo:1:003:1 -115 512 = ccde360a 83589cb3 b6dafde9 19ba0c04 6e3a177d dfc29fc4 04f74af2 189fe5a5
ffff8ba9566a6e40 60174523 C Bo:1:003:1 0 512 >
ffff8ba9566a6e40 60174531 S Bi:1:003:1 -115 512 <
ffff8ba9566a6e40 60176099 C Bi:1:003:1 0 512 = 7ac8e633 00000000 03000000 00000000 00000000 00000000 00000000 00000000
ffff8ba9566a6e40 60176108 S Bi:1:003:1 -115 512 <
ffff8ba9566a6e40 60176120 C Bi:1:003:1 0 0
ffff8ba9538a2a80 60226202 S Bo:1:003:1 -115 512 = 52472a36 82a172e4 b7d8e33c 421424ca bbb32780 0283d53e 1d8ddb0d 8f805f85
ffff8ba9538a2a80 60226238 C Bo:1:003:1 0 512 >
ffff8ba9538a2a80 60226245 S Bi:1:003:1 -115 512 <
ffff8ba9538a2a80 60226434 C Bi:1:003:1 0 512 = 7ac81a34 00000000 03000000 00000000 00000000 00000000 00000000 00000000
ffff8ba9538a2a80 60226440 S Bi:1:003:1 -115 512 <
ffff8ba9538a2a80 60226474 C Bi:1:003:1 0 0
ffff8ba9538a2a80 60276552 S Bo:1:003:1 -115 512 = 79313b6d 9650e5d6 9cae28e1 4de5ac1d 01d979d7 c212d6a8 01648533 f83f397b
ffff8ba9538a2a80 60276586 C Bo:1:003:1 0 512 >
ffff8ba9538a2a80 60276592 S Bi:1:003:1 -115 512 <
ffff8ba9538a2a80 60276782 C Bi:1:003:1 0 512 = 7ac84c34 00000000 03000000 00000000 00000000 00000000 00000000 00000000
ffff8ba9538a2a80 60276788 S Bi:1:003:1 -115 512 <
ffff8ba9538a2a80 60276821 C Bi:1:003:1 0 0
ffff8ba9538a2a80 60326902 S Bo:1:003:1 -115 512 = be324839 7bf926fc 713050d2 a93f1ecf 67a2ddc0 ca77ed92 89fd9be4 04eee7bf
ffff8ba9538a2a80 60326949 C Bo:1:003:1 0 512 >
ffff8ba9538a2a80 60326959 S Bi:1:003:1 -115 512 <
ffff8ba9538a2a80 60327140 C Bi:1:003:1 0 512 = 7ac87e34 00000000 03000000 00000000 00000000 00000000 00000000 00000000
ffff8ba9538a2a80 60327149 S Bi:1:003:1 -115 512 <
ffff8ba9538a2a80 60327173 C Bi:1:003:1 0 0
ffff8ba9538a2a80 60377252 S Bo:1:003:1 -115 512 = 4d120eb6 72406e69 484190c5 2cfcb0aa a68e3d98 e20af1d9 394bd301 b2e17862
ffff8ba9538a2a80 60377295 C Bo:1:003:1 0 512 >
ffff8ba9538a2a80 60377304 S Bi:1:003:1 -115 512 <
ffff8ba9538a2a80 60377493 C Bi:1:003:1 0 512 = 7ac8b134 00000000 02000000 00000000 00000000 00000000 00000000 00000000
ffff8ba9538a2a80 60377502 S Bi:1:003:1 -115 512 <
ffff8ba9538a2a80 60377524 C Bi:1:003:1 0 0
ffff8ba9538a2a80 60377565 S Bo:1:003:1 -115 60117 = 4a553e77 4bc033f8 903df57f 30ce9b3a 20ad69f4 a7377615 60ea77cd bd28b599
ffff8ba9538a2a80 60379554 C Bo:1:003:1 0 60117 >
ffff8ba9538a2a80 60379563 S Bi:1:003:1 -115 512 <
ffff8ba9538a2a80 60379968 C Bi:1:003:1 0 512 = 79c8b234 00000000 03000000 00000000 00000000 00000000 00000000 00000000
ffff8ba9538a2a80 60379985 S Bi:1:003:1 -115 512 <
ffff8ba9538a2a80 60380009 C Bi:1:003:1 0 0
ffff8ba9538a2a80 60380040 S Bo:1:003:1 -115 56807 = e7280bc1 eb8bd6b1 13c1fd05 f78ba9c9 073e5ef3 9dcbb1ad 84b445b5 851e5f19
ffff8ba9538a2a80 60381580 C Bo:1:003:1 0 56807 >
ffff8ba9538a2a80 60381586 S Bi:1:003:1 -115 512 <
ffff8ba9538a2a80 60382258 C Bi:1:003:1 0 512 = 79c8b434 00000000 04000000 00000000 00000000 00000000 00000000 00000000
ffff8ba9538a2a80 60382267 S Bi:1:003:1 -115 512 <
ffff8ba9538a2a80 60382298 C Bi:1:003:1 0 0
ffff8ba9538a2a80 60382323 S Bo:1:003:1 -115 512 = bf0a5623 5e7b6396 02607e8d 9362843e 2cf72355 2f7fbbd0 c532d17e 4cbb7987
ffff8ba9538a2a80 60382359 C Bo:1:003:1 0 512 >
ffff8ba9538a2a80 60382364 S Bi:1:003:1 -115 512 <
ffff8ba9538a2a80 60382511 C Bi:1:003:1 0 512 = 7ac8b634 00000000 04000000 00000000 00000000 00000000 00000000 00000000
ffff8ba9538a2a80 60382516 S Bi:1:003:1 -115 512 <
ffff8ba9538a2a80 60382551 C Bi:1:003:1 0 0
ffff8ba9538a2a80 60432630 S Bo:1:003:1 -115 512 = cb000895 457966fe 47542e07 8f082752 2880f362 87ee8119 36e93526 14527cf8
ffff8ba9538a2a80 60432664 C Bo:1:003:1 0 512 >
ffff8ba9538a2a80 60432670 S Bi:1:003:1 -115 512 <
ffff8ba9538a2a80 60432867 C Bi:1:003:1 0 512 = 7ac8e834 00000000 04000000 00000000 00000000 00000000 00000000 00000000
ffff8ba9538a2a80 60432873 S Bi:1:003:1 -115 512 <
ffff8ba9538a2a80 60432907 C Bi:1:003:1 0 0
ffff8ba9538a2a80 60482984 S Bo:1:003:1 -115 512 = 17675e2a 6019ee13 cc5e8585 a65e8ac8 2dce1079 07c6b148 9b0de21e eb247ec1
ffff8ba9538a2a80 60483018 C Bo:1:003:1 0 512 >
ffff8ba9538a2a80 60483023 S Bi:1:003:1 -115 512 <
ffff8ba9538a2a80 60483216 C Bi:1:003:1 0 512 = 7ac81b35 00000000 04000000 00000000 00000000 00000000 00000000 00000000
ffff8ba9538a2a80 60483222 S Bi:1:003:1 -115 512 <
ffff8ba9538a2a80 60483250 C Bi:1:003:1 0 0
ffff8ba98420ea80 60533289 S Bo:1:003:1 -115 512 = ebf7fb79 1957f21d a2137575 0f039366 68b4e894 f521fefb 8f0d057b d4b14a6f
ffff8ba98420ea80 60533320 C Bo:1:003:1 0 512 >
ffff8ba98420ea80 60533326 S Bi:1:003:1 -115 512 <
ffff8ba98420ea80 60533525 C Bi:1:003:1 0 512 = 7ac84d35 00000000 04000000 00000000 00000000 00000000 00000000 00000000
ffff8ba98420ea80 60533529 S Bi:1:003:1 -115 512 <
ffff8ba98420ea80 60533561 C Bi:1:003:1 0 0
ffff8ba98420ea80 60583636 S Bo:1:003:1 -115 512 = 191de995 90107f8b c8817671 207098d7 0772af17 2d8680aa d1bf1df6 7b0689ee
ffff8ba98420ea80 60583663 C Bo:1:003:1 0 512 >
ffff8ba9a6103d40 60583676 S Bi:1:003:1 -115 512 <
ffff8ba9a6103d40 60583840 C Bi:1:003:1 0 512 = 7ac87f35 00000000 04000000 00000000 00000000 00000000 00000000 00000000
ffff8ba9a6102900 60583850 S Bi:1:003:1 -115 512 <
ffff8ba9a6102900 60583884 C Bi:1:003:1 0 0
ffff8ba9250dd080 60633965 S Bo:1:003:1 -115 512 = c82381bc 177c1716 7d428bc3 c1ddfce6 0a3afdc6 80ba7e8e d90086ad 44dfa112
ffff8ba9250dd080 60634012 C Bo:1:003:1 0 512 >
ffff8ba9250dd080 60634015 S Bi:1:003:1 -115 512 <
ffff8ba9250dd080 60634219 C Bi:1:003:1 0 512 = 7ac8b135 00000000 04000000 00000000 00000000 00000000 00000000 00000000
ffff8ba9250dd080 60634231 S Bi:1:003:1 -115 512 <
ffff8ba9250dd080 60634254 C Bi:1:003:1 0 0
ffff8ba91f96a000 60684383 S Bo:1:003:1 -115 512 = 20e014a4 5a675475 fccc42e5 177f396f 7f56e3aa a0037095 981d6690 396fd8c0
ffff8ba91f96a000 60684432 C Bo:1:003:1 0 512 >
ffff8ba91f96a000 60684446 S Bi:1:003:1 -115 512 <
ffff8ba91f96a000 60684678 C Bi:1:003:1 0 512 = 7ac8e435 00000000 03000000 00000000 00000000 00000000 00000000 00000000
ffff8ba91f96a000 60684690 S Bi:1:003:1 -115 512 <
ffff8ba91f96a000 60684703 C Bi:1:003:1 0 0
ffff8ba91f96a000 60734783 S Bo:1:003:1 -115 512 = 7b37c13b ab14c7fe adad6790 3c77539e 3e06d9da 059c5617 3fa922b1 f37773b0
ffff8ba91f96a000 60734829 C Bo:1:003:1 0 512 >
ffff8ba91f96a000 60734837 S Bi:1:003:1 -115 512 <
ffff8ba91f96a000 60735034 C Bi:1:003:1 0 512 = 7ac81636 00000000 03000000 00000000 00000000 00000000 00000000 00000000
ffff8ba91f96a000 60735043 S Bi:1:003:1 -115 512 <
ffff8ba91f96a000 60735065 C Bi:1:003:1 0 0
ffff8ba91f96a000 60785144 S Bo:1:003:1 -115 512 = d33d4c55 39d979a7 ded3f635 6753636d 1f8e6598 848c7544 7ec589f2 7c43f192
ffff8ba91f96a000 60785185 C Bo:1:003:1 0 512 >
ffff8ba91f96a000 60785194 S Bi:1:003:1 -115 512 <
ffff8ba91f96a000 60785386 C Bi:1:003:1 0 512 = 7ac84936 00000000 03000000 00000000 00000000 00000000 00000000 00000000
ffff8ba91f96a000 60785395 S Bi:1:003:1 -115 512 <
ffff8ba91f96a000 60785419 C Bi:1:003:1 0 0
ffff8ba91f96a000 60835497 S Bo:1:003:1 -115 512 = d97cecf9 2fb78ddf ea0ed695 886a3dc8 ba5f160d 11190bd0 04312f0b 12f0bf89
ffff8ba91f96a000 60835543 C Bo:1:003:1 0 512 >
ffff8ba91f96a000 60835551 S Bi:1:003:1 -115 512 <
ffff8ba91f96a000 60835779 C Bi:1:003:1 0 512 = 7ac87b36 00000000 03000000 00000000 00000000 00000000 00000000 00000000
ffff8ba91f96a000 60835789 S Bi:1:003:1 -115 512 <
ffff8ba91f96a000 60835812 C Bi:1:003:1 0 0
ffff8ba91f96a000 60885890 S Bo:1:003:1 -115 512 = 53d70f86 9247b52d 07ed5d93 fa438473 ecfcba51 1416d589 48ce9d75 fabdb0f2
ffff8ba91f96a000 60885936 C Bo:1:003:1 0 512 >
ffff8ba91f96a000 60885944 S Bi:1:003:1 -115 512 <
ffff8ba91f96a000 60886156 C Bi:1:003:1 0 512 = 7ac8ad36 00000000 03000000 00000000 00000000 00000000 00000000 00000000
ffff8ba91f96a000 60886165 S Bi:1:003:1 -115 512 <
ffff8ba91f96a000 60886177 C Bi:1:003:1 0 0
ffff8ba91f96a000 60936256 S Bo:1:003:1 -115 512 = 07b5c641 20af5eb0 db1a29fd f25f5361 028af4e0 f2a48e5f eb4510bd 547ce133
ffff8ba91f96a000 60936303 C Bo:1:003:1 0 512 >
ffff8ba91f96a000 60936312 S Bi:1:003:1 -115 512 <
ffff8ba91f96a000 60936543 C Bi:1:003:1 0 512 = 7ac8e036 00000000 03000000 00000000 00000000 00000000 00000000 00000000
ffff8ba91f96a000 60936551 S Bi:1:003:1 -115 512 <
ffff8ba91f96a000 60936574 C Bi:1:003:1 0 0
ffff8ba9538a2a80 60986664 S Bo:1:003:1 -115 512 = ee5530c4 339b3bf4 47b22057 03182946 07e21055 281c781b ce6a4235 1da046ff
ffff8ba9538a2a80 60986711 C Bo:1:003:1 0 512 >
ffff8ba9538a2a80 60986721 S Bi:1:003:1 -115 512 <
ffff8ba9538a2a80 60986932 C Bi:1:003:1 0 512 = 7ac81237 00000000 02000000 00000000 00000000 00000000 00000000 00000000
ffff8ba9538a2a80 60986942 S Bi:1:003:1 -115 512 <
ffff8ba9538a2a80 60986964 C Bi:1:003:1 0 0
ffff8ba9538a2a80 60987012 S Bo:1:003:1 -115 59032 = 64a4d48b 76e031fa 8357149a 8e26c6ee e21b1a03 3ad5edaa 59ba454b 96e10c5e
ffff8ba9538a2a80 60988936 C Bo:1:003:1 0 59032 >
ffff8ba9538a2a80 60988947 S Bi:1:003:1 -115 512 <
ffff8ba9538a2a80 60989330 C Bi:1:003:1 0 512 = 79c81337 00000000 03000000 00000000 00000000 00000000 00000000 00000000
ffff8ba9538a2a80 60989349 S Bi:1:003:1 -115 512 <
ffff8ba9538a2a80 60989361 C Bi:1:003:1 0 0
ffff8ba9538a2a80 60989394 S Bo:1:003:1 -115 55552 = 3031e56c acf72a84 dfbd19c8 57cc779e 8573d3d9 3f5d46df 3e00b096 2ea294d6
ffff8ba9538a2a80 60991173 C Bo:1:003:1 0 55552 >
ffff8ba9538a2a80 60991186 S Bi:1:003:1 -115 512 <
ffff8ba9538a2a80 60991546 C Bi:1:003:1 0 512 = 79c81537 00000000 04000000 00000000 00000000 00000000 00000000 00000000
ffff8ba9538a2a80 60991564 S Bi:1:003:1 -115 512 <
ffff8ba9538a2a80 60991576 C Bi:1:003:1 0 0
ffff8ba9538a2a80 60991602 S Bo:1:003:1 -115 512 = ddb2a2e0 2a3be0d4 8fe3374e 2408172c bbdaec28 ba9c2e54 64b57b29 cd2e7329
ffff8ba9538a2a80 60991649 C Bo:1:003:1 0 512 >
ffff8ba9538a2a80 60991655 S Bi:1:003:1 -115 512 <
ffff8ba9538a2a80 60991794 C Bi:1:003:1 0 512 = 7ac81737 00000000 04000000 00000000 00000000 00000000 00000000 00000000
ffff8ba9538a2a80 60991801 S Bi:1:003:1 -115 512 <
ffff8ba9538a2a80 60991831 C Bi:1:003:1 0 0
ffff8ba94077cf00 61041913 S Bo:1:003:1 -115 512 = 8adbfc0e f3bdbcc1 2685c120 e79bf5c1 d404b257 45d4e22f 47697d69 3fadba6d
ffff8ba94077cf00 61041959 C Bo:1:003:1 0 512 >
ffff8ba94077cf00 61041969 S Bi:1:003:1 -115 512 <
ffff8ba94077cf00 61042159 C Bi:1:003:1 0 512 = 7ac84937 00000000 04000000 00000000 00000000 00000000 00000000 00000000
ffff8ba94077cf00 61042168 S Bi:1:003:1 -115 512 <
ffff8ba94077cf00 61042180 C Bi:1:003:1 0 0
ffff8ba9566a6e40 61092261 S Bo:1:003:1 -115 512 = 7868d27f 524fc2dc 4b32ef89 64b4c36c 3b2a1b70 302ecbde c8cbe359 2a8d3677
ffff8ba9566a6e40 61092305 C Bo:1:003:1 0 512 >
ffff8ba9566a6e40 61092315 S Bi:1:003:1 -115 512 <
ffff8ba9566a6e40 61092490 C Bi:1:003:1 0 512 = 7ac87c37 00000000 04000000 00000000 00000000 00000000 00000000 00000000
ffff8ba9566a6e40 61092498 S Bi:1:003:1 -115 512 <
ffff8ba9566a6e40 61092521 C Bi:1:003:1 0 0
ffff8ba91dece000 61142598 S Bo:1:003:1 -115 512 = 39a55dfb bf4ff4ed d72c48a5 96e35889 5c1272c6 a9415ebf 9f80da4e f84a5871
ffff8ba91dece000 61142663 C Bo:1:003:1 0 512 >
ffff8ba91dece000 61142671 S Bi:1:003:1 -115 512 <
ffff8ba91dece000 61142957 C Bi:1:003:1 0 512 = 7ac8ae37 00000000 04000000 00000000 00000000 00000000 00000000 00000000
ffff8ba91dece000 61142966 S Bi:1:003:1 -115 512 <
ffff8ba91dece000 61142988 C Bi:1:003:1 0 0
ffff8ba91dece000 61193024 S Bo:1:003:1 -115 512 = 082c6a31 da6b467f dca0780a 460c9aec 79b7e0f0 2b59208e ff7782d4 71f78d0d
ffff8ba91dece000 61193059 C Bo:1:003:1 0 512 >
ffff8ba91dece000 61193066 S Bi:1:003:1 -115 512 <
ffff8ba91dece000 61193271 C Bi:1:003:1 0 512 = 7ac8e137 00000000 04000000 00000000 00000000 00000000 00000000 00000000
ffff8ba91dece000 61193276 S Bi:1:003:1 -115 512 <
ffff8ba91dece000 61193311 C Bi:1:003:1 0 0
ffff8ba91dece000 61243387 S Bo:1:003:1 -115 512 = 970e75b8 d27fbfd5 cafc1f3f 9c768377 4ee19929 319f6b1e 098d5a8e 55e9070f
ffff8ba91dece000 61243422 C Bo:1:003:1 0 512 >
ffff8ba91dece000 61243427 S Bi:1:003:1 -115 512 <
ffff8ba91dece000 61244553 C Bi:1:003:1 0 512 = 7ac81338 00000000 04000000 00000000 00000000 00000000 00000000 00000000
ffff8ba91dece000 61244558 S Bi:1:003:1 -115 512 <
ffff8ba91dece000 61244593 C Bi:1:003:1 0 0
ffff8ba91f96a000 61294672 S Bo:1:003:1 -115 512 = 4b5f927e b65cf8c9 16150959 652033be e823ede2 528f4aac 1bac5bcb 76b4a835
ffff8ba91f96a000 61294708 C Bo:1:003:1 0 512 >
ffff8ba91f96a000 61294715 S Bi:1:003:1 -115 512 <
ffff8ba91f96a000 61294903 C Bi:1:003:1 0 512 = 7ac84638 00000000 03000000 00000000 00000000 00000000 00000000 00000000
ffff8ba91f96a000 61294908 S Bi:1:003:1 -115 512 <
ffff8ba91f96a000 61294943 C Bi:1:003:1 0 0
ffff8ba9a6102900 61345019 S Bo:1:003:1 -115 512 = abd2656c ae2943bb 16a48267 30962200 2312d0df 2c5538e0 87ccb24e 3979fc89
ffff8ba9a6102900 61345058 C Bo:1:003:1 0 512 >
ffff8ba9a6102900 61345065 S Bi:1:003:1 -115 512 <
ffff8ba9a6102900 61345648 C Bi:1:003:1 0 512 = 7ac87938 00000000 03000000 00000000 00000000 00000000 00000000 00000000
ffff8ba9a6102900 61345654 S Bi:1:003:1 -115 512 <
ffff8ba9a6102900 61345688 C Bi:1:003:1 0 0
ffff8ba91dece000 61395779 S Bo:1:003:1 -115 512 = bb80dad6 67c6779a 55cc54e0 20a01d3c 41aadcaf e30d0def 5ca649ed 57206b34
ffff8ba91dece000 61395815 C Bo:1:003:1 0 512 >
ffff8ba91dece000 61395822 S Bi:1:003:1 -115 512 <
ffff8ba91dece000 61396005 C Bi:1:003:1 0 512 = 7ac8ab38 00000000 03000000 00000000 00000000 00000000 00000000 00000000
ffff8ba91dece000 61396011 S Bi:1:003:1 -115 512 <
ffff8ba91dece000 61396046 C Bi:1:003:1 0 0
ffff8ba91dece000 61446125 S Bo:1:003:1 -115 512 = 772c05c4 9d3eb722 0622c73f e2fc72ef 46d64960 a2f470b5 b923cc2c 91987d3b
ffff8ba91dece000 61446155 C Bo:1:003:1 0 512 >
ffff8ba91dece000 61446161 S Bi:1:003:1 -115 512 <
ffff8ba91dece000 61446352 C Bi:1:003:1 0 512 = 7ac8de38 00000000 03000000 00000000 00000000 00000000 00000000 00000000
ffff8ba91dece000 61446357 S Bi:1:003:1 -115 512 <
ffff8ba91dece000 61446392 C Bi:1:003:1 0 0
ffff8ba91dece000 61496470 S Bo:1:003:1 -115 512 = 78e30391 363f8fde 1709d277 e2ec91d2 03349ce4 0ed57acd 39c070b7 f6815f15
ffff8ba91dece000 61496505 C Bo:1:003:1 0 512 >
ffff8ba91dece000 61496510 S Bi:1:003:1 -115 512 <
ffff8ba91dece000 61496701 C Bi:1:003:1 0 512 = 7ac81039 00000000 03000000 00000000 00000000 00000000 00000000 00000000
ffff8ba91dece000 61496706 S Bi:1:003:1 -115 512 <
ffff8ba91dece000 61496741 C Bi:1:003:1 0 0
ffff8ba91dece000 61546818 S Bo:1:003:1 -115 512 = 6cb0eb6a e99ef2b2 32b89a04 4e102edc 3dee80b4 0750a1b7 5aa96646 af5ef7a6
ffff8ba91dece000 61546852 C Bo:1:003:1 0 512 >
ffff8ba91dece000 61546858 S Bi:1:003:1 -115 512 <
ffff8ba91dece000 61547053 C Bi:1:003:1 0 512 = 7ac84239 00000000 03000000 00000000 00000000 00000000 00000000 00000000
ffff8ba91dece000 61547062 S Bi:1:003:1 -115 512 <
ffff8ba91dece000 61547092 C Bi:1:003:1 0 0
ffff8ba91dece000 61597172 S Bo:1:003:1 -115 512 = 5462e86b f80367e1 f7d3a450 c118da9b 95c58705 27dd2f22 5aac8514 4504f3f1
ffff8ba91dece000 61597206 C Bo:1:003:1 0 512 >
ffff8ba91dece000 61597211 S Bi:1:003:1 -115 512 <
ffff8ba91dece000 61597402 C Bi:1:003:1 0 512 = 7ac87539 00000000 02000000 00000000 00000000 00000000 00000000 00000000
ffff8ba91dece000 61597407 S Bi:1:003:1 -115 512 <
ffff8ba91dece000 61597442 C Bi:1:003:1 0 0
ffff8ba91dece000 61597481 S Bo:1:003:1 -115 58906 = 3ba10d2e 1255ecec dee4aea8 4cb21712 c3fa972f bdf2ccdb 6b137e12 995129d3
ffff8ba91dece000 61598986 C Bo:1:003:1 0 58906 >
ffff8ba91dece000 61598995 S Bi:1:003:1 -115 512 <
ffff8ba91dece000 61599530 C Bi:1:003:1 0 512 = 79c87639 00000000 03000000 00000000 00000000 00000000 00000000 00000000
ffff8ba91dece000 61599545 S Bi:1:003:1 -115 512 <
ffff8ba91dece000 61599570 C Bi:1:003:1 0 0
ffff8ba91dece000 61599601 S Bo:1:003:1 -115 61107 = 24f8dc7f 3409d92a 14adafe9 af9dc1c1 23682409 8b153519 d7237cbf cb8a0d10
ffff8ba91dece000 61601090 C Bo:1:003:1 0 61107 >
ffff8ba91dece000 61601096 S Bi:1:003:1 -115 512 <
ffff8ba91dece000 61601508 C Bi:1:003:1 0 512 = 79c87739 00000000 04000000 00000000 00000000 00000000 00000000 00000000
ffff8ba91dece000 61601518 S Bi:1:003:1 -115 512 <
ffff8ba91dece000 61601547 C Bi:1:003:1 0 0
ffff8ba91dece000 61601572 S Bo:1:003:1 -115 512 = b5078dfb a703b60a c83129bb fda39277 29a58d1d 66ca03c8 29b6c273 a10311a2
ffff8ba91dece000 61601608 C Bo:1:003:1 0 512 >
ffff8ba91dece000 61601613 S Bi:1:003:1 -115 512 <
ffff8ba91dece000 61601757 C Bi:1:003:1 0 512 = 7ac87939 00000000 04000000 00000000 00000000 00000000 00000000 00000000
ffff8ba91dece000 61601762 S Bi:1:003:1 -115 512 <
ffff8ba91dece000 61601796 C Bi:1:003:1 0 0
ffff8ba9250dc000 61651885 S Bo:1:003:1 -115 512 = e17a01d9 e90e5554 697231dc 9a17d422 02a0c32c 357cfa1d 629fbe6e 01a5d829
ffff8ba9250dc000 61651919 C Bo:1:003:1 0 512 >
ffff8ba9250dc000 61651924 S Bi:1:003:1 -115 512 <
ffff8ba9250dc000 61652121 C Bi:1:003:1 0 512 = 7ac8ab39 00000000 04000000 00000000 00000000 00000000 00000000 00000000
ffff8ba9250dc000 61652125 S Bi:1:003:1 -115 512 <
ffff8ba9250dc000 61652161 C Bi:1:003:1 0 0
ffff8ba91dece000 61702248 S Bo:1:003:1 -115 512 = 88db49f1 af71383d b5695d51 8e114b91 d20f2e88 d231931c 239e3c7c 46c46d7a
ffff8ba91dece000 61702290 C Bo:1:003:1 0 512 >
ffff8ba91dece000 61702297 S Bi:1:003:1 -115 512 <
ffff8ba91dece000 61702498 C Bi:1:003:1 0 512 = 7ac8de39 00000000 04000000 00000000 00000000 00000000 00000000 00000000
ffff8ba91dece000 61702507 S Bi:1:003:1 -115 512 <
ffff8ba91dece000 61702530 C Bi:1:003:1 0 0
ffff8ba91dece000 61752608 S Bo:1:003:1 -115 512 = 52b97145 84912810 027d3d95 c129733c 6b0d3dda 3fe011c0 d90f3758 aafee9dc
ffff8ba91dece000 61752666 C Bo:1:003:1 0 512 >
ffff8ba91dece000 61752675 S Bi:1:003:1 -115 512 <
ffff8ba91dece000 61752873 C Bi:1:003:1 0 512 = 7ac8103a 00000000 04000000 00000000 00000000 00000000 00000000 00000000
ffff8ba91dece000 61752882 S Bi:1:003:1 -115 512 <
ffff8ba91dece000 61752895 C Bi:1:003:1 0 0
ffff8ba91dece000 61802973 S Bo:1:003:1 -115 512 = 92ac0ad2 29701a1d 0867ead3 67d34358 4d58d6ff bfc104b0 99684917 56ef73d5
ffff8ba91dece000 61803019 C Bo:1:003:1 0 512 >
ffff8ba91dece000 61803027 S Bi:1:003:1 -115 512 <
ffff8ba91dece000 61803252 C Bi:1:003:1 0 512 = 7ac8423a 00000000 04000000 00000000 00000000 00000000 00000000 00000000
ffff8ba91dece000 61803261 S Bi:1:003:1 -115 512 <
ffff8ba91dece000 61803284 C Bi:1:003:1 0 0
ffff8ba91dece000 61853362 S Bo:1:003:1 -115 512 = 386df80c 8c38fcf5 ba1265ae fc7cb9c0 46caca65 9997f02d bf7b682b 96920fee
ffff8ba91dece000 61853418 C Bo:1:003:1 0 512 >
ffff8ba91dece000 61853426 S Bi:1:003:1 -115 512 <
ffff8ba91dece000 61853622 C Bi:1:003:1 0 512 = 7ac8753a 00000000 04000000 00000000 00000000 00000000 00000000 00000000
ffff8ba91dece000 61853631 S Bi:1:003:1 -115 512 <
ffff8ba91dece000 61853644 C Bi:1:003:1 0 0
ffff8ba91dece000 61903724 S Bo:1:003:1 -115 512 = f70f8318 95cc8b43 c9f1f612 9afc2d46 b2baec22 08b3d112 e23c0e20 be6a6030
ffff8ba91dece000 61903760 C Bo:1:003:1 0 512 >
ffff8ba91dece000 61903767 S Bi:1:003:1 -115 512 <
ffff8ba91dece000 61903992 C Bi:1:003:1 0 512 = 7ac8a73a 00000000 03000000 00000000 00000000 00000000 00000000 00000000
ffff8ba91dece000 61903997 S Bi:1:003:1 -115 512 <
ffff8ba91dece000 61904032 C Bi:1:003:1 0 0
ffff8ba94077cf00 61954119 S Bo:1:003:1 -115 512 = d593e7b6 d4b08556 029d1bed 6483e062 f64d98d8 77f0797a 748bc5e1 a0420b88
ffff8ba94077cf00 61954160 C Bo:1:003:1 0 512 >
ffff8ba94077cf00 61954168 S Bi:1:003:1 -115 512 <
ffff8ba94077cf00 61954360 C Bi:1:003:1 0 512 = 7ac8da3a 00000000 03000000 00000000 00000000 00000000 00000000 00000000
ffff8ba94077cf00 61954366 S Bi:1:003:1 -115 512 <
ffff8ba94077cf00 61954400 C Bi:1:003:1 0 0
ffff8ba94077cf00 62004477 S Bo:1:003:1 -115 512 = 6372f16d 3c52718c 6b80404f 9db9d9b4 8cfaead2 dcf6dcc6 c7a14d59 7955e7e9
ffff8ba94077cf00 62004511 C Bo:1:003:1 0 512 >
ffff8ba94077cf00 62004517 S Bi:1:003:1 -115 512 <
ffff8ba94077cf00 62004768 C Bi:1:003:1 0 512 = 7ac80c3b 00000000 03000000 00000000 00000000 00000000 00000000 00000000
ffff8ba94077cf00 62004774 S Bi:1:003:1 -115 512 <
ffff8ba94077cf00 62004808 C Bi:1:003:1 0 0
ffff8ba94077cf00 62054882 S Bo:1:003:1 -115 512 = f347c1bd 1f09e0ee 700c1e63 2e6766a2 b7f47d56 295e42d4 e377afa5 c30c8467
ffff8ba94077cf00 62054916 C Bo:1:003:1 0 512 >
ffff8ba94077cf00 62054922 S Bi:1:003:1 -115 512 <
ffff8ba94077cf00 62055107 C Bi:1:003:1 0 512 = 7ac83e3b 00000000 03000000 00000000 00000000 00000000 00000000 00000000
ffff8ba94077cf00 62055113 S Bi:1:003:1 -115 512 <
ffff8ba94077cf00 62055147 C Bi:1:003:1 0 0
ffff8ba94077cf00 62105224 S Bo:1:003:1 -115 512 = 035f53b4 1c855c62 711a2faa 4d1d926a ea0c340b 1fd5fa28 e040db64 bbf443fa
ffff8ba94077cf00 62105259 C Bo:1:003:1 0 512 >
ffff8ba94077cf00 62105269 S Bi:1:003:1 -115 512 <
ffff8ba94077cf00 62105445 C Bi:1:003:1 0 512 = 7ac8713b 00000000 03000000 00000000 00000000 00000000 00000000 00000000
ffff8ba94077cf00 62105450 S Bi:1:003:1 -115 512 <
ffff8ba94077cf00 62105485 C Bi:1:003:1 0 0
ffff8ba94077c6c0 62155545 S Bo:1:003:1 -115 512 = abb398e6 0e9d78a3 15ab6774 27f85bda 81cde440 ca1b93b4 65908888 524ca391
ffff8ba94077c6c0 62155572 C Bo:1:003:1 0 512 >
ffff8ba94987f080 62155585 S Bi:1:003:1 -115 512 <
ffff8ba94987f080 62155761 C Bi:1:003:1 0 512 = 7ac8a33b 00000000 02000000 00000000 00000000 00000000 00000000 00000000
ffff8ba94987fe00 62155770 S Bi:1:003:1 -115 512 <
ffff8ba94987fe00 62155803 C Bi:1:003:1 0 0
ffff8ba902f155c0 62155850 S Bo:1:003:1 -115 57284 = 99495bdf 1429ab50 c2aa3012 f8197874 3ec36dfb 87b121d5 79d28395 2e255d8b
ffff8ba902f155c0 62157210 C Bo:1:003:1 0 57284 >
ffff8ba949881080 62157220 S Bi:1:003:1 -115 512 <
ffff8ba949881080 62157635 C Bi:1:003:1 0 512 = 79c8a43b 00000000 03000000 00000000 00000000 00000000 00000000 00000000
ffff8ba902af9380 62157651 S Bi:1:003:1 -115 512 <
ffff8ba902af9380 62157673 C Bi:1:003:1 0 0
ffff8ba94077cf00 62157720 S Bo:1:003:1 -115 56246 = 4d737dfd 256eff99 5516a2c0 e0735ea9 601ef64b 1433fce0 7c4984ff d428349a
ffff8ba94077cf00 62159056 C Bo:1:003:1 0 56246 >
ffff8ba91f96a000 62159067 S Bi:1:003:1 -115 512 <
ffff8ba91f96a000 62159487 C Bi:1:003:1 0 512 = 79c8a53b 00000000 04000000 00000000 00000000 00000000 00000000 00000000
ffff8ba9250dce40 62159506 S Bi:1:003:1 -115 512 <
ffff8ba9250dce40 62159525 C Bi:1:003:1 0 0
ffff8ba902a426c0 62159554 S Bo:1:003:1 -115 512 = 3d639322 e3cdee9f a8f420d7 a4507ebd f327fa82 51dbe1ff 0ef2b0ad 3f5d0f44
ffff8ba902a426c0 62159581 C Bo:1:003:1 0 512 >
ffff8ba902a42900 62159590 S Bi:1:003:1 -115 512 <
ffff8ba902a42900 62159732 C Bi:1:003:1 0 512 = 7ac8a73b 00000000 04000000 00000000 00000000 00000000 00000000 00000000
ffff8ba914b9a300 62159741 S Bi:1:003:1 -115 512 <
ffff8ba914b9a300 62159771 C Bi:1:003:1 0 0
ffff8ba91dece000 62209862 S Bo:1:003:1 -115 512 = 9e1e66e6 b8b80f80 f479dfd2 38f957aa d09645ec 41e3a700 e58da444 f3a0085b
ffff8ba91dece000 62209903 C Bo:1:003:1 0 512 >
ffff8ba91dece000 62209911 S Bi:1:003:1 -115 512 <
ffff8ba91dece000 62210099 C Bi:1:003:1 0 512 = 7ac8d93b 00000000 04000000 00000000 00000000 00000000 00000000 00000000
ffff8ba91dece000 62210109 S Bi:1:003:1 -115 512 <
ffff8ba91dece000 62210132 C Bi:1:003:1 0 0
ffff8ba91dece000 62260209 S Bo:1:003:1 -115 512 = d7f7a0a1 8b59f003 c2874a45 17297386 9bcf02b7 2db80cf3 75aec468 7d5188f6
ffff8ba91dece000 62260255 C Bo:1:003:1 0 512 >
ffff8ba91dece000 62260264 S Bi:1:003:1 -115 512 <
ffff8ba91dece000 62260471 C Bi:1:003:1 0 512 = 7ac80c3c 00000000 04000000 00000000 00000000 00000000 00000000 00000000
ffff8ba91dece000 62260480 S Bi:1:003:1 -115 512 <
ffff8ba91dece000 62260503 C Bi:1:003:1 0 0
ffff8ba91dece000 62310582 S Bo:1:003:1 -115 512 = 2a6de7a8 08717d96 2ae64af8 f046c27f fefa7277 94f8f6e4 c0958123 7df53f16
ffff8ba91dece000 62310628 C Bo:1:003:1 0 512 >
ffff8ba91dece000 62310637 S Bi:1:003:1 -115 512 <
ffff8ba91dece000 62310824 C Bi:1:003:1 0 512 = 7ac83e3c 00000000 04000000 00000000 00000000 00000000 00000000 00000000
ffff8ba91dece000 62310833 S Bi:1:003:1 -115 512 <
ffff8ba91dece000 62310856 C Bi:1:003:1 0 0
ffff8ba91dece000 62360934 S Bo:1:003:1 -115 512 = 9a0f727a ba5b8cc5 eedb88f4 f1b69b37 8bfb9be3 5378b82e d9a9d959 f204f23f
ffff8ba91dece000 62360980 C Bo:1:003:1 0 512 >
ffff8ba91dece000 62360989 S Bi:1:003:1 -115 512 <
ffff8ba91dece000 62361191 C Bi:1:003:1 0 512 = 7ac8703c 00000000 04000000 00000000 00000000 00000000 00000000 00000000
ffff8ba91dece000 62361200 S Bi:1:003:1 -115 512 <
ffff8ba91dece000 62361223 C Bi:1:003:1 0 0
ffff8ba91dece000 62411301 S Bo:1:003:1 -115 512 = 95967173 3d02c162 3dea8ace 9b1b40d3 4b3729fc 785656a4 da66545b 98c1a41e
ffff8ba91dece000 62411343 C Bo:1:003:1 0 512 >
ffff8ba91dece000 62411352 S Bi:1:003:1 -115 512 <
ffff8ba91dece000 62411536 C Bi:1:003:1 0 512 = 7ac8a33c 00000000 04000000 00000000 00000000 00000000 00000000 00000000
ffff8ba91dece000 62411545 S Bi:1:003:1 -115 512 <
ffff8ba91dece000 62411568 C Bi:1:003:1 0 0
ffff8ba91dece000 62461646 S Bo:1:003:1 -115 512 = 0f013112 54f25ec4 89f8bccd 6cb425bf 1dae156c 1f605151 28882160 bac1e703
ffff8ba91dece000 62461692 C Bo:1:003:1 0 512 >
ffff8ba91dece000 62461701 S Bi:1:003:1 -115 512 <
ffff8ba91dece000 62461885 C Bi:1:003:1 0 512 = 7ac8d53c 00000000 03000000 00000000 00000000 00000000 00000000 00000000
ffff8ba91dece000 62461894 S Bi:1:003:1 -115 512 <
ffff8ba91dece000 62461917 C Bi:1:003:1 0 0
ffff8ba91dece000 62511995 S Bo:1:003:1 -115 512 = e92d7951 b95ef104 3f1aad72 bc4d4a61 787e37c1 93827704 ea394681 a1527168
ffff8ba91dece000 62512053 C Bo:1:003:1 0 512 >
ffff8ba91dece000 62512069 S Bi:1:003:1 -115 512 <
ffff8ba91dece000 62512257 C Bi:1:003:1 0 512 = 7ac8083d 00000000 03000000 00000000 00000000 00000000 00000000 00000000
ffff8ba91dece000 62512267 S Bi:1:003:1 -115 512 <
ffff8ba91dece000 62512280 C Bi:1:003:1 0 0
ffff8ba91dece000 62562359 S Bo:1:003:1 -115 512 = 1053747f dff15bb7 1716f68b 51c97358 fea49b29 a2138e14 bb1a461f da76ec28
ffff8ba91dece000 62562402 C Bo:1:003:1 0 512 >
ffff8ba91dece000 62562410 S Bi:1:003:1 -115 512 <
ffff8ba91dece000 62562614 C Bi:1:003:1 0 512 = 7ac83a3d 00000000 03000000 00000000 00000000 00000000 00000000 00000000
ffff8ba91dece000 62562623 S Bi:1:003:1 -115 512 <
ffff8ba91dece000 62562635 C Bi:1:003:1 0 0
ffff8ba91dece000 62612713 S Bo:1:003:1 -115 512 = 2f7f7f43 eebb9ca9 0ab12e79 e86bb86a 7dc92032 865b0a5e 85676c12 c6fc59d0
ffff8ba91dece000 62612759 C Bo:1:003:1 0 512 >
ffff8ba91dece000 62612768 S Bi:1:003:1 -115 512 <
ffff8ba91dece000 62613104 C Bi:1:003:1 0 512 = 7ac86c3d 00000000 03000000 00000000 00000000 00000000 00000000 00000000
ffff8ba91dece000 62613112 S Bi:1:003:1 -115 512 <
ffff8ba91dece000 62613135 C Bi:1:003:1 0 0
ffff8ba91dece000 62663213 S Bo:1:003:1 -115 512 = 33f789c8 af0461f7 213168d8 81b47ba7 60574474 3e3fcade 56fa7afd b62b2134
ffff8ba91dece000 62663253 C Bo:1:003:1 0 512 >
ffff8ba94077c3c0 62663268 S Bi:1:003:1 -115 512 <
ffff8ba94077c3c0 62663456 C Bi:1:003:1 0 512 = 7ac89f3d 00000000 02000000 00000000 00000000 00000000 00000000 00000000
ffff8ba91dece000 62663470 S Bi:1:003:1 -115 512 <
ffff8ba91dece000 62663484 C Bi:1:003:1 0 0
ffff8ba94077c3c0 62663530 S Bo:1:003:1 -115 59030 = 83e2a001 f4cd8ea2 c506816c 0419472e 71be45c5 4857cabd e41c7aad 8b9a6b68
ffff8ba94077c3c0 62664987 C Bo:1:003:1 0 59030 >
ffff8ba9a6102900 62665002 S Bi:1:003:1 -115 512 <
ffff8ba9a6102900 62665635 C Bi:1:003:1 0 512 = 79c8a03d 00000000 03000000 00000000 00000000 00000000 00000000 00000000
ffff8ba94987e780 62665658 S Bi:1:003:1 -115 512 <
ffff8ba94987e780 62665669 C Bi:1:003:1 0 0
ffff8ba93ef36180 62665712 S Bo:1:003:1 -115 59761 = a5dea2ef d8cb3ff0 b11c7531 df7a3cd8 b49bb467 f04cb73b fa242de5 5d12f780
ffff8ba93ef36180 62667077 C Bo:1:003:1 0 59761 >
ffff8ba94077d200 62667283 S Bi:1:003:1 -115 512 <
ffff8ba94077d200 62668138 C Bi:1:003:1 0 512 = 79c8a13d 00000000 04000000 00000000 00000000 00000000 00000000 00000000
ffff8ba94077d200 62668157 S Bi:1:003:1 -115 512 <
ffff8ba94077d200 62668181 C Bi:1:003:1 0 0
ffff8ba9250dd200 62668213 S Bo:1:003:1 -115 512 = f897adb4 3157229a 18fe49a4 c18703e8 e88dfbe4 4208e7d2 8f52e273 703a8795
ffff8ba9250dd200 62668242 C Bo:1:003:1 0 512 >
ffff8ba9250dd440 62668251 S Bi:1:003:1 -115 512 <
ffff8ba9250dd440 62668394 C Bi:1:003:1 0 512 = 7ac8a43d 00000000 04000000 00000000 00000000 00000000 00000000 00000000
ffff8ba9250dd440 62668401 S Bi:1:003:1 -115 512 <
ffff8ba9250dd440 62668436 C Bi:1:003:1 0 0
ffff8ba9250dc900 62718517 S Bo:1:003:1 -115 512 = ef9a45b9 b7527121 1c490c72 b2d1fbad 78bc7935 55c0a712 75e368db 745720cd
ffff8ba9250dc900 62718563 C Bo:1:003:1 0 512 >
ffff8ba9250dc900 62718571 S Bi:1:003:1 -115 512 <
ffff8ba9250dc900 62718769 C Bi:1:003:1 0 512 = 7ac8d63d 00000000 04000000 00000000 00000000 00000000 00000000 00000000
ffff8ba9250dc900 62718777 S Bi:1:003:1 -115 512 <
ffff8ba9250dc900 62718800 C Bi:1:003:1 0 0
ffff8ba9250dc900 62768877 S Bo:1:003:1 -115 512 = a533e501 795193f9 8c9e355e 9d4f6144 c07e4077 c00cd5ee 144fa7ab 8b126f06
ffff8ba9250dc900 62768938 C Bo:1:003:1 0 512 >
ffff8ba9250dc900 62768947 S Bi:1:003:1 -115 512 <
ffff8ba9250dc900 62769167 C Bi:1:003:1 0 512 = 7ac8083e 00000000 04000000 00000000 00000000 00000000 00000000 00000000
ffff8ba9250dc900 62769177 S Bi:1:003:1 -115 512 <
ffff8ba9250dc900 62769200 C Bi:1:003:1 0 0
ffff8ba9250dc900 62819282 S Bo:1:003:1 -115 512 = 6492e62a 6f7b984b 401a2007 b516b488 58c06e29 d58c4303 9f7f2060 4ae4ef51
ffff8ba9250dc900 62819329 C Bo:1:003:1 0 512 >
ffff8ba9250dc900 62819339 S Bi:1:003:1 -115 512 <
ffff8ba9250dc900 62819527 C Bi:1:003:1 0 512 = 7ac83b3e 00000000 04000000 00000000 00000000 00000000 00000000 00000000
ffff8ba9250dc900 62819535 S Bi:1:003:1 -115 512 <
ffff8ba9250dc900 62819548 C Bi:1:003:1 0 0
ffff8ba9250dc900 62869626 S Bo:1:003:1 -115 512 = 8dc178d4 9cea9d9c 32bdaaf9 37eee36e 5f0dece1 3d85378e e192cf16 3ef75aeb
ffff8ba9250dc900 62869684 C Bo:1:003:1 0 512 >
ffff8ba9250dc900 62869692 S Bi:1:003:1 -115 512 <
ffff8ba9250dc900 62869916 C Bi:1:003:1 0 512 = 7ac86d3e 00000000 04000000 00000000 00000000 00000000 00000000 00000000
ffff8ba9250dc900 62869932 S Bi:1:003:1 -115 512 <
ffff8ba9250dc900 62869944 C Bi:1:003:1 0 0
ffff8ba9250dc900 62920062 S Bo:1:003:1 -115 512 = 7710f969 cf55679d b874dedf f7cb62fb c01c8345 38d6d792 311de52e 95e7f827
ffff8ba9250dc900 62920111 C Bo:1:003:1 0 512 >
ffff8ba9250dc900 62920125 S Bi:1:003:1 -115 512 <
ffff8ba9250dc900 62920315 C Bi:1:003:1 0 512 = 7ac8a03e 00000000 04000000 00000000 00000000 00000000 00000000 00000000
ffff8ba9250dc900 62920342 S Bi:1:003:1 -115 512 <
ffff8ba9250dc900 62920372 C Bi:1:003:1 0 0
ffff8ba9250dc900 62970455 S Bo:1:003:1 -115 512 = 6a08108b ef23a57d 3c008ffc 5cc2370d c686c92c 8162a270 e0bcfdf6 3fecda99
ffff8ba9250dc900 62970501 C Bo:1:003:1 0 512 >
ffff8ba9250dc900 62970510 S Bi:1:003:1 -115 512 <
ffff8ba9250dc900 62970728 C Bi:1:003:1 0 512 = 7ac8d23e 00000000 03000000 00000000 00000000 00000000 00000000 00000000
ffff8ba9250dc900 62970736 S Bi:1:003:1 -115 512 <
ffff8ba9250dc900 62970759 C Bi:1:003:1 0 0
ffff8ba9250dc900 63020838 S Bo:1:003:1 -115 512 = 7d1a7f3d 3bbc5134 331a590e fe612a6b ccb90e0f 10519d2c cecc3b39 73f11b75
ffff8ba9250dc900 63020884 C Bo:1:003:1 0 512 >
ffff8ba9250dc900 63020893 S Bi:1:003:1 -115 512 <
ffff8ba9250dc900 63021121 C Bi:1:003:1 0 512 = 7ac8043f 00000000 03000000 00000000 00000000 00000000 00000000 00000000
ffff8ba9250dc900 63021130 S Bi:1:003:1 -115 512 <
ffff8ba9250dc900 63021154 C Bi:1:003:1 0 0
ffff8ba9250dc900 63071234 S Bo:1:003:1 -115 512 = 2efd13f2 aaec8e26 d7f5f491 fb9e5ddb f3e56089 d713bc1d f65bb678 e0397779
ffff8ba9250dc900 63071278 C Bo:1:003:1 0 512 >
ffff8ba9250dc900 63071286 S Bi:1:003:1 -115 512 <
ffff8ba9250dc900 63071485 C Bi:1:003:1 0 512 = 7ac8373f 00000000 03000000 00000000 00000000 00000000 00000000 00000000
ffff8ba9250dc900 63071494 S Bi:1:003:1 -115 512 <
ffff8ba9250dc900 63071517 C Bi:1:003:1 0 0
ffff8ba9a6102900 63121601 S Bo:1:003:1 -115 512 = 78639cb6 18296a89 9737c928 57b5810c c4941ec5 777cc79a 3c17bc16 6ec998c1
ffff8ba9a6102900 63121646 C Bo:1:003:1 0 512 >
ffff8ba9a6102900 63121656 S Bi:1:003:1 -115 512 <
ffff8ba9a6102900 63121856 C Bi:1:003:1 0 512 = 7ac8693f 00000000 03000000 00000000 00000000 00000000 00000000 00000000
ffff8ba9a6102900 63121865 S Bi:1:003:1 -115 512 <
ffff8ba9a6102900 63121885 C Bi:1:003:1 0 0
ffff8ba9a6102900 63171963 S Bo:1:003:1 -115 512 = df2054a1 6eab9e29 40dcf9e1 3f41e89e 554a3b48 0aeb8887 b6322e9f edf42a52
ffff8ba9a6102900 63172009 C Bo:1:003:1 0 512 >
ffff8ba9a6102900 63172018 S Bi:1:003:1 -115 512 <
ffff8ba9a6102900 63172195 C Bi:1:003:1 0 512 = 7ac89b3f 00000000 03000000 00000000 00000000 00000000 00000000 00000000
ffff8ba9a6102900 63172204 S Bi:1:003:1 -115 512 <
ffff8ba9a6102900 63172227 C Bi:1:003:1 0 0
ffff8ba949880c00 63222291 S Bo:1:003:1 -115 512 = 544fdf01 7a31ada6 207d2acf a97c8379 af75e70d ab34d76e 29a98ef9 dc141e81
ffff8ba949880c00 63222324 C Bo:1:003:1 0 512 >
ffff8ba949880c00 63222332 S Bi:1:003:1 -115 512 <
ffff8ba949880c00 63222523 C Bi:1:003:1 0 512 = 7ac8ce3f 00000000 03000000 00000000 00000000 00000000 00000000 00000000
ffff8ba949880c00 63222529 S Bi:1:003:1 -115 512 <
ffff8ba949880c00 63222563 C Bi:1:003:1 0 0
ffff8ba9250dc900 63272597 S Bo:1:003:1 -115 512 = 2deb097d 7a86b079 c9c28e3e 778ac3c3 3fdf7a50 44426e13 aaf9f7de ebbc797a
ffff8ba9250dc900 63272632 C Bo:1:003:1 0 512 >
ffff8ba9250dc900 63272639 S Bi:1:003:1 -115 512 <
ffff8ba9250dc900 63272835 C Bi:1:003:1 0 512 = 7ac80040 00000000 02000000 00000000 00000000 00000000 00000000 00000000
ffff8ba9250dc900 63272841 S Bi:1:003:1 -115 512 <
ffff8ba9250dc900 63272875 C Bi:1:003:1 0 0
ffff8ba9250dc900 63272918 S Bo:1:003:1 -115 57392 = 97185ae0 b11b2cc3 5a08628e 46868935 360fb693 936247d4 7de7ce68 69de76a4
ffff8ba9250dc900 63274357 C Bo:1:003:1 0 57392 >
ffff8ba9250dc900 63274364 S Bi:1:003:1 -115 512 <
ffff8ba9250dc900 63275304 C Bi:1:003:1 0 512 = 79c80140 00000000 03000000 00000000 00000000 00000000 00000000 00000000
ffff8ba9250dc900 63275320 S Bi:1:003:1 -115 512 <
ffff8ba9250dc900 63275345 C Bi:1:003:1 0 0
ffff8ba9250dc900 63275400 S Bo:1:003:1 -115 61275 = b40903ad e7dca8f5 45da90a3 f34e5131 bd0610d2 da9b9e17 08e03407 448855ad
ffff8ba9250dc900 63276964 C Bo:1:003:1 0 61275 >
ffff8ba9250dc900 63276971 S Bi:1:003:1 -115 512 <
ffff8ba9250dc900 63277804 C Bi:1:003:1 0 512 = 79c80340 00000000 04000000 00000000 00000000 00000000 00000000 00000000
ffff8ba9250dc900 63277822 S Bi:1:003:1 -115 512 <
ffff8ba9250dc900 63277845 C Bi:1:003:1 0 0
ffff8ba9250dc900 63277869 S Bo:1:003:1 -115 512 = 514905f1 1d1ed24b ef5aac96 4802be1a 1c408f3b 85eca4fa 1999734d f005a713
ffff8ba9250dc900 63277905 C Bo:1:003:1 0 512 >
ffff8ba9250dc900 63277911 S Bi:1:003:1 -115 512 <
ffff8ba9250dc900 63278069 C Bi:1:003:1 0 512 = 7ac80540 00000000 04000000 00000000 00000000 00000000 00000000 00000000
ffff8ba9250dc900 63278074 S Bi:1:003:1 -115 512 <
ffff8ba9250dc900 63278105 C Bi:1:003:1 0 0
ffff8ba9250dc900 63328185 S Bo:1:003:1 -115 512 = 720e5bdf f7c241cf 42b150b5 d102985c 66e88065 2d7138cd 7d14a642 678e38cd
ffff8ba9250dc900 63328235 C Bo:1:003:1 0 512 >
ffff8ba9250dc900 63328246 S Bi:1:003:1 -115 512 <
ffff8ba9250dc900 63328442 C Bi:1:003:1 0 512 = 7ac83840 00000000 04000000 00000000 00000000 00000000 00000000 00000000
ffff8ba9250dc900 63328451 S Bi:1:003:1 -115 512 <
ffff8ba9250dc900 63328474 C Bi:1:003:1 0 0
ffff8ba9a6102900 63378566 S Bo:1:003:1 -115 512 = 45113f41 e0567cf4 ba9ec8e6 5e49472e 38eae8e6 aa0baee4 59797e7f 07d3a0c8
ffff8ba9a6102900 63378613 C Bo:1:003:1 0 512 >
ffff8ba9a6102900 63378624 S Bi:1:003:1 -115 512 <
ffff8ba9a6102900 63378819 C Bi:1:003:1 0 512 = 7ac86a40 00000000 04000000 00000000 00000000 00000000 00000000 00000000
ffff8ba9a6102900 63378830 S Bi:1:003:1 -115 512 <
ffff8ba9a6102900 63378853 C Bi:1:003:1 0 0
ffff8ba93ef36180 63428934 S Bo:1:003:1 -115 512 = 05b83dbe 02934a84 887dfba4 ec0d59e5 7132b7a7 66a76597 9d30d33a ad9f5647
ffff8ba93ef36180 63428981 C Bo:1:003:1 0 512 >
ffff8ba93ef36180 63428992 S Bi:1:003:1 -115 512 <
ffff8ba93ef36180 63429194 C Bi:1:003:1 0 512 = 7ac89c40 00000000 04000000 00000000 00000000 00000000 00000000 00000000
ffff8ba93ef36180 63429203 S Bi:1:003:1 -115 512 <
ffff8ba93ef36180 63429226 C Bi:1:003:1 0 0
ffff8ba93ef36180 63479305 S Bo:1:003:1 -115 512 = dc3da129 c43b063d 54b91925 1960f11b 90963dac d3ea04ea 102d4c58 52a8cd07
ffff8ba93ef36180 63479351 C Bo:1:003:1 0 512 >
ffff8ba93ef36180 63479359 S Bi:1:003:1 -115 512 <
ffff8ba93ef36180 63479571 C Bi:1:003:1 0 512 = 7ac8cf40 00000000 04000000 00000000 00000000 00000000 00000000 00000000
ffff8ba93ef36180 63479580 S Bi:1:003:1 -115 512 <
ffff8ba93ef36180 63479603 C Bi:1:003:1 0 0
ffff8ba93ef36180 63529685 S Bo:1:003:1 -115 512 = 2c6b5e8a 886a1434 7a716c06 e20c88e5 7512df9c 3eb88c57 05b0a1f3 c590255f
ffff8ba93ef36180 63529732 C Bo:1:003:1 0 512 >
ffff8ba93ef36180 63529742 S Bi:1:003:1 -115 512 <
ffff8ba93ef36180 63529946 C Bi:1:003:1 0 512 = 7ac80141 00000000 04000000 00000000 00000000 00000000 00000000 00000000
ffff8ba93ef36180 63529956 S Bi:1:003:1 -115 512 <
ffff8ba93ef36180 63529978 C Bi:1:003:1 0 0
ffff8ba93ef36180 63580056 S Bo:1:003:1 -115 512 = b484e182 15c87ac8 ffc7e5b0 782670d9 c85c12ea 46ed048b 2e3a12ab 3a1df4bc
ffff8ba93ef36180 63580105 C Bo:1:003:1 0 512 >
ffff8ba93ef36180 63580113 S Bi:1:003:1 -115 512 <
ffff8ba93ef36180 63580348 C Bi:1:003:1 0 512 = 7ac83441 00000000 03000000 00000000 00000000 00000000 00000000 00000000
ffff8ba93ef36180 63580357 S Bi:1:003:1 -115 512 <
ffff8ba93ef36180 63580370 C Bi:1:003:1 0 0
ffff8ba93ef36180 63630449 S Bo:1:003:1 -115 512 = fbd3c95d 3361e303 7c057098 d1dfc6b8 33b4f373 9405033c f5af0d43 86862e69
ffff8ba93ef36180 63630495 C Bo:1:003:1 0 512 >
ffff8ba93ef36180 63630504 S Bi:1:003:1 -115 512 <
ffff8ba93ef36180 63630696 C Bi:1:003:1 0 512 = 7ac86641 00000000 03000000 00000000 00000000 00000000 00000000 00000000
ffff8ba93ef36180 63630705 S Bi:1:003:1 -115 512 <
ffff8ba93ef36180 63630727 C Bi:1:003:1 0 0
ffff8ba93ef36180 63680806 S Bo:1:003:1 -115 512 = 80d4887d b23cf486 da67031b 503e22a3 1379ce28 a939bdf9 0bcf9415 38e9e2ab
ffff8ba93ef36180 63680852 C Bo:1:003:1 0 512 >
ffff8ba93ef36180 63680861 S Bi:1:003:1 -115 512 <
ffff8ba93ef36180 63681086 C Bi:1:003:1 0 512 = 7ac89841 00000000 03000000 00000000 00000000 00000000 00000000 00000000
ffff8ba93ef36180 63681095 S Bi:1:003:1 -115 512 <
ffff8ba93ef36180 63681107 C Bi:1:003:1 0 0
ffff8ba91dd880c0 63731192 S Bo:1:003:1 -115 512 = ef51ce44 3d28247e c85e5c72 d31f9b2c c4e53186 1aecff13 c899ae15 3ea0317f
ffff8ba91dd880c0 63731241 C Bo:1:003:1 0 512 >
ffff8ba91dd880c0 63731252 S Bi:1:003:1 -115 512 <
ffff8ba91dd880c0 63731447 C Bi:1:003:1 0 512 = 7ac8cb41 00000000 03000000 00000000 00000000 00000000 00000000 00000000
ffff8ba91dd880c0 63731458 S Bi:1:003:1 -115 512 <
ffff8ba91dd880c0 63731472 C Bi:1:003:1 0 0
ffff8ba91dd880c0 63781559 S Bo:1:003:1 -115 512 = 4667b846 0a6c4ed6 a7535415 6469c546 230f293e 12be885c 1f9b28e8 110c514f
ffff8ba91dd880c0 63781606 C Bo:1:003:1 0 512 >
ffff8ba91dd880c0 63781616 S Bi:1:003:1 -115 512 <
ffff8ba91dd880c0 63781838 C Bi:1:003:1 0 512 = 7ac8fd41 00000000 03000000 00000000 00000000 00000000 00000000 00000000
ffff8ba91dd880c0 63781847 S Bi:1:003:1 -115 512 <
ffff8ba91dd880c0 63781869 C Bi:1:003:1 0 0
ffff8ba91dd880c0 63831947 S Bo:1:003:1 -115 512 = f1263a34 95c95f60 1e9ad22a a2359da5 e10af31d 272d761a 0ba23c5f a03d0263
ffff8ba91dd880c0 63831993 C Bo:1:003:1 0 512 >
ffff8ba91dd880c0 63832005 S Bi:1:003:1 -115 512 <
ffff8ba91dd880c0 63832208 C Bi:1:003:1 0 512 = 7ac82f42 00000000 02000000 00000000 00000000 00000000 00000000 00000000
ffff8ba91dd880c0 63832217 S Bi:1:003:1 -115 512 <
ffff8ba91dd880c0 63832229 C Bi:1:003:1 0 0
ffff8ba91dd880c0 63832271 S Bo:1:003:1 -115 55545 = addf26cb b56ba354 f51944d7 a7e2c13a 0e203165 adcde1a6 ae7fe9f0 7b6a28c5
ffff8ba91dd880c0 63833906 C Bo:1:003:1 0 55545 >
ffff8ba91dd880c0 63833916 S Bi:1:003:1 -115 512 <
ffff8ba91dd880c0 63834249 C Bi:1:003:1 0 512 = 79c83042 00000000 03000000 00000000 00000000 00000000 00000000 00000000
ffff8ba91dd880c0 63834270 S Bi:1:003:1 -115 512 <
ffff8ba91dd880c0 63834282 C Bi:1:003:1 0 0
ffff8ba91dd880c0 63834314 S Bo:1:003:1 -115 61342 = da1d17b4 e8693367 0d55730e 115c9857 5f20c767 2dae4134 74a92cb8 a063db3f
ffff8ba91dd880c0 63836072 C Bo:1:003:1 0 61342 >
ffff8ba91dd880c0 63836082 S Bi:1:003:1 -115 512 <
ffff8ba91dd880c0 63836463 C Bi:1:003:1 0 512 = 79c83242 00000000 04000000 00000000 00000000 00000000 00000000 00000000
ffff8ba91dd880c0 63836478 S Bi:1:003:1 -115 512 <
ffff8ba91dd880c0 63836490 C Bi:1:003:1 0 0
ffff8ba91dd880c0 63836516 S Bo:1:003:1 -115 512 = fa10568e ed194f45 96017161 57cb3383 26229a56 d5dc4340 7d95e1c1 17bb53ca
ffff8ba91dd880c0 63836563 C Bo:1:003:1 0 512 >
ffff8ba91dd880c0 63836568 S Bi:1:003:1 -115 512 <
ffff8ba91dd880c0 63836750 C Bi:1:003:1 0 512 = 7ac83442 00000000 04000000 00000000 00000000 00000000 00000000 00000000
ffff8ba91dd880c0 63836756 S Bi:1:003:1 -115 512 <
ffff8ba91dd880c0 63836790 C Bi:1:003:1 0 0
ffff8ba9a6102900 63886882 S Bo:1:003:1 -115 512 = 1bdc95cd 5c0156a8 9a5a1374 cb28e286 47e89a6f e050f0f5 4dadc7eb 6e9ee103
ffff8ba9a6102900 63886928 C Bo:1:003:1 0 512 >
ffff8ba9a6102900 63886939 S Bi:1:003:1 -115 512 <
ffff8ba9a6102900 63887134 C Bi:1:003:1 0 512 = 7ac86642 00000000 04000000 00000000 00000000 00000000 00000000 00000000
ffff8ba9a6102900 63887144 S Bi:1:003:1 -115 512 <
ffff8ba9a6102900 63887156 C Bi:1:003:1 0 0
ffff8ba9a6102900 63937240 S Bo:1:003:1 -115 512 = 515af7cd db3ca55a f250e84d 5b7c5936 c7afe9d5 ef006d54 2a7efeb9 ef9d2d51
ffff8ba9a6102900 63937286 C Bo:1:003:1 0 512 >
ffff8ba9a6102900 63937298 S Bi:1:003:1 -115 512 <
ffff8ba9a6102900 63937515 C Bi:1:003:1 0 512 = 7ac89942 00000000 04000000 00000000 00000000 00000000 00000000 00000000
ffff8ba9a6102900 63937524 S Bi:1:003:1 -115 512 <
ffff8ba9a6102900 63937547 C Bi:1:003:1 0 0
ffff8ba9a6102900 63987626 S Bo:1:003:1 -115 512 = 62fc1ac5 66d9790f 207fba65 2a04290e 65a084a6 e08fabb8 bb7c15e4 501542b3
ffff8ba9a6102900 63987672 C Bo:1:003:1 0 512 >
ffff8ba9a6102900 63987681 S Bi:1:003:1 -115 512 <
ffff8ba9a6102900 63987866 C Bi:1:003:1 0 512 = 7ac8cb42 00000000 04000000 00000000 00000000 00000000 00000000 00000000
ffff8ba9a6102900 63987875 S Bi:1:003:1 -115 512 <
ffff8ba9a6102900 63987890 C Bi:1:003:1 0 0
ffff8ba9a6102900 64037971 S Bo:1:003:1 -115 512 = 61a08abb 202035b6 d44b07af b8d15124 6fe506f4 d61620fd 7387f9a8 24473917
ffff8ba9a6102900 64038020 C Bo:1:003:1 0 512 >
ffff8ba9a6102900 64038029 S Bi:1:003:1 -115 512 <
ffff8ba9a6102900 64038263 C Bi:1:003:1 0 512 = 7ac8fd42 00000000 04000000 00000000 00000000 00000000 00000000 00000000
ffff8ba9a6102900 64038272 S Bi:1:003:1 -115 512 <
ffff8ba9a6102900 64038284 C Bi:1:003:1 0 0
ffff8ba9a6102900 64088364 S Bo:1:003:1 -115 512 = 0f247b4f 7688c958 38f497c6 450f2c99 3a633e54 8fbb8357 e76d6f1f 948eb3f4
ffff8ba9a6102900 64088411 C Bo:1:003:1 0 512 >
ffff8ba9a6102900 64088420 S Bi:1:003:1 -115 512 <
ffff8ba9a6102900 64088606 C Bi:1:003:1 0 512 = 7ac83043 00000000 04000000 00000000 00000000 00000000 00000000 00000000
ffff8ba9a6102900 64088615 S Bi:1:003:1 -115 512 <
ffff8ba9a6102900 64088638 C Bi:1:003:1 0 0
ffff8ba94077c3c0 64138718 S Bo:1:003:1 -115 512 = 88572950 582c3b68 e4080a50 b54c26e2 573cc187 64dc025a 2fdeb7cf d73679ea
ffff8ba94077c3c0 64138765 C Bo:1:003:1 0 512 >
ffff8ba94077c3c0 64138775 S Bi:1:003:1 -115 512 <
ffff8ba94077c3c0 64138954 C Bi:1:003:1 0 512 = 7ac86243 00000000 03000000 00000000 00000000 00000000 00000000 00000000
ffff8ba94077c3c0 64138963 S Bi:1:003:1 -115 512 <
ffff8ba94077c3c0 64138986 C Bi:1:003:1 0 0
ffff8ba94077c3c0 64189024 S Bo:1:003:1 -115 512 = 99932219 5ea038e7 eefb0cf6 f2cadbd5 843c275a e3d63a0a cbf2ff9f 50bf2f08
ffff8ba94077c3c0 64189086 C Bo:1:003:1 0 512 >
ffff8ba94077c3c0 64189095 S Bi:1:003:1 -115 512 <
ffff8ba94077c3c0 64189281 C Bi:1:003:1 0 512 = 7ac89543 00000000 03000000 00000000 00000000 00000000 00000000 00000000
ffff8ba94077c3c0 64189289 S Bi:1:003:1 -115 512 <
ffff8ba94077c3c0 64189311 C Bi:1:003:1 0 0
ffff8ba94077c3c0 64239390 S Bo:1:003:1 -115 512 = 9f8a4042 81a1e28c 5da483bf 9e8bd282 6df4efbf 7eb784b6 400473cf 8b2d3a74
ffff8ba94077c3c0 64239429 C Bo:1:003:1 0 512 >
ffff8ba9250dd440 64239445 S Bi:1:003:1 -115 512 <
ffff8ba9250dd440 64239620 C Bi:1:003:1 0 512 = 7ac8c743 00000000 03000000 00000000 00000000 00000000 00000000 00000000
ffff8ba94077c3c0 64239636 S Bi:1:003:1 -115 512 <
ffff8ba94077c3c0 64239648 C Bi:1:003:1 0 0
ffff8ba9566a6a80 64289704 S Bo:1:003:1 -115 512 = 1f312f03 270a4674 9077c95d 43689a66 52bdd697 7ae2b026 9c939ae4 dbf7d58c
ffff8ba9566a6a80 64289751 C Bo:1:003:1 0 512 >
ffff8ba9566a6a80 64289762 S Bi:1:003:1 -115 512 <
ffff8ba9566a6a80 64289956 C Bi:1:003:1 0 512 = 7ac8f943 00000000 03000000 00000000 00000000 00000000 00000000 00000000
ffff8ba9566a6a80 64289965 S Bi:1:003:1 -115 512 <
ffff8ba9566a6a80 64289987 C Bi:1:003:1 0 0
ffff8ba9566a6a80 64340025 S Bo:1:003:1 -115 512 = 0ab7f1f5 8c1a78fd d5921016 a300770a 09d2c750 6be2bbd8 da25d957 485ad683
ffff8ba9566a6a80 64340088 C Bo:1:003:1 0 512 >
ffff8ba9566a6a80 64340097 S Bi:1:003:1 -115 512 <
ffff8ba9566a6a80 64340296 C Bi:1:003:1 0 512 = 7ac82c44 00000000 03000000 00000000 00000000 00000000 00000000 00000000
ffff8ba9566a6a80 64340304 S Bi:1:003:1 -115 512 <
ffff8ba9566a6a80 64340317 C Bi:1:003:1 0 0
ffff8ba9566a6a80 64390395 S Bo:1:003:1 -115 512 = 527f3edc a74fffc5 21fa3107 9efcff1c 0c7d2b42 cfb7effb 91c7be17 15b17e56
ffff8ba9566a6a80 64390441 C Bo:1:003:1 0 512 >
ffff8ba9566a6a80 64390449 S Bi:1:003:1 -115 512 <
ffff8ba9566a6a80 64390642 C Bi:1:003:1 0 512 = 7ac85e44 00000000 03000000 00000000 00000000 00000000 00000000 00000000
ffff8ba9566a6a80 64390651 S Bi:1:003:1 -115 512 <
ffff8ba9566a6a80 64390674 C Bi:1:003:1 0 0
ffff8ba9566a6a80 64440751 S Bo:1:003:1 -115 512 = bd951294 eb83f5d7 c9721657 1395ee02 043d3a8f cd44e054 a180c67c 39a164eb
ffff8ba9566a6a80 64440797 C Bo:1:003:1 0 512 >
ffff8ba9566a6a80 64440805 S Bi:1:003:1 -115 512 <
ffff8ba9566a6a80 64441023 C Bi:1:003:1 0 512 = 7ac89044 00000000 02000000 00000000 00000000 00000000 00000000 00000000
ffff8ba9566a6a80 64441032 S Bi:1:003:1 -115 512 <
ffff8ba9566a6a80 64441055 C Bi:1:003:1 0 0
ffff8ba9566a6a80 64441097 S Bo:1:003:1 -115 59700 = 09f222fc 8785dae9 e4850ace 27981ca4 e3f09ddc 2bd398e3 c199b9a8 33da9380
ffff8ba9566a6a80 64442565 C Bo:1:003:1 0 59700 >
ffff8ba9566a6a80 64442575 S Bi:1:003:1 -115 512 <
ffff8ba9566a6a80 64442984 C Bi:1:003:1 0 512 = 79c89144 00000000 03000000 00000000 00000000 00000000 00000000 00000000
ffff8ba9566a6a80 64443006 S Bi:1:003:1 -115 512 <
ffff8ba9566a6a80 64443038 C Bi:1:003:1 0 0
ffff8ba9566a6a80 64443069 S Bo:1:003:1 -115 59264 = 9bc61fea de4e1d6a 060cb280 3bdb8538 60f3d984 5ac828ad c09d4aa7 d18870ad
ffff8ba9566a6a80 64444541 C Bo:1:003:1 0 59264 >
ffff8ba9566a6a80 64444551 S Bi:1:003:1 -115 512 <
ffff8ba9566a6a80 64445053 C Bi:1:003:1 0 512 = 79c89344 00000000 04000000 00000000 00000000 00000000 00000000 00000000
ffff8ba9566a6a80 64445067 S Bi:1:003:1 -115 512 <
ffff8ba9566a6a80 64445078 C Bi:1:003:1 0 0
ffff8ba9566a6a80 64445104 S Bo:1:003:1 -115 512 = 5ea50ea8 d356af4d 8015b821 17003a4a 565a327d 8e8a264e 28534e41 63649616
ffff8ba9566a6a80 64445140 C Bo:1:003:1 0 512 >
ffff8ba9566a6a80 64445145 S Bi:1:003:1 -115 512 <
ffff8ba9566a6a80 64445296 C Bi:1:003:1 0 512 = 7ac89544 00000000 04000000 00000000 00000000 00000000 00000000 00000000
ffff8ba9566a6a80 64445302 S Bi:1:003:1 -115 512 <
ffff8ba9566a6a80 64445336 C Bi:1:003:1 0 0
ffff8ba902a42540 64495390 S Bo:1:003:1 -115 512 = f414aacb 09c265ae 9c977d50 3920648f 4461c026 1ac6377c c4154218 4758aa8d
ffff8ba902a42540 64495436 C Bo:1:003:1 0 512 >
ffff8ba902a42540 64495446 S Bi:1:003:1 -115 512 <
ffff8ba902a42540 64495636 C Bi:1:003:1 0 512 = 7ac8c744 00000000 04000000 00000000 00000000 00000000 00000000 00000000
ffff8ba902a42540 64495645 S Bi:1:003:1 -115 512 <
ffff8ba902a42540 64495667 C Bi:1:003:1 0 0
ffff8ba902a42540 64545747 S Bo:1:003:1 -115 512 = 6f190163 3199ea5a aa1c0c2c 6a2735b1 ac1b81b1 192dbaed d7d3783d 003acd18
ffff8ba902a42540 64545792 C Bo:1:003:1 0 512 >
ffff8ba902a42540 64545801 S Bi:1:003:1 -115 512 <
ffff8ba902a42540 64546022 C Bi:1:003:1 0 512 = 7ac8f944 00000000 04000000 00000000 00000000 00000000 00000000 00000000
ffff8ba902a42540 64546031 S Bi:1:003:1 -115 512 <
ffff8ba902a42540 64546054 C Bi:1:003:1 0 0
ffff8ba902a42540 64596125 S Bo:1:003:1 -115 512 = 8c1bdc4b 48e82214 44a0a513 048cec8c 288980d3 301dd75a 2b94dc4e ed5575c5
ffff8ba902a42540 64596160 C Bo:1:003:1 0 512 >
ffff8ba902a42540 64596168 S Bi:1:003:1 -115 512 <
ffff8ba902a42540 64596365 C Bi:1:003:1 0 512 = 7ac82c45 00000000 04000000 00000000 00000000 00000000 00000000 00000000
ffff8ba902a42540 64596375 S Bi:1:003:1 -115 512 <
ffff8ba902a42540 64596401 C Bi:1:003:1 0 0
ffff8ba902a42540 64646480 S Bo:1:003:1 -115 512 = 03ce9090 20fc114b 0563642b 88a6a246 d6f5a88a 25197eb2 03ab1065 4f45f6c2
ffff8ba902a42540 64646524 C Bo:1:003:1 0 512 >
ffff8ba902a42540 64646531 S Bi:1:003:1 -115 512 <
ffff8ba902a42540 64646747 C Bi:1:003:1 0 512 = 7ac85e45 00000000 04000000 00000000 00000000 00000000 00000000 00000000
ffff8ba902a42540 64646756 S Bi:1:003:1 -115 512 <
ffff8ba902a42540 64646768 C Bi:1:003:1 0 0
ffff8ba9250dd200 64696807 S Bo:1:003:1 -115 512 = d0c1ff23 d654486b 5b6847ae 2521d536 2f5fa129 8ce54c48 de189062 aa823e9b
ffff8ba9250dd200 64696853 C Bo:1:003:1 0 512 >
ffff8ba9250dd200 64696862 S Bi:1:003:1 -115 512 <
ffff8ba9250dd200 64697059 C Bi:1:003:1 0 512 = 7ac89045 00000000 04000000 00000000 00000000 00000000 00000000 00000000
ffff8ba9250dd200 64697067 S Bi:1:003:1 -115 512 <
ffff8ba9250dd200 64697090 C Bi:1:003:1 0 0
ffff8ba94077c3c0 64747130 S Bo:1:003:1 -115 512 = a4d1d7d3 abdc0e97 378a4961 259324d5 1af5ee1f 8851cf8f 6f832d48 f540423f
ffff8ba94077c3c0 64747168 C Bo:1:003:1 0 512 >
ffff8ba9250dd200 64747182 S Bi:1:003:1 -115 512 <
ffff8ba9250dd200 64747406 C Bi:1:003:1 0 512 = 7ac8c345 00000000 04000000 00000000 00000000 00000000 00000000 00000000
ffff8ba949881080 64747428 S Bi:1:003:1 -115 512 <
ffff8ba949881080 64747444 C Bi:1:003:1 0 0
ffff8ba902f155c0 64797559 S Bo:1:003:1 -115 512 = 86402ece bbfce759 9bc69a2b 9cd82712 44daa78e e29711bb 47d612da 5483a985
ffff8ba902f155c0 64797596 C Bo:1:003:1 0 512 >
ffff8ba902f155c0 64797606 S Bi:1:003:1 -115 512 <
ffff8ba902f155c0 64797813 C Bi:1:003:1 0 512 = 7ac8f545 00000000 03000000 00000000 00000000 00000000 00000000 00000000
ffff8ba902f155c0 64797828 S Bi:1:003:1 -115 512 <
ffff8ba902f155c0 64797840 C Bi:1:003:1 0 0
ffff8ba902f155c0 64847952 S Bo:1:003:1 -115 512 = 7b9baeb3 74aad63f e8252b35 243aea86 e91a0b43 08b52dcd 94ae7e05 1fe69656
ffff8ba902f155c0 64847989 C Bo:1:003:1 0 512 >
ffff8ba902f155c0 64847997 S Bi:1:003:1 -115 512 <
ffff8ba902f155c0 64848229 C Bi:1:003:1 0 512 = 7ac82746 00000000 03000000 00000000 00000000 00000000 00000000 00000000
ffff8ba902f155c0 64848244 S Bi:1:003:1 -115 512 <
ffff8ba902f155c0 64848255 C Bi:1:003:1 0 0
ffff8ba902f155c0 64898343 S Bo:1:003:1 -115 512 = 29ff7e1d f7952c71 0f09e40f 3d16f6dd e28560e3 ec62a3ea 14c7967b fef3df42
ffff8ba902f155c0 64898379 C Bo:1:003:1 0 512 >
ffff8ba902f155c0 64898384 S Bi:1:003:1 -115 512 <
ffff8ba902f155c0 64898582 C Bi:1:003:1 0 512 = 7ac85a46 00000000 03000000 00000000 00000000 00000000 00000000 00000000
ffff8ba902f155c0 64898586 S Bi:1:003:1 -115 512 <
ffff8ba902f155c0 64898622 C Bi:1:003:1 0 0
ffff8ba94077c3c0 64948709 S Bo:1:003:1 -115 512 = 1931b14d 3b6bf10a dba3bb19 e6269f21 dc7bfc67 eae071e3 f51f4cc5 380b26b8
ffff8ba94077c3c0 64948747 C Bo:1:003:1 0 512 >
ffff8ba94077c3c0 64948756 S Bi:1:003:1 -115 512 <
ffff8ba94077c3c0 64948983 C Bi:1:003:1 0 512 = 7ac88c46 00000000 03000000 00000000 00000000 00000000 00000000 00000000
ffff8ba94077c3c0 64948993 S Bi:1:003:1 -115 512 <
ffff8ba94077c3c0 64949015 C Bi:1:003:1 0 0
ffff8ba94077c3c0 64999094 S Bo:1:003:1 -115 512 = c5fda456 e4769b83 3b3dfb42 05902ec4 930017fb 006eb317 120f8719 94c79891
ffff8ba94077c3c0 64999140 C Bo:1:003:1 0 512 >
ffff8ba94077c3c0 64999148 S Bi:1:003:1 -115 512 <
ffff8ba94077c3c0 64999345 C Bi:1:003:1 0 512 = 7ac8bf46 00000000 03000000 00000000 00000000 00000000 00000000 00000000
ffff8ba94077c3c0 64999354 S Bi:1:003:1 -115 512 <
ffff8ba94077c3c0 64999376 C Bi:1:003:1 0 0
ffff8ba94077c3c0 65049455 S Bo:1:003:1 -115 512 = 987b856f 1903c447 c52ceafc ee8c78ef 817cf50b 9103ad90 f01dbb4e 8b64c7d4
ffff8ba94077c3c0 65049501 C Bo:1:003:1 0 512 >
ffff8ba94077c3c0 65049509 S Bi:1:003:1 -115 512 <
ffff8ba94077c3c0 65049771 C Bi:1:003:1 0 512 = 7ac8f146 00000000 03000000 00000000 00000000 00000000 00000000 00000000
ffff8ba94077c3c0 65049780 S Bi:1:003:1 -115 512 <
ffff8ba94077c3c0 65049803 C Bi:1:003:1 0 0
ffff8ba94077c3c0 65099882 S Bo:1:003:1 -115 512 = 5bae56ea e5089f97 11dcc29c a4dd8759 e7723373 49949659 cfdc9e31 4c3998aa
ffff8ba94077c3c0 65099927 C Bo:1:003:1 0 512 >
ffff8ba94077c3c0 65099936 S Bi:1:003:1 -115 512 <
ffff8ba94077c3c0 65100131 C Bi:1:003:1 0 512 = 7ac82347 00000000 02000000 00000000 00000000 00000000 00000000 00000000
ffff8ba94077c3c0 65100139 S Bi:1:003:1 -115 512 <
ffff8ba94077c3c0 65100152 C Bi:1:003:1 0 0
ffff8ba94077c3c0 65100195 S Bo:1:003:1 -115 57899 = b5aac8d5 90535b9f 64293764 56211987 fd68c348 a6bc7dea 264d4532 0e639076
ffff8ba94077c3c0 65101614 C Bo:1:003:1 0 57899 >
ffff8ba94077c3c0 65101624 S Bi:1:003:1 -115 512 <
ffff8ba94077c3c0 65101969 C Bi:1:003:1 0 512 = 79c82447 00000000 03000000 00000000 00000000 00000000 00000000 00000000
ffff8ba94077c3c0 65101986 S Bi:1:003:1 -115 512 <
ffff8ba94077c3c0 65101998 C Bi:1:003:1 0 0
ffff8ba94077c3c0 65102033 S Bo:1:003:1 -115 60460 = 5611d70e 1e44e223 70b56708 ec515a37 1e8e30c4 25b95aa6 41c71af6 f96ab3cb
ffff8ba94077c3c0 65103528 C Bo:1:003:1 0 60460 >
ffff8ba94077c3c0 65103537 S Bi:1:003:1 -115 512 <
ffff8ba94077c3c0 65103969 C Bi:1:003:1 0 512 = 79c82647 00000000 04000000 00000000 00000000 00000000 00000000 00000000
ffff8ba94077c3c0 65103982 S Bi:1:003:1 -115 512 <
ffff8ba94077c3c0 65103994 C Bi:1:003:1 0 0
ffff8ba94077c3c0 65104020 S Bo:1:003:1 -115 512 = 1d08ef87 130ddd7c 169f7bc5 b75c3349 8b0855b2 b423188b 695ba821 db73a501
ffff8ba94077c3c0 65104055 C Bo:1:003:1 0 512 >
ffff8ba94077c3c0 65104060 S Bi:1:003:1 -115 512 <
ffff8ba94077c3c0 65104208 C Bi:1:003:1 0 512 = 7ac82847 00000000 04000000 00000000 00000000 00000000 00000000 00000000
ffff8ba94077c3c0 65104214 S Bi:1:003:1 -115 512 <
ffff8ba94077c3c0 65104248 C Bi:1:003:1 0 0
ffff8ba93ef36180 65154297 S Bo:1:003:1 -115 512 = eec2bc73 4970777d 5e11ad0e 48398ad0 3268c66e 3ca9d6ba 03aeb2ed fb3e5e9c
ffff8ba93ef36180 65154354 C Bo:1:003:1 0 512 >
ffff8ba93ef36180 65154364 S Bi:1:003:1 -115 512 <
ffff8ba93ef36180 65155813 C Bi:1:003:1 0 512 = 7ac85a47 00000000 04000000 00000000 00000000 00000000 00000000 00000000
ffff8ba93ef36180 65155822 S Bi:1:003:1 -115 512 <
ffff8ba93ef36180 65155834 C Bi:1:003:1 0 0
ffff8ba93ef36180 65205914 S Bo:1:003:1 -115 512 = 64698217 65c7f8cd b2fcb1f8 006e0aac b93251f7 21fe62f1 7d9a74a5 a35d1c71
ffff8ba93ef36180 65205971 C Bo:1:003:1 0 512 >
ffff8ba93ef36180 65205980 S Bi:1:003:1 -115 512 <
ffff8ba93ef36180 65206168 C Bi:1:003:1 0 512 = 7ac88d47 00000000 04000000 00000000 00000000 00000000 00000000 00000000
ffff8ba93ef36180 65206177 S Bi:1:003:1 -115 512 <
ffff8ba93ef36180 65206201 C Bi:1:003:1 0 0
ffff8ba93ef36180 65256280 S Bo:1:003:1 -115 512 = 2a351a9f 07d83cbb 78126f6c 6aa76204 65b40902 db5d59b9 b07bd12a d3935568
ffff8ba93ef36180 65256326 C Bo:1:003:1 0 512 >
ffff8ba93ef36180 65256334 S Bi:1:003:1 -115 512 <
ffff8ba93ef36180 65256522 C Bi:1:003:1 0 512 = 7ac8c047 00000000 04000000 00000000 00000000 00000000 00000000 00000000
ffff8ba93ef36180 65256531 S Bi:1:003:1 -115 512 <
ffff8ba93ef36180 65256554 C Bi:1:003:1 0 0
ffff8ba93ef36180 65306632 S Bo:1:003:1 -115 512 = af00e039 13d88c46 b281e5f0 22c83b70 98be2a96 b25a3b68 ee85a4d7 e731165d
ffff8ba93ef36180 65306678 C Bo:1:003:1 0 512 >
ffff8ba93ef36180 65306687 S Bi:1:003:1 -115 512 <
ffff8ba93ef36180 65306869 C Bi:1:003:1 0 512 = 7ac8f247 00000000 04000000 00000000 00000000 00000000 00000000 00000000
ffff8ba93ef36180 65306931 S Bi:1:003:1 -115 512 <
ffff8ba93ef36180 65306970 C Bi:1:003:1 0 0
ffff8ba93ef36180 65357023 S Bo:1:003:1 -115 512 = f4ceb939 f725f161 45c909bf e5455c4e a8137cae 0a8eb3ac 3ab0eb6b faa95b80
ffff8ba93ef36180 65357069 C Bo:1:003:1 0 512 >
ffff8ba93ef36180 65357078 S Bi:1:003:1 -115 512 <
ffff8ba93ef36180 65357265 C Bi:1:003:1 0 512 = 7ac82548 00000000 04000000 00000000 00000000 00000000 00000000 00000000
ffff8ba93ef36180 65357274 S Bi:1:003:1 -115 512 <
ffff8ba93ef36180 65357287 C Bi:1:003:1 0 0
ffff8ba93ef36180 65407365 S Bo:1:003:1 -115 512 = 7022ff96 69e3dc3c 8f525eb0 3906fa92 427e0bef 133e8e2b 854f1a87 cd0dc2d0
ffff8ba93ef36180 65407406 C Bo:1:003:1 0 512 >
ffff8ba93ef36180 65407415 S Bi:1:003:1 -115 512 <
ffff8ba93ef36180 65407629 C Bi:1:003:1 0 512 = 7ac85748 00000000 03000000 00000000 00000000 00000000 00000000 00000000
ffff8ba93ef36180 65407638 S Bi:1:003:1 -115 512 <
ffff8ba93ef36180 65407661 C Bi:1:003:1 0 0
ffff8ba902a42540 65457755 S Bo:1:003:1 -115 512 = bca84cdf 9ef97e07 6331d39a 24547312 8c2f65a2 52df1610 5ed9b24b 3246409b
ffff8ba902a42540 65457802 C Bo:1:003:1 0 512 >
ffff8ba902a42540 65457812 S Bi:1:003:1 -115 512 <
ffff8ba902a42540 65457992 C Bi:1:003:1 0 512 = 7ac88948 00000000 03000000 00000000 00000000 00000000 00000000 00000000
ffff8ba902a42540 65458003 S Bi:1:003:1 -115 512 <
ffff8ba902a42540 65458017 C Bi:1:003:1 0 0
ffff8ba902a42540 65508095 S Bo:1:003:1 -115 512 = aa71a58d 61f2bf4f 564e5abd dc66ee97 2d933b90 d4af0631 f3ef370c c1188876
ffff8ba902a42540 65508140 C Bo:1:003:1 0 512 >
ffff8ba902a42540 65508149 S Bi:1:003:1 -115 512 <
ffff8ba902a42540 65508365 C Bi:1:003:1 0 512 = 7ac8bc48 00000000 03000000 00000000 00000000 00000000 00000000 00000000
ffff8ba902a42540 65508374 S Bi:1:003:1 -115 512 <
ffff8ba902a42540 65508396 C Bi:1:003:1 0 0
ffff8ba902a42540 65558474 S Bo:1:003:1 -115 512 = 29525476 b18b3a76 02dec419 2930ff50 a7798ff6 18dcb175 bd01b49b 5a87c3cc
ffff8ba902a42540 65558520 C Bo:1:003:1 0 512 >
ffff8ba902a42540 65558529 S Bi:1:003:1 -115 512 <
ffff8ba902a42540 65558726 C Bi:1:003:1 0 512 = 7ac8ee48 00000000 03000000 00000000 00000000 00000000 00000000 00000000
ffff8ba902a42540 65558734 S Bi:1:003:1 -115 512 <
ffff8ba902a42540 65558758 C Bi:1:003:1 0 0
ffff8ba902a42540 65608838 S Bo:1:003:1 -115 512 = 093e17e1 f9b98246 3d47794f 1b83219c 108b968b 2b7c7d6f 180e90c6 a0b4ab11
ffff8ba902a42540 65608873 C Bo:1:003:1 0 512 >
ffff8ba902a42540 65608880 S Bi:1:003:1 -115 512 <
ffff8ba902a42540 65609099 C Bi:1:003:1 0 512 = 7ac82049 00000000 03000000 00000000 00000000 00000000 00000000 00000000
ffff8ba902a42540 65609105 S Bi:1:003:1 -115 512 <
ffff8ba902a42540 65609138 C Bi:1:003:1 0 0
ffff8ba902a42540 65659216 S Bo:1:003:1 -115 512 = 2f7f2a25 7a4ea3da 1eb35500 a969ea32 97e8dfcc 03b9af43 fe262d85 42466437
ffff8ba902a42540 65659246 C Bo:1:003:1 0 512 >
ffff8ba902a42540 65659250 S Bi:1:003:1 -115 512 <
ffff8ba902a42540 65659441 C Bi:1:003:1 0 512 = 7ac85349 00000000 03000000 00000000 00000000 00000000 00000000 00000000
ffff8ba902a42540 65659446 S Bi:1:003:1 -115 512 <
ffff8ba902a42540 65659480 C Bi:1:003:1 0 0
ffff8ba902a42540 65709558 S Bo:1:003:1 -115 512 = f2c2d3f9 29162042 6c84fd9f d20e6826 6d53602a 8d9f8732 69f57524 41684b06
ffff8ba902a42540 65709614 C Bo:1:003:1 0 512 >
ffff8ba902a42540 65709623 S Bi:1:003:1 -115 512 <
ffff8ba902a42540 65709827 C Bi:1:003:1 0 512 = 7ac88549 00000000 03000000 00000000 00000000 00000000 00000000 00000000
ffff8ba902a42540 65709836 S Bi:1:003:1 -115 512 <
ffff8ba902a42540 65709859 C Bi:1:003:1 0 0
ffff8ba902a42540 65759938 S Bo:1:003:1 -115 512 = 3f0dfe7a ec22d28a 9aca43d6 02ac859f f1e25593 2886c89c e6b54252 cfa4bdd2
ffff8ba902a42540 65759984 C Bo:1:003:1 0 512 >
ffff8ba902a42540 65759992 S Bi:1:003:1 -115 512 <
ffff8ba902a42540 65760186 C Bi:1:003:1 0 512 = 7ac8b749 00000000 02000000 00000000 00000000 00000000 00000000 00000000
ffff8ba902a42540 65760195 S Bi:1:003:1 -115 512 <
ffff8ba902a42540 65760215 C Bi:1:003:1 0 0
ffff8ba902a42540 65760258 S Bo:1:003:1 -115 54443 = a424197f b578fe57 a75e9760 216faf7e d67c9262 8e58673f ae24cd96 37fba09a
ffff8ba902a42540 65761621 C Bo:1:003:1 0 54443 >
ffff8ba902a42540 65761633 S Bi:1:003:1 -115 512 <
ffff8ba902a42540 65774892 C Bi:1:003:1 0 512 = 79c8b849 00000000 03000000 00000000 00000000 00000000 00000000 00000000
ffff8ba902a42540 65774913 S Bi:1:003:1 -115 512 <
ffff8ba902a42540 65774945 C Bi:1:003:1 0 0
ffff8ba902a42540 65774981 S Bo:1:003:1 -115 60452 = fa35192b 8ce0178d c8e76e7b fa9dbfaf 8777e13c 45471c2b bbf4779b e96b742b
ffff8ba902a42540 65776451 C Bo:1:003:1 0 60452 >
ffff8ba902a42540 65776460 S Bi:1:003:1 -115 512 <
ffff8ba902a42540 65776949 C Bi:1:003:1 0 512 = 79c8c649 00000000 04000000 00000000 00000000 00000000 00000000 00000000
ffff8ba902a42540 65776960 S Bi:1:003:1 -115 512 <
ffff8ba902a42540 65776982 C Bi:1:003:1 0 0
ffff8ba902a42540 65777008 S Bo:1:003:1 -115 512 = 0e7ce5d4 0237a254 199bb91b c54ea045 f3baab3c 85e2430c c5941108 91dafe76
ffff8ba902a42540 65777044 C Bo:1:003:1 0 512 >
ffff8ba902a42540 65777049 S Bi:1:003:1 -115 512 <
ffff8ba902a42540 65777226 C Bi:1:003:1 0 512 = 7ac8c949 00000000 04000000 00000000 00000000 00000000 00000000 00000000
ffff8ba902a42540 65777232 S Bi:1:003:1 -115 512 <
ffff8ba902a42540 65777266 C Bi:1:003:1 0 0
ffff8ba9250dd440 65827338 S Bo:1:003:1 -115 512 = 662b28be 2e61af02 c6971cf8 f49f0e2c 5a0a0fca 0eee1d0a 34d6b585 b2d68819
ffff8ba9250dd440 65827384 C Bo:1:003:1 0 512 >
ffff8ba9250dd440 65827394 S Bi:1:003:1 -115 512 <
ffff8ba9250dd440 65827590 C Bi:1:003:1 0 512 = 7ac8fb49 00000000 04000000 00000000 00000000 00000000 00000000 00000000
ffff8ba9250dd440 65827600 S Bi:1:003:1 -115 512 <
ffff8ba9250dd440 65827623 C Bi:1:003:1 0 0
ffff8ba902a42540 65877659 S Bo:1:003:1 -115 512 = 66059cb7 923337ea 32300eaa 1e047023 d728990a 4762507c bd7a171b 40d80f89
ffff8ba902a42540 65877694 C Bo:1:003:1 0 512 >
ffff8ba902a42540 65877701 S Bi:1:003:1 -115 512 <
ffff8ba902a42540 65877922 C Bi:1:003:1 0 512 = 7ac82d4a 00000000 04000000 00000000 00000000 00000000 00000000 00000000
ffff8ba902a42540 65877927 S Bi:1:003:1 -115 512 <
ffff8ba902a42540 65877962 C Bi:1:003:1 0 0
ffff8ba902a42540 65928025 S Bo:1:003:1 -115 512 = 2ebe1e95 452ae660 611cf803 1243233a 9509e795 3d53d5ad ce3562ee d003ac06
ffff8ba902a42540 65928060 C Bo:1:003:1 0 512 >
ffff8ba902a42540 65928066 S Bi:1:003:1 -115 512 <
ffff8ba902a42540 65928261 C Bi:1:003:1 0 512 = 7ac8604a 00000000 04000000 00000000 00000000 00000000 00000000 00000000
ffff8ba902a42540 65928267 S Bi:1:003:1 -115 512 <
ffff8ba902a42540 65928298 C Bi:1:003:1 0 0
ffff8ba9250dd440 65978342 S Bo:1:003:1 -115 512 = e36694fa 092ad06c ff23ffa2 fee93753 c66e27d9 3437babd 7cdd091e 47192a07
ffff8ba9250dd440 65978378 C Bo:1:003:1 0 512 >
ffff8ba9250dd440 65978385 S Bi:1:003:1 -115 512 <
ffff8ba9250dd440 65978610 C Bi:1:003:1 0 512 = 7ac8924a 00000000 04000000 00000000 00000000 00000000 00000000 00000000
ffff8ba9250dd440 65978616 S Bi:1:003:1 -115 512 <
ffff8ba9250dd440 65978650 C Bi:1:003:1 0 0
ffff8ba9566a7980 66028733 S Bo:1:003:1 -115 512 = 73c976c1 44a78d5e 83a417d9 46afa0c8 ea226e87 bb3d8adb fae03c75 6ef89cdf
ffff8ba9566a7980 66028781 C Bo:1:003:1 0 512 >
ffff8ba9566a7980 66028792 S Bi:1:003:1 -115 512 <
ffff8ba9566a7980 66028983 C Bi:1:003:1 0 512 = 7ac8c44a 00000000 03000000 00000000 00000000 00000000 00000000 00000000
ffff8ba9566a7980 66028993 S Bi:1:003:1 -115 512 <
ffff8ba9566a7980 66029016 C Bi:1:003:1 0 0
ffff8ba9566a7980 66079097 S Bo:1:003:1 -115 512 = 2655c400 d619d3a1 4568a2f6 26d103f3 7a428a45 9221f019 440ec7e4 852632d4
ffff8ba9566a7980 66079144 C Bo:1:003:1 0 512 >
ffff8ba9566a7980 66079153 S Bi:1:003:1 -115 512 <
ffff8ba9566a7980 66079484 C Bi:1:003:1 0 512 = 7ac8f74a 00000000 03000000 00000000 00000000 00000000 00000000 00000000
ffff8ba9566a7980 66079493 S Bi:1:003:1 -115 512 <
ffff8ba9566a7980 66079516 C Bi:1:003:1 0 0
ffff8ba9566a7980 66129595 S Bo:1:003:1 -115 512 = dd2a5e12 df16ead3 646e07a6 0409c998 a30214d0 7b1ac059 498f7f89 182ec035
ffff8ba9566a7980 66129641 C Bo:1:003:1 0 512 >
ffff8ba9566a7980 66129649 S Bi:1:003:1 -115 512 <
ffff8ba9566a7980 66129828 C Bi:1:003:1 0 512 = 7ac8294b 00000000 03000000 00000000 00000000 00000000 00000000 00000000
ffff8ba9566a7980 66129837 S Bi:1:003:1 -115 512 <
ffff8ba9566a7980 66129860 C Bi:1:003:1 0 0
ffff8ba9566a7980 66179938 S Bo:1:003:1 -115 512 = b12004b6 60b62c0c bcf14b42 72d8b9aa 93df384d bc8ea23f e1384096 d950d679
ffff8ba9566a7980 66179995 C Bo:1:003:1 0 512 >
ffff8ba9566a7980 66180004 S Bi:1:003:1 -115 512 <
ffff8ba9566a7980 66180208 C Bi:1:003:1 0 512 = 7ac85b4b 00000000 03000000 00000000 00000000 00000000 00000000 00000000
ffff8ba9566a7980 66180217 S Bi:1:003:1 -115 512 <
ffff8ba9566a7980 66180240 C Bi:1:003:1 0 0
ffff8ba9566a7980 66230319 S Bo:1:003:1 -115 512 = 0533a3a1 fd5033b0 8b8f84b6 c90e089e 45f0b90e 9a809d5b d15679c9 b0d010e6
ffff8ba9566a7980 66230365 C Bo:1:003:1 0 512 >
ffff8ba9566a7980 66230374 S Bi:1:003:1 -115 512 <
ffff8ba9566a7980 66230558 C Bi:1:003:1 0 512 = 7ac88e4b 00000000 03000000 00000000 00000000 00000000 00000000 00000000
ffff8ba9566a7980 66230566 S Bi:1:003:1 -115 512 <
ffff8ba9566a7980 66230590 C Bi:1:003:1 0 0
ffff8ba9566a7980 66280667 S Bo:1:003:1 -115 512 = f0f93a5c c5ab926f f09fea6f e54faee6 91ca6bfd 02579479 ab51ca3d 1fca3a57
ffff8ba9566a7980 66280713 C Bo:1:003:1 0 512 >
ffff8ba9566a7980 66280721 S Bi:1:003:1 -115 512 <
ffff8ba9566a7980 66280922 C Bi:1:003:1 0 512 = 7ac8c04b 00000000 03000000 00000000 00000000 00000000 00000000 00000000
ffff8ba9566a7980 66280931 S Bi:1:003:1 -115 512 <
ffff8ba9566a7980 66280943 C Bi:1:003:1 0 0
ffff8ba902af9ec0 66331016 S Bo:1:003:1 -115 512 = 76422606 fccddf15 717a24d7 eb8df1c0 4b884a28 398fdc28 7a659f15 d7e023ff
ffff8ba902af9ec0 66331057 C Bo:1:003:1 0 512 >
ffff8ba902af9ec0 66331071 S Bi:1:003:1 -115 512 <
ffff8ba902af9ec0 66331265 C Bi:1:003:1 0 512 = 7ac8f34b 00000000 02000000 00000000 00000000 00000000 00000000 00000000
ffff8ba902af9ec0 66331276 S Bi:1:003:1 -115 512 <
ffff8ba902af9ec0 66331289 C Bi:1:003:1 0 0
ffff8ba902af9ec0 66331337 S Bo:1:003:1 -115 58251 = 909bc499 9f49932e 2d6d65c0 f0aa5e49 308694a0 b775d070 0b947e87 4682f8bd
ffff8ba902af9ec0 66332799 C Bo:1:003:1 0 58251 >
ffff8ba902af9ec0 66332810 S Bi:1:003:1 -115 512 <
ffff8ba902af9ec0 66333247 C Bi:1:003:1 0 512 = 79c8f44b 00000000 03000000 00000000 00000000 00000000 00000000 00000000
ffff8ba902af9ec0 66333272 S Bi:1:003:1 -115 512 <
ffff8ba902af9ec0 66333301 C Bi:1:003:1 0 0
ffff8ba902af9ec0 66333339 S Bo:1:003:1 -115 60115 = 7a1e8b6e e11cebbb fa5fd069 3ec8f3ac 5d67b089 e6b7daf5 05296e83 e9c6f06a
ffff8ba902af9ec0 66334999 C Bo:1:003:1 0 60115 >
ffff8ba902af9ec0 66335009 S Bi:1:003:1 -115 512 <
ffff8ba902af9ec0 66335378 C Bi:1:003:1 0 512 = 79c8f54b 00000000 04000000 00000000 00000000 00000000 00000000 00000000
ffff8ba902af9ec0 66335402 S Bi:1:003:1 -115 512 <
ffff8ba902af9ec0 66335431 C Bi:1:003:1 0 0
ffff8ba902af9ec0 66335459 S Bo:1:003:1 -115 512 = d80e1267 a5af662e e77b69d6 61c06f0a 4e53165f 9d403d19 1ff55d24 36e07ca8
ffff8ba902af9ec0 66335493 C Bo:1:003:1 0 512 >
ffff8ba902af9ec0 66335500 S Bi:1:003:1 -115 512 <
ffff8ba902af9ec0 66335651 C Bi:1:003:1 0 512 = 7ac8f74b 00000000 04000000 00000000 00000000 00000000 00000000 00000000
ffff8ba902af9ec0 66335657 S Bi:1:003:1 -115 512 <
ffff8ba902af9ec0 66335690 C Bi:1:003:1 0 0
ffff8ba902af9ec0 66385803 S Bo:1:003:1 -115 512 = ff395dee 50fc7906 556bc1f7 900ca11e fddea500 1df20d0f 77cd05b7 96698278
ffff8ba902af9ec0 66385853 C Bo:1:003:1 0 512 >
ffff8ba902af9ec0 66385864 S Bi:1:003:1 -115 512 <
ffff8ba902af9ec0 66386054 C Bi:1:003:1 0 512 = 7ac8294c 00000000 04000000 00000000 00000000 00000000 00000000 00000000
ffff8ba902af9ec0 66386076 S Bi:1:003:1 -115 512 <
ffff8ba902af9ec0 66386092 C Bi:1:003:1 0 0
ffff8ba902af9ec0 66436215 S Bo:1:003:1 -115 512 = 08546b2e 9c449b38 74deebc6 8779c5d6 31be2dd0 3ed6de52 1e7d7e69 cfce8b8b
ffff8ba902af9ec0 66436248 C Bo:1:003:1 0 512 >
ffff8ba902af9ec0 66436261 S Bi:1:003:1 -115 512 <
ffff8ba902af9ec0 66436460 C Bi:1:003:1 0 512 = 7ac85c4c 00000000 04000000 00000000 00000000 00000000 00000000 00000000
ffff8ba902af9ec0 66436470 S Bi:1:003:1 -115 512 <
ffff8ba902af9ec0 66436500 C Bi:1:003:1 0 0
ffff8ba902af9ec0 66486579 S Bo:1:003:1 -115 512 = 4505ed56 cf2578bb 5232b958 ea3bc31d e3f005c1 5684f512 22ebb564 aa268338
ffff8ba902af9ec0 66486613 C Bo:1:003:1 0 512 >
ffff8ba902af9ec0 66486618 S Bi:1:003:1 -115 512 <
ffff8ba902af9ec0 66486811 C Bi:1:003:1 0 512 = 7ac88e4c 00000000 04000000 00000000 00000000 00000000 00000000 00000000
ffff8ba902af9ec0 66486816 S Bi:1:003:1 -115 512 <
ffff8ba902af9ec0 66486846 C Bi:1:003:1 0 0
ffff8ba902af9ec0 66536923 S Bo:1:003:1 -115 512 = d42044a8 c067a28d e3027e42 49443a1c bbe7744d eb9492ba e4e1e041 828bfe4c
ffff8ba902af9ec0 66536958 C Bo:1:003:1 0 512 >
ffff8ba902af9ec0 66536963 S Bi:1:003:1 -115 512 <
ffff8ba902af9ec0 66537155 C Bi:1:003:1 0 512 = 7ac8c04c 00000000 04000000 00000000 00000000 00000000 00000000 00000000
ffff8ba902af9ec0 66537160 S Bi:1:003:1 -115 512 <
ffff8ba902af9ec0 66537191 C Bi:1:003:1 0 0
ffff8ba902af9ec0 66587268 S Bo:1:003:1 -115 512 = a9e7d666 483b1adc 50191acf 0d1aaac7 792ea702 d586b82d 46daaf6b 3b10d1cd
ffff8ba902af9ec0 66587298 C Bo:1:003:1 0 512 >
ffff8ba902af9ec0 66587304 S Bi:1:003:1 -115 512 <
ffff8ba902af9ec0 66587534 C Bi:1:003:1 0 512 = 7ac8f34c 00000000 04000000 00000000 00000000 00000000 00000000 00000000
ffff8ba902af9ec0 66587539 S Bi:1:003:1 -115 512 <
ffff8ba902af9ec0 66587574 C Bi:1:003:1 0 0
ffff8ba902af9ec0 66637653 S Bo:1:003:1 -115 512 = d27a6bea ce45fd8d 11093ed6 994c5f07 8a7e4d08 7d5ab9dd 2db726f4 0b065b60
ffff8ba902af9ec0 66637687 C Bo:1:003:1 0 512 >
ffff8ba902af9ec0 66637693 S Bi:1:003:1 -115 512 <
ffff8ba902af9ec0 66637893 C Bi:1:003:1 0 512 = 7ac8254d 00000000 03000000 00000000 00000000 00000000 00000000 00000000
ffff8ba902af9ec0 66637899 S Bi:1:003:1 -115 512 <
ffff8ba902af9ec0 66637932 C Bi:1:003:1 0 0
ffff8ba902af9ec0 66688051 S Bo:1:003:1 -115 512 = 84becc4d 0e897b13 a1db4b2e 8e36d1b7 d900cc0d 0ea9b095 62c8a174 5210df61
ffff8ba902af9ec0 66688085 C Bo:1:003:1 0 512 >
ffff8ba902af9ec0 66688099 S Bi:1:003:1 -115 512 <
ffff8ba902af9ec0 66688325 C Bi:1:003:1 0 512 = 7ac8584d 00000000 03000000 00000000 00000000 00000000 00000000 00000000
ffff8ba902af9ec0 66688348 S Bi:1:003:1 -115 512 <
ffff8ba902af9ec0 66688371 C Bi:1:003:1 0 0
ffff8ba902af9ec0 66738488 S Bo:1:003:1 -115 512 = 2a2b86c2 fc265b1b 8ee2fd36 35ec1172 d6a30b18 4238c0f1 bed1d5d6 eb54a9f4
ffff8ba902af9ec0 66738538 C Bo:1:003:1 0 512 >
ffff8ba902af9ec0 66738555 S Bi:1:003:1 -115 512 <
ffff8ba902af9ec0 66738748 C Bi:1:003:1 0 512 = 7ac88a4d 00000000 03000000 00000000 00000000 00000000 00000000 00000000
ffff8ba902af9ec0 66738774 S Bi:1:003:1 -115 512 <
ffff8ba902af9ec0 66738805 C Bi:1:003:1 0 0
ffff8ba902af9ec0 66788918 S Bo:1:003:1 -115 512 = d6e8a239 cc1024d7 3da788b4 62f292f3 df61a9d3 e0777136 833522de 2384b0d7
ffff8ba902af9ec0 66788967 C Bo:1:003:1 0 512 >
ffff8ba902af9ec0 66788979 S Bi:1:003:1 -115 512 <
ffff8ba902af9ec0 66789257 C Bi:1:003:1 0 512 = 7ac8bc4d 00000000 03000000 00000000 00000000 00000000 00000000 00000000
ffff8ba902af9ec0 66789282 S Bi:1:003:1 -115 512 <
ffff8ba902af9ec0 66789313 C Bi:1:003:1 0 0
ffff8ba902af9ec0 66839420 S Bo:1:003:1 -115 512 = 4a2cb769 d7bd29b7 7a7b8875 889f6268 45331f7b a9bcf56b 617c3456 cba6a143
ffff8ba902af9ec0 66839463 C Bo:1:003:1 0 512 >
ffff8ba9566a7d40 66839483 S Bi:1:003:1 -115 512 <
ffff8ba9566a7d40 66839678 C Bi:1:003:1 0 512 = 7ac8ef4d 00000000 03000000 00000000 00000000 00000000 00000000 00000000
ffff8ba9250dde00 66839707 S Bi:1:003:1 -115 512 <
ffff8ba9250dde00 66839722 C Bi:1:003:1 0 0
ffff8ba9246e6b40 66889849 S Bo:1:003:1 -115 512 = 04a16ab7 0ff8b33c 67782d5c 5eeb7a98 97f185c6 9f499f64 15085573 5c6536c1
ffff8ba9246e6b40 66889905 C Bo:1:003:1 0 512 >
ffff8ba9246e6b40 66889921 S Bi:1:003:1 -115 512 <
ffff8ba9246e6b40 66890139 C Bi:1:003:1 0 512 = 7ac8214e 00000000 02000000 00000000 00000000 00000000 00000000 00000000
ffff8ba9246e6b40 66890166 S Bi:1:003:1 -115 512 <
ffff8ba9246e6b40 66890197 C Bi:1:003:1 0 0
ffff8ba9246e6b40 66890267 S Bo:1:003:1 -115 56336 = 40a73f83 b4abfc7e 7cdcedff d634484a 08386199 b0881cb9 180bec94 dd09ecea
ffff8ba9246e6b40 66891728 C Bo:1:003:1 0 56336 >
ffff8ba9246e6b40 66891755 S Bi:1:003:1 -115 512 <
ffff8ba9246e6b40 66892173 C Bi:1:003:1 0 512 = 79c8224e 00000000 03000000 00000000 00000000 00000000 00000000 00000000
ffff8ba9246e6b40 66892206 S Bi:1:003:1 -115 512 <
ffff8ba9246e6b40 66892229 C Bi:1:003:1 0 0
ffff8ba9246e6b40 66892292 S Bo:1:003:1 -115 58630 = 8248bab8 5cc5c0ce f9d7dfad c15641b7 e2c01df4 71375ca5 b40f3801 3cc50afc
ffff8ba9246e6b40 66895589 C Bo:1:003:1 0 58630 >
ffff8ba9246e6b40 66895599 S Bi:1:003:1 -115 512 <
ffff8ba9246e6b40 66896017 C Bi:1:003:1 0 512 = 79c8244e 00000000 04000000 00000000 00000000 00000000 00000000 00000000
ffff8ba9246e6b40 66896030 S Bi:1:003:1 -115 512 <
ffff8ba9246e6b40 66896041 C Bi:1:003:1 0 0
ffff8ba9246e6b40 66896067 S Bo:1:003:1 -115 512 = f5acdf94 4443658f 68b04c44 2a4a615b 1b287474 905a1b3a 740ba6af 7791fdb5
ffff8ba9246e6b40 66896128 C Bo:1:003:1 0 512 >
ffff8ba9246e6b40 66896137 S Bi:1:003:1 -115 512 <
ffff8ba9246e6b40 66896288 C Bi:1:003:1 0 512 = 7ac8284e 00000000 04000000 00000000 00000000 00000000 00000000 00000000
ffff8ba9246e6b40 66896297 S Bi:1:003:1 -115 512 <
ffff8ba9246e6b40 66896310 C Bi:1:003:1 0 0
ffff8ba9246e6b40 66946387 S Bo:1:003:1 -115 512 = a06a7851 a1dbbaa5 34953ecf 7d3e4c8f c4178f8b 34fdc0e8 2350fb80 c251bfe8
ffff8ba9246e6b40 66946429 C Bo:1:003:1 0 512 >
ffff8ba9246e6b40 66946438 S Bi:1:003:1 -115 512 <
ffff8ba9246e6b40 66946649 C Bi:1:003:1 0 512 = 7ac85a4e 00000000 04000000 00000000 00000000 00000000 00000000 00000000
ffff8ba9246e6b40 66946658 S Bi:1:003:1 -115 512 <
ffff8ba9246e6b40 66946681 C Bi:1:003:1 0 0
ffff8ba9246e6b40 66996760 S Bo:1:003:1 -115 512 = de29953a f49b94e7 063557b4 20911178 9b2fc9d1 96f1d8e4 1bdce7eb 667d5a8f
ffff8ba9246e6b40 66996806 C Bo:1:003:1 0 512 >
ffff8ba9246e6b40 66996814 S Bi:1:003:1 -115 512 <
ffff8ba9246e6b40 66997012 C Bi:1:003:1 0 512 = 7ac88c4e 00000000 04000000 00000000 00000000 00000000 00000000 00000000
ffff8ba9246e6b40 66997021 S Bi:1:003:1 -115 512 <
ffff8ba9246e6b40 66997033 C Bi:1:003:1 0 0
ffff8ba9246e6b40 67047110 S Bo:1:003:1 -115 512 = 5efb3625 02be8821 9e3e2d2a d5120137 e501ced3 56223c64 fb4b164b 11d8a48f
ffff8ba9246e6b40 67047160 C Bo:1:003:1 0 512 >
ffff8ba9246e6b40 67047168 S Bi:1:003:1 -115 512 <
ffff8ba9246e6b40 67047388 C Bi:1:003:1 0 512 = 7ac8bf4e 00000000 04000000 00000000 00000000 00000000 00000000 00000000
ffff8ba9246e6b40 67047397 S Bi:1:003:1 -115 512 <
ffff8ba9246e6b40 67047411 C Bi:1:003:1 0 0
ffff8ba9246e6b40 67097489 S Bo:1:003:1 -115 512 = 23d3ff97 3061f1fc 32307424 801759ef bfba84a3 64b49de3 94c9d1e4 930104e9
ffff8ba9246e6b40 67097535 C Bo:1:003:1 0 512 >
ffff8ba9246e6b40 67097543 S Bi:1:003:1 -115 512 <
ffff8ba9246e6b40 67098250 C Bi:1:003:1 0 512 = 7ac8f14e 00000000 04000000 00000000 00000000 00000000 00000000 00000000
ffff8ba9246e6b40 67098260 S Bi:1:003:1 -115 512 <
ffff8ba9246e6b40 67098282 C Bi:1:003:1 0 0
ffff8ba954973b00 67148338 S Bo:1:003:1 -115 512 = 4812b065 cbb0b579 d754cc95 fc12baf2 aecc2ec1 063daf52 eaa88530 b954764a
ffff8ba954973b00 67148386 C Bo:1:003:1 0 512 >
ffff8ba954973b00 67148397 S Bi:1:003:1 -115 512 <
ffff8ba954973b00 67148595 C Bi:1:003:1 0 512 = 7ac8244f 00000000 04000000 00000000 00000000 00000000 00000000 00000000
ffff8ba954973b00 67148604 S Bi:1:003:1 -115 512 <
ffff8ba954973b00 67148616 C Bi:1:003:1 0 0
ffff8ba954973b00 67198700 S Bo:1:003:1 -115 512 = 8f805c6b 338f2b03 461e1b46 7269f4f4 2027e246 b8261d51 d0e57f0f 9944e06e
ffff8ba954973b00 67198760 C Bo:1:003:1 0 512 >
ffff8ba954973b00 67198771 S Bi:1:003:1 -115 512 <
ffff8ba954973b00 67198964 C Bi:1:003:1 0 512 = 7ac8564f 00000000 03000000 00000000 00000000 00000000 00000000 00000000
ffff8ba954973b00 67198974 S Bi:1:003:1 -115 512 <
ffff8ba954973b00 67198996 C Bi:1:003:1 0 0
ffff8ba902a42540 67249081 S Bo:1:003:1 -115 512 = e9e440be 439f4452 49bced51 d029cd15 8deda3f4 d37a7d3f c05b93e1 01071447
ffff8ba902a42540 67249136 C Bo:1:003:1 0 512 >
ffff8ba902a42540 67249147 S Bi:1:003:1 -115 512 <
ffff8ba902a42540 67249326 C Bi:1:003:1 0 512 = 7ac8894f 00000000 03000000 00000000 00000000 00000000 00000000 00000000
ffff8ba902a42540 67249335 S Bi:1:003:1 -115 512 <
ffff8ba902a42540 67249357 C Bi:1:003:1 0 0
ffff8ba902a42540 67299442 S Bo:1:003:1 -115 512 = e9e136e9 a17a7b59 5f64a9c2 61b94e1f a6d3cf01 39a43cfe 384d80a0 d425e9b3
ffff8ba902a42540 67299488 C Bo:1:003:1 0 512 >
ffff8ba902a42540 67299499 S Bi:1:003:1 -115 512 <
ffff8ba902a42540 67299700 C Bi:1:003:1 0 512 = 7ac8bb4f 00000000 03000000 00000000 00000000 00000000 00000000 00000000
ffff8ba902a42540 67299709 S Bi:1:003:1 -115 512 <
ffff8ba902a42540 67299731 C Bi:1:003:1 0 0
ffff8ba902a42540 67349810 S Bo:1:003:1 -115 512 = d046f64e c2409f49 dad7f888 71195d59 7813ed18 490185ec 5593821d c616d3b4
ffff8ba902a42540 67349853 C Bo:1:003:1 0 512 >
ffff8ba9250dd440 67349870 S Bi:1:003:1 -115 512 <
ffff8ba9250dd440 67350060 C Bi:1:003:1 0 512 = 7ac8ed4f 00000000 03000000 00000000 00000000 00000000 00000000 00000000
ffff8ba9a6102900 67350073 S Bi:1:003:1 -115 512 <
ffff8ba9a6102900 67350084 C Bi:1:003:1 0 0
ffff8ba954973ec0 67400168 S Bo:1:003:1 -115 512 = 7c2d1e93 72ba4c5e c11f0b49 948fd9ff 5818670a f4468385 191ee2e6 3da661ab
ffff8ba954973ec0 67400214 C Bo:1:003:1 0 512 >
ffff8ba954973ec0 67400224 S Bi:1:003:1 -115 512 <
ffff8ba954973ec0 67400422 C Bi:1:003:1 0 512 = 7ac82050 00000000 03000000 00000000 00000000 00000000 00000000 00000000
ffff8ba954973ec0 67400432 S Bi:1:003:1 -115 512 <
ffff8ba954973ec0 67400454 C Bi:1:003:1 0 0
ffff8ba954973ec0 67450533 S Bo:1:003:1 -115 512 = 213e3583 45e897dd aec51077 7a565071 ff403470 4e9694c1 cd925164 f2a05521
ffff8ba954973ec0 67450579 C Bo:1:003:1 0 512 >
ffff8ba954973ec0 67450588 S Bi:1:003:1 -115 512 <
ffff8ba954973ec0 67450807 C Bi:1:003:1 0 512 = 7ac85250 00000000 03000000 00000000 00000000 00000000 00000000 00000000
ffff8ba954973ec0 67450816 S Bi:1:003:1 -115 512 <
ffff8ba954973ec0 67450839 C Bi:1:003:1 0 0
ffff8ba94077c3c0 67500919 S Bo:1:003:1 -115 512 = 0e72e7a7 6bc71628 e5836506 709778b5 40575e50 1f08d597 95002a59 eb20bbf8
ffff8ba94077c3c0 67500965 C Bo:1:003:1 0 512 >
ffff8ba94077c3c0 67500975 S Bi:1:003:1 -115 512 <
ffff8ba94077c3c0 67501160 C Bi:1:003:1 0 512 = 7ac88450 00000000 02000000 00000000 00000000 00000000 00000000 00000000
ffff8ba94077c3c0 67501168 S Bi:1:003:1 -115 512 <
ffff8ba94077c3c0 67501191 C Bi:1:003:1 0 0
ffff8ba94077c3c0 67501234 S Bo:1:003:1 -115 58031 = b80336c0 e2d4a04e bfc584da f24917c7 37ed0bf7 bab8274c 0297be6b 523b7190
ffff8ba94077c3c0 67502682 C Bo:1:003:1 0 58031 >
ffff8ba94077c3c0 67502693 S Bi:1:003:1 -115 512 <
ffff8ba94077c3c0 67503135 C Bi:1:003:1 0 512 = 79c88550 00000000 03000000 00000000 00000000 00000000 00000000 00000000
ffff8ba94077c3c0 67503155 S Bi:1:003:1 -115 512 <
ffff8ba94077c3c0 67503167 C Bi:1:003:1 0 0
ffff8ba94077c3c0 67503198 S Bo:1:003:1 -115 56944 = f36323fd 1ad60f25 17229c35 862b8143 0c79bcfe fe9e4abd ebdece0e bd327062
ffff8ba94077c3c0 67504579 C Bo:1:003:1 0 56944 >
ffff8ba94077c3c0 67504589 S Bi:1:003:1 -115 512 <
ffff8ba94077c3c0 67505012 C Bi:1:003:1 0 512 = 79c88750 00000000 04000000 00000000 00000000 00000000 00000000 00000000
ffff8ba94077c3c0 67505025 S Bi:1:003:1 -115 512 <
ffff8ba94077c3c0 67505037 C Bi:1:003:1 0 0
ffff8ba94077c3c0 67505062 S Bo:1:003:1 -115 512 = 11121b8d b93f1ce7 4580f939 a1d8dc05 d4fdfcc6 01c85429 88258d67 47510dd7
ffff8ba94077c3c0 67505098 C Bo:1:003:1 0 512 >
ffff8ba94077c3c0 67505104 S Bi:1:003:1 -115 512 <
ffff8ba94077c3c0 67505262 C Bi:1:003:1 0 512 = 7ac88950 00000000 04000000 00000000 00000000 00000000 00000000 00000000
ffff8ba94077c3c0 67505269 S Bi:1:003:1 -115 512 <
ffff8ba94077c3c0 67505302 C Bi:1:003:1 0 0
ffff8ba949880c00 67555394 S Bo:1:003:1 -115 512 = 897eee15 e9eb10d8 83d4fd09 48c2a628 7ffca78c bd4b58b9 66d9d3a4 59b5337f
ffff8ba949880c00 67555437 C Bo:1:003:1 0 512 >
ffff8ba949880c00 67555447 S Bi:1:003:1 -115 512 <
ffff8ba949880c00 67555670 C Bi:1:003:1 0 512 = 7ac8bb50 00000000 04000000 00000000 00000000 00000000 00000000 00000000
ffff8ba949880c00 67555679 S Bi:1:003:1 -115 512 <
ffff8ba949880c00 67555691 C Bi:1:003:1 0 0
ffff8ba949880c00 67605770 S Bo:1:003:1 -115 512 = ff1de14a dbb5de06 4918da0e e6b7b020 00d70b1a a0e82ae3 732d0259 c1a587e9
ffff8ba949880c00 67605816 C Bo:1:003:1 0 512 >
ffff8ba949880c00 67605825 S Bi:1:003:1 -115 512 <
ffff8ba949880c00 67606023 C Bi:1:003:1 0 512 = 7ac8ed50 00000000 04000000 00000000 00000000 00000000 00000000 00000000
ffff8ba949880c00 67606031 S Bi:1:003:1 -115 512 <
ffff8ba949880c00 67606044 C Bi:1:003:1 0 0
ffff8ba949880c00 67656122 S Bo:1:003:1 -115 512 = 33978267 f552b94c 2be14a6d ed3c540a 72ce5cdd d4a45cc6 de49670e 1cf4676a
ffff8ba949880c00 67656169 C Bo:1:003:1 0 512 >
ffff8ba949880c00 67656177 S Bi:1:003:1 -115 512 <
ffff8ba949880c00 67656400 C Bi:1:003:1 0 512 = 7ac82051 00000000 04000000 00000000 00000000 00000000 00000000 00000000
ffff8ba949880c00 67656408 S Bi:1:003:1 -115 512 <
ffff8ba949880c00 67656433 C Bi:1:003:1 0 0
ffff8ba949880c00 67706513 S Bo:1:003:1 -115 512 = 16acdd3e 62d78c02 639fbfca 4176f83e 227f3b9c ed1f962b 7b0fbed3 342507c5
ffff8ba949880c00 67706559 C Bo:1:003:1 0 512 >
ffff8ba949880c00 67706567 S Bi:1:003:1 -115 512 <
ffff8ba949880c00 67706760 C Bi:1:003:1 0 512 = 7ac85251 00000000 04000000 00000000 00000000 00000000 00000000 00000000
ffff8ba949880c00 67706768 S Bi:1:003:1 -115 512 <
ffff8ba949880c00 67706790 C Bi:1:003:1 0 0
ffff8ba949880c00 67756869 S Bo:1:003:1 -115 512 = 19dbe2e4 6f5fa305 b6f8a181 b2f052af 7488bf2a c78c4aa5 0b853d40 4c709fdb
ffff8ba949880c00 67756915 C Bo:1:003:1 0 512 >
ffff8ba949880c00 67756923 S Bi:1:003:1 -115 512 <
ffff8ba949880c00 67757139 C Bi:1:003:1 0 512 = 7ac88451 00000000 04000000 00000000 00000000 00000000 00000000 00000000
ffff8ba949880c00 67757148 S Bi:1:003:1 -115 512 <
ffff8ba949880c00 67757161 C Bi:1:003:1 0 0
ffff8ba949880c00 67807240 S Bo:1:003:1 -115 512 = 09fde671 29930333 5433a8eb 74d9ebf6 7eb2054c 20c7d2f3 3cf54efa d9807644
ffff8ba949880c00 67807282 C Bo:1:003:1 0 512 >
ffff8ba949880c00 67807291 S Bi:1:003:1 -115 512 <
ffff8ba949880c00 67807493 C Bi:1:003:1 0 512 = 7ac8b751 00000000 03000000 00000000 00000000 00000000 00000000 00000000
ffff8ba949880c00 67807502 S Bi:1:003:1 -115 512 <
ffff8ba949880c00 67807514 C Bi:1:003:1 0 0
ffff8ba949880c00 67857593 S Bo:1:003:1 -115 512 = c21a5589 5b417bb3 692e9e34 9453dbc6 25ea1b25 c2caf9bb 686644e2 3b9f2c63
ffff8ba949880c00 67857642 C Bo:1:003:1 0 512 >
ffff8ba949880c00 67857650 S Bi:1:003:1 -115 512 <
ffff8ba949880c00 67857877 C Bi:1:003:1 0 512 = 7ac8e951 00000000 03000000 00000000 00000000 00000000 00000000 00000000
ffff8ba949880c00 67857886 S Bi:1:003:1 -115 512 <
ffff8ba949880c00 67857898 C Bi:1:003:1 0 0
ffff8ba949880c00 67907978 S Bo:1:003:1 -115 512 = 9eeec765 119fc9dd b5d7b9aa 54915fc8 05f8e0c2 22dc4a9a f09ed907 41e6ae51
ffff8ba949880c00 67908013 C Bo:1:003:1 0 512 >
ffff8ba949880c00 67908020 S Bi:1:003:1 -115 512 <
ffff8ba949880c00 67908234 C Bi:1:003:1 0 512 = 7ac81b52 00000000 03000000 00000000 00000000 00000000 00000000 00000000
ffff8ba949880c00 67908240 S Bi:1:003:1 -115 512 <
ffff8ba949880c00 67908276 C Bi:1:003:1 0 0
ffff8ba949880c00 67958383 S Bo:1:003:1 -115 512 = b5482e48 ca6e541a 74150b5c 329bb8d6 2657f533 69597fc1 a0f8b30b 5e8dd00e
ffff8ba949880c00 67958427 C Bo:1:003:1 0 512 >
ffff8ba949880c00 67958440 S Bi:1:003:1 -115 512 <
ffff8ba949880c00 67958618 C Bi:1:003:1 0 512 = 7ac84e52 00000000 03000000 00000000 00000000 00000000 00000000 00000000
ffff8ba949880c00 67958644 S Bi:1:003:1 -115 512 <
ffff8ba949880c00 67958676 C Bi:1:003:1 0 0
ffff8ba949880c00 68008755 S Bo:1:003:1 -115 512 = 1c1865b8 8652f328 e484f5f3 3bc46093 5715f755 f1a0c1ea e7fbe8a3 4df93453
ffff8ba949880c00 68008802 C Bo:1:003:1 0 512 >
ffff8ba949880c00 68008811 S Bi:1:003:1 -115 512 <
ffff8ba949880c00 68009017 C Bi:1:003:1 0 512 = 7ac88052 00000000 03000000 00000000 00000000 00000000 00000000 00000000
ffff8ba949880c00 68009026 S Bi:1:003:1 -115 512 <
ffff8ba949880c00 68009045 C Bi:1:003:1 0 0
ffff8ba949880c00 68059124 S Bo:1:003:1 -115 512 = db35acc7 90cce5cc 8bdde09a c0913de0 18bb2557 66ec2f9f 53a73396 c1722455
ffff8ba949880c00 68059155 C Bo:1:003:1 0 512 >
ffff8ba949880c00 68059161 S Bi:1:003:1 -115 512 <
ffff8ba949880c00 68059393 C Bi:1:003:1 0 512 = 7ac8b352 00000000 02000000 00000000 00000000 00000000 00000000 00000000
ffff8ba949880c00 68059399 S Bi:1:003:1 -115 512 <
ffff8ba949880c00 68059433 C Bi:1:003:1 0 0
ffff8ba949880c00 68059471 S Bo:1:003:1 -115 56640 = bf6e1280 1acdd3fd b7b9eda8 59cf50c7 4ba5a2be 244bf64b 7794e706 f8ccfa5d
ffff8ba949880c00 68061169 C Bo:1:003:1 0 56640 >
ffff8ba949880c00 68061175 S Bi:1:003:1 -115 512 <
ffff8ba949880c00 68061574 C Bi:1:003:1 0 512 = 79c8b452 00000000 03000000 00000000 00000000 00000000 00000000 00000000
ffff8ba949880c00 68061595 S Bi:1:003:1 -115 512 <
ffff8ba949880c00 68061617 C Bi:1:003:1 0 0
ffff8ba949880c00 68061648 S Bo:1:003:1 -115 58549 = 82877edf 0794d91f a89ab211 86685115 bd91895e bbe13ff1 511ea20e 045d4292
ffff8ba949880c00 68065079 C Bo:1:003:1 0 58549 >
ffff8ba949880c00 68065085 S Bi:1:003:1 -115 512 <
ffff8ba949880c00 68065488 C Bi:1:003:1 0 512 = 79c8b552 00000000 04000000 00000000 00000000 00000000 00000000 00000000
ffff8ba949880c00 68065499 S Bi:1:003:1 -115 512 <
ffff8ba949880c00 68065528 C Bi:1:003:1 0 0
ffff8ba949880c00 68065553 S Bo:1:003:1 -115 512 = 13f6d6ab 4222842e da36b589 a7e50b73 4419cb58 bc6c961e 734f61f5 fa2ae350
ffff8ba949880c00 68065589 C Bo:1:003:1 0 512 >
ffff8ba949880c00 68065595 S Bi:1:003:1 -115 512 <
ffff8ba949880c00 68065756 C Bi:1:003:1 0 512 = 7ac8b952 00000000 04000000 00000000 00000000 00000000 00000000 00000000
ffff8ba949880c00 68065762 S Bi:1:003:1 -115 512 <
ffff8ba949880c00 68065797 C Bi:1:003:1 0 0
ffff8ba949880c00 68115907 S Bo:1:003:1 -115 512 = 731628a3 556a9e88 b3608bf7 03c9be97 927e2b82 1da9f910 1ef1169a a792612b
ffff8ba949880c00 68115943 C Bo:1:003:1 0 512 >
ffff8ba949880c00 68115953 S Bi:1:003:1 -115 512 <
ffff8ba949880c00 68116207 C Bi:1:003:1 0 512 = 7ac8eb52 00000000 04000000 00000000 00000000 00000000 00000000 00000000
ffff8ba949880c00 68116229 S Bi:1:003:1 -115 512 <
ffff8ba949880c00 68116245 C Bi:1:003:1 0 0
ffff8ba949880c00 68166326 S Bo:1:003:1 -115 512 = b01722cc 2dd005cd b8049388 80958f89 38fa6d5d 0451406f 1b68b7dc 197c0798
ffff8ba949880c00 68166361 C Bo:1:003:1 0 512 >
ffff8ba949880c00 68166367 S Bi:1:003:1 -115 512 <
ffff8ba949880c00 68166537 C Bi:1:003:1 0 512 = 7ac81e53 00000000 04000000 00000000 00000000 00000000 00000000 00000000
ffff8ba949880c00 68166543 S Bi:1:003:1 -115 512 <
ffff8ba949880c00 68166577 C Bi:1:003:1 0 0
ffff8ba949880c00 68216657 S Bo:1:003:1 -115 512 = a2851574 90f0f689 c0370bf3 e9fe08bc 8b345f0d 57048efd 913751d4 a78b76fc
ffff8ba949880c00 68216692 C Bo:1:003:1 0 512 >
ffff8ba949880c00 68216699 S Bi:1:003:1 -115 512 <
ffff8ba949880c00 68216896 C Bi:1:003:1 0 512 = 7ac85053 00000000 04000000 00000000 00000000 00000000 00000000 00000000
ffff8ba949880c00 68216901 S Bi:1:003:1 -115 512 <
ffff8ba949880c00 68216932 C Bi:1:003:1 0 0
ffff8ba949880c00 68267020 S Bo:1:003:1 -115 512 = 7b55723a 3a7b7887 ed238cf9 b217922c a0e9e955 f6eb19ac ef16fb77 1cc37d1f
ffff8ba949880c00 68267055 C Bo:1:003:1 0 512 >
ffff8ba949880c00 68267062 S Bi:1:003:1 -115 512 <
ffff8ba949880c00 68267257 C Bi:1:003:1 0 512 = 7ac88353 00000000 04000000 00000000 00000000 00000000 00000000 00000000
ffff8ba949880c00 68267264 S Bi:1:003:1 -115 512 <
ffff8ba949880c00 68267297 C Bi:1:003:1 0 0
ffff8ba949880c00 68317375 S Bo:1:003:1 -115 512 = 783217c5 631b5770 e2ce38ca b299d640 4d981048 ef7381a8 fb8b3ff3 d7e07775
ffff8ba949880c00 68317410 C Bo:1:003:1 0 512 >
ffff8ba949880c00 68317416 S Bi:1:003:1 -115 512 <
ffff8ba949880c00 68317612 C Bi:1:003:1 0 512 = 7ac8b553 00000000 04000000 00000000 00000000 00000000 00000000 00000000
ffff8ba949880c00 68317618 S Bi:1:003:1 -115 512 <
ffff8ba949880c00 68317652 C Bi:1:003:1 0 0
ffff8ba949880c00 68367730 S Bo:1:003:1 -115 512 = b87d49dc ee64cc21 e5dc6617 3c54bf1c 0cbb4e53 63b58138 73b5f00b 234fb90c
ffff8ba949880c00 68367764 C Bo:1:003:1 0 512 >
ffff8ba949880c00 68367770 S Bi:1:003:1 -115 512 <
ffff8ba949880c00 68367968 C Bi:1:003:1 0 512 = 7ac8e753 00000000 03000000 00000000 00000000 00000000 00000000 00000000
ffff8ba949880c00 68367973 S Bi:1:003:1 -115 512 <
ffff8ba949880c00 68368008 C Bi:1:003:1 0 0
ffff8ba954973b00 68418078 S Bo:1:003:1 -115 512 = 8b35a7e0 7a631682 3e07f7dc 035c03e4 0164c918 f22f354e 5349ccc3 77dfcc3e
ffff8ba954973b00 68418113 C Bo:1:003:1 0 512 >
ffff8ba954973b00 68418118 S Bi:1:003:1 -115 512 <
ffff8ba954973b00 68418335 C Bi:1:003:1 0 512 = 7ac81a54 00000000 03000000 00000000 00000000 00000000 00000000 00000000
ffff8ba954973b00 68418341 S Bi:1:003:1 -115 512 <
ffff8ba954973b00 68418375 C Bi:1:003:1 0 0
ffff8ba954973b00 68468460 S Bo:1:003:1 -115 512 = b6555727 dac00134 2ba2de00 c4790879 d79d4319 db1b8d9e 282f70ee e0b072c1
ffff8ba954973b00 68468496 C Bo:1:003:1 0 512 >
ffff8ba954973b00 68468507 S Bi:1:003:1 -115 512 <
ffff8ba954973b00 68468696 C Bi:1:003:1 0 512 = 7ac84c54 00000000 03000000 00000000 00000000 00000000 00000000 00000000
ffff8ba954973b00 68468703 S Bi:1:003:1 -115 512 <
ffff8ba954973b00 68468733 C Bi:1:003:1 0 0
ffff8ba954973b00 68518814 S Bo:1:003:1 -115 512 = e3f782db 7c4254f4 e52ed0bc c7d0e776 ad466bc1 dd5820b0 8f557fde 31d7a6fa
ffff8ba954973b00 68518849 C Bo:1:003:1 0 512 >
ffff8ba954973b00 68518856 S Bi:1:003:1 -115 512 <
ffff8ba954973b00 68519073 C Bi:1:003:1 0 512 = 7ac87e54 00000000 03000000 00000000 00000000 00000000 00000000 00000000
ffff8ba954973b00 68519079 S Bi:1:003:1 -115 512 <
ffff8ba954973b00 68519113 C Bi:1:003:1 0 0
ffff8ba954973b00 68569194 S Bo:1:003:1 -115 512 = 74930b7f 163b7bd8 b7977db1 73647d04 87f36759 6eb2bb89 ac6c7211 64585cda
ffff8ba954973b00 68569230 C Bo:1:003:1 0 512 >
ffff8ba954973b00 68569237 S Bi:1:003:1 -115 512 <
ffff8ba954973b00 68569436 C Bi:1:003:1 0 512 = 7ac8b154 00000000 03000000 00000000 00000000 00000000 00000000 00000000
ffff8ba954973b00 68569442 S Bi:1:003:1 -115 512 <
ffff8ba954973b00 68569476 C Bi:1:003:1 0 0
ffff8ba949880c00 68619563 S Bo:1:003:1 -115 512 = 7f7a3f53 8b8a3ea3 4619a80d d414d797 5faf6292 eac52829 2fc36024 222b9da9
ffff8ba949880c00 68619592 C Bo:1:003:1 0 512 >
ffff8ba949880c00 68619599 S Bi:1:003:1 -115 512 <
ffff8ba949880c00 68619822 C Bi:1:003:1 0 512 = 7ac8e354 00000000 03000000 00000000 00000000 00000000 00000000 00000000
ffff8ba949880c00 68619828 S Bi:1:003:1 -115 512 <
ffff8ba949880c00 68619856 C Bi:1:003:1 0 0
ffff8ba94077c3c0 68669943 S Bo:1:003:1 -115 512 = 8256e6ca 8c97f3b3 2277fb12 cd9c070e 5df022d3 9e0f4ec5 bb893596 416580d7
ffff8ba94077c3c0 68669978 C Bo:1:003:1 0 512 >
ffff8ba94077c3c0 68669985 S Bi:1:003:1 -115 512 <
ffff8ba94077c3c0 68670165 C Bi:1:003:1 0 512 = 7ac81555 00000000 02000000 00000000 00000000 00000000 00000000 00000000
ffff8ba94077c3c0 68670171 S Bi:1:003:1 -115 512 <
ffff8ba94077c3c0 68670202 C Bi:1:003:1 0 0
ffff8ba94077c3c0 68670246 S Bo:1:003:1 -115 54917 = acc99269 cc8ac6c9 880d1918 fdec7eea 6cee10df fb10c726 993fd132 904dbf99
ffff8ba94077c3c0 68671607 C Bo:1:003:1 0 54917 >
ffff8ba94077c3c0 68671614 S Bi:1:003:1 -115 512 <
ffff8ba94077c3c0 68672120 C Bi:1:003:1 0 512 = 79c81655 00000000 03000000 00000000 00000000 00000000 00000000 00000000
ffff8ba94077c3c0 68672145 S Bi:1:003:1 -115 512 <
ffff8ba94077c3c0 68672174 C Bi:1:003:1 0 0
ffff8ba94077c3c0 68672210 S Bo:1:003:1 -115 58632 = 50180f81 9d0d7107 20b43321 afbf731e 93bc73af 1a2d23f5 2a6663d2 3270ae06
ffff8ba94077c3c0 68673698 C Bo:1:003:1 0 58632 >
ffff8ba94077c3c0 68673706 S Bi:1:003:1 -115 512 <
ffff8ba94077c3c0 68674246 C Bi:1:003:1 0 512 = 79c81855 00000000 04000000 00000000 00000000 00000000 00000000 00000000
ffff8ba94077c3c0 68674258 S Bi:1:003:1 -115 512 <
ffff8ba94077c3c0 68674285 C Bi:1:003:1 0 0
ffff8ba94077c3c0 68674310 S Bo:1:003:1 -115 512 = 319a189e d17f55ac 9712e2c2 87d34baf 71305a9c 6f2f6eb9 058051a5 d4b45164
ffff8ba94077c3c0 68674346 C Bo:1:003:1 0 512 >
ffff8ba94077c3c0 68674351 S Bi:1:003:1 -115 512 <
ffff8ba94077c3c0 68674513 C Bi:1:003:1 0 512 = 7ac81a55 00000000 04000000 00000000 00000000 00000000 00000000 00000000
ffff8ba94077c3c0 68674519 S Bi:1:003:1 -115 512 <
ffff8ba94077c3c0 68674554 C Bi:1:003:1 0 0
ffff8ba94077c3c0 68724657 S Bo:1:003:1 -115 512 = 0d0bf377 b9d75350 968737fb f515f3a4 7178c345 c3f7a3c0 1372fbe4 e24733b0
ffff8ba94077c3c0 68724694 C Bo:1:003:1 0 512 >
ffff8ba94077c3c0 68724703 S Bi:1:003:1 -115 512 <
ffff8ba94077c3c0 68724926 C Bi:1:003:1 0 512 = 7ac84c55 00000000 04000000 00000000 00000000 00000000 00000000 00000000
ffff8ba94077c3c0 68724935 S Bi:1:003:1 -115 512 <
ffff8ba94077c3c0 68724966 C Bi:1:003:1 0 0
ffff8ba94077c3c0 68775026 S Bo:1:003:1 -115 512 = 27a1fcff c5be55be 82d8b5ec 48e3b1a6 59761250 2e6a6cd7 655d6166 31a62574
ffff8ba94077c3c0 68775062 C Bo:1:003:1 0 512 >
ffff8ba94077c3c0 68775070 S Bi:1:003:1 -115 512 <
ffff8ba94077c3c0 68775265 C Bi:1:003:1 0 512 = 7ac87f55 00000000 04000000 00000000 00000000 00000000 00000000 00000000
ffff8ba94077c3c0 68775271 S Bi:1:003:1 -115 512 <
ffff8ba94077c3c0 68775305 C Bi:1:003:1 0 0
ffff8ba94077c3c0 68825382 S Bo:1:003:1 -115 512 = f3e7c5c3 df5459ef 80348d7c 628a8a11 937deed5 8c03e62a 2fe325ca 7cfd047f
ffff8ba94077c3c0 68825417 C Bo:1:003:1 0 512 >
ffff8ba94077c3c0 68825422 S Bi:1:003:1 -115 512 <
ffff8ba94077c3c0 68825646 C Bi:1:003:1 0 512 = 7ac8b155 00000000 04000000 00000000 00000000 00000000 00000000 00000000
ffff8ba94077c3c0 68825652 S Bi:1:003:1 -115 512 <
ffff8ba94077c3c0 68825686 C Bi:1:003:1 0 0
ffff8ba94077c3c0 68875795 S Bo:1:003:1 -115 512 = 0fe1396c ee1ec3aa ae9bad55 86dabc43 434b0b90 995f1bd7 de2a62d3 9dde692e
ffff8ba94077c3c0 68875835 C Bo:1:003:1 0 512 >
ffff8ba94077c3c0 68875851 S Bi:1:003:1 -115 512 <
ffff8ba94077c3c0 68876032 C Bi:1:003:1 0 512 = 7ac8e355 00000000 04000000 00000000 00000000 00000000 00000000 00000000
ffff8ba94077c3c0 68876043 S Bi:1:003:1 -115 512 <
ffff8ba94077c3c0 68876069 C Bi:1:003:1 0 0
ffff8ba94077c3c0 68926150 S Bo:1:003:1 -115 512 = 1b9022b3 80f0119e 6064445b 14ef2d3a a1291e9d 04106765 4501ad4e be53382c
ffff8ba94077c3c0 68926178 C Bo:1:003:1 0 512 >
ffff8ba91dd880c0 68926188 S Bi:1:003:1 -115 512 <
ffff8ba91dd880c0 68926407 C Bi:1:003:1 0 512 = 7ac81656 00000000 04000000 00000000 00000000 00000000 00000000 00000000
ffff8ba94987f500 68926416 S Bi:1:003:1 -115 512 <
ffff8ba94987f500 68926448 C Bi:1:003:1 0 0
ffff8ba91fa62000 68976529 S Bo:1:003:1 -115 512 = 8cd1243e a6781194 1d0bcf52 f1be5fd7 38226850 d8ff1724 997de98a 57148ba5
ffff8ba91fa62000 68976564 C Bo:1:003:1 0 512 >
ffff8ba91fa62000 68976570 S Bi:1:003:1 -115 512 <
ffff8ba91fa62000 68976768 C Bi:1:003:1 0 512 = 7ac84856 00000000 03000000 00000000 00000000 00000000 00000000 00000000
ffff8ba91fa62000 68976773 S Bi:1:003:1 -115 512 <
ffff8ba91fa62000 68976808 C Bi:1:003:1 0 0
ffff8ba91fa62000 69026885 S Bo:1:003:1 -115 512 = 36905725 d6e03a95 517b6603 c6a55700 72270b9d d69f6e2d 41249677 35532925
ffff8ba91fa62000 69026929 C Bo:1:003:1 0 512 >
ffff8ba91fa62000 69026938 S Bi:1:003:1 -115 512 <
ffff8ba91fa62000 69027158 C Bi:1:003:1 0 512 = 7ac87a56 00000000 03000000 00000000 00000000 00000000 00000000 00000000
ffff8ba91fa62000 69027167 S Bi:1:003:1 -115 512 <
ffff8ba91fa62000 69027190 C Bi:1:003:1 0 0
ffff8ba91fa62000 69077267 S Bo:1:003:1 -115 512 = 779ad210 9e2da615 912d411c 6c63659c a529402a 83b072b7 1ec8d05b e15ac9a2
ffff8ba91fa62000 69077305 C Bo:1:003:1 0 512 >
ffff8ba91fa62000 69077312 S Bi:1:003:1 -115 512 <
ffff8ba91fa62000 69077520 C Bi:1:003:1 0 512 = 7ac8ad56 00000000 03000000 00000000 00000000 00000000 00000000 00000000
ffff8ba91fa62000 69077532 S Bi:1:003:1 -115 512 <
ffff8ba91fa62000 69077560 C Bi:1:003:1 0 0
ffff8ba91fa62000 69127639 S Bo:1:003:1 -115 512 = 423fda9c fab86da3 a39f6719 a28538f5 1277584e 64efb847 ac5830ae d8555ef0
ffff8ba91fa62000 69127674 C Bo:1:003:1 0 512 >
ffff8ba91fa62000 69127679 S Bi:1:003:1 -115 512 <
ffff8ba91fa62000 69128273 C Bi:1:003:1 0 512 = 7ac8df56 00000000 03000000 00000000 00000000 00000000 00000000 00000000
ffff8ba91fa62000 69128279 S Bi:1:003:1 -115 512 <
ffff8ba91fa62000 69128313 C Bi:1:003:1 0 0
ffff8ba91fa62000 69178392 S Bo:1:003:1 -115 512 = 083a1a15 c674c526 6cecd481 61342bdf 8ef7700c a8a1b483 13f5d939 dd665757
ffff8ba91fa62000 69178425 C Bo:1:003:1 0 512 >
ffff8ba91fa62000 69178432 S Bi:1:003:1 -115 512 <
ffff8ba91fa62000 69178666 C Bi:1:003:1 0 512 = 7ac81257 00000000 03000000 00000000 00000000 00000000 00000000 00000000
ffff8ba91fa62000 69178671 S Bi:1:003:1 -115 512 <
ffff8ba91fa62000 69178706 C Bi:1:003:1 0 0
ffff8ba91fa62000 69228786 S Bo:1:003:1 -115 512 = c01ca8dc 0909af8c 815b2113 4c2399dc 26007a40 9762ca1b 5536d20e f493a77c
ffff8ba91fa62000 69228821 C Bo:1:003:1 0 512 >
ffff8ba91fa62000 69228828 S Bi:1:003:1 -115 512 <
ffff8ba91fa62000 69229072 C Bi:1:003:1 0 512 = 7ac84457 00000000 03000000 00000000 00000000 00000000 00000000 00000000
ffff8ba91fa62000 69229078 S Bi:1:003:1 -115 512 <
ffff8ba91fa62000 69229108 C Bi:1:003:1 0 0
ffff8ba91fa62000 69279187 S Bo:1:003:1 -115 512 = 21ca9c73 6ed577ee e166d103 eb5b0110 01fa2008 cfee1146 2f52cba0 33ff0c7e
ffff8ba91fa62000 69279222 C Bo:1:003:1 0 512 >
ffff8ba91fa62000 69279229 S Bi:1:003:1 -115 512 <
ffff8ba91fa62000 69279405 C Bi:1:003:1 0 512 = 7ac87757 00000000 02000000 00000000 00000000 00000000 00000000 00000000
ffff8ba91fa62000 69279410 S Bi:1:003:1 -115 512 <
ffff8ba91fa62000 69279449 C Bi:1:003:1 0 0
ffff8ba91fa62000 69279490 S Bo:1:003:1 -115 59253 = f6e992d4 5fc022b5 3f6fda77 7adc268e c284d8e5 6b52f29a 54bb6723 785fe6b1
ffff8ba91fa62000 69281070 C Bo:1:003:1 0 59253 >
ffff8ba91fa62000 69281077 S Bi:1:003:1 -115 512 <
ffff8ba91fa62000 69281437 C Bi:1:003:1 0 512 = 79c87857 00000000 03000000 00000000 00000000 00000000 00000000 00000000
ffff8ba91fa62000 69281453 S Bi:1:003:1 -115 512 <
ffff8ba91fa62000 69281475 C Bi:1:003:1 0 0
ffff8ba91fa62000 69281506 S Bo:1:003:1 -115 58627 = fa8c00a7 2fe55a5c 3aa93b65 694731a8 c82a15c5 b1af29ac eac1ea75 f96de240
ffff8ba91fa62000 69283057 C Bo:1:003:1 0 58627 >
ffff8ba91fa62000 69283070 S Bi:1:003:1 -115 512 <
ffff8ba91fa62000 69283438 C Bi:1:003:1 0 512 = 79c87957 00000000 04000000 00000000 00000000 00000000 00000000 00000000
ffff8ba91fa62000 69283454 S Bi:1:003:1 -115 512 <
ffff8ba91fa62000 69283477 C Bi:1:003:1 0 0
ffff8ba91fa62000 69283503 S Bo:1:003:1 -115 512 = 3107fb7a ad7cc61d a2897e09 8715e885 232d7f8a cb1a6c53 8b3e211c ae2d89cb
ffff8ba91fa62000 69283537 C Bo:1:003:1 0 512 >
ffff8ba91fa62000 69283542 S Bi:1:003:1 -115 512 <
ffff8ba91fa62000 69283694 C Bi:1:003:1 0 512 = 7ac87b57 00000000 04000000 00000000 00000000 00000000 00000000 00000000
ffff8ba91fa62000 69283699 S Bi:1:003:1 -115 512 <
ffff8ba91fa62000 69283732 C Bi:1:003:1 0 0
ffff8ba91fa62000 69333810 S Bo:1:003:1 -115 512 = 3beb3ddc 5a88881b a9e3759d 44b8e340 3cbda689 5b2e5301 417fdfc8 24081cfd
ffff8ba91fa62000 69333846 C Bo:1:003:1 0 512 >
ffff8ba91fa62000 69333852 S Bi:1:003:1 -115 512 <
ffff8ba91fa62000 69334055 C Bi:1:003:1 0 512 = 7ac8ad57 00000000 04000000 00000000 00000000 00000000 00000000 00000000
ffff8ba91fa62000 69334060 S Bi:1:003:1 -115 512 <
ffff8ba91fa62000 69334095 C Bi:1:003:1 0 0
ffff8ba91fa62000 69384175 S Bo:1:003:1 -115 512 = 2647e1bd 8fb0817a c106a3f3 4806354f 0a43e6ac b1eeefb7 9f9e0b04 2572e09a
ffff8ba91fa62000 69384224 C Bo:1:003:1 0 512 >
ffff8ba91fa62000 69384240 S Bi:1:003:1 -115 512 <
ffff8ba91fa62000 69384415 C Bi:1:003:1 0 512 = 7ac8e057 00000000 04000000 00000000 00000000 00000000 00000000 00000000
ffff8ba91fa62000 69384424 S Bi:1:003:1 -115 512 <
ffff8ba91fa62000 69384447 C Bi:1:003:1 0 0
ffff8ba91fa62000 69434526 S Bo:1:003:1 -115 512 = 5ce78278 177fec8d b36d408e 7763d483 c4e5f46b 3abc85fb fb72dbcb 377bb2e4
ffff8ba91fa62000 69434559 C Bo:1:003:1 0 512 >
ffff8ba9a6102540 69434569 S Bi:1:003:1 -115 512 <
ffff8ba9a6102540 69434802 C Bi:1:003:1 0 512 = 7ac81258 00000000 04000000 00000000 00000000 00000000 00000000 00000000
ffff8ba9246e6480 69434812 S Bi:1:003:1 -115 512 <
ffff8ba9246e6480 69434842 C Bi:1:003:1 0 0
ffff8ba90290c300 69484928 S Bo:1:003:1 -115 512 = d6b7def5 d05633a6 36867a92 b7aae58d 2978c521 67732291 990afafc 28b7a9dd
ffff8ba90290c300 69484967 C Bo:1:003:1 0 512 >
ffff8ba90290c300 69484975 S Bi:1:003:1 -115 512 <
ffff8ba90290c300 69485154 C Bi:1:003:1 0 512 = 7ac84458 00000000 04000000 00000000 00000000 00000000 00000000 00000000
ffff8ba90290c300 69485160 S Bi:1:003:1 -115 512 <
ffff8ba90290c300 69485194 C Bi:1:003:1 0 0
ffff8ba90290c300 69535275 S Bo:1:003:1 -115 512 = 72bb60cf c4efb967 81fe5ea4 2212caf9 b860ff17 ba3080cc b51f97a3 27f98774
ffff8ba90290c300 69535313 C Bo:1:003:1 0 512 >
ffff8ba90290c300 69535323 S Bi:1:003:1 -115 512 <
ffff8ba90290c300 69535514 C Bi:1:003:1 0 512 = 7ac87758 00000000 03000000 00000000 00000000 00000000 00000000 00000000
ffff8ba90290c300 69535520 S Bi:1:003:1 -115 512 <
ffff8ba90290c300 69535553 C Bi:1:003:1 0 0
ffff8ba90290c300 69585631 S Bo:1:003:1 -115 512 = ba354e2b 597cf194 644b98e1 b41a940b 25b603fc 3efe84da 9c78e394 2ef7e1d5
ffff8ba90290c300 69585676 C Bo:1:003:1 0 512 >
ffff8ba90290c300 69585684 S Bi:1:003:1 -115 512 <
ffff8ba90290c300 69585899 C Bi:1:003:1 0 512 = 7ac8a958 00000000 03000000 00000000 00000000 00000000 00000000 00000000
ffff8ba90290c300 69585908 S Bi:1:003:1 -115 512 <
ffff8ba90290c300 69585930 C Bi:1:003:1 0 0
ffff8ba90290c300 69636014 S Bo:1:003:1 -115 512 = 38e8ef83 91e5712f 10ada9db 506220e7 216e9dc1 11926002 7cffdc38 dd9e69db
ffff8ba90290c300 69636063 C Bo:1:003:1 0 512 >
ffff8ba90290c300 69636075 S Bi:1:003:1 -115 512 <
ffff8ba90290c300 69636265 C Bi:1:003:1 0 512 = 7ac8dc58 00000000 03000000 00000000 00000000 00000000 00000000 00000000
ffff8ba90290c300 69636273 S Bi:1:003:1 -115 512 <
ffff8ba90290c300 69636297 C Bi:1:003:1 0 0
ffff8ba90290c300 69686379 S Bo:1:003:1 -115 512 = e846d40a f87a0d9e 1b99177d fa9bfbcf b0a19e51 174e1195 343af7e5 f99bf8ab
ffff8ba90290c300 69686422 C Bo:1:003:1 0 512 >
ffff8ba90290c300 69686433 S Bi:1:003:1 -115 512 <
ffff8ba90290c300 69686634 C Bi:1:003:1 0 512 = 7ac80e59 00000000 03000000 00000000 00000000 00000000 00000000 00000000
ffff8ba90290c300 69686642 S Bi:1:003:1 -115 512 <
ffff8ba90290c300 69686656 C Bi:1:003:1 0 0
ffff8ba90290c300 69736738 S Bo:1:003:1 -115 512 = 4847b63b e87b881a bdf35a4e f0f7e9bb 3cd8dab0 af2e4a1f 108d00fc 1d0d5f63
ffff8ba90290c300 69736787 C Bo:1:003:1 0 512 >
ffff8ba90290c300 69736795 S Bi:1:003:1 -115 512 <
ffff8ba90290c300 69736988 C Bi:1:003:1 0 512 = 7ac84059 00000000 03000000 00000000 00000000 00000000 00000000 00000000
ffff8ba90290c300 69736994 S Bi:1:003:1 -115 512 <
ffff8ba90290c300 69737031 C Bi:1:003:1 0 0
ffff8ba90290c300 69787143 S Bo:1:003:1 -115 512 = 3136ddc1 2594b76c 66620ae3 f65ea8c8 b1c86cc1 2bf04483 88e976ec 281d4308
ffff8ba90290c300 69787175 C Bo:1:003:1 0 512 >
ffff8ba90290c300 69787185 S Bi:1:003:1 -115 512 <
ffff8ba90290c300 69787406 C Bi:1:003:1 0 512 = 7ac87359 00000000 03000000 00000000 00000000 00000000 00000000 00000000
ffff8ba90290c300 69787415 S Bi:1:003:1 -115 512 <
ffff8ba90290c300 69787446 C Bi:1:003:1 0 0
ffff8ba90290c300 69837515 S Bo:1:003:1 -115 512 = 7926d518 9efeadfc 9b58fe71 0c870ae3 f6ed998c 47d1a73b 638817d1 dd0769b7
ffff8ba90290c300 69837549 C Bo:1:003:1 0 512 >
ffff8ba90290c300 69837555 S Bi:1:003:1 -115 512 <
ffff8ba90290c300 69837753 C Bi:1:003:1 0 512 = 7ac8a559 00000000 02000000 00000000 00000000 00000000 00000000 00000000
ffff8ba90290c300 69837759 S Bi:1:003:1 -115 512 <
ffff8ba90290c300 69837793 C Bi:1:003:1 0 0
ffff8ba90290c300 69837832 S Bo:1:003:1 -115 58661 = f8ad1254 bff1e42f 77b33a52 20e7532f b4baa99c 2b72fdb8 d230d60a 1c290663
ffff8ba90290c300 69839258 C Bo:1:003:1 0 58661 >
ffff8ba90290c300 69839264 S Bi:1:003:1 -115 512 <
ffff8ba90290c300 69839665 C Bi:1:003:1 0 512 = 79c8a659 00000000 03000000 00000000 00000000 00000000 00000000 00000000
ffff8ba90290c300 69839681 S Bi:1:003:1 -115 512 <
ffff8ba90290c300 69839705 C Bi:1:003:1 0 0
ffff8ba90290c300 69839736 S Bo:1:003:1 -115 58643 = d2cde78a 15b04aa7 8dbdd10b 2ed4d36c b45b34cb 5876367c a88718e6 88a5ffa6
ffff8ba90290c300 69841177 C Bo:1:003:1 0 58643 >
ffff8ba90290c300 69841183 S Bi:1:003:1 -115 512 <
ffff8ba90290c300 69841582 C Bi:1:003:1 0 512 = 79c8a759 00000000 04000000 00000000 00000000 00000000 00000000 00000000
ffff8ba90290c300 69841592 S Bi:1:003:1 -115 512 <
ffff8ba90290c300 69841622 C Bi:1:003:1 0 0
ffff8ba90290c300 69841647 S Bo:1:003:1 -115 512 = 54ac2137 86959fe2 eb39d8a2 b00278eb c70430db 35bd550d 0f0a4425 67084200
ffff8ba90290c300 69841683 C Bo:1:003:1 0 512 >
ffff8ba90290c300 69841688 S Bi:1:003:1 -115 512 <
ffff8ba90290c300 69841841 C Bi:1:003:1 0 512 = 7ac8a959 00000000 04000000 00000000 00000000 00000000 00000000 00000000
ffff8ba90290c300 69841847 S Bi:1:003:1 -115 512 <
ffff8ba90290c300 69841881 C Bi:1:003:1 0 0
ffff8ba902f155c0 69891915 S Bo:1:003:1 -115 512 = ec9dcb3a 3915b916 989c744b c6e0c5cb f8575f23 a0b17b21 7c0da505 f18e4766
ffff8ba902f155c0 69891951 C Bo:1:003:1 0 512 >
ffff8ba902f155c0 69891958 S Bi:1:003:1 -115 512 <
ffff8ba902f155c0 69892183 C Bi:1:003:1 0 512 = 7ac8db59 00000000 04000000 00000000 00000000 00000000 00000000 00000000
ffff8ba902f155c0 69892189 S Bi:1:003:1 -115 512 <
ffff8ba902f155c0 69892220 C Bi:1:003:1 0 0
ffff8ba93ef36180 69942289 S Bo:1:003:1 -115 512 = f594ac74 22dc1450 e639a4f3 287277c8 cf8fae9c 08954b4a a64ee65a faf5148e
ffff8ba93ef36180 69942324 C Bo:1:003:1 0 512 >
ffff8ba93ef36180 69942331 S Bi:1:003:1 -115 512 <
ffff8ba93ef36180 69942533 C Bi:1:003:1 0 512 = 7ac80e5a 00000000 04000000 00000000 00000000 00000000 00000000 00000000
ffff8ba93ef36180 69942539 S Bi:1:003:1 -115 512 <
ffff8ba93ef36180 69942573 C Bi:1:003:1 0 0
ffff8ba93ef36180 69992654 S Bo:1:003:1 -115 512 = a8e68df9 dc2e6140 c27aeb83 77d5691f ccea6ccc 9004d40f 09186cb0 cb8177dd
ffff8ba93ef36180 69992688 C Bo:1:003:1 0 512 >
ffff8ba93ef36180 69992694 S Bi:1:003:1 -115 512 <
ffff8ba93ef36180 69992915 C Bi:1:003:1 0 512 = 7ac8405a 00000000 04000000 00000000 00000000 00000000 00000000 00000000
ffff8ba93ef36180 69992920 S Bi:1:003:1 -115 512 <
ffff8ba93ef36180 69992955 C Bi:1:003:1 0 0
ffff8ba93ef36180 70043032 S Bo:1:003:1 -115 512 = a4d6cc68 0ddb5381 03fb9a73 18b57e46 7cad857d 8ebdb781 7b52d09c b4c4019a
ffff8ba93ef36180 70043066 C Bo:1:003:1 0 512 >
ffff8ba93ef36180 70043072 S Bi:1:003:1 -115 512 <
ffff8ba93ef36180 70043285 C Bi:1:003:1 0 512 = 7ac8735a 00000000 04000000 00000000 00000000 00000000 00000000 00000000
ffff8ba93ef36180 70043290 S Bi:1:003:1 -115 512 <
ffff8ba93ef36180 70043325 C Bi:1:003:1 0 0
ffff8ba93ef36180 70093403 S Bo:1:003:1 -115 512 = 3791f72d ca3d0440 4c2b0618 d680700b 159e4682 5a18e38c f6c37efc 7a5412d0
ffff8ba93ef36180 70093449 C Bo:1:003:1 0 512 >
ffff8ba93ef36180 70093457 S Bi:1:003:1 -115 512 <
ffff8ba93ef36180 70093676 C Bi:1:003:1 0 512 = 7ac8a55a 00000000 04000000 00000000 00000000 00000000 00000000 00000000
ffff8ba93ef36180 70093684 S Bi:1:003:1 -115 512 <
ffff8ba93ef36180 70093707 C Bi:1:003:1 0 0
ffff8ba93ef36180 70143784 S Bo:1:003:1 -115 512 = 694d8786 63c3275c 08dcdbbe 6bbb62b4 3899f44a 9afdfa60 c1b06fcb b9435cc6
ffff8ba93ef36180 70143830 C Bo:1:003:1 0 512 >
ffff8ba93ef36180 70143837 S Bi:1:003:1 -115 512 <
ffff8ba93ef36180 70144099 C Bi:1:003:1 0 512 = 7ac8d75a 00000000 03000000 00000000 00000000 00000000 00000000 00000000
ffff8ba93ef36180 70144109 S Bi:1:003:1 -115 512 <
ffff8ba93ef36180 70144131 C Bi:1:003:1 0 0
ffff8ba93ef36180 70194209 S Bo:1:003:1 -115 512 = b8efd47f 50ed694a e6b5ea06 787a7467 75134a6d 27bb9b5a d4329b9d 3e3d6637
ffff8ba93ef36180 70194254 C Bo:1:003:1 0 512 >
ffff8ba93ef36180 70194263 S Bi:1:003:1 -115 512 <
ffff8ba93ef36180 70194454 C Bi:1:003:1 0 512 = 7ac80a5b 00000000 03000000 00000000 00000000 00000000 00000000 00000000
ffff8ba93ef36180 70194462 S Bi:1:003:1 -115 512 <
ffff8ba93ef36180 70194476 C Bi:1:003:1 0 0
ffff8ba93ef36180 70244556 S Bo:1:003:1 -115 512 = d29a3c45 625e44a9 79b26293 9cc259f1 aa95898c baaa91c3 f8bcdaee b728b484
ffff8ba93ef36180 70244598 C Bo:1:003:1 0 512 >
ffff8ba93ef36180 70244607 S Bi:1:003:1 -115 512 <
ffff8ba93ef36180 70244828 C Bi:1:003:1 0 512 = 7ac83c5b 00000000 03000000 00000000 00000000 00000000 00000000 00000000
ffff8ba93ef36180 70244836 S Bi:1:003:1 -115 512 <
ffff8ba93ef36180 70244858 C Bi:1:003:1 0 0
ffff8ba93ef36180 70294937 S Bo:1:003:1 -115 512 = 121955db 40a9f777 235736ba b4464a40 16e3287f 84c47cc1 01548932 80dc581c
ffff8ba93ef36180 70294982 C Bo:1:003:1 0 512 >
ffff8ba93ef36180 70294990 S Bi:1:003:1 -115 512 <
ffff8ba93ef36180 70295184 C Bi:1:003:1 0 512 = 7ac86e5b 00000000 03000000 00000000 00000000 00000000 00000000 00000000
ffff8ba93ef36180 70295192 S Bi:1:003:1 -115 512 <
ffff8ba93ef36180 70295215 C Bi:1:003:1 0 0
ffff8ba93ef36180 70345293 S Bo:1:003:1 -115 512 = 99d412ab 9c4f1f0c 6ab4f3d3 5fb120fd 4b5c0a70 fd205fa7 8d90f3e3 a2df9bec
ffff8ba93ef36180 70345339 C Bo:1:003:1 0 512 >
ffff8ba93ef36180 70345347 S Bi:1:003:1 -115 512 <
ffff8ba93ef36180 70345554 C Bi:1:003:1 0 512 = 7ac8a15b 00000000 03000000 00000000 00000000 00000000 00000000 00000000
ffff8ba93ef36180 70345562 S Bi:1:003:1 -115 512 <
ffff8ba93ef36180 70345585 C Bi:1:003:1 0 0
ffff8ba93ef36180 70395663 S Bo:1:003:1 -115 512 = 4f0bf4f1 ce4c7a55 48be5d22 52dbbe91 d42ff758 412fb0f7 b8d2fcb2 1a591753
ffff8ba93ef36180 70395709 C Bo:1:003:1 0 512 >
ffff8ba93ef36180 70395717 S Bi:1:003:1 -115 512 <
ffff8ba93ef36180 70395935 C Bi:1:003:1 0 512 = 7ac8d35b 00000000 03000000 00000000 00000000 00000000 00000000 00000000
ffff8ba93ef36180 70395943 S Bi:1:003:1 -115 512 <
ffff8ba93ef36180 70395966 C Bi:1:003:1 0 0
ffff8ba93ef36180 70446023 S Bo:1:003:1 -115 512 = 8f0d410f 464d123e 6b9d840e eb718485 0cf8486f d4455eb6 4445b1db 0efa555d
ffff8ba93ef36180 70446069 C Bo:1:003:1 0 512 >
ffff8ba93ef36180 70446076 S Bi:1:003:1 -115 512 <
ffff8ba93ef36180 70446274 C Bi:1:003:1 0 512 = 7ac8065c 00000000 02000000 00000000 00000000 00000000 00000000 00000000
ffff8ba93ef36180 70446282 S Bi:1:003:1 -115 512 <
ffff8ba93ef36180 70446305 C Bi:1:003:1 0 0
ffff8ba93ef36180 70446350 S Bo:1:003:1 -115 58294 = 3811e74b 9950b4e3 087d69dd 3d3ab5ab 2f76cc43 648a16e1 e24a1499 88e92005
ffff8ba93ef36180 70447789 C Bo:1:003:1 0 58294 >
ffff8ba93ef36180 70447805 S Bi:1:003:1 -115 512 <
ffff8ba93ef36180 70448204 C Bi:1:003:1 0 512 = 79c8075c 00000000 03000000 00000000 00000000 00000000 00000000 00000000
ffff8ba93ef36180 70448223 S Bi:1:003:1 -115 512 <
ffff8ba93ef36180 70448235 C Bi:1:003:1 0 0
ffff8ba93ef36180 70448272 S Bo:1:003:1 -115 57510 = 59a6b0e9 0a9c5be3 2f1e3e2f d6cf6cc4 e40b0452 a715946f 1b586d40 a4f5df4a
ffff8ba93ef36180 70449701 C Bo:1:003:1 0 57510 >
ffff8ba93ef36180 70449714 S Bi:1:003:1 -115 512 <
ffff8ba93ef36180 70450135 C Bi:1:003:1 0 512 = 79c8085c 00000000 04000000 00000000 00000000 00000000 00000000 00000000
ffff8ba93ef36180 70450153 S Bi:1:003:1 -115 512 <
ffff8ba93ef36180 70450165 C Bi:1:003:1 0 0
ffff8ba93ef36180 70450191 S Bo:1:003:1 -115 512 = cf010246 a99e97ff 49088bad a6e475f8 ed0d405e 15497582 c29c259e c5a397d6
ffff8ba93ef36180 70450226 C Bo:1:003:1 0 512 >
ffff8ba93ef36180 70450232 S Bi:1:003:1 -115 512 <
ffff8ba93ef36180 70450386 C Bi:1:003:1 0 512 = 7ac80a5c 00000000 04000000 00000000 00000000 00000000 00000000 00000000
ffff8ba93ef36180 70450392 S Bi:1:003:1 -115 512 <
ffff8ba93ef36180 70450424 C Bi:1:003:1 0 0
ffff8ba9a232a600 70500520 S Bo:1:003:1 -115 512 = 0325f1f6 ed60a9e6 47ee62e6 b91cd10d bf3976f3 efbe5b23 a59dcc01 350b1c4a
ffff8ba9a232a600 70500567 C Bo:1:003:1 0 512 >
ffff8ba9a232a600 70500577 S Bi:1:003:1 -115 512 <
ffff8ba9a232a600 70501693 C Bi:1:003:1 0 512 = 7ac83c5c 00000000 04000000 00000000 00000000 00000000 00000000 00000000
ffff8ba9a232a600 70501703 S Bi:1:003:1 -115 512 <
ffff8ba9a232a600 70501715 C Bi:1:003:1 0 0
ffff8ba9a232a600 70551826 S Bo:1:003:1 -115 512 = cbec71d9 adb1f1ae 68cda803 c534bb69 33e7aa61 ae1b6a9e 18f2a59a 7f32b52a
ffff8ba9a232a600 70551874 C Bo:1:003:1 0 512 >
ffff8ba9a232a600 70551886 S Bi:1:003:1 -115 512 <
ffff8ba9a232a600 70552108 C Bi:1:003:1 0 512 = 7ac86f5c 00000000 04000000 00000000 00000000 00000000 00000000 00000000
ffff8ba9a232a600 70552134 S Bi:1:003:1 -115 512 <
ffff8ba9a232a600 70552172 C Bi:1:003:1 0 0
ffff8ba9a232a600 70602269 S Bo:1:003:1 -115 512 = c2d48619 e50d1096 e4ce33ba a6968a21 69e38220 a4d69949 1e74b5ff 06a2399d
ffff8ba9a232a600 70602313 C Bo:1:003:1 0 512 >
ffff8ba9a232a600 70602327 S Bi:1:003:1 -115 512 <
ffff8ba9a232a600 70602516 C Bi:1:003:1 0 512 = 7ac8a25c 00000000 04000000 00000000 00000000 00000000 00000000 00000000
ffff8ba9a232a600 70602525 S Bi:1:003:1 -115 512 <
ffff8ba9a232a600 70602537 C Bi:1:003:1 0 0
ffff8ba9a232a600 70652617 S Bo:1:003:1 -115 512 = c62dcea0 52fe09c4 f249592e 0d290c13 93fa89dd a20ca93a aa03c775 e88b2b63
ffff8ba9a232a600 70652663 C Bo:1:003:1 0 512 >
ffff8ba9a232a600 70652671 S Bi:1:003:1 -115 512 <
ffff8ba9a232a600 70652899 C Bi:1:003:1 0 512 = 7ac8d45c 00000000 04000000 00000000 00000000 00000000 00000000 00000000
ffff8ba9a232a600 70652908 S Bi:1:003:1 -115 512 <
ffff8ba9a232a600 70652921 C Bi:1:003:1 0 0
ffff8ba9a232a600 70703003 S Bo:1:003:1 -115 512 = 64e70ae7 59084e7b e0453114 47f60762 c095f472 fb576965 4e8810a3 9aebb1f4
ffff8ba9a232a600 70703063 C Bo:1:003:1 0 512 >
ffff8ba9a232a600 70703073 S Bi:1:003:1 -115 512 <
ffff8ba9a232a600 70703258 C Bi:1:003:1 0 512 = 7ac8075d 00000000 03000000 00000000 00000000 00000000 00000000 00000000
ffff8ba9a232a600 70703267 S Bi:1:003:1 -115 512 <
ffff8ba9a232a600 70703286 C Bi:1:003:1 0 0
ffff8ba9a232a600 70753366 S Bo:1:003:1 -115 512 = ed01185f cee88c94 6a33c12d b58dd48e 02d2999b 3bc77e61 b86819b9 48d390bb
ffff8ba9a232a600 70753407 C Bo:1:003:1 0 512 >
ffff8ba9a232a600 70753440 S Bi:1:003:1 -115 512 <
ffff8ba9a232a600 70753634 C Bi:1:003:1 0 512 = 7ac8395d 00000000 03000000 00000000 00000000 00000000 00000000 00000000
ffff8ba9a232a600 70753642 S Bi:1:003:1 -115 512 <
ffff8ba9a232a600 70753665 C Bi:1:003:1 0 0
ffff8ba9a232a600 70803743 S Bo:1:003:1 -115 512 = f903f82b a71ebcbd 5ba3140c f41dcf8d 07a0676b b6f62e7d 98061828 16efb467
ffff8ba9a232a600 70803790 C Bo:1:003:1 0 512 >
ffff8ba9a232a600 70803798 S Bi:1:003:1 -115 512 <
ffff8ba9a232a600 70803984 C Bi:1:003:1 0 512 = 7ac86b5d 00000000 03000000 00000000 00000000 00000000 00000000 00000000
ffff8ba9a232a600 70803993 S Bi:1:003:1 -115 512 <
ffff8ba9a232a600 70804016 C Bi:1:003:1 0 0
ffff8ba9a232a600 70854095 S Bo:1:003:1 -115 512 = 4ce6b13a 74c9e8ba 9fed7f79 99a369fe b4876165 a3681144 d0ad1896 56804b43
ffff8ba9a232a600 70854141 C Bo:1:003:1 0 512 >
ffff8ba9a232a600 70854149 S Bi:1:003:1 -115 512 <
ffff8ba9a232a600 70854371 C Bi:1:003:1 0 512 = 7ac89e5d 00000000 03000000 00000000 00000000 00000000 00000000 00000000
ffff8ba9a232a600 70854379 S Bi:1:003:1 -115 512 <
ffff8ba9a232a600 70854402 C Bi:1:003:1 0 0
ffff8ba9a232a600 70904481 S Bo:1:003:1 -115 512 = d7eafb0e e0468610 dc5898ab ffb58f4a c194d4f5 52428f21 40fb2758 8ebe2257
ffff8ba9a232a600 70904527 C Bo:1:003:1 0 512 >
ffff8ba9a232a600 70904535 S Bi:1:003:1 -115 512 <
ffff8ba9a232a600 70904733 C Bi:1:003:1 0 512 = 7ac8d05d 00000000 02000000 00000000 00000000 00000000 00000000 00000000
ffff8ba9a232a600 70904742 S Bi:1:003:1 -115 512 <
ffff8ba9a232a600 70904765 C Bi:1:003:1 0 0
ffff8ba9a232a600 70904802 S Bo:1:003:1 -115 61419 = 38bb2b7d 527a3332 1d722fe9 1d3fd767 fe7772d1 c8f14df3 d46050d9 ce7a8c51
ffff8ba9a232a600 70906310 C Bo:1:003:1 0 61419 >
ffff8ba9a232a600 70906321 S Bi:1:003:1 -115 512 <
ffff8ba9a232a600 70906763 C Bi:1:003:1 0 512 = 79c8d15d 00000000 03000000 00000000 00000000 00000000 00000000 00000000
ffff8ba9a232a600 70906779 S Bi:1:003:1 -115 512 <
ffff8ba9a232a600 70906791 C Bi:1:003:1 0 0
ffff8ba9a232a600 70906821 S Bo:1:003:1 -115 56429 = f601d09b 53dcdc64 fc56137d b3c7db6a 09da8703 5b9a50b6 dd6a2230 367c14e6
ffff8ba9a232a600 70908264 C Bo:1:003:1 0 56429 >
ffff8ba9a232a600 70908273 S Bi:1:003:1 -115 512 <
ffff8ba9a232a600 70908654 C Bi:1:003:1 0 512 = 79c8d25d 00000000 04000000 00000000 00000000 00000000 00000000 00000000
ffff8ba9a232a600 70908664 S Bi:1:003:1 -115 512 <
ffff8ba9a232a600 70908686 C Bi:1:003:1 0 0
ffff8ba9a232a600 70908711 S Bo:1:003:1 -115 512 = 24db2c1a 4aff8d45 ccb4e8b5 fa093cf6 8660642f 14bc1c98 e6d345a5 04c28e37
ffff8ba9a232a600 70908747 C Bo:1:003:1 0 512 >
ffff8ba9a232a600 70908752 S Bi:1:003:1 -115 512 <
ffff8ba9a232a600 70908905 C Bi:1:003:1 0 512 = 7ac8d45d 00000000 04000000 00000000 00000000 00000000 00000000 00000000
ffff8ba9a232a600 70908911 S Bi:1:003:1 -115 512 <
ffff8ba9a232a600 70908945 C Bi:1:003:1 0 0
ffff8ba9a232a600 70959024 S Bo:1:003:1 -115 512 = cf4c8bf5 0408504b 69d3c2cf d80912e0 d4e93b05 9a05f5ee 8575e703 cf10db73
ffff8ba9a232a600 70959069 C Bo:1:003:1 0 512 >
ffff8ba9a232a600 70959078 S Bi:1:003:1 -115 512 <
ffff8ba9a232a600 70959311 C Bi:1:003:1 0 512 = 7ac8075e 00000000 04000000 00000000 00000000 00000000 00000000 00000000
ffff8ba9a232a600 70959320 S Bi:1:003:1 -115 512 <
ffff8ba9a232a600 70959343 C Bi:1:003:1 0 0
ffff8ba98420f380 71009434 S Bo:1:003:1 -115 512 = c0f9f807 47aaf4ab 51d26e5e 0746743e 84d080a4 04eeda39 d08b5b39 3f633918
ffff8ba98420f380 71009476 C Bo:1:003:1 0 512 >
ffff8ba98420f380 71009485 S Bi:1:003:1 -115 512 <
ffff8ba98420f380 71009689 C Bi:1:003:1 0 512 = 7ac8395e 00000000 04000000 00000000 00000000 00000000 00000000 00000000
ffff8ba98420f380 71009698 S Bi:1:003:1 -115 512 <
ffff8ba98420f380 71009720 C Bi:1:003:1 0 0
ffff8ba98420f380 71059799 S Bo:1:003:1 -115 512 = 7a5876bd b7f4c300 536eb849 03da5de5 5c97e511 8210c948 4d472148 4e0fdab9
ffff8ba98420f380 71059845 C Bo:1:003:1 0 512 >
ffff8ba98420f380 71059854 S Bi:1:003:1 -115 512 <
ffff8ba98420f380 71060068 C Bi:1:003:1 0 512 = 7ac86b5e 00000000 04000000 00000000 00000000 00000000 00000000 00000000
ffff8ba98420f380 71060077 S Bi:1:003:1 -115 512 <
ffff8ba98420f380 71060102 C Bi:1:003:1 0 0
ffff8ba94077c540 71110184 S Bo:1:003:1 -115 512 = 6d1e7ff8 51bb4abb 0553468d f7439d17 cb0bc070 3607b1da fc7f9fdc 6e042083
ffff8ba94077c540 71110231 C Bo:1:003:1 0 512 >
ffff8ba94077c540 71110241 S Bi:1:003:1 -115 512 <
ffff8ba94077c540 71110438 C Bi:1:003:1 0 512 = 7ac89e5e 00000000 04000000 00000000 00000000 00000000 00000000 00000000
ffff8ba94077c540 71110447 S Bi:1:003:1 -115 512 <
ffff8ba94077c540 71110469 C Bi:1:003:1 0 0
ffff8ba9a232a600 71160515 S Bo:1:003:1 -115 512 = 9744906f e4a25bda cc594849 e2bc9df2 98e5961e 6b9b30d2 b717a16f 8686485c
ffff8ba9a232a600 71160572 C Bo:1:003:1 0 512 >
ffff8ba9a232a600 71160581 S Bi:1:003:1 -115 512 <
ffff8ba9a232a600 71160829 C Bi:1:003:1 0 512 = 7ac8d05e 00000000 04000000 00000000 00000000 00000000 00000000 00000000
ffff8ba9a232a600 71160838 S Bi:1:003:1 -115 512 <
ffff8ba9a232a600 71160851 C Bi:1:003:1 0 0
ffff8ba94987f500 71210912 S Bo:1:003:1 -115 512 = de63bd49 751ceade 5dfff0f4 79fb38c8 cb596a18 8ab86d53 f4673776 82d6487a
ffff8ba94987f500 71210954 C Bo:1:003:1 0 512 >
ffff8ba94987f500 71210962 S Bi:1:003:1 -115 512 <
ffff8ba94987f500 71211155 C Bi:1:003:1 0 512 = 7ac8025f 00000000 03000000 00000000 00000000 00000000 00000000 00000000
ffff8ba94987f500 71211168 S Bi:1:003:1 -115 512 <
ffff8ba94987f500 71211182 C Bi:1:003:1 0 0
ffff8ba91dd880c0 71261237 S Bo:1:003:1 -115 512 = 2da984e3 ce6c4a3e 7a6195c7 64301513 608cc3d3 5e3d210b 67411d30 61b47db2
ffff8ba91dd880c0 71261284 C Bo:1:003:1 0 512 >
ffff8ba91dd880c0 71261295 S Bi:1:003:1 -115 512 <
ffff8ba91dd880c0 71261475 C Bi:1:003:1 0 512 = 7ac8355f 00000000 03000000 00000000 00000000 00000000 00000000 00000000
ffff8ba91dd880c0 71261484 S Bi:1:003:1 -115 512 <
ffff8ba91dd880c0 71261507 C Bi:1:003:1 0 0
ffff8ba91dd880c0 71311587 S Bo:1:003:1 -115 512 = 14734b80 80af9ad3 417e60f3 28bc13b6 a3b8f2eb 3cc9e756 723fe542 f172496c
ffff8ba91dd880c0 71311633 C Bo:1:003:1 0 512 >
ffff8ba91dd880c0 71311643 S Bi:1:003:1 -115 512 <
ffff8ba91dd880c0 71311843 C Bi:1:003:1 0 512 = 7ac8675f 00000000 03000000 00000000 00000000 00000000 00000000 00000000
ffff8ba91dd880c0 71311852 S Bi:1:003:1 -115 512 <
ffff8ba91dd880c0 71311875 C Bi:1:003:1 0 0
ffff8ba9a232a600 71361912 S Bo:1:003:1 -115 512 = ef336534 f6eac7d8 840bed80 4b2f42ee 56afc96f 0656fcaa fed08bbf 875285e8
ffff8ba9a232a600 71361947 C Bo:1:003:1 0 512 >
ffff8ba9a232a600 71361955 S Bi:1:003:1 -115 512 <
ffff8ba9a232a600 71362149 C Bi:1:003:1 0 512 = 7ac8995f 00000000 03000000 00000000 00000000 00000000 00000000 00000000
ffff8ba9a232a600 71362155 S Bi:1:003:1 -115 512 <
ffff8ba9a232a600 71362188 C Bi:1:003:1 0 0
ffff8ba9a232a600 71412267 S Bo:1:003:1 -115 512 = fa638b5a 5af5c5fa 0088830d 88db97f3 efe4a732 7b565848 5af23dc1 cc7d64e3
ffff8ba9a232a600 71412313 C Bo:1:003:1 0 512 >
ffff8ba9a232a600 71412318 S Bi:1:003:1 -115 512 <
ffff8ba9a232a600 71412516 C Bi:1:003:1 0 512 = 7ac8cc5f 00000000 03000000 00000000 00000000 00000000 00000000 00000000
ffff8ba9a232a600 71412522 S Bi:1:003:1 -115 512 <
ffff8ba9a232a600 71412556 C Bi:1:003:1 0 0
ffff8ba9a232a600 71462633 S Bo:1:003:1 -115 512 = 1f085431 460d56bf c352dbd8 30fbed7e 6672725c d97fb58f 396e5aab b367861f
ffff8ba9a232a600 71462679 C Bo:1:003:1 0 512 >
ffff8ba9a232a600 71462687 S Bi:1:003:1 -115 512 <
ffff8ba9a232a600 71462901 C Bi:1:003:1 0 512 = 7ac8fe5f 00000000 03000000 00000000 00000000 00000000 00000000 00000000
ffff8ba9a232a600 71462909 S Bi:1:003:1 -115 512 <
ffff8ba9a232a600 71462922 C Bi:1:003:1 0 0
ffff8ba9a232a600 71513003 S Bo:1:003:1 -115 512 = cafdcbdf 0dc48b66 3b6cd8bb 5f2e0263 6c06a9d4 89edfc84 a3bf858b cbb8d73c
ffff8ba9a232a600 71513041 C Bo:1:003:1 0 512 >
ffff8ba920809ec0 71513057 S Bi:1:003:1 -115 512 <
ffff8ba920809ec0 71513248 C Bi:1:003:1 0 512 = 7ac83160 00000000 02000000 00000000 00000000 00000000 00000000 00000000
ffff8ba98420f380 71513264 S Bi:1:003:1 -115 512 <
ffff8ba98420f380 71513276 C Bi:1:003:1 0 0
ffff8ba920809ec0 71513325 S Bo:1:003:1 -115 55308 = 1b0d6e8b e7bfb7d5 453d63ba 4137b6b6 4138849a aa5ad1fb dda0c96a 115dd38d
ffff8ba920809ec0 71514729 C Bo:1:003:1 0 55308 >
ffff8ba9a232a600 71514755 S Bi:1:003:1 -115 512 <
ffff8ba9a232a600 71515138 C Bi:1:003:1 0 512 = 79c83260 00000000 03000000 00000000 00000000 00000000 00000000 00000000
ffff8ba9a232a600 71515161 S Bi:1:003:1 -115 512 <
ffff8ba9a232a600 71515177 C Bi:1:003:1 0 0
ffff8ba9a6102900 71515219 S Bo:1:003:1 -115 58473 = 14730e73 746a8f29 1c83833f 9fc69160 95559af2 248c9df7 50d495e4 ac1bcb02
ffff8ba9a6102900 71516719 C Bo:1:003:1 0 58473 >
ffff8ba9a6102900 71516729 S Bi:1:003:1 -115 512 <
ffff8ba9a6102900 71517116 C Bi:1:003:1 0 512 = 79c83360 00000000 04000000 00000000 00000000 00000000 00000000 00000000
ffff8ba9a6102900 71517135 S Bi:1:003:1 -115 512 <
ffff8ba9a6102900 71517147 C Bi:1:003:1 0 0
ffff8ba920809ec0 71517191 S Bo:1:003:1 -115 512 = c312c815 6ac884dd 033d9d8a 5a24cd5f 17067444 0438c452 4b9f65ea 95015ee0
ffff8ba920809ec0 71517218 C Bo:1:003:1 0 512 >
ffff8ba9250dd440 71517229 S Bi:1:003:1 -115 512 <
ffff8ba9250dd440 71517375 C Bi:1:003:1 0 512 = 7ac83560 00000000 04000000 00000000 00000000 00000000 00000000 00000000
ffff8ba902a42540 71517390 S Bi:1:003:1 -115 512 <
ffff8ba902a42540 71517417 C Bi:1:003:1 0 0
ffff8ba91fa62a80 71567514 S Bo:1:003:1 -115 512 = 16db8653 2d7b5ae7 d4b4e032 16496b3d 33bd6455 6e09c2a4 816cfe02 44fc65e4
ffff8ba91fa62a80 71567570 C Bo:1:003:1 0 512 >
ffff8ba91fa62a80 71567580 S Bi:1:003:1 -115 512 <
ffff8ba91fa62a80 71567820 C Bi:1:003:1 0 512 = 7ac86760 00000000 04000000 00000000 00000000 00000000 00000000 00000000
ffff8ba91fa62a80 71567829 S Bi:1:003:1 -115 512 <
ffff8ba91fa62a80 71567851 C Bi:1:003:1 0 0
ffff8ba91fa62a80 71617931 S Bo:1:003:1 -115 512 = 1bf33907 ee1e89d4 8bd932c2 220dc73b 39e8af2a b5bdf2fb b7f80076 8da1af8f
ffff8ba91fa62a80 71617973 C Bo:1:003:1 0 512 >
ffff8ba91fa62a80 71617981 S Bi:1:003:1 -115 512 <
ffff8ba91fa62a80 71618198 C Bi:1:003:1 0 512 = 7ac89960 00000000 04000000 00000000 00000000 00000000 00000000 00000000
ffff8ba91fa62a80 71618205 S Bi:1:003:1 -115 512 <
ffff8ba91fa62a80 71618230 C Bi:1:003:1 0 0
ffff8ba91fa62a80 71668311 S Bo:1:003:1 -115 512 = b9c0f5d9 f92322ea c1e8ca8d 8d8c8876 7d471872 05eb7fce 9b124dd5 5e65bc01
ffff8ba91fa62a80 71668352 C Bo:1:003:1 0 512 >
ffff8ba91fa62a80 71668446 S Bi:1:003:1 -115 512 <
ffff8ba91fa62a80 71668585 C Bi:1:003:1 0 512 = 7ac8cc60 00000000 04000000 00000000 00000000 00000000 00000000 00000000
ffff8ba91fa62a80 71668594 S Bi:1:003:1 -115 512 <
ffff8ba91fa62a80 71668616 C Bi:1:003:1 0 0
ffff8ba91fa62a80 71718696 S Bo:1:003:1 -115 512 = 0ddfa560 66545422 88db5086 3c5ccf6b 9d282a06 0fb66d30 1b3f5ed5 1c024467
ffff8ba91fa62a80 71718743 C Bo:1:003:1 0 512 >
ffff8ba91fa62a80 71718752 S Bi:1:003:1 -115 512 <
ffff8ba91fa62a80 71718961 C Bi:1:003:1 0 512 = 7ac8fe60 00000000 04000000 00000000 00000000 00000000 00000000 00000000
ffff8ba91fa62a80 71718970 S Bi:1:003:1 -115 512 <
ffff8ba91fa62a80 71718993 C Bi:1:003:1 0 0
ffff8ba91fa62a80 71769023 S Bo:1:003:1 -115 512 = 1cab32cf 897085c2 fe66e240 7b27c658 54fcca15 864bd5c1 5bd353fa ab559cbb
ffff8ba91fa62a80 71769079 C Bo:1:003:1 0 512 >
ffff8ba91fa62a80 71769088 S Bi:1:003:1 -115 512 <
ffff8ba91fa62a80 71770338 C Bi:1:003:1 0 512 = 7ac83161 00000000 04000000 00000000 00000000 00000000 00000000 00000000
ffff8ba91fa62a80 71770347 S Bi:1:003:1 -115 512 <
ffff8ba91fa62a80 71770370 C Bi:1:003:1 0 0
ffff8ba91fa62a80 71820449 S Bo:1:003:1 -115 512 = b952cb82 4e4a235e f1d1fb07 bfeb240b 04126813 b88b4da2 29fa1b73 043bf9ad
ffff8ba91fa62a80 71820491 C Bo:1:003:1 0 512 >
ffff8ba91fa62a80 71820499 S Bi:1:003:1 -115 512 <
ffff8ba91fa62a80 71820719 C Bi:1:003:1 0 512 = 7ac86461 00000000 03000000 00000000 00000000 00000000 00000000 00000000
ffff8ba91fa62a80 71820728 S Bi:1:003:1 -115 512 <
ffff8ba91fa62a80 71820750 C Bi:1:003:1 0 0
ffff8ba91fa62a80 71870829 S Bo:1:003:1 -115 512 = d1ce62f1 2aa644fa ee62645a beb80792 f91ddc42 bcdd89dd d984c14e ab9387f6
ffff8ba91fa62a80 71870875 C Bo:1:003:1 0 512 >
ffff8ba91fa62a80 71870887 S Bi:1:003:1 -115 512 <
ffff8ba91fa62a80 71871160 C Bi:1:003:1 0 512 = 7ac89661 00000000 03000000 00000000 00000000 00000000 00000000 00000000
ffff8ba91fa62a80 71871170 S Bi:1:003:1 -115 512 <
ffff8ba91fa62a80 71871192 C Bi:1:003:1 0 0
ffff8ba91fa62a80 71921288 S Bo:1:003:1 -115 512 = d771c24e 547a696b af272c72 350e8452 f1f1ca7f 9317e147 6bce5acf a69916be
ffff8ba91fa62a80 71921312 C Bo:1:003:1 0 512 >
ffff8ba91fa62a80 71921319 S Bi:1:003:1 -115 512 <
ffff8ba91fa62a80 71921554 C Bi:1:003:1 0 512 = 7ac8c961 00000000 03000000 00000000 00000000 00000000 00000000 00000000
ffff8ba91fa62a80 71921560 S Bi:1:003:1 -115 512 <
ffff8ba91fa62a80 71921593 C Bi:1:003:1 0 0
ffff8ba91fa62a80 71971670 S Bo:1:003:1 -115 512 = 78d75473 1a334ec3 d2400495 4a9f2d3a dad3c198 6d99502b 48c9494f 5dad8b25
ffff8ba91fa62a80 71971705 C Bo:1:003:1 0 512 >
ffff8ba91fa62a80 71971712 S Bi:1:003:1 -115 512 <
ffff8ba91fa62a80 71971898 C Bi:1:003:1 0 512 = 7ac8fb61 00000000 03000000 00000000 00000000 00000000 00000000 00000000
ffff8ba91fa62a80 71971904 S Bi:1:003:1 -115 512 <
ffff8ba91fa62a80 71971938 C Bi:1:003:1 0 0
ffff8ba91fa62a80 72022018 S Bo:1:003:1 -115 512 = b47212c5 ff4c82dd c0060987 bb462414 bad6a8fd 4023e017 86fa269b 3107446a
ffff8ba91fa62a80 72022062 C Bo:1:003:1 0 512 >
ffff8ba91fa62a80 72022068 S Bi:1:003:1 -115 512 <
ffff8ba91fa62a80 72022302 C Bi:1:003:1 0 512 = 7ac82e62 00000000 03000000 00000000 00000000 00000000 00000000 00000000
ffff8ba91fa62a80 72022308 S Bi:1:003:1 -115 512 <
ffff8ba91fa62a80 72022341 C Bi:1:003:1 0 0
ffff8ba91fa62a80 72072419 S Bo:1:003:1 -115 512 = 555000ef e2cd588a 4095d2c9 fc1377dc 5c0abf3c 4f78e34f 2530abe6 d6810f1f
ffff8ba91fa62a80 72072462 C Bo:1:003:1 0 512 >
ffff8ba91fa62a80 72072470 S Bi:1:003:1 -115 512 <
ffff8ba91fa62a80 72072658 C Bi:1:003:1 0 512 = 7ac86062 00000000 03000000 00000000 00000000 00000000 00000000 00000000
ffff8ba91fa62a80 72072667 S Bi:1:003:1 -115 512 <
ffff8ba91fa62a80 72072690 C Bi:1:003:1 0 0
ffff8ba91fa62a80 72122768 S Bo:1:003:1 -115 512 = 12fd191b a2829678 440790db 2483a535 2aaaec37 8569dd43 3820c54c 4bf2ee19
ffff8ba91fa62a80 72122813 C Bo:1:003:1 0 512 >
ffff8ba91fa62a80 72122821 S Bi:1:003:1 -115 512 <
ffff8ba91fa62a80 72123061 C Bi:1:003:1 0 512 = 7ac89262 00000000 02000000 00000000 00000000 00000000 00000000 00000000
ffff8ba91fa62a80 72123070 S Bi:1:003:1 -115 512 <
ffff8ba91fa62a80 72123093 C Bi:1:003:1 0 0
ffff8ba91fa62a80 72123136 S Bo:1:003:1 -115 57224 = f6b1c825 7c0b879e 38a793a8 2ba525a1 da6b9bfe 161984bb aee61273 e2924fbb
ffff8ba91fa62a80 72124560 C Bo:1:003:1 0 57224 >
ffff8ba91fa62a80 72124569 S Bi:1:003:1 -115 512 <
ffff8ba91fa62a80 72125043 C Bi:1:003:1 0 512 = 79c89362 00000000 03000000 00000000 00000000 00000000 00000000 00000000
ffff8ba91fa62a80 72125062 S Bi:1:003:1 -115 512 <
ffff8ba91fa62a80 72125073 C Bi:1:003:1 0 0
ffff8ba91fa62a80 72125105 S Bo:1:003:1 -115 61218 = 9baa0eb2 c8f2f092 66f1937c a8bec1fb 2690335a 4e559863 64106ff9 54691620
ffff8ba91fa62a80 72126634 C Bo:1:003:1 0 61218 >
ffff8ba91fa62a80 72126643 S Bi:1:003:1 -115 512 <
ffff8ba91fa62a80 72127061 C Bi:1:003:1 0 512 = 79c89562 00000000 04000000 00000000 00000000 00000000 00000000 00000000
ffff8ba91fa62a80 72127073 S Bi:1:003:1 -115 512 <
ffff8ba91fa62a80 72127085 C Bi:1:003:1 0 0
ffff8ba91fa62a80 72127111 S Bo:1:003:1 -115 512 = 1dd193cb d58a3a70 9ad7b4a7 b9c201c2 8b7edeb6 f38c7c68 153934ce e4485144
ffff8ba91fa62a80 72127146 C Bo:1:003:1 0 512 >
ffff8ba91fa62a80 72127153 S Bi:1:003:1 -115 512 <
ffff8ba91fa62a80 72127321 C Bi:1:003:1 0 512 = 7ac89762 00000000 04000000 00000000 00000000 00000000 00000000 00000000
ffff8ba91fa62a80 72127327 S Bi:1:003:1 -115 512 <
ffff8ba91fa62a80 72127360 C Bi:1:003:1 0 0
ffff8ba91fa62a80 72177439 S Bo:1:003:1 -115 512 = aaa98519 2478cade 033125c4 2ec6892e bc64c12f 37dd9281 adb65e6e e014466a
ffff8ba91fa62a80 72177480 C Bo:1:003:1 0 512 >
ffff8ba91fa62a80 72177489 S Bi:1:003:1 -115 512 <
ffff8ba91fa62a80 72177697 C Bi:1:003:1 0 512 = 7ac8c962 00000000 04000000 00000000 00000000 00000000 00000000 00000000
ffff8ba91fa62a80 72177706 S Bi:1:003:1 -115 512 <
ffff8ba91fa62a80 72177718 C Bi:1:003:1 0 0
ffff8ba91fa62a80 72227799 S Bo:1:003:1 -115 512 = b922f2a2 8af7ebcd 6654a031 2f479f11 7cd4d662 691a2f5a 61e71554 f217f579
ffff8ba91fa62a80 72227846 C Bo:1:003:1 0 512 >
ffff8ba91fa62a80 72227856 S Bi:1:003:1 -115 512 <
ffff8ba91fa62a80 72228027 C Bi:1:003:1 0 512 = 7ac8fb62 00000000 04000000 00000000 00000000 00000000 00000000 00000000
ffff8ba91fa62a80 72228036 S Bi:1:003:1 -115 512 <
ffff8ba91fa62a80 72228048 C Bi:1:003:1 0 0
ffff8ba91fa62a80 72278129 S Bo:1:003:1 -115 512 = e051b1c5 8a0c3b63 a227aa43 b3a00f30 e82df875 63e96000 7f37e10e 828fac54
ffff8ba91fa62a80 72278188 C Bo:1:003:1 0 512 >
ffff8ba91fa62a80 72278198 S Bi:1:003:1 -115 512 <
ffff8ba91fa62a80 72278389 C Bi:1:003:1 0 512 = 7ac82e63 00000000 04000000 00000000 00000000 00000000 00000000 00000000
ffff8ba91fa62a80 72278398 S Bi:1:003:1 -115 512 <
ffff8ba91fa62a80 72278421 C Bi:1:003:1 0 0
ffff8ba91fa62a80 72328499 S Bo:1:003:1 -115 512 = 19093252 dedbea3c 501d9f6d 802fdcad f8ce9352 f7cf8695 48ddf6b4 e111b307
ffff8ba91fa62a80 72328556 C Bo:1:003:1 0 512 >
ffff8ba91fa62a80 72328565 S Bi:1:003:1 -115 512 <
ffff8ba91fa62a80 72328744 C Bi:1:003:1 0 512 = 7ac86063 00000000 04000000 00000000 00000000 00000000 00000000 00000000
ffff8ba91fa62a80 72328753 S Bi:1:003:1 -115 512 <
ffff8ba91fa62a80 72328773 C Bi:1:003:1 0 0
ffff8ba91fa62a80 72378852 S Bo:1:003:1 -115 512 = c4d3bc31 b32bd50d 4eebc364 9b8426a8 a0a8f4fc d537bf4d 1e0d6162 484ff4ce
ffff8ba91fa62a80 72378898 C Bo:1:003:1 0 512 >
ffff8ba91fa62a80 72378906 S Bi:1:003:1 -115 512 <
ffff8ba91fa62a80 72379115 C Bi:1:003:1 0 512 = 7ac89263 00000000 04000000 00000000 00000000 00000000 00000000 00000000
ffff8ba91fa62a80 72379123 S Bi:1:003:1 -115 512 <
ffff8ba91fa62a80 72379136 C Bi:1:003:1 0 0
ffff8ba9a232a600 72429226 S Bo:1:003:1 -115 512 = 0d7d6c54 b24cb5fd c14e69f9 1b10bda1 c790a3bd 055f6a1d df86653d 0d05818d
ffff8ba9a232a600 72429273 C Bo:1:003:1 0 512 >
ffff8ba9a232a600 72429283 S Bi:1:003:1 -115 512 <
ffff8ba9a232a600 72429497 C Bi:1:003:1 0 512 = 7ac8c563 00000000 03000000 00000000 00000000 00000000 00000000 00000000
ffff8ba9a232a600 72429506 S Bi:1:003:1 -115 512 <
ffff8ba9a232a600 72429534 C Bi:1:003:1 0 0
ffff8ba9a232a600 72479613 S Bo:1:003:1 -115 512 = 733fc40c ab9c9637 4e9cff15 674c8981 66116ee3 b3e93e46 6f3b7531 416edd1d
ffff8ba9a232a600 72479659 C Bo:1:003:1 0 512 >
ffff8ba9a232a600 72479668 S Bi:1:003:1 -115 512 <
ffff8ba9a232a600 72479860 C Bi:1:003:1 0 512 = 7ac8f763 00000000 03000000 00000000 00000000 00000000 00000000 00000000
ffff8ba9a232a600 72479869 S Bi:1:003:1 -115 512 <
ffff8ba9a232a600 72479892 C Bi:1:003:1 0 0
ffff8ba9a232a600 72529973 S Bo:1:003:1 -115 512 = 7ab93169 3e50c1c0 d23039a5 09c69684 2cf5a34f b79cca63 cfd2bb73 f5b142d5
ffff8ba9a232a600 72530019 C Bo:1:003:1 0 512 >
ffff8ba9a232a600 72530028 S Bi:1:003:1 -115 512 <
ffff8ba9a232a600 72530248 C Bi:1:003:1 0 512 = 7ac82964 00000000 03000000 00000000 00000000 00000000 00000000 00000000
ffff8ba9a232a600 72530256 S Bi:1:003:1 -115 512 <
ffff8ba9a232a600 72530280 C Bi:1:003:1 0 0
ffff8ba9a232a600 72580360 S Bo:1:003:1 -115 512 = 8c631135 6ef65257 f385af21 b822e6a9 cf6c4e08 27b2180b e53ecdfa 356bd0a7
ffff8ba9a232a600 72580406 C Bo:1:003:1 0 512 >
ffff8ba9a232a600 72580415 S Bi:1:003:1 -115 512 <
ffff8ba9a232a600 72580613 C Bi:1:003:1 0 512 = 7ac85c64 00000000 03000000 00000000 00000000 00000000 00000000 00000000
ffff8ba9a232a600 72580622 S Bi:1:003:1 -115 512 <
ffff8ba9a232a600 72580645 C Bi:1:003:1 0 0
ffff8ba9a232a600 72630724 S Bo:1:003:1 -115 512 = da2d4e90 81954768 60a63646 9b1400a3 e6ce2f7b ebaaffac df23d4d6 1fc833ca
ffff8ba9a232a600 72630770 C Bo:1:003:1 0 512 >
ffff8ba9a232a600 72630779 S Bi:1:003:1 -115 512 <
ffff8ba9a232a600 72630995 C Bi:1:003:1 0 512 = 7ac88e64 00000000 03000000 00000000 00000000 00000000 00000000 00000000
ffff8ba9a232a600 72631004 S Bi:1:003:1 -115 512 <
ffff8ba9a232a600 72631028 C Bi:1:003:1 0 0
ffff8ba9a232a600 72681105 S Bo:1:003:1 -115 512 = 98c1406a 0770269e 26ae2f84 64d3bff1 816473a4 ba53848d 3daaf021 548aec51
ffff8ba9a232a600 72681151 C Bo:1:003:1 0 512 >
ffff8ba9a232a600 72681160 S Bi:1:003:1 -115 512 <
ffff8ba9a232a600 72681359 C Bi:1:003:1 0 512 = 7ac8c164 00000000 03000000 00000000 00000000 00000000 00000000 00000000
ffff8ba9a232a600 72681368 S Bi:1:003:1 -115 512 <
ffff8ba9a232a600 72681380 C Bi:1:003:1 0 0
ffff8ba9a232a600 72731459 S Bo:1:003:1 -115 512 = 37edb43d 6958cd2d c7ece76d 80186063 ff5b07bd c140ad2f ffd1c496 b85eafe9
ffff8ba9a232a600 72731505 C Bo:1:003:1 0 512 >
ffff8ba9a232a600 72731514 S Bi:1:003:1 -115 512 <
ffff8ba9a232a600 72731712 C Bi:1:003:1 0 512 = 7ac8f364 00000000 02000000 00000000 00000000 00000000 00000000 00000000
ffff8ba9a232a600 72731721 S Bi:1:003:1 -115 512 <
ffff8ba9a232a600 72731743 C Bi:1:003:1 0 0
ffff8ba9a232a600 72731783 S Bo:1:003:1 -115 57369 = 4a5a91a2 63b30589 6dd7d6d2 dd0b4c65 df56c715 ded9e68f ea4ca58e a61c27e9
ffff8ba9a232a600 72733215 C Bo:1:003:1 0 57369 >
ffff8ba9a232a600 72733225 S Bi:1:003:1 -115 512 <
ffff8ba9a232a600 72733657 C Bi:1:003:1 0 512 = 79c8f464 00000000 03000000 00000000 00000000 00000000 00000000 00000000
ffff8ba9a232a600 72733677 S Bi:1:003:1 -115 512 <
ffff8ba9a232a600 72733689 C Bi:1:003:1 0 0
ffff8ba9a232a600 72733732 S Bo:1:003:1 -115 59896 = 3659a24f 19711419 2da1bbf9 668a9692 943e5501 2616ae67 227f2f77 54b0c607
ffff8ba9a232a600 72735340 C Bo:1:003:1 0 59896 >
ffff8ba9a232a600 72735351 S Bi:1:003:1 -115 512 <
ffff8ba9a232a600 72735864 C Bi:1:003:1 0 512 = 79c8f564 00000000 04000000 00000000 00000000 00000000 00000000 00000000
ffff8ba9a232a600 72735881 S Bi:1:003:1 -115 512 <
ffff8ba9a232a600 72735903 C Bi:1:003:1 0 0
ffff8ba9a232a600 72735928 S Bo:1:003:1 -115 512 = f03bcf10 6be2a1df 34893649 60ee56d9 5f2a9aa8 7ab3565c 8258e5d5 6983dc45
ffff8ba9a232a600 72735963 C Bo:1:003:1 0 512 >
ffff8ba9a232a600 72735969 S Bi:1:003:1 -115 512 <
ffff8ba9a232a600 72736196 C Bi:1:003:1 0 512 = 7ac8f764 00000000 04000000 00000000 00000000 00000000 00000000 00000000
ffff8ba9a232a600 72736202 S Bi:1:003:1 -115 512 <
ffff8ba9a232a600 72736233 C Bi:1:003:1 0 0
ffff8ba9a232a600 72786311 S Bo:1:003:1 -115 512 = 885c8864 423c36dd 4d6c90ee 1be004d1 4547e73d aa3f8af6 d0318f27 1e048095
ffff8ba9a232a600 72786357 C Bo:1:003:1 0 512 >
ffff8ba9a232a600 72786366 S Bi:1:003:1 -115 512 <
ffff8ba9a232a600 72786549 C Bi:1:003:1 0 512 = 7ac82a65 00000000 04000000 00000000 00000000 00000000 00000000 00000000
ffff8ba9a232a600 72786557 S Bi:1:003:1 -115 512 <
ffff8ba9a232a600 72786580 C Bi:1:003:1 0 0
ffff8ba9a232a600 72836659 S Bo:1:003:1 -115 512 = 2590cd35 c5421d5d a7ce12b2 41d39a7a dcde0634 c9439194 df05ba70 005b5acf
ffff8ba9a232a600 72836705 C Bo:1:003:1 0 512 >
ffff8ba9a232a600 72836713 S Bi:1:003:1 -115 512 <
ffff8ba9a232a600 72836983 C Bi:1:003:1 0 512 = 7ac85c65 00000000 04000000 00000000 00000000 00000000 00000000 00000000
ffff8ba9a232a600 72836992 S Bi:1:003:1 -115 512 <
ffff8ba9a232a600 72837015 C Bi:1:003:1 0 0
ffff8ba9a232a600 72887093 S Bo:1:003:1 -115 512 = c875dd70 818d7afa 30c16be2 055a7adf c07ff08b 26ab31ce e0af423d ad17522c
ffff8ba9a232a600 72887128 C Bo:1:003:1 0 512 >
ffff8ba9a232a600 72887134 S Bi:1:003:1 -115 512 <
ffff8ba9a232a600 72887321 C Bi:1:003:1 0 512 = 7ac88f65 00000000 04000000 00000000 00000000 00000000 00000000 00000000
ffff8ba9a232a600 72887326 S Bi:1:003:1 -115 512 <
ffff8ba9a232a600 72887360 C Bi:1:003:1 0 0
ffff8ba9a232a600 72937475 S Bo:1:003:1 -115 512 = fb044e9c 401166c5 58acfc96 4dba06c4 46344629 24207583 aacf6d52 aca198a5
ffff8ba9a232a600 72937523 C Bo:1:003:1 0 512 >
ffff8ba9a232a600 72937536 S Bi:1:003:1 -115 512 <
ffff8ba9a232a600 72937797 C Bi:1:003:1 0 512 = 7ac8c165 00000000 04000000 00000000 00000000 00000000 00000000 00000000
ffff8ba9a232a600 72937824 S Bi:1:003:1 -115 512 <
ffff8ba9a232a600 72937855 C Bi:1:003:1 0 0
ffff8ba9a232a600 72987934 S Bo:1:003:1 -115 512 = f22d52c7 4ce55e9d 60cce41b 99cf7df5 ae144743 6b14ff72 38b43700 1e2dea11
ffff8ba9a232a600 72987980 C Bo:1:003:1 0 512 >
ffff8ba9a232a600 72987990 S Bi:1:003:1 -115 512 <
ffff8ba9a232a600 72988173 C Bi:1:003:1 0 512 = 7ac8f365 00000000 04000000 00000000 00000000 00000000 00000000 00000000
ffff8ba9a232a600 72988182 S Bi:1:003:1 -115 512 <
ffff8ba9a232a600 72988205 C Bi:1:003:1 0 0
ffff8ba9a232aa80 73038286 S Bo:1:003:1 -115 512 = f70e20ad 4625414b 1439127d f486e1e5 9a2510a6 759a8e01 4733ac25 30db990f
ffff8ba9a232aa80 73038332 C Bo:1:003:1 0 512 >
ffff8ba9a232aa80 73038341 S Bi:1:003:1 -115 512 <
ffff8ba9a232aa80 73039288 C Bi:1:003:1 0 512 = 7ac82666 00000000 03000000 00000000 00000000 00000000 00000000 00000000
ffff8ba9a232aa80 73039296 S Bi:1:003:1 -115 512 <
ffff8ba9a232aa80 73039320 C Bi:1:003:1 0 0
ffff8ba9a232aa80 73089397 S Bo:1:003:1 -115 512 = 7b82e128 93a2e6ce 11d8c9bd 371110dd 21217960 73447e7a 434ecec9 4dc72016
ffff8ba9a232aa80 73089433 C Bo:1:003:1 0 512 >
ffff8ba949880c00 73089449 S Bi:1:003:1 -115 512 <
ffff8ba949880c00 73089632 C Bi:1:003:1 0 512 = 7ac85966 00000000 03000000 00000000 00000000 00000000 00000000 00000000
ffff8ba954973ec0 73089645 S Bi:1:003:1 -115 512 <
ffff8ba954973ec0 73089667 C Bi:1:003:1 0 0
ffff8ba9538a29c0 73139750 S Bo:1:003:1 -115 512 = 445aabde 42fec754 65a2817c 645a0dc3 95e9e42d 0b59920e 168218dd b3a30391
ffff8ba9538a29c0 73139797 C Bo:1:003:1 0 512 >
ffff8ba9538a29c0 73139807 S Bi:1:003:1 -115 512 <
ffff8ba9538a29c0 73140640 C Bi:1:003:1 0 512 = 7ac88b66 00000000 03000000 00000000 00000000 00000000 00000000 00000000
ffff8ba9538a29c0 73140649 S Bi:1:003:1 -115 512 <
ffff8ba9538a29c0 73140673 C Bi:1:003:1 0 0
ffff8ba9538a29c0 73190751 S Bo:1:003:1 -115 512 = 22f349f9 d0ecbce4 4e1a5b3b 0e562fb2 46175ee4 5d3aa634 134d0898 97f242a7
ffff8ba9538a29c0 73190797 C Bo:1:003:1 0 512 >
ffff8ba9538a29c0 73190806 S Bi:1:003:1 -115 512 <
ffff8ba9538a29c0 73191038 C Bi:1:003:1 0 512 = 7ac8be66 00000000 03000000 00000000 00000000 00000000 00000000 00000000
ffff8ba9538a29c0 73191047 S Bi:1:003:1 -115 512 <
ffff8ba9538a29c0 73191070 C Bi:1:003:1 0 0
ffff8ba9538a29c0 73241149 S Bo:1:003:1 -115 512 = 64418d49 06a3dd9d 7e70e28a 974c485e 685c7540 d09771ed 62a30e2a 57c74b34
ffff8ba9538a29c0 73241197 C Bo:1:003:1 0 512 >
ffff8ba9538a29c0 73241206 S Bi:1:003:1 -115 512 <
ffff8ba9538a29c0 73241393 C Bi:1:003:1 0 512 = 7ac8f166 00000000 03000000 00000000 00000000 00000000 00000000 00000000
ffff8ba9538a29c0 73241401 S Bi:1:003:1 -115 512 <
ffff8ba9538a29c0 73241421 C Bi:1:003:1 0 0
ffff8ba9538a29c0 73291503 S Bo:1:003:1 -115 512 = 3cd3f09a 7181a389 968d0959 44c2dbde 87bec4f9 795e093c d887e31b 2904e5a2
ffff8ba9538a29c0 73291549 C Bo:1:003:1 0 512 >
ffff8ba9538a29c0 73291560 S Bi:1:003:1 -115 512 <
ffff8ba9538a29c0 73291735 C Bi:1:003:1 0 512 = 7ac82367 00000000 03000000 00000000 00000000 00000000 00000000 00000000
ffff8ba9538a29c0 73291744 S Bi:1:003:1 -115 512 <
ffff8ba9538a29c0 73291767 C Bi:1:003:1 0 0
ffff8ba9538a29c0 73341846 S Bo:1:003:1 -115 512 = b7fa4760 53715cd5 ac7f706f e00ee7a5 3a3a7107 a5d0c73b bd331e33 c3c38311
ffff8ba9538a29c0 73341892 C Bo:1:003:1 0 512 >
ffff8ba9538a29c0 73341901 S Bi:1:003:1 -115 512 <
ffff8ba9538a29c0 73342078 C Bi:1:003:1 0 512 = 7ac85567 00000000 02000000 00000000 00000000 00000000 00000000 00000000
ffff8ba9538a29c0 73342087 S Bi:1:003:1 -115 512 <
ffff8ba9538a29c0 73342115 C Bi:1:003:1 0 0
ffff8ba9538a29c0 73342157 S Bo:1:003:1 -115 54353 = 3dae3647 e3277fe8 48a7e8ac bde3f628 2a538222 18a963bb 95caee59 a1092358
ffff8ba9538a29c0 73343485 C Bo:1:003:1 0 54353 >
ffff8ba9538a29c0 73343494 S Bi:1:003:1 -115 512 <
ffff8ba9538a29c0 73343910 C Bi:1:003:1 0 512 = 79c85667 00000000 03000000 00000000 00000000 00000000 00000000 00000000
ffff8ba9538a29c0 73343928 S Bi:1:003:1 -115 512 <
ffff8ba9538a29c0 73343940 C Bi:1:003:1 0 0
ffff8ba9538a29c0 73343973 S Bo:1:003:1 -115 59922 = 0ee8b3d0 56a3b554 bde33eeb 4364aed7 d6b7d3ac a484b26f 2153d1b8 6a17d858
ffff8ba9538a29c0 73345498 C Bo:1:003:1 0 59922 >
ffff8ba9538a29c0 73345505 S Bi:1:003:1 -115 512 <
ffff8ba9538a29c0 73345930 C Bi:1:003:1 0 512 = 79c85767 00000000 04000000 00000000 00000000 00000000 00000000 00000000
ffff8ba9538a29c0 73345943 S Bi:1:003:1 -115 512 <
ffff8ba9538a29c0 73345955 C Bi:1:003:1 0 0
ffff8ba9538a29c0 73345980 S Bo:1:003:1 -115 512 = 917ada39 659c9a33 89f99855 31745340 dc57355c 35888862 66c6352b ec47e264
ffff8ba9538a29c0 73346030 C Bo:1:003:1 0 512 >
ffff8ba9538a29c0 73346036 S Bi:1:003:1 -115 512 <
ffff8ba9538a29c0 73346189 C Bi:1:003:1 0 512 = 7ac85a67 00000000 04000000 00000000 00000000 00000000 00000000 00000000
ffff8ba9538a29c0 73346195 S Bi:1:003:1 -115 512 <
ffff8ba9538a29c0 73346225 C Bi:1:003:1 0 0
ffff8ba9538a29c0 73396303 S Bo:1:003:1 -115 512 = 8f21a5d5 2a883290 a4145695 0f1a0382 62f7ccf0 c54fbe63 36efeefd 11add70d
ffff8ba9538a29c0 73396350 C Bo:1:003:1 0 512 >
ffff8ba9538a29c0 73396358 S Bi:1:003:1 -115 512 <
ffff8ba9538a29c0 73396550 C Bi:1:003:1 0 512 = 7ac88c67 00000000 04000000 00000000 00000000 00000000 00000000 00000000
ffff8ba9538a29c0 73396558 S Bi:1:003:1 -115 512 <
ffff8ba9538a29c0 73396581 C Bi:1:003:1 0 0
ffff8ba9538a29c0 73446659 S Bo:1:003:1 -115 512 = f0dd7d34 d4925425 aaca06e2 23ec7797 fe7b907d ee13b5f0 b0552939 a0e7c980
ffff8ba9538a29c0 73446705 C Bo:1:003:1 0 512 >
ffff8ba9538a29c0 73446714 S Bi:1:003:1 -115 512 <
ffff8ba9538a29c0 73446911 C Bi:1:003:1 0 512 = 7ac8be67 00000000 04000000 00000000 00000000 00000000 00000000 00000000
ffff8ba9538a29c0 73446920 S Bi:1:003:1 -115 512 <
ffff8ba9538a29c0 73446943 C Bi:1:003:1 0 0
ffff8ba9538a29c0 73497026 S Bo:1:003:1 -115 512 = 1ac9ca90 83cea19b 9fddd7fa f85fa937 56415ec4 cbf26aac 30289f4a 720b499c
ffff8ba9538a29c0 73497071 C Bo:1:003:1 0 512 >
ffff8ba9538a29c0 73497081 S Bi:1:003:1 -115 512 <
ffff8ba9538a29c0 73497283 C Bi:1:003:1 0 512 = 7ac8f167 00000000 04000000 00000000 00000000 00000000 00000000 00000000
ffff8ba9538a29c0 73497293 S Bi:1:003:1 -115 512 <
ffff8ba9538a29c0 73497314 C Bi:1:003:1 0 0
ffff8ba9538a29c0 73547397 S Bo:1:003:1 -115 512 = 73f47f46 9b6884fa f536ea78 a4c88c0c ba8b8d4b 7873bfaa 49e9a71d 7d263dc4
ffff8ba9538a29c0 73547440 C Bo:1:003:1 0 512 >
ffff8ba9538a29c0 73547451 S Bi:1:003:1 -115 512 <
ffff8ba9538a29c0 73547656 C Bi:1:003:1 0 512 = 7ac82368 00000000 04000000 00000000 00000000 00000000 00000000 00000000
ffff8ba9538a29c0 73547665 S Bi:1:003:1 -115 512 <
ffff8ba9538a29c0 73547687 C Bi:1:003:1 0 0
ffff8ba98420f380 73597770 S Bo:1:003:1 -115 512 = 50c0cec3 2c567ce4 02e6234e c48ab868 c53fbad5 b242474c c729430c 537d2bc1
ffff8ba98420f380 73597810 C Bo:1:003:1 0 512 >
ffff8ba91fa62a80 73597829 S Bi:1:003:1 -115 512 <
ffff8ba91fa62a80 73598025 C Bi:1:003:1 0 512 = 7ac85568 00000000 04000000 00000000 00000000 00000000 00000000 00000000
ffff8ba902f155c0 73598037 S Bi:1:003:1 -115 512 <
ffff8ba902f155c0 73598062 C Bi:1:003:1 0 0
ffff8ba91fa62fc0 73648146 S Bo:1:003:1 -115 512 = 85f3207e b431f20b adafa617 6bc2d9ac a48702ee ef085140 27ca61e1 331b8d83
ffff8ba91fa62fc0 73648183 C Bo:1:003:1 0 512 >
ffff8ba91fa62fc0 73648194 S Bi:1:003:1 -115 512 <
ffff8ba91fa62fc0 73648394 C Bi:1:003:1 0 512 = 7ac88868 00000000 03000000 00000000 00000000 00000000 00000000 00000000
ffff8ba91fa62fc0 73648401 S Bi:1:003:1 -115 512 <
ffff8ba91fa62fc0 73648434 C Bi:1:003:1 0 0
ffff8ba9538a29c0 73698515 S Bo:1:003:1 -115 512 = 4b874b10 3ed7985c e2fa8b02 6bf19cb2 f35ffc1a 6c245c9c 2166d026 15440334
ffff8ba9538a29c0 73698552 C Bo:1:003:1 0 512 >
ffff8ba9538a29c0 73698561 S Bi:1:003:1 -115 512 <
ffff8ba9538a29c0 73698793 C Bi:1:003:1 0 512 = 7ac8ba68 00000000 03000000 00000000 00000000 00000000 00000000 00000000
ffff8ba9538a29c0 73698801 S Bi:1:003:1 -115 512 <
ffff8ba9538a29c0 73698814 C Bi:1:003:1 0 0
ffff8ba98420e9c0 73748859 S Bo:1:003:1 -115 512 = ef4dc8e3 60d4be21 43c5976f b5e12ab6 fe905f16 6d05bb79 635b22d2 b6865f90
ffff8ba98420e9c0 73748906 C Bo:1:003:1 0 512 >
ffff8ba98420e9c0 73748915 S Bi:1:003:1 -115 512 <
ffff8ba98420e9c0 73749133 C Bi:1:003:1 0 512 = 7ac8ec68 00000000 03000000 00000000 00000000 00000000 00000000 00000000
ffff8ba98420e9c0 73749142 S Bi:1:003:1 -115 512 <
ffff8ba98420e9c0 73749165 C Bi:1:003:1 0 0
ffff8ba98420e9c0 73799243 S Bo:1:003:1 -115 512 = 96514325 a9ca971e c876c370 4e2455c2 4b94bb7d 768acabd 66378439 71f10a98
ffff8ba98420e9c0 73799275 C Bo:1:003:1 0 512 >
ffff8ba98420e9c0 73799282 S Bi:1:003:1 -115 512 <
ffff8ba98420e9c0 73799498 C Bi:1:003:1 0 512 = 7ac81f69 00000000 03000000 00000000 00000000 00000000 00000000 00000000
ffff8ba98420e9c0 73799506 S Bi:1:003:1 -115 512 <
ffff8ba98420e9c0 73799529 C Bi:1:003:1 0 0
ffff8ba98420e9c0 73849607 S Bo:1:003:1 -115 512 = 74c0f4f7 83996105 bf8fb626 35876015 4cef5a59 d1878033 ac73252d a74fd6c5
ffff8ba98420e9c0 73849645 C Bo:1:003:1 0 512 >
ffff8ba98420e9c0 73849653 S Bi:1:003:1 -115 512 <
ffff8ba98420e9c0 73849869 C Bi:1:003:1 0 512 = 7ac85169 00000000 03000000 00000000 00000000 00000000 00000000 00000000
ffff8ba98420e9c0 73849878 S Bi:1:003:1 -115 512 <
ffff8ba98420e9c0 73849891 C Bi:1:003:1 0 0
ffff8ba9538a29c0 73899961 S Bo:1:003:1 -115 512 = 498912f5 26063013 0fe79dd0 61372b92 a5eae368 12ecbd6d b9c9bb78 94809dd5
ffff8ba9538a29c0 73899997 C Bo:1:003:1 0 512 >
ffff8ba9538a29c0 73900005 S Bi:1:003:1 -115 512 <
ffff8ba9538a29c0 73900223 C Bi:1:003:1 0 512 = 7ac88369 00000000 03000000 00000000 00000000 00000000 00000000 00000000
ffff8ba9538a29c0 73900251 S Bi:1:003:1 -115 512 <
ffff8ba9538a29c0 73900282 C Bi:1:003:1 0 0
ffff8ba9538a29c0 73950401 S Bo:1:003:1 -115 512 = d529ad50 20cea79b 527c4722 7cf0185d 87c860db 8d6677bb c2b10945 b50830e2
ffff8ba9538a29c0 73950433 C Bo:1:003:1 0 512 >
ffff8ba9538a29c0 73950443 S Bi:1:003:1 -115 512 <
ffff8ba9538a29c0 73950640 C Bi:1:003:1 0 512 = 7ac8b669 00000000 02000000 00000000 00000000 00000000 00000000 00000000
ffff8ba9538a29c0 73950663 S Bi:1:003:1 -115 512 <
ffff8ba9538a29c0 73950694 C Bi:1:003:1 0 0
ffff8ba9538a29c0 73950762 S Bo:1:003:1 -115 59953 = dc35e7a3 e3f95bdd 9affbbd7 194f97f4 9c5f0d02 f300f9d2 0893ec29 fd2c4187
ffff8ba9538a29c0 73952228 C Bo:1:003:1 0 59953 >
ffff8ba9538a29c0 73952252 S Bi:1:003:1 -115 512 <
ffff8ba9538a29c0 73952643 C Bi:1:003:1 0 512 = 79c8b769 00000000 03000000 00000000 00000000 00000000 00000000 00000000
ffff8ba9538a29c0 73952683 S Bi:1:003:1 -115 512 <
ffff8ba9538a29c0 73952713 C Bi:1:003:1 0 0
ffff8ba9538a29c0 73952774 S Bo:1:003:1 -115 56027 = 3d84661c 71a7f4b0 30be56d3 d97d132e d0f3f8b0 ccf5c376 cf6f0cf3 66b4f400
ffff8ba9538a29c0 73954220 C Bo:1:003:1 0 56027 >
ffff8ba9538a29c0 73954226 S Bi:1:003:1 -115 512 <
ffff8ba9538a29c0 73954608 C Bi:1:003:1 0 512 = 79c8b869 00000000 04000000 00000000 00000000 00000000 00000000 00000000
ffff8ba9538a29c0 73954618 S Bi:1:003:1 -115 512 <
ffff8ba9538a29c0 73954648 C Bi:1:003:1 0 0
ffff8ba9538a29c0 73954672 S Bo:1:003:1 -115 512 = f610d424 ae87ea89 db2eb7cc 32c3cbcf 9059d3eb ca1d99d6 5c6093d3 76a07fa3
ffff8ba9538a29c0 73954709 C Bo:1:003:1 0 512 >
ffff8ba9538a29c0 73954713 S Bi:1:003:1 -115 512 <
ffff8ba9538a29c0 73954935 C Bi:1:003:1 0 512 = 7ac8ba69 00000000 04000000 00000000 00000000 00000000 00000000 00000000
ffff8ba9538a29c0 73954940 S Bi:1:003:1 -115 512 <
ffff8ba9538a29c0 73954975 C Bi:1:003:1 0 0
ffff8ba9538a29c0 74005024 S Bo:1:003:1 -115 512 = b737206e e5a7b308 2671a8b4 40a32b25 1e0e3571 49b559dc 3bf8a4b0 ee05c987
ffff8ba9538a29c0 74005058 C Bo:1:003:1 0 512 >
ffff8ba9538a29c0 74005063 S Bi:1:003:1 -115 512 <
ffff8ba9538a29c0 74005435 C Bi:1:003:1 0 512 = 7ac8ed69 00000000 04000000 00000000 00000000 00000000 00000000 00000000
ffff8ba9538a29c0 74005440 S Bi:1:003:1 -115 512 <
ffff8ba9538a29c0 74005471 C Bi:1:003:1 0 0
ffff8ba9538a29c0 74055549 S Bo:1:003:1 -115 512 = 18f83678 ac04b2f1 a4ef638c 47b77c3d 37c282f3 a00f20b3 30413726 9ea75065
ffff8ba9538a29c0 74055579 C Bo:1:003:1 0 512 >
ffff8ba9538a29c0 74055585 S Bi:1:003:1 -115 512 <
ffff8ba9538a29c0 74055805 C Bi:1:003:1 0 512 = 7ac81f6a 00000000 04000000 00000000 00000000 00000000 00000000 00000000
ffff8ba9538a29c0 74055811 S Bi:1:003:1 -115 512 <
ffff8ba9538a29c0 74055849 C Bi:1:003:1 0 0
ffff8ba9538a29c0 74105929 S Bo:1:003:1 -115 512 = bfd8de27 8cfeb1d3 9e89713f ced7ec06 f6a492d3 6f2abff5 9b25111f 9c9c71ed
ffff8ba9538a29c0 74105964 C Bo:1:003:1 0 512 >
ffff8ba9538a29c0 74105970 S Bi:1:003:1 -115 512 <
ffff8ba9538a29c0 74106208 C Bi:1:003:1 0 512 = 7ac8516a 00000000 04000000 00000000 00000000 00000000 00000000 00000000
ffff8ba9538a29c0 74106213 S Bi:1:003:1 -115 512 <
ffff8ba9538a29c0 74106251 C Bi:1:003:1 0 0
ffff8ba9538a29c0 74156329 S Bo:1:003:1 -115 512 = 86be321c 792e07af 2ff0aee6 bca7644e ee4ddc30 975ccc2a ec1f4ad4 dd8593a3
ffff8ba9538a29c0 74156364 C Bo:1:003:1 0 512 >
ffff8ba9538a29c0 74156369 S Bi:1:003:1 -115 512 <
ffff8ba9538a29c0 74156585 C Bi:1:003:1 0 512 = 7ac8846a 00000000 04000000 00000000 00000000 00000000 00000000 00000000
ffff8ba9538a29c0 74156589 S Bi:1:003:1 -115 512 <
ffff8ba9538a29c0 74156625 C Bi:1:003:1 0 0
ffff8ba9538a29c0 74206702 S Bo:1:003:1 -115 512 = 13f4a43d 3dde5d2f 1aae704d d076f7f4 0fb43297 ccf14063 48f61602 4642b169
ffff8ba9538a29c0 74206737 C Bo:1:003:1 0 512 >
ffff8ba9538a29c0 74206742 S Bi:1:003:1 -115 512 <
ffff8ba9538a29c0 74206984 C Bi:1:003:1 0 512 = 7ac8b66a 00000000 04000000 00000000 00000000 00000000 00000000 00000000
ffff8ba9538a29c0 74206990 S Bi:1:003:1 -115 512 <
ffff8ba9538a29c0 74207021 C Bi:1:003:1 0 0
ffff8ba9538a29c0 74257098 S Bo:1:003:1 -115 512 = 9accaf22 e79e6b5e ae3bf940 c304f4b8 d3228d3c 01574894 40fe8114 ff5abb97
ffff8ba9538a29c0 74257140 C Bo:1:003:1 0 512 >
ffff8ba9538a29c0 74257145 S Bi:1:003:1 -115 512 <
ffff8ba9538a29c0 74257344 C Bi:1:003:1 0 512 = 7ac8e96a 00000000 03000000 00000000 00000000 00000000 00000000 00000000
ffff8ba9538a29c0 74257349 S Bi:1:003:1 -115 512 <
ffff8ba9538a29c0 74257383 C Bi:1:003:1 0 0
ffff8ba9538a29c0 74307460 S Bo:1:003:1 -115 512 = 6f4793d8 b7b015eb 595b1640 9dbc61ce bf579a1c 971555bf 8b3e6e24 5e27c95f
ffff8ba9538a29c0 74307506 C Bo:1:003:1 0 512 >
ffff8ba9538a29c0 74307511 S Bi:1:003:1 -115 512 <
ffff8ba9538a29c0 74307736 C Bi:1:003:1 0 512 = 7ac81b6b 00000000 03000000 00000000 00000000 00000000 00000000 00000000
ffff8ba9538a29c0 74307742 S Bi:1:003:1 -115 512 <
ffff8ba9538a29c0 74307773 C Bi:1:003:1 0 0
ffff8ba9538a29c0 74357849 S Bo:1:003:1 -115 512 = aafc187c 53962948 8ebda191 05619f24 2b9e8ec9 7079800e c7627660 29cdda04
ffff8ba9538a29c0 74357884 C Bo:1:003:1 0 512 >
ffff8ba9538a29c0 74357889 S Bi:1:003:1 -115 512 <
ffff8ba9538a29c0 74358078 C Bi:1:003:1 0 512 = 7ac84d6b 00000000 03000000 00000000 00000000 00000000 00000000 00000000
ffff8ba9538a29c0 74358083 S Bi:1:003:1 -115 512 <
ffff8ba9538a29c0 74358119 C Bi:1:003:1 0 0
ffff8ba9538a29c0 74408197 S Bo:1:003:1 -115 512 = f98e4321 58495f32 209d8b07 ec4de424 cace2471 428c2157 6e0499ef 0bd94a32
ffff8ba9538a29c0 74408223 C Bo:1:003:1 0 512 >
ffff8ba9538a29c0 74408227 S Bi:1:003:1 -115 512 <
ffff8ba9538a29c0 74409399 C Bi:1:003:1 0 512 = 7ac8806b 00000000 03000000 00000000 00000000 00000000 00000000 00000000
ffff8ba9538a29c0 74409404 S Bi:1:003:1 -115 512 <
ffff8ba9538a29c0 74409439 C Bi:1:003:1 0 0
ffff8ba9538a29c0 74459515 S Bo:1:003:1 -115 512 = d128c2e0 43dd06c1 3982ffa1 cfba732c 827cfc36 882378e2 26d23fb0 3ff0b036
ffff8ba9538a29c0 74459549 C Bo:1:003:1 0 512 >
ffff8ba9538a29c0 74459554 S Bi:1:003:1 -115 512 <
ffff8ba9538a29c0 74459749 C Bi:1:003:1 0 512 = 7ac8b36b 00000000 03000000 00000000 00000000 00000000 00000000 00000000
ffff8ba9538a29c0 74459753 S Bi:1:003:1 -115 512 <
ffff8ba9538a29c0 74459797 C Bi:1:003:1 0 0
ffff8ba9538a29c0 74509874 S Bo:1:003:1 -115 512 = f3daf0b7 0a328a93 c71220e9 53068185 1ed2c02d de509ee8 38761c41 78f402ef
ffff8ba9538a29c0 74509908 C Bo:1:003:1 0 512 >
ffff8ba9538a29c0 74509913 S Bi:1:003:1 -115 512 <
ffff8ba9538a29c0 74510312 C Bi:1:003:1 0 512 = 7ac8e56b 00000000 03000000 00000000 00000000 00000000 00000000 00000000
ffff8ba9538a29c0 74510317 S Bi:1:003:1 -115 512 <
ffff8ba9538a29c0 74510351 C Bi:1:003:1 0 0
ffff8ba9246e6480 74560444 S Bo:1:003:1 -115 512 = 551d4c79 94575bb9 1b3073ef ea507bd7 0000f40f 7620f36c ff702ffc 5e57855c
ffff8ba9246e6480 74560480 C Bo:1:003:1 0 512 >
ffff8ba9246e6480 74560486 S Bi:1:003:1 -115 512 <
ffff8ba9246e6480 74560708 C Bi:1:003:1 0 512 = 7ac8186c 00000000 02000000 00000000 00000000 00000000 00000000 00000000
ffff8ba9246e6480 74560713 S Bi:1:003:1 -115 512 <
ffff8ba9246e6480 74560745 C Bi:1:003:1 0 0
ffff8ba9246e6480 74560784 S Bo:1:003:1 -115 58541 = 4a51cd0f 83530914 d444d10d 8eef481a bf376aaf 52b9143d e2666bc3 3f4fcf9b
ffff8ba9246e6480 74562199 C Bo:1:003:1 0 58541 >
ffff8ba9246e6480 74562206 S Bi:1:003:1 -115 512 <
ffff8ba9246e6480 74562673 C Bi:1:003:1 0 512 = 79c8196c 00000000 03000000 00000000 00000000 00000000 00000000 00000000
ffff8ba9246e6480 74562691 S Bi:1:003:1 -115 512 <
ffff8ba9246e6480 74562705 C Bi:1:003:1 0 0
ffff8ba9246e6480 74562737 S Bo:1:003:1 -115 53345 = 41f8a4f3 2a4d39b7 e02955c0 4f69b370 5bf3f62f 4f179b5c 9964712d 15af802a
ffff8ba9246e6480 74564045 C Bo:1:003:1 0 53345 >
ffff8ba9246e6480 74564056 S Bi:1:003:1 -115 512 <
ffff8ba9246e6480 74564507 C Bi:1:003:1 0 512 = 79c81a6c 00000000 04000000 00000000 00000000 00000000 00000000 00000000
ffff8ba9246e6480 74564522 S Bi:1:003:1 -115 512 <
ffff8ba9246e6480 74564548 C Bi:1:003:1 0 0
ffff8ba9246e6480 74564572 S Bo:1:003:1 -115 512 = 739c3265 5fe5f8bd b0732ba0 5aacec6e 28802fad 1be7191f 8a4519b9 f411a6dd
ffff8ba9246e6480 74564608 C Bo:1:003:1 0 512 >
ffff8ba9246e6480 74564612 S Bi:1:003:1 -115 512 <
ffff8ba9246e6480 74564811 C Bi:1:003:1 0 512 = 7ac81c6c 00000000 04000000 00000000 00000000 00000000 00000000 00000000
ffff8ba9246e6480 74564823 S Bi:1:003:1 -115 512 <
ffff8ba9246e6480 74564851 C Bi:1:003:1 0 0
ffff8ba9246e6480 74614967 S Bo:1:003:1 -115 512 = dd5fce3a 01a49ed6 9796d375 88b2ae94 4d422e24 8b7c8883 2342d534 17377393
ffff8ba9246e6480 74615004 C Bo:1:003:1 0 512 >
ffff8ba9246e6480 74615015 S Bi:1:003:1 -115 512 <
ffff8ba9246e6480 74615210 C Bi:1:003:1 0 512 = 7ac84e6c 00000000 04000000 00000000 00000000 00000000 00000000 00000000
ffff8ba9246e6480 74615232 S Bi:1:003:1 -115 512 <
ffff8ba9246e6480 74615265 C Bi:1:003:1 0 0
ffff8ba9246e6480 74665349 S Bo:1:003:1 -115 512 = a3ad1a81 97b4e882 b61f38f1 86672da7 eb1c11cc 2c1deccb c9124dca 9d354f32
ffff8ba9246e6480 74665380 C Bo:1:003:1 0 512 >
ffff8ba9246e6480 74665388 S Bi:1:003:1 -115 512 <
ffff8ba9246e6480 74665625 C Bi:1:003:1 0 512 = 7ac8816c 00000000 04000000 00000000 00000000 00000000 00000000 00000000
ffff8ba9246e6480 74665640 S Bi:1:003:1 -115 512 <
ffff8ba9246e6480 74665665 C Bi:1:003:1 0 0
ffff8ba9a6102540 74715701 S Bo:1:003:1 -115 512 = 68a5f0d8 633e6498 6512077b 51866bee 2f6df992 1ac9514b 093fa59a 782209a6
ffff8ba9a6102540 74715739 C Bo:1:003:1 0 512 >
ffff8ba9a6102540 74715807 S Bi:1:003:1 -115 512 <
ffff8ba9a6102540 74715947 C Bi:1:003:1 0 512 = 7ac8b36c 00000000 04000000 00000000 00000000 00000000 00000000 00000000
ffff8ba9a6102540 74715956 S Bi:1:003:1 -115 512 <
ffff8ba9a6102540 74715979 C Bi:1:003:1 0 0
ffff8ba9a6102540 74766022 S Bo:1:003:1 -115 512 = 2bdbe3a9 c8bf356b 9ba73c41 fc80c857 029337fd 4fa3f8ab 6c33efcb 3331b919
ffff8ba9a6102540 74766068 C Bo:1:003:1 0 512 >
ffff8ba9a6102540 74766077 S Bi:1:003:1 -115 512 <
ffff8ba9a6102540 74766308 C Bi:1:003:1 0 512 = 7ac8e66c 00000000 04000000 00000000 00000000 00000000 00000000 00000000
ffff8ba9a6102540 74766316 S Bi:1:003:1 -115 512 <
ffff8ba9a6102540 74766329 C Bi:1:003:1 0 0
ffff8ba9a6102540 74816409 S Bo:1:003:1 -115 512 = 9c6dde76 e0886f2d e0810f01 1738968c 04641e30 536d2b7b d951d159 262c47e9
ffff8ba9a6102540 74816444 C Bo:1:003:1 0 512 >
ffff8ba9a6102540 74816451 S Bi:1:003:1 -115 512 <
ffff8ba9a6102540 74816649 C Bi:1:003:1 0 512 = 7ac8186d 00000000 03000000 00000000 00000000 00000000 00000000 00000000
ffff8ba9a6102540 74816655 S Bi:1:003:1 -115 512 <
ffff8ba9a6102540 74816689 C Bi:1:003:1 0 0
ffff8ba9a6102540 74866768 S Bo:1:003:1 -115 512 = bbecc597 462a9d38 bf9f54b3 83e2731e 786324ca 1006995f 03a3af73 20eb5849
ffff8ba9a6102540 74866802 C Bo:1:003:1 0 512 >
ffff8ba9a6102540 74866808 S Bi:1:003:1 -115 512 <
ffff8ba9a6102540 74867029 C Bi:1:003:1 0 512 = 7ac84a6d 00000000 03000000 00000000 00000000 00000000 00000000 00000000
ffff8ba9a6102540 74867080 S Bi:1:003:1 -115 512 <
ffff8ba9a6102540 74867109 C Bi:1:003:1 0 0
ffff8ba9a6102540 74917188 S Bo:1:003:1 -115 512 = 205a0c3c e770a63a 10354ec0 def48a23 399cece3 bf5335f6 6b55d4ba 601cf7a8
ffff8ba9a6102540 74917225 C Bo:1:003:1 0 512 >
ffff8ba9a6102540 74917236 S Bi:1:003:1 -115 512 <
ffff8ba9a6102540 74917426 C Bi:1:003:1 0 512 = 7ac87d6d 00000000 03000000 00000000 00000000 00000000 00000000 00000000
ffff8ba9a6102540 74917435 S Bi:1:003:1 -115 512 <
ffff8ba9a6102540 74917457 C Bi:1:003:1 0 0
ffff8ba9a6102540 74967536 S Bo:1:003:1 -115 512 = 54600f57 4fd30576 86f26c1c d6486817 d533e6d0 1e388e09 db706073 627c38d5
ffff8ba9a6102540 74967582 C Bo:1:003:1 0 512 >
ffff8ba9a6102540 74967591 S Bi:1:003:1 -115 512 <
ffff8ba9a6102540 74967807 C Bi:1:003:1 0 512 = 7ac8af6d 00000000 03000000 00000000 00000000 00000000 00000000 00000000
ffff8ba9a6102540 74967816 S Bi:1:003:1 -115 512 <
ffff8ba9a6102540 74967839 C Bi:1:003:1 0 0
ffff8ba9a6102540 75017921 S Bo:1:003:1 -115 512 = 1ff351eb 1ab6a85c c7132489 112e7bc2 d6f37996 c0617e7f 653cee4e 713d2332
ffff8ba9a6102540 75017967 C Bo:1:003:1 0 512 >
ffff8ba9a6102540 75017977 S Bi:1:003:1 -115 512 <
ffff8ba9a6102540 75018173 C Bi:1:003:1 0 512 = 7ac8e16d 00000000 03000000 00000000 00000000 00000000 00000000 00000000
ffff8ba9a6102540 75018182 S Bi:1:003:1 -115 512 <
ffff8ba9a6102540 75018205 C Bi:1:003:1 0 0
ffff8ba98420e9c0 75068265 S Bo:1:003:1 -115 512 = 01f24307 013d04b5 12bcfe03 29ef8973 91b01e56 0f1b36f9 9f47fee0 0ac1418a
ffff8ba98420e9c0 75068311 C Bo:1:003:1 0 512 >
ffff8ba98420e9c0 75068321 S Bi:1:003:1 -115 512 <
ffff8ba98420e9c0 75068543 C Bi:1:003:1 0 512 = 7ac8146e 00000000 03000000 00000000 00000000 00000000 00000000 00000000
ffff8ba98420e9c0 75068552 S Bi:1:003:1 -115 512 <
ffff8ba98420e9c0 75068565 C Bi:1:003:1 0 0
ffff8ba98420e9c0 75118647 S Bo:1:003:1 -115 512 = 68073f1d fdc808f0 7df4f1e2 a75f9a0b 52abdb7f 3b3963fa 27271ffd 9c6b3f03
ffff8ba98420e9c0 75118693 C Bo:1:003:1 0 512 >
ffff8ba98420e9c0 75118703 S Bi:1:003:1 -115 512 <
ffff8ba98420e9c0 75118899 C Bi:1:003:1 0 512 = 7ac8466e 00000000 02000000 00000000 00000000 00000000 00000000 00000000
ffff8ba98420e9c0 75118908 S Bi:1:003:1 -115 512 <
ffff8ba98420e9c0 75118931 C Bi:1:003:1 0 0
ffff8ba98420e9c0 75118974 S Bo:1:003:1 -115 58043 = 0ddc4618 c28a68bf 452490f7 f2562e08 e44a062c 41a0f11b 1075ee5d c0603edf
ffff8ba98420e9c0 75120428 C Bo:1:003:1 0 58043 >
ffff8ba98420e9c0 75120442 S Bi:1:003:1 -115 512 <
ffff8ba98420e9c0 75120879 C Bi:1:003:1 0 512 = 79c8476e 00000000 03000000 00000000 00000000 00000000 00000000 00000000
ffff8ba98420e9c0 75120898 S Bi:1:003:1 -115 512 <
ffff8ba98420e9c0 75120910 C Bi:1:003:1 0 0
ffff8ba98420e9c0 75120947 S Bo:1:003:1 -115 55167 = 2bf5ab65 9c2828a0 287a49d4 8b66f8c5 76ff7e12 f8e1e8a2 1d48afef 6f3ed27b
ffff8ba98420e9c0 75122395 C Bo:1:003:1 0 55167 >
ffff8ba98420e9c0 75122407 S Bi:1:003:1 -115 512 <
ffff8ba98420e9c0 75122739 C Bi:1:003:1 0 512 = 79c8486e 00000000 04000000 00000000 00000000 00000000 00000000 00000000
ffff8ba98420e9c0 75122756 S Bi:1:003:1 -115 512 <
ffff8ba98420e9c0 75122768 C Bi:1:003:1 0 0
ffff8ba98420e9c0 75122794 S Bo:1:003:1 -115 512 = 4eb62d2e 42c6c4ee f20f733e 3189fed7 7da2f2d7 25943cb9 375b629d 7ba69838
ffff8ba98420e9c0 75122829 C Bo:1:003:1 0 512 >
ffff8ba98420e9c0 75122835 S Bi:1:003:1 -115 512 <
ffff8ba98420e9c0 75122997 C Bi:1:003:1 0 512 = 7ac84a6e 00000000 04000000 00000000 00000000 00000000 00000000 00000000
ffff8ba98420e9c0 75123006 S Bi:1:003:1 -115 512 <
ffff8ba98420e9c0 75123036 C Bi:1:003:1 0 0
ffff8ba98420e9c0 75173116 S Bo:1:003:1 -115 512 = ad274dff 25a286ab 63dec5ab eef99170 d94ab6e1 5ebab731 cfb79012 ae23ead1
ffff8ba98420e9c0 75173163 C Bo:1:003:1 0 512 >
ffff8ba98420e9c0 75173172 S Bi:1:003:1 -115 512 <
ffff8ba98420e9c0 75173388 C Bi:1:003:1 0 512 = 7ac87d6e 00000000 04000000 00000000 00000000 00000000 00000000 00000000
ffff8ba98420e9c0 75173396 S Bi:1:003:1 -115 512 <
ffff8ba98420e9c0 75173419 C Bi:1:003:1 0 0
ffff8ba98420e9c0 75223506 S Bo:1:003:1 -115 512 = 97417f18 d7b6dabf b2e7e5ae 5e49eab1 bee94a40 870ec79a 7ca8c087 95a7499d
ffff8ba98420e9c0 75223553 C Bo:1:003:1 0 512 >
ffff8ba98420e9c0 75223563 S Bi:1:003:1 -115 512 <
ffff8ba98420e9c0 75223774 C Bi:1:003:1 0 512 = 7ac8af6e 00000000 04000000 00000000 00000000 00000000 00000000 00000000
ffff8ba98420e9c0 75223782 S Bi:1:003:1 -115 512 <
ffff8ba98420e9c0 75223805 C Bi:1:003:1 0 0
ffff8ba98420e9c0 75273884 S Bo:1:003:1 -115 512 = 8f438630 06b3dd5e d3297e6c 06d59f69 2a8c001a 73988ecd d564faa4 2f8a73b8
ffff8ba98420e9c0 75273930 C Bo:1:003:1 0 512 >
ffff8ba98420e9c0 75273939 S Bi:1:003:1 -115 512 <
ffff8ba98420e9c0 75274140 C Bi:1:003:1 0 512 = 7ac8e16e 00000000 04000000 00000000 00000000 00000000 00000000 00000000
ffff8ba98420e9c0 75274148 S Bi:1:003:1 -115 512 <
ffff8ba98420e9c0 75274161 C Bi:1:003:1 0 0
ffff8ba98420e9c0 75324244 S Bo:1:003:1 -115 512 = a4a69b03 6c456c95 c0f1a91b 5b46b993 aa85bd56 d42f8898 2fa02e71 484f5669
ffff8ba98420e9c0 75324290 C Bo:1:003:1 0 512 >
ffff8ba98420e9c0 75324300 S Bi:1:003:1 -115 512 <
ffff8ba98420e9c0 75324476 C Bi:1:003:1 0 512 = 7ac8146f 00000000 04000000 00000000 00000000 00000000 00000000 00000000
ffff8ba98420e9c0 75324485 S Bi:1:003:1 -115 512 <
ffff8ba98420e9c0 75324508 C Bi:1:003:1 0 0
ffff8ba91fa62a80 75374589 S Bo:1:003:1 -115 512 = 3fd7f820 3ea7e852 74d191e0 65cd1f19 2f0a5157 0ad3768c 4374eaa3 e09193c1
ffff8ba91fa62a80 75374636 C Bo:1:003:1 0 512 >
ffff8ba91fa62a80 75374646 S Bi:1:003:1 -115 512 <
ffff8ba91fa62a80 75374899 C Bi:1:003:1 0 512 = 7ac8466f 00000000 04000000 00000000 00000000 00000000 00000000 00000000
ffff8ba91fa62a80 75374909 S Bi:1:003:1 -115 512 <
ffff8ba91fa62a80 75374921 C Bi:1:003:1 0 0
ffff8ba98420f380 75424975 S Bo:1:003:1 -115 512 = 41f4121c 8423132e 4febf189 3ff5ae0d 82af573b 9dd3ce81 cee03f2b 34d3d52b
ffff8ba98420f380 75425021 C Bo:1:003:1 0 512 >
ffff8ba98420f380 75425031 S Bi:1:003:1 -115 512 <
ffff8ba98420f380 75425213 C Bi:1:003:1 0 512 = 7ac8786f 00000000 03000000 00000000 00000000 00000000 00000000 00000000
ffff8ba98420f380 75425222 S Bi:1:003:1 -115 512 <
ffff8ba98420f380 75425244 C Bi:1:003:1 0 0
ffff8ba9a6102540 75475286 S Bo:1:003:1 -115 512 = 285c198d 3f5b4f28 eda7b5e3 a9e207ec 44171eb4 7e335d87 b7c25e9d a11e8456
ffff8ba9a6102540 75475332 C Bo:1:003:1 0 512 >
ffff8ba9a6102540 75475341 S Bi:1:003:1 -115 512 <
ffff8ba9a6102540 75475571 C Bi:1:003:1 0 512 = 7ac8ab6f 00000000 03000000 00000000 00000000 00000000 00000000 00000000
ffff8ba9a6102540 75475580 S Bi:1:003:1 -115 512 <
ffff8ba9a6102540 75475603 C Bi:1:003:1 0 0
ffff8ba9a6102540 75525681 S Bo:1:003:1 -115 512 = e0db28bd 5759da22 03dfb32d fcb9171e 93f76ebe 7d537d99 40be9dfc 146b788e
ffff8ba9a6102540 75525727 C Bo:1:003:1 0 512 >
ffff8ba9a6102540 75525735 S Bi:1:003:1 -115 512 <
ffff8ba9a6102540 75525953 C Bi:1:003:1 0 512 = 7ac8dd6f 00000000 03000000 00000000 00000000 00000000 00000000 00000000
ffff8ba9a6102540 75525962 S Bi:1:003:1 -115 512 <
ffff8ba9a6102540 75525986 C Bi:1:003:1 0 0
ffff8ba9a6102540 75576120 S Bo:1:003:1 -115 512 = 907b2373 f3494418 4d510a72 bcd70deb 85645d70 ae1344b6 35c0a086 6a6ee8f5
ffff8ba9a6102540 75576165 C Bo:1:003:1 0 512 >
ffff8ba9a6102540 75576174 S Bi:1:003:1 -115 512 <
ffff8ba9a6102540 75576417 C Bi:1:003:1 0 512 = 7ac81070 00000000 03000000 00000000 00000000 00000000 00000000 00000000
ffff8ba9a6102540 75576426 S Bi:1:003:1 -115 512 <
ffff8ba9a6102540 75576450 C Bi:1:003:1 0 0
ffff8ba98420f380 75626497 S Bo:1:003:1 -115 512 = 8f658fdc 96846400 d59ef315 606995d8 e689d5bf 6945f111 1bae5687 2b2e1f52
ffff8ba98420f380 75626544 C Bo:1:003:1 0 512 >
ffff8ba98420f380 75626553 S Bi:1:003:1 -115 512 <
ffff8ba98420f380 75626766 C Bi:1:003:1 0 512 = 7ac84270 00000000 03000000 00000000 00000000 00000000 00000000 00000000
ffff8ba98420f380 75626775 S Bi:1:003:1 -115 512 <
ffff8ba98420f380 75626797 C Bi:1:003:1 0 0
ffff8ba94077dec0 75676862 S Bo:1:003:1 -115 512 = 99990012 96efc98c c2897cfb 46a88011 25aae46a 493e166a 950f1488 ec7dabed
ffff8ba94077dec0 75676903 C Bo:1:003:1 0 512 >
ffff8ba98420f380 75676918 S Bi:1:003:1 -115 512 <
ffff8ba98420f380 75677150 C Bi:1:003:1 0 512 = 7ac87470 00000000 03000000 00000000 00000000 00000000 00000000 00000000
ffff8ba94077dec0 75677165 S Bi:1:003:1 -115 512 <
ffff8ba94077dec0 75677178 C Bi:1:003:1 0 0
ffff8ba91dd880c0 75727262 S Bo:1:003:1 -115 512 = 53ffdada 77f81ad9 f0e5a1e7 ffd6d7a8 d0a468a5 5c5a1409 c4b4776d b9f9480d
ffff8ba91dd880c0 75727308 C Bo:1:003:1 0 512 >
ffff8ba91dd880c0 75727317 S Bi:1:003:1 -115 512 <
ffff8ba91dd880c0 75727519 C Bi:1:003:1 0 512 = 7ac8a770 00000000 02000000 00000000 00000000 00000000 00000000 00000000
ffff8ba91dd880c0 75727528 S Bi:1:003:1 -115 512 <
ffff8ba91dd880c0 75727548 C Bi:1:003:1 0 0
ffff8ba91dd880c0 75727587 S Bo:1:003:1 -115 52824 = d3c6de6f c413de15 c40cd394 d0121475 abd84960 9114396a 6c54e42e f2500496
ffff8ba91dd880c0 75728880 C Bo:1:003:1 0 52824 >
ffff8ba91dd880c0 75728888 S Bi:1:003:1 -115 512 <
ffff8ba91dd880c0 75729265 C Bi:1:003:1 0 512 = 79c8a870 00000000 03000000 00000000 00000000 00000000 00000000 00000000
ffff8ba91dd880c0 75729281 S Bi:1:003:1 -115 512 <
ffff8ba91dd880c0 75729304 C Bi:1:003:1 0 0
ffff8ba91dd880c0 75729336 S Bo:1:003:1 -115 56494 = 98f084bb 2480754d 1de22a95 d06b6b6c bb46fbdf 6d1a8033 61acb5fd 7b3e676d
ffff8ba91dd880c0 75730766 C Bo:1:003:1 0 56494 >
ffff8ba91dd880c0 75730773 S Bi:1:003:1 -115 512 <
ffff8ba91dd880c0 75731219 C Bi:1:003:1 0 512 = 79c8a970 00000000 04000000 00000000 00000000 00000000 00000000 00000000
ffff8ba91dd880c0 75731272 S Bi:1:003:1 -115 512 <
ffff8ba91dd880c0 75731302 C Bi:1:003:1 0 0
ffff8ba91dd880c0 75731354 S Bo:1:003:1 -115 512 = 5c905c6a 001555e4 39adbd42 9749d632 f5ade29c e2afb48a 48c99055 1114f4a0
ffff8ba91dd880c0 75731388 C Bo:1:003:1 0 512 >
ffff8ba91dd880c0 75731397 S Bi:1:003:1 -115 512 <
ffff8ba91dd880c0 75731571 C Bi:1:003:1 0 512 = 7ac8ab70 00000000 04000000 00000000 00000000 00000000 00000000 00000000
ffff8ba91dd880c0 75731579 S Bi:1:003:1 -115 512 <
ffff8ba91dd880c0 75731612 C Bi:1:003:1 0 0
ffff8ba91dd880c0 75781724 S Bo:1:003:1 -115 512 = 0101a616 1fe622c4 3900fb0d 7b667e52 1c799141 68471007 f5c2d75f fc820e29
ffff8ba91dd880c0 75781762 C Bo:1:003:1 0 512 >
ffff8ba91dd880c0 75781773 S Bi:1:003:1 -115 512 <
ffff8ba91dd880c0 75781963 C Bi:1:003:1 0 512 = 7ac8dd70 00000000 04000000 00000000 00000000 00000000 00000000 00000000
ffff8ba91dd880c0 75781985 S Bi:1:003:1 -115 512 <
ffff8ba91dd880c0 75782009 C Bi:1:003:1 0 0
ffff8ba91dd880c0 75832092 S Bo:1:003:1 -115 512 = 1937dbac 6bd1a2ab b91eed13 954a0285 c535383d 275b8dbb 12c083ad 91747fe1
ffff8ba91dd880c0 75832123 C Bo:1:003:1 0 512 >
ffff8ba91dd880c0 75832129 S Bi:1:003:1 -115 512 <
ffff8ba91dd880c0 75832355 C Bi:1:003:1 0 512 = 7ac81071 00000000 04000000 00000000 00000000 00000000 00000000 00000000
ffff8ba91dd880c0 75832361 S Bi:1:003:1 -115 512 <
ffff8ba91dd880c0 75832397 C Bi:1:003:1 0 0
ffff8ba91dd880c0 75882513 S Bo:1:003:1 -115 512 = f012ff38 d369b23b 7d79e21d 3997ae84 834e149b 34a7f012 9aded546 538fa121
ffff8ba91dd880c0 75882551 C Bo:1:003:1 0 512 >
ffff8ba91dd880c0 75882561 S Bi:1:003:1 -115 512 <
ffff8ba91dd880c0 75882751 C Bi:1:003:1 0 512 = 7ac84271 00000000 04000000 00000000 00000000 00000000 00000000 00000000
ffff8ba91dd880c0 75882773 S Bi:1:003:1 -115 512 <
ffff8ba91dd880c0 75882805 C Bi:1:003:1 0 0
ffff8ba91dd880c0 75932885 S Bo:1:003:1 -115 512 = b84b3122 bce394b4 dc29c7dd 4a53fba3 d6deebe1 6a3df7ca d231d40b 085bdc48
ffff8ba91dd880c0 75932920 C Bo:1:003:1 0 512 >
ffff8ba91dd880c0 75932926 S Bi:1:003:1 -115 512 <
ffff8ba91dd880c0 75933154 C Bi:1:003:1 0 512 = 7ac87471 00000000 04000000 00000000 00000000 00000000 00000000 00000000
ffff8ba91dd880c0 75933160 S Bi:1:003:1 -115 512 <
ffff8ba91dd880c0 75933190 C Bi:1:003:1 0 0
ffff8ba91dd880c0 75983271 S Bo:1:003:1 -115 512 = 63f633b1 35cba603 9ebbbe3a 171aa58d a0057617 850bebca f5b6b456 0c6bd2e3
ffff8ba91dd880c0 75983306 C Bo:1:003:1 0 512 >
ffff8ba91dd880c0 75983313 S Bi:1:003:1 -115 512 <
ffff8ba91dd880c0 75983515 C Bi:1:003:1 0 512 = 7ac8a771 00000000 04000000 00000000 00000000 00000000 00000000 00000000
ffff8ba91dd880c0 75983521 S Bi:1:003:1 -115 512 <
ffff8ba91dd880c0 75983552 C Bi:1:003:1 0 0
ffff8ba941e70840 76033634 S Bo:1:003:1 -115 512 = 058fb993 69b5408c 59c14ab2 391fdefc 8d52537c e3a34a1a e60331a4 8c86e003
ffff8ba941e70840 76033669 C Bo:1:003:1 0 512 >
ffff8ba941e70840 76033677 S Bi:1:003:1 -115 512 <
ffff8ba941e70840 76033896 C Bi:1:003:1 0 512 = 7ac8d971 00000000 04000000 00000000 00000000 00000000 00000000 00000000
ffff8ba941e70840 76033905 S Bi:1:003:1 -115 512 <
ffff8ba941e70840 76033936 C Bi:1:003:1 0 0
ffff8ba941e70840 76084017 S Bo:1:003:1 -115 512 = 4cc56466 4896da46 91f2d303 f92dcc61 70f5a14c e97ad8ad a72921cd e99621ef
ffff8ba941e70840 76084051 C Bo:1:003:1 0 512 >
ffff8ba941e70840 76084057 S Bi:1:003:1 -115 512 <
ffff8ba941e70840 76084248 C Bi:1:003:1 0 512 = 7ac80c72 00000000 03000000 00000000 00000000 00000000 00000000 00000000
ffff8ba941e70840 76084254 S Bi:1:003:1 -115 512 <
ffff8ba941e70840 76084288 C Bi:1:003:1 0 0
ffff8ba91fa62a80 76134341 S Bo:1:003:1 -115 512 = 6d5fd681 30722edd f7fb02fb 612a42c8 949a4cb7 2df34c0a 3638db64 0708007d
ffff8ba91fa62a80 76134383 C Bo:1:003:1 0 512 >
ffff8ba91fa62a80 76134392 S Bi:1:003:1 -115 512 <
ffff8ba91fa62a80 76134615 C Bi:1:003:1 0 512 = 7ac83e72 00000000 03000000 00000000 00000000 00000000 00000000 00000000
ffff8ba91fa62a80 76134625 S Bi:1:003:1 -115 512 <
ffff8ba91fa62a80 76134647 C Bi:1:003:1 0 0
ffff8ba91fa62a80 76184727 S Bo:1:003:1 -115 512 = f89f674a f6c6541f 84b59cb5 ac1c4df6 7d604373 382f1e43 5f60915d 99fb3d15
ffff8ba91fa62a80 76184773 C Bo:1:003:1 0 512 >
ffff8ba91fa62a80 76184781 S Bi:1:003:1 -115 512 <
ffff8ba91fa62a80 76184974 C Bi:1:003:1 0 512 = 7ac87072 00000000 03000000 00000000 00000000 00000000 00000000 00000000
ffff8ba91fa62a80 76184982 S Bi:1:003:1 -115 512 <
ffff8ba91fa62a80 76185005 C Bi:1:003:1 0 0
ffff8ba94077dec0 76235087 S Bo:1:003:1 -115 512 = 02b88fe9 9e4360f9 b81c1c10 8c706899 483857ef 3e1e0a4e ce4fb2f3 4b411f5e
ffff8ba94077dec0 76235129 C Bo:1:003:1 0 512 >
ffff8ba94077dec0 76235140 S Bi:1:003:1 -115 512 <
ffff8ba94077dec0 76235361 C Bi:1:003:1 0 512 = 7ac8a372 00000000 03000000 00000000 00000000 00000000 00000000 00000000
ffff8ba94077dec0 76235371 S Bi:1:003:1 -115 512 <
ffff8ba94077dec0 76235393 C Bi:1:003:1 0 0
ffff8ba941e70840 76285444 S Bo:1:003:1 -115 512 = e2237ada 0394cccd 8b2a2973 4928770b 42fec5ab 20a12e02 78450389 0627b1f1
ffff8ba941e70840 76285491 C Bo:1:003:1 0 512 >
ffff8ba941e70840 76285501 S Bi:1:003:1 -115 512 <
ffff8ba941e70840 76285743 C Bi:1:003:1 0 512 = 7ac8d572 00000000 03000000 00000000 00000000 00000000 00000000 00000000
ffff8ba941e70840 76285753 S Bi:1:003:1 -115 512 <
ffff8ba941e70840 76285776 C Bi:1:003:1 0 0
ffff8ba941e70840 76335856 S Bo:1:003:1 -115 512 = e249feb2 f00add76 863e4d1f 40b60985 4134ddf2 725c53b4 550f64ec 444c80a0
ffff8ba941e70840 76335902 C Bo:1:003:1 0 512 >
ffff8ba941e70840 76335911 S Bi:1:003:1 -115 512 <
ffff8ba941e70840 76336092 C Bi:1:003:1 0 512 = 7ac80773 00000000 02000000 00000000 00000000 00000000 00000000 00000000
ffff8ba941e70840 76336101 S Bi:1:003:1 -115 512 <
ffff8ba941e70840 76336124 C Bi:1:003:1 0 0
ffff8ba941e70840 76336166 S Bo:1:003:1 -115 58156 = c1579623 3f743927 9fe471cd 774a065b 51aaefd4 435eb632 2f1759f0 0e0d2725
ffff8ba941e70840 76337581 C Bo:1:003:1 0 58156 >
ffff8ba941e70840 76337590 S Bi:1:003:1 -115 512 <
ffff8ba941e70840 76338022 C Bi:1:003:1 0 512 = 79c80873 00000000 03000000 00000000 00000000 00000000 00000000 00000000
ffff8ba941e70840 76338046 S Bi:1:003:1 -115 512 <
ffff8ba941e70840 76338076 C Bi:1:003:1 0 0
ffff8ba941e70840 76338113 S Bo:1:003:1 -115 59341 = fc0352b1 79236dc2 7951db4d b2e94939 16cbc34d c0b64cb1 6d8510e2 d9c4c9f8
ffff8ba941e70840 76339657 C Bo:1:003:1 0 59341 >
ffff8ba941e70840 76339667 S Bi:1:003:1 -115 512 <
ffff8ba941e70840 76340048 C Bi:1:003:1 0 512 = 79c80a73 00000000 04000000 00000000 00000000 00000000 00000000 00000000
ffff8ba941e70840 76340071 S Bi:1:003:1 -115 512 <
ffff8ba941e70840 76340091 C Bi:1:003:1 0 0
ffff8ba941e70840 76340117 S Bo:1:003:1 -115 512 = 233343b7 4684e23e 59b0ad57 bb07dde8 31f998a1 635784cb 7cbc99bc 0451e2bb
ffff8ba941e70840 76340152 C Bo:1:003:1 0 512 >
ffff8ba941e70840 76340159 S Bi:1:003:1 -115 512 <
ffff8ba941e70840 76340297 C Bi:1:003:1 0 512 = 7ac80c73 00000000 04000000 00000000 00000000 00000000 00000000 00000000
ffff8ba941e70840 76340303 S Bi:1:003:1 -115 512 <
ffff8ba941e70840 76340336 C Bi:1:003:1 0 0
ffff8ba941e70840 76390415 S Bo:1:003:1 -115 512 = ccf9579c e7435118 00837263 2b43e59c c9882d2f 785cd1d7 fafd2ab1 4280680b
ffff8ba941e70840 76390461 C Bo:1:003:1 0 512 >
ffff8ba941e70840 76390471 S Bi:1:003:1 -115 512 <
ffff8ba941e70840 76390671 C Bi:1:003:1 0 512 = 7ac83e73 00000000 04000000 00000000 00000000 00000000 00000000 00000000
ffff8ba941e70840 76390680 S Bi:1:003:1 -115 512 <
ffff8ba941e70840 76390702 C Bi:1:003:1 0 0
ffff8ba941e70840 76440782 S Bo:1:003:1 -115 512 = 70bc992b b3f22dc7 c04b4a8f 34f439a9 8880b4f3 620307b5 502d84a2 f541e30f
ffff8ba941e70840 76440827 C Bo:1:003:1 0 512 >
ffff8ba941e70840 76440836 S Bi:1:003:1 -115 512 <
ffff8ba941e70840 76441023 C Bi:1:003:1 0 512 = 7ac87073 00000000 04000000 00000000 00000000 00000000 00000000 00000000
ffff8ba941e70840 76441032 S Bi:1:003:1 -115 512 <
ffff8ba941e70840 76441053 C Bi:1:003:1 0 0
ffff8ba94077dec0 76491088 S Bo:1:003:1 -115 512 = ddd15b05 188b1075 da731170 659aafb2 eb6e0a66 4ea8928c 251f1648 55675f93
ffff8ba94077dec0 76491131 C Bo:1:003:1 0 512 >
ffff8ba94077dec0 76491141 S Bi:1:003:1 -115 512 <
ffff8ba94077dec0 76491330 C Bi:1:003:1 0 512 = 7ac8a373 00000000 04000000 00000000 00000000 00000000 00000000 00000000
ffff8ba94077dec0 76491339 S Bi:1:003:1 -115 512 <
ffff8ba94077dec0 76491359 C Bi:1:003:1 0 0
ffff8ba94077dec0 76541439 S Bo:1:003:1 -115 512 = 4f54ccfa a99e13b7 5db9d8d1 2f895eef af2b364e 89f6dd0e 918c3378 78bb9858
ffff8ba94077dec0 76541496 C Bo:1:003:1 0 512 >
ffff8ba94077dec0 76541506 S Bi:1:003:1 -115 512 <
ffff8ba94077dec0 76541696 C Bi:1:003:1 0 512 = 7ac8d573 00000000 04000000 00000000 00000000 00000000 00000000 00000000
ffff8ba94077dec0 76541705 S Bi:1:003:1 -115 512 <
ffff8ba94077dec0 76541727 C Bi:1:003:1 0 0
ffff8ba94077dec0 76591805 S Bo:1:003:1 -115 512 = 8eac1ab7 b8cca69c 0253b944 35ad422e 32d8bfa6 c8fdb29e 554d1a42 f739b221
ffff8ba94077dec0 76591865 C Bo:1:003:1 0 512 >
ffff8ba94077dec0 76591874 S Bi:1:003:1 -115 512 <
ffff8ba94077dec0 76592072 C Bi:1:003:1 0 512 = 7ac80774 00000000 04000000 00000000 00000000 00000000 00000000 00000000
ffff8ba94077dec0 76592081 S Bi:1:003:1 -115 512 <
ffff8ba94077dec0 76592103 C Bi:1:003:1 0 0
ffff8ba94077dec0 76642181 S Bo:1:003:1 -115 512 = 9b91f103 653352f1 9d137b04 589519f4 a5fd208a e1db0927 b29d9e28 346683bc
ffff8ba94077dec0 76642237 C Bo:1:003:1 0 512 >
ffff8ba94077dec0 76642245 S Bi:1:003:1 -115 512 <
ffff8ba94077dec0 76642428 C Bi:1:003:1 0 512 = 7ac83a74 00000000 03000000 00000000 00000000 00000000 00000000 00000000
ffff8ba94077dec0 76642437 S Bi:1:003:1 -115 512 <
ffff8ba94077dec0 76642461 C Bi:1:003:1 0 0
ffff8ba94077dec0 76692539 S Bo:1:003:1 -115 512 = c2e2b17f 4db568ab ea7702f2 8ec5b73a c2e2d080 931ee1ed 65d86183 c9ec25d7
ffff8ba94077dec0 76692585 C Bo:1:003:1 0 512 >
ffff8ba94077dec0 76692594 S Bi:1:003:1 -115 512 <
ffff8ba94077dec0 76692794 C Bi:1:003:1 0 512 = 7ac86c74 00000000 03000000 00000000 00000000 00000000 00000000 00000000
ffff8ba94077dec0 76692803 S Bi:1:003:1 -115 512 <
ffff8ba94077dec0 76692826 C Bi:1:003:1 0 0
ffff8ba9246e6480 76742909 S Bo:1:003:1 -115 512 = 68f917cc d5e8254d 889c6d36 72a4f730 ffcae00d 77c3803d 947458c0 bc29f759
ffff8ba9246e6480 76742956 C Bo:1:003:1 0 512 >
ffff8ba9246e6480 76742967 S Bi:1:003:1 -115 512 <
ffff8ba9246e6480 76743181 C Bi:1:003:1 0 512 = 7ac89e74 00000000 03000000 00000000 00000000 00000000 00000000 00000000
ffff8ba9246e6480 76743191 S Bi:1:003:1 -115 512 <
ffff8ba9246e6480 76743217 C Bi:1:003:1 0 0
ffff8ba9246e6480 76793300 S Bo:1:003:1 -115 512 = 8f1be9ee 10763f22 43d850ef 91785f35 cb8afc4d 3371d355 22e36b21 4ca86464
ffff8ba9246e6480 76793362 C Bo:1:003:1 0 512 >
ffff8ba9246e6480 76793373 S Bi:1:003:1 -115 512 <
ffff8ba9246e6480 76793588 C Bi:1:003:1 0 512 = 7ac8d174 00000000 03000000 00000000 00000000 00000000 00000000 00000000
ffff8ba9246e6480 76793597 S Bi:1:003:1 -115 512 <
ffff8ba9246e6480 76793620 C Bi:1:003:1 0 0
ffff8ba920808900 76843705 S Bo:1:003:1 -115 512 = 54d5006d fe84f5d2 bc0868f9 5154cb2b ced8c9ff 4a832dc4 64bf6cdd fdbdf7f2
ffff8ba920808900 76843741 C Bo:1:003:1 0 512 >
ffff8ba920808900 76843762 S Bi:1:003:1 -115 512 <
ffff8ba920808900 76843970 C Bi:1:003:1 0 512 = 7ac80375 00000000 03000000 00000000 00000000 00000000 00000000 00000000
ffff8ba920808900 76843991 S Bi:1:003:1 -115 512 <
ffff8ba920808900 76844024 C Bi:1:003:1 0 0
ffff8ba94077d380 76852786 S Co:1:002:0 s 21 09 0351 0000 02d7 727 = 51090800 0000f0ff 50000000 00000000 00000000 00000000 00000000 00000000
ffff8ba94077d380 76858262 C Co:1:002:0 0 727 >
ffff8ba94077d380 76858270 S Co:1:002:0 s 21 09 0351 0000 02d7 727 = 51090400 0000f0ff 50000000 00000000 00000000 00000000 00000000 00000000
ffff8ba94077d380 76863855 C Co:1:002:0 0 727 >
ffff8ba94077d380 76863860 S Co:1:002:0 s 21 09 0351 0000 02d7 727 = 51090401 0000f066 ccff0000 00000000 00000000 00000000 00000000 00000000
ffff8ba94077d380 76869499 C Co:1:002:0 0 727 >
ffff8ba94077d380 76869504 S Co:1:002:0 s 21 09 0351 0000 02d7 727 = 51090402 0000f066 ccff0000 00000000 00000000 00000000 00000000 00000000
ffff8ba94077d380 76875142 C Co:1:002:0 0 727 >
ffff8ba920808900 76894109 S Bo:1:003:1 -115 512 = feeb3779 d5a88ded 6ae566eb aa0814ec 46f3a7d8 863e69e7 b8b90a6e c327c431
ffff8ba920808900 76894143 C Bo:1:003:1 0 512 >
ffff8ba920808900 76894150 S Bi:1:003:1 -115 512 <
ffff8ba920808900 76894367 C Bi:1:003:1 0 512 = 7ac83675 00000000 02000000 00000000 00000000 00000000 00000000 00000000
ffff8ba920808900 76894372 S Bi:1:003:1 -115 512 <
ffff8ba920808900 76894408 C Bi:1:003:1 0 0
ffff8ba920808900 76894482 S Bo:1:003:1 -115 59159 = 0cf04e34 bfb5f7e6 aead5c13 faa0e014 dc2f3e73 8bc184c4 78bdfcee 9590b09a
ffff8ba920808900 76896052 C Bo:1:003:1 0 59159 >
ffff8ba920808900 76896060 S Bi:1:003:1 -115 512 <
ffff8ba920808900 76896475 C Bi:1:003:1 0 512 = 79c83775 00000000 03000000 00000000 00000000 00000000 00000000 00000000
ffff8ba920808900 76896491 S Bi:1:003:1 -115 512 <
ffff8ba920808900 76896515 C Bi:1:003:1 0 0
ffff8ba920808900 76896547 S Bo:1:003:1 -115 57917 = d848f617 3847b4f2 17f8a92f 8a86ec82 fe1b7827 b379e6f4 774b5448 7bf2c88d
ffff8ba920808900 76897988 C Bo:1:003:1 0 57917 >
ffff8ba920808900 76898000 S Bi:1:003:1 -115 512 <
ffff8ba920808900 76898444 C Bi:1:003:1 0 512 = 79c83875 00000000 04000000 00000000 00000000 00000000 00000000 00000000
ffff8ba920808900 76898460 S Bi:1:003:1 -115 512 <
ffff8ba920808900 76898484 C Bi:1:003:1 0 0
ffff8ba98420f380 76898514 S Bo:1:003:1 -115 512 = 164ea9d9 0fe67283 49eced36 bed6f226 57b09910 fcf84ff6 03758d7a 8d3eb4bc
ffff8ba98420f380 76898538 C Bo:1:003:1 0 512 >
ffff8ba9538a58c0 76898547 S Bi:1:003:1 -115 512 <
ffff8ba9538a58c0 76898725 C Bi:1:003:1 0 512 = 7ac83a75 00000000 04000000 00000000 00000000 00000000 00000000 00000000
ffff8ba9538a58c0 76898731 S Bi:1:003:1 -115 512 <
ffff8ba9538a58c0 76898765 C Bi:1:003:1 0 0
ffff8ba988000600 76936640 S Bo:1:003:1 -115 525 = 3f211bae c1561970 8bd9016c bdb76e6e 9b5b14c8 bc883e00 d97b4068 45d29245
ffff8ba988000600 76936675 C Bo:1:003:1 0 525 >
ffff8ba988000600 76936683 S Bi:1:003:1 -115 512 <
ffff8ba988000600 77037008 C Bi:1:003:1 -2 0
ffff8ba902bb0780 77037030 S Bo:1:003:1 -115 512 = 1c76d43d 3be64603 7eb7ff24 3a09ccae c4dad0fb 3815387f b0284cb8 01a53388
ffff8ba902bb0780 77037068 C Bo:1:003:1 0 512 >
ffff8ba902bb0780 77037075 S Bi:1:003:1 -115 512 <
ffff8ba902bb0780 79037406 C Bi:1:003:1 -2 0
ffff8ba902bb0780 79037417 S Bi:1:003:1 -115 512 <
ffff8ba902bb0780 79042737 C Bi:1:003:1 -2 0
ffff8ba902bb0780 79042790 S Bo:1:003:1 -115 59568 = a0172328 e08bb8e9 770f73a3 e685be1b b098dca9 b110441c 76e5d78f a369318f
ffff8ba902bb0780 79044350 C Bo:1:003:1 0 59568 >
ffff8ba902bb0780 79044359 S Bi:1:003:1 -115 512 <
ffff8ba902bb0780 81044711 C Bi:1:003:1 -2 0
ffff8ba902bb0780 81044736 S Bi:1:003:1 -115 512 <
ffff8ba902bb0780 81050086 C Bi:1:003:1 -2 0
ffff8ba902bb0780 81050134 S Bo:1:003:1 -115 55069 = 17b3672a fea4729d 12a9f3a8 cc4a8696 31f68a21 0fcd0931 950dcc83 df65b519
ffff8ba902bb0780 81051583 C Bo:1:003:1 0 55069 >
ffff8ba902bb0780 81051593 S Bi:1:003:1 -115 512 <
ffff8ba902bb0780 83051954 C Bi:1:003:1 -2 0
ffff8ba902bb0780 83051981 S Bi:1:003:1 -115 512 <
ffff8ba902bb0780 83057337 C Bi:1:003:1 -2 0
ffff8ba902bb0780 83057387 S Bo:1:003:1 -115 59163 = 20afc74f 32fb91ea fb835e07 39486377 a1f881a1 dcb1d9ae 1698870e 16246881
ffff8ba902bb0780 83058951 C Bo:1:003:1 0 59163 >
ffff8ba902bb0780 83058967 S Bi:1:003:1 -115 512 <
ffff8ba902bb0780 85059279 C Bi:1:003:1 -2 0
ffff8ba902bb0780 85059304 S Bi:1:003:1 -115 512 <
ffff8ba902bb0780 85064628 C Bi:1:003:1 -2 0
ffff8ba902bb0780 85064673 S Bo:1:003:1 -115 56989 = 314ec7f0 5e09cc0d b6e6eca8 c4d51d21 03d5ac03 86ff3feb 46ce0b76 877795a6
ffff8ba902bb0780 85066184 C Bo:1:003:1 0 56989 >
ffff8ba902bb0780 85066192 S Bi:1:003:1 -115 512 <
ffff8ba902bb0780 87066526 C Bi:1:003:1 -2 0
ffff8ba902bb0780 87066547 S Bi:1:003:1 -115 512 <
ffff8ba902bb0780 87071880 C Bi:1:003:1 -2 0
ffff8ba902bb0780 87071924 S Bo:1:003:1 -115 55324 = e5fc6646 037ea354 35e69f3c 600e5f3c 4f1801f2 4c4e55fe 92eeb782 86c0f251
ffff8ba902bb0780 87073365 C Bo:1:003:1 0 55324 >
ffff8ba902bb0780 87073373 S Bi:1:003:1 -115 512 <
ffff8ba902bb0780 89073698 C Bi:1:003:1 -2 0
ffff8ba902bb0780 89073719 S Bi:1:003:1 -115 512 <
ffff8ba902bb0780 89079042 C Bi:1:003:1 -2 0
ffff8ba902bb0780 89079088 S Bo:1:003:1 -115 55904 = 97755cd1 14c551d0 4c0d5cb6 78aaa9d3 3dc0629b 680f57db 8c5ce06e 2fc64f4c
ffff8ba902bb0780 89080511 C Bo:1:003:1 0 55904 >
ffff8ba902bb0780 89080520 S Bi:1:003:1 -115 512 <
ffff8ba902bb0780 91080883 C Bi:1:003:1 -2 0
ffff8ba902bb0780 91080909 S Bi:1:003:1 -115 512 <
ffff8ba902bb0780 91086248 C Bi:1:003:1 -2 0
ffff8ba902bb0780 91086294 S Bo:1:003:1 -115 56550 = d8a1e66a 0cf9e981 623798a1 f192af77 c9b0981a 7abfdca4 06f4805c 02c0140e
ffff8ba902bb0780 91087771 C Bo:1:003:1 0 56550 >
ffff8ba902bb0780 91087779 S Bi:1:003:1 -115 512 <
ffff8ba902bb0780 93088123 C Bi:1:003:1 -2 0
ffff8ba902bb0780 93088150 S Bi:1:003:1 -115 512 <
ffff8ba902bb0780 93093502 C Bi:1:003:1 -2 0
ffff8ba902bb0780 93093549 S Bo:1:003:1 -115 59791 = e301b8a3 44d36e3d 976bbba6 3156b4db 5b99295a 555e8745 d8da39ea 9fc6bdf0
ffff8ba902bb0780 93095142 C Bo:1:003:1 0 59791 >
ffff8ba902bb0780 93095154 S Bi:1:003:1 -115 512 <
ffff8ba902bb0780 95095518 C Bi:1:003:1 -2 0
ffff8ba902bb0780 95095541 S Bi:1:003:1 -115 512 <
ffff8ba902bb0780 95100904 C Bi:1:003:1 -2 0
ffff8ba902bb0780 95100952 S Bo:1:003:1 -115 58153 = bad6021c 9e64b764 4d2a6f73 c48d9f36 b00570ee eb5e8af5 c016d23c e9e7e9dd
ffff8ba902bb0780 95102501 C Bo:1:003:1 0 58153 >
ffff8ba902bb0780 95102512 S Bi:1:003:1 -115 512 <
ffff8ba902bb0780 97102859 C Bi:1:003:1 -2 0
ffff8ba902bb0780 97102883 S Bi:1:003:1 -115 512 <
ffff8ba902bb0780 97108226 C Bi:1:003:1 -2 0
ffff8ba902bb0780 97108276 S Bo:1:003:1 -115 59007 = ba28389f 28a08130 0e38058e 31479e2e 421fdc75 f0909f7e 83442429 89bbaf3a
ffff8ba902bb0780 97109893 C Bo:1:003:1 0 59007 >
ffff8ba902bb0780 97109905 S Bi:1:003:1 -115 512 <
ffff8ba902bb0780 99110246 C Bi:1:003:1 -2 0
ffff8ba902bb0780 99110269 S Bi:1:003:1 -115 512 <
ffff8ba902bb0780 99115614 C Bi:1:003:1 -2 0
ffff8ba902bb0780 99115662 S Bo:1:003:1 -115 59739 = 5f3fe02e 20799dd0 5f206a69 40ea62b5 084fa3fc f7d5dc5f 06036abc 38b43c13
ffff8ba902bb0780 99166380 C Bo:1:003:1 0 59739 >
ffff8ba902bb0780 99166392 S Bi:1:003:1 -115 512 <
ffff8ba902bb0780 101166740 C Bi:1:003:1 -2 0
ffff8ba902bb0780 101166765 S Bi:1:003:1 -115 512 <
ffff8ba902bb0780 101172108 C Bi:1:003:1 -2 0
ffff8ba902bb0780 101172155 S Bo:1:003:1 -115 61468 = b5802d9f 7c6757f9 beb2d02d d96c1ee0 26a704bd b78ae5fa 312c9c79 081ee7bd
ffff8ba902bb0780 101173749 C Bo:1:003:1 0 61468 >
ffff8ba902bb0780 101173760 S Bi:1:003:1 -115 512 <
ffff8ba902bb0780 103174117 C Bi:1:003:1 -2 0
ffff8ba902bb0780 103174142 S Bi:1:003:1 -115 512 <
ffff8ba902bb0780 103179486 C Bi:1:003:1 -2 0
ffff8ba902bb0780 103179533 S Bo:1:003:1 -115 57778 = 71602f42 e9cf48e8 4ff15400 23b45863 0b28088c 1ae68f71 27308853 a32c9ce8
ffff8ba902bb0780 103181747 C Bo:1:003:1 0 57778 >
ffff8ba902bb0780 103181759 S Bi:1:003:1 -115 512 <
ffff8ba902bb0780 105182096 C Bi:1:003:1 -2 0
ffff8ba902bb0780 105182118 S Bi:1:003:1 -115 512 <
ffff8ba902bb0780 105187438 C Bi:1:003:1 -2 0
ffff8ba902bb0780 105187482 S Bo:1:003:1 -115 58103 = 8b2f58e7 5de42151 98857084 44e286b1 2e245c65 b6befde0 5975466f 1bd1861d
ffff8ba902bb0780 105188998 C Bo:1:003:1 0 58103 >
ffff8ba902bb0780 105189007 S Bi:1:003:1 -115 512 <
ffff8ba902bb0780 107189351 C Bi:1:003:1 -2 0
ffff8ba902bb0780 107189380 S Bi:1:003:1 -115 512 <
ffff8ba902bb0780 107194721 C Bi:1:003:1 -2 0
ffff8ba902bb0780 107194775 S Bo:1:003:1 -115 59224 = d6441cbd b71fb48f ff952945 3f19b22d dcdb01f5 10d515a4 59ba8b40 44f11874
ffff8ba902bb0780 107246410 C Bo:1:003:1 0 59224 >
ffff8ba902bb0780 107246425 S Bi:1:003:1 -115 512 <
ffff8ba902bb0780 109246786 C Bi:1:003:1 -2 0
ffff8ba902bb0780 109246814 S Bi:1:003:1 -115 512 <
ffff8ba902bb0780 109252155 C Bi:1:003:1 -2 0
ffff8ba902bb0780 109252203 S Bo:1:003:1 -115 53792 = 32d2f12c 0ad85e8e 31600e19 e610209a a7ac02c0 cb62fb16 cf363e45 f717e232
ffff8ba902bb0780 109253824 C Bo:1:003:1 0 53792 >
ffff8ba902bb0780 109253836 S Bi:1:003:1 -115 512 <
ffff8ba902bb0780 111254178 C Bi:1:003:1 -2 0
ffff8ba902bb0780 111254200 S Bi:1:003:1 -115 512 <
ffff8ba902bb0780 111259562 C Bi:1:003:1 -2 0
ffff8ba902bb0780 111259609 S Bo:1:003:1 -115 60544 = e6557c4c 8a6632bd 5019f30a e2a7f9dd b38dd62d bc0ff7c3 4dca6d8b 6ee2ae47
ffff8ba902bb0780 111261550 C Bo:1:003:1 0 60544 >
ffff8ba902bb0780 111261560 S Bi:1:003:1 -115 512 <
ffff8ba902bb0780 113261906 C Bi:1:003:1 -2 0
ffff8ba902bb0780 113261930 S Bi:1:003:1 -115 512 <
ffff8ba902bb0780 113267287 C Bi:1:003:1 -2 0
ffff8ba902bb0780 113267335 S Bo:1:003:1 -115 58395 = fc3dcfff 98b86fd7 b3be8cab 96e88ecb 78f02823 e4640c3b 42496bc0 4b9d761d
ffff8ba902bb0780 113269118 C Bo:1:003:1 0 58395 >
ffff8ba902bb0780 113269133 S Bi:1:003:1 -115 512 <
ffff8ba902bb0780 115269479 C Bi:1:003:1 -2 0
ffff8ba902bb0780 115269501 S Bi:1:003:1 -115 512 <
ffff8ba902bb0780 115274857 C Bi:1:003:1 -2 0
ffff8ba902bb0780 115274907 S Bo:1:003:1 -115 60274 = 0d0425e8 e531dbc5 c06a1327 105027d8 f0dfc855 57fabd7f 1034b06e bb5c31fe
ffff8ba902bb0780 115326519 C Bo:1:003:1 0 60274 >
ffff8ba902bb0780 115326532 S Bi:1:003:1 -115 512 <
ffff8ba902bb0780 117326846 C Bi:1:003:1 -2 0
ffff8ba902bb0780 117326874 S Bi:1:003:1 -115 512 <
ffff8ba902bb0780 117332205 C Bi:1:003:1 -2 0
ffff8ba902bb0780 117332251 S Bo:1:003:1 -115 56390 = 61164d41 9d435d9c 1b1e7192 0dd3fa61 96bd97fe bc95705a f6782f09 b17770f4
ffff8ba902bb0780 117333850 C Bo:1:003:1 0 56390 >
ffff8ba902bb0780 117333859 S Bi:1:003:1 -115 512 <
ffff8ba902bb0780 119334199 C Bi:1:003:1 -2 0
ffff8ba902bb0780 119334229 S Bi:1:003:1 -115 512 <
ffff8ba9