ffff8ba94077d140 16848645 C Bi:1:003:1 -2 0
ffff8ba94077d140 18849154 C Bi:1:003:1 -2 0
ffff8ba94077d140 18862549 C Bi:1:003:1 -2 0
ffff8ba98420c240 43985006 C Bi:1:003:1 -2 0
ffff8ba98420c240 45985410 C Bi:1:003:1 -2 0
ffff8ba98420c240 45990779 C Bi:1:003:1 -2 0
ffff8ba988000600 77037008 C Bi:1:003:1 -2 0
ffff8ba902bb0780 79037406 C Bi:1:003:1 -2 0
ffff8ba902bb0780 79042737 C Bi:1:003:1 -2 0
ffff8ba902bb0780 81044711 C Bi:1:003:1 -2 0
ffff8ba902bb0780 81050086 C Bi:1:003:1 -2 0
ffff8ba902bb0780 83051954 C Bi:1:003:1 -2 0
ffff8ba902bb0780 83057337 C Bi:1:003:1 -2 0
ffff8ba902bb0780 85059279 C Bi:1:003:1 -2 0
ffff8ba902bb0780 85064628 C Bi:1:003:1 -2 0
ffff8ba902bb0780 87066526 C Bi:1:003:1 -2 0
ffff8ba902bb0780 87071880 C Bi:1:003:1 -2 0
ffff8ba902bb0780 89073698 C Bi:1:003:1 -2 0
ffff8ba902bb0780 89079042 C Bi:1:003:1 -2 0
ffff8ba902bb0780 91080883 C Bi:1:003:1 -2 0
